title,url
El Paso braces for worst as Title 42 deadline looms,/news/world-us-canada-65552877
Israeli air strike kills missile commander in Gaza,https://www.bbc.com/news/world-middle-east-65553728
Violence and mass arrests as Imran Khan charged,https://www.bbc.com/news/world-asia-65541215
Turkey's 300-year-old 'eco-mansions',https://www.bbc.com/travel/article/20230510-turkeys-300-year-old-eco-mansions
The centuries-old symbol of Korea,https://www.bbc.com/culture/article/20230510-the-ancient-symbol-that-defines-korea
Republican George Santos pleads not guilty to fraud,/news/world-us-canada-65548728
Russian fury as Poland renames Kaliningrad exclave,/news/world-europe-65545636
Trump mulls pardoning Capitol rioters in CNN townhall,/news/world-us-canada-65553964
'Worse than AC Milan's wildest dreams' but 'big regrets' for Inter,/sport/football/65553144
Groves wins as Cavendish crashes over line - after dog chaos,/sport/cycling/65548695
Former NFL star facing prison over fatal car crash,/sport/american-football/65551863
What to expect from Eurovision's semi-final two,https://www.bbc.co.uk/news/entertainment-arts-65549501
The greatest pop show on Earth,https://www.bbc.com/culture/article/20230509-eurovision-song-contest-why-gen-z-biggest-fans
Half-Ukrainian girl's honour to open Eurovision,https://www.bbc.com/news/uk-england-birmingham-65551573
How our genes influence our decisions,https://www.bbc.com/future/article/20230509-how-genetics-determine-our-life-choices
The workers quitting the jobs they love,https://www.bbc.com/worklife/article/20230509-is-it-time-to-quit-your-passion-job
Eastern Europe's mysterious tombstones,https://www.bbc.com/travel/article/20230509-bosnia-and-herzegovinas-mysterious-steci-stones
17 photos of landscapes few can see,https://www.bbc.com/culture/article/20230508-17-photos-of-landscapes-few-can-see
How worried should I be about the US economy?,https://www.bbc.com/news/business-65487054
'I wasn't Meghan in disguise at Coronation',https://www.bbc.com/news/articles/cljgg9801w5o
Australia investigates suspected frog mucus deaths,https://www.bbc.com/news/world-australia-65541618
"Mariupol: The story of loss, bravery and determination",https://www.bbcselect.com/watch/mariupol-the-peoples-story/?utm_source=BBC.com&utm_medium=Homepage&utm_campaign=Mariupol+Peabody+Win
Can a wind turbine handle hurricane speed winds?,https://www.bbc.com/news/business-65261147
BBC editor (and Eurovision superfan) plays 10 nostalgic hits,/news/entertainment-arts-65552525
BBC editor (and Eurovision superfan) plays 10...,/news/entertainment-arts-65552525
Family stunned by 'meteorite' crashing...,/news/world-us-canada-65550761
Peacocks abducted as Khan protesters damage...,/news/world-asia-65550077
WATCH: People escape car seconds before train...,/news/world-us-canada-65544141
BBC reporter mix-up sees wrong Eurovision...,/news/entertainment-arts-65545646
Watch daylight Rolex heist at luxury Tokyo...,/news/world-asia-65544140
The most iconic Eurovision performances from...,/news/entertainment-arts-65540108
One-minute World News,/news/10462520
Watch: Alesha Dixon does throwback Eurovision...,/news/entertainment-arts-65540590
'I have peaked too soon' - Eurovision fan,/news/entertainment-arts-65539720
Her illness fooled celebs - the truth may be even darker,https://www.bbc.com/news/uk-65428918
New DNA map could lead to better treatments,/news/science-environment-65539594
Vodafone 3G turn-off sparks internet access fears,/news/technology-65545865
Harry blames press intrusion for Chelsy break-up,/news/uk-65550021
"Covid global health emergency is over, WHO says",/news/health-65499929
North Carolina lawmakers pass 12-week abortion ban,/news/world-us-canada-65489803
Sweet firms try to sugar coat price rises,https://www.bbc.co.uk/news/business-65532112
Why teaching robots to blink is hard but important,https://www.bbc.com/news/business-65251892
Can Morocco solve Europe’s energy crisis?,https://www.bbc.com/news/business-65415529
Must see pictures from the King's Coronation,/news/uk-65506969
In pictures: Royal superfans camp out ahead of Coronation,/news/in-pictures-65484438
Stylish singers and snipers: Africa's top shots,/news/world-africa-65480076
In pictures: Night-time Coronation rehearsal,/news/in-pictures-65467802
The 17 most eye-catching looks at the Met Gala,/news/entertainment-arts-65413976
