title,url
Somali forces claim end to deadly hotel siege,/news/world-africa-62621205
Finnish PM reveals she has taken drug test,/news/world-europe-62608831
Ex-Briton 'Isis Beatle' sentenced to life in prison,/news/world-us-canada-62609217
Possible breakthrough to destroy 'forever chemicals',/news/science-environment-62561756
'How did you beat me?' - Usyk defeats Joshua,/sport/live/boxing/62562489
Seal breaks into New Zealand home and explores it,/news/world-asia-62608162
'Competing with mother nature is tough',/news/world-us-canada-62514791
Drone attack on Russian base in Crimea,/news/world-europe-62618538
Spirited Joshua loses to Usyk by split decision,/sport/boxing/62612531
Will Kane become Premier League's best goalscorer?,/sport/football/62617323
Munro & Rashid help Rockets beat Spirit to go top,https://www.bbc.co.uk/sport/live/cricket/60184897
Game of Thrones prequel is 'darker' ★★★★☆,https://www.bbc.com/culture/article/20220818-house-of-the-dragon-review-its-pure-game-of-thrones
A pizza topping that divides the world,https://www.bbc.com/future/article/20220818-why-is-ham-and-pineapple-pizza-so-controversial
Can Hawaii solve a global food crisis?,https://www.bbc.com/travel/article/20220818-ahupuaa-hawaiis-ancient-land-management-system
Canada's new 700km island path,https://www.bbc.com/travel/article/20220817-canadas-new-700km-island-path
The thinking trap that dupes you,https://www.bbc.com/worklife/article/20220812-the-illusion-of-knowledge-that-makes-people-overconfident
The identical twins split up at birth,https://www.bbc.com/future/article/20220817-the-twins-who-were-split-up-at-birth
Why perceptions of tattoos are changing,https://www.bbc.com/culture/article/20220817-will-tattoos-finally-be-accepted-as-art
Zulu king crowned despite family feud,https://www.bbc.com/news/world-africa-62604497
The world's 10 most ingenious buildings,https://www.bbc.com/culture/article/20220809-designed-to-last-ten-of-the-worlds-most-ingenious-buildings
Russian-speakers told to pick sides in loyalty test,https://www.bbc.com/news/world-europe-62592714
Why did the British army's time in Afghanistan go so wrong?,https://www.bbcselect.com/watch/afghanistan-the-british-lions-last-roar/?utm_source=BBC&utm_medium=Homepage&utm_campaign=Afghanistan+the+British+Lions+Last+Roar
How Hollywood hopes to monster waste,https://www.bbc.com/news/business-62048067
The new sound of dance music sweeping the world,/news/world-africa-62552242
The new sound of dance music sweeping the...,/news/world-africa-62552242
'I broke the world record with my last ever...,/news/uk-england-derbyshire-62470947
Ukraine displays destroyed Russian tanks,/news/world-europe-62617278
Australian firm drills in Zimbabwe for oil...,/news/uk-62615088
New Zulu king crowned in South Africa,/news/world-africa-62620607
Beaches closed after sewage pumped into sea,/news/uk-62614739
One-minute World News,/news/10462520
Islanders forced from their homes to the...,/news/world-latin-america-62497711
Car bombs and gunfire target Mogadishu hotel,/news/world-africa-62613521
"Hippo, fish and crabs tested for Covid in...",/news/world-asia-china-62610739
Robot boat maps Pacific underwater volcano,/news/science-environment-62606589
A green solution to the vinyl record backlog?,/news/technology-62426472
"Demi Lovato is back, and this time she's angry",/news/entertainment-arts-62603941
Greece promotes smaller islands but locals are unconvinced,https://www.bbc.co.uk/news/business-62595814
UK first country to approve dual-strain Covid jab,/news/health-62548336
Crops 'made better' at using sunlight to grow,/news/science-environment-62592286
The TikTok comedy stars trying to make it on stage,/news/entertainment-arts-62573535
Property guardians move with the times to save cash,https://www.bbc.com/news/business-62491329
How to make movies without a huge carbon footprint,https://www.bbc.com/news/business-62051070
First saved images from vast photo archive shared,/news/uk-england-merseyside-62591866
Africa's top shots: Crowning queens and coming of age,/news/world-africa-62588364
Shortlist for crime writer's photo prize announced,/news/uk-england-tyne-62552361
In pictures: Stunning Sturgeon Moon lights up skies,/news/in-pictures-62518102
"In pictures: Heatwaves, drought and wildfires",/news/in-pictures-62497772
