title,url
Second Canada stabbings suspect dies after arrest,/news/world-us-canada-62829432
Chinese pair plotted 'mini-state' in Pacific nation,https://www.bbc.com/news/world-asia-62830548
Alcaraz beats Sinner in epic 3am finish at US Open,https://www.bbc.com/sport/tennis/62828340
Italy's debated gluten-free pasta,https://www.bbc.com/travel/article/20220907-pizzoccheri-northern-italys-gluten-free-buckwheat-pasta
The mystery of Europe's bog murders,https://www.bbc.com/future/article/20220907-the-mystery-of-the-human-sacrifices-buried-in-europes-bogs
Queen under medical supervision at Balmoral,/news/uk-62836057
US approves $2.6bn in aid for Ukraine and allies,/news/world-europe-62832881
How the ‘man in black’ was exposed by women he terrorised,https://www.bbc.co.uk/news/world-europe-62799246
Champions League reaction & Chelsea manager latest,/sport/live/football/62830700
"Rain delays start of England v SA third Test - clips, radio & text",/sport/live/cricket/58523279
'We have to reinvent ourselves' - Klopp,/sport/football/62828546
'I can finally say I like my job',https://www.bbc.com/worklife/article/20220905-why-people-are-industry-hopping
The biggest myths of the teenage brain,https://www.bbc.com/future/article/20220823-what-really-goes-on-in-teens-brains
How huge statues 'walked' 900 years ago,https://www.bbc.com/travel/article/20220906-the-walking-statues-of-easter-island
'A flawed film with a kind heart',https://www.bbc.com/culture/article/20220907-the-son-review-a-flawed-film-with-a-kind-heart
Marvelous films that transport you to unexpected places,https://www.bbc.com/culture/article/20220825-longshots-festival-six-films-that-take-us-on-a-journey
Domestic abuse: 'I can rebuild my life with forensic spray',https://www.bbc.com/news/uk-62821880
Apple reveals iPhone 14 Pro and Watch Ultra,https://www.bbc.com/news/technology-62827774
How India is building a pearl farming industry,https://www.bbc.com/news/business-62204515
'There were no women in my field so I found my own way',https://www.bbc.com/news/business-62719779
The Northern Lights as seen from space,/news/world-62831574
The Northern Lights as seen from space,/news/world-62831574
Watch: Cambridge children arrive at new...,/news/uk-62827918
Firefighters tackle Italy chemical plant fire,/news/world-europe-62823049
Evacuations as California battles deadly...,/news/world-us-canada-62821271
On a mission with China's pet detectives,/news/world-asia-62661308
Liz Truss outlines her three priorities,/news/uk-62812691
What do voters think of Liz Truss?,/news/uk-politics-62815916
One-minute World News,/news/10462520
"Truss in, Johnson out - the day in 90 seconds",/news/uk-politics-62811785
Liz Truss's first Downing Street speech as PM...,/news/uk-politics-62808801
Who might win the 2022 Mercury Prize?,/news/entertainment-arts-62825157
Should billboard advertising be banned?,https://www.bbc.co.uk/news/business-62806697
"Malaria vaccine is world-changing, say scientists",/news/health-62797776
Harry Styles jokes about Chris Pine 'spit' story,/news/entertainment-arts-62818523
PM explores 'fundamental' energy reform to cut bills,/news/science-environment-62832029
Instagram fined €405m over children's data privacy,/news/technology-62800884
Kwasi Kwarteng: Chancellor who likes a challenge,/news/business-62796213
The inside scoop on ice cream innovation,https://www.bbc.com/news/business-62745767
Moon Landing: The drama and danger of Apollo 11,https://www.bbcselect.com/watch/moon-landing/ ?utm_source=BBC.com&utm_medium=Homepage&utm_campaign=Moon+Landing
In pictures: Liz Truss becomes UK's 56th PM,/news/in-pictures-62810557
Boy's stunning stag shot scoops top award,/news/uk-england-london-62750748
Africa's top shots: Tears of joy and celebrating bishops,/news/world-africa-62751874
Is this ape really cuddling a pet mongoose?,/news/science-environment-62724822
In pictures: The life of Mikhail Gorbachev,/news/world-europe-62732829
