title,url
Israel to allow more fuel into Gaza as UN says aid operation is 'impossible',/news/live/world-middle-east-67446662
White House criticises Musk over antisemitic 'lie',https://www.bbc.com/news/world-us-canada-67446800
Track issues cause chaos in Las Vegas F1 practice,https://www.bbc.com/sport/formula1/67447322
10 of the most absurd trends of 2023,https://www.bbc.com/culture/article/20231115-alien-chic-to-clown-shoes-10-of-most-bizarre-style-trends-of-2023
How Black Friday got so bloated,https://www.bbc.com/worklife/article/20231116-why-you-see-black-friday-sales-in-july
Biden facing internal dissent over Israel's Gaza campaign,/news/world-us-canada-67453674
George Santos to face another expulsion vote,/news/world-us-canada-67446799
NFL host apologises for saying she made up reports,/news/world-us-canada-67456034
Euro 2024 qualifier: England v Malta - team news & build-up,/sport/live/football/67369867
Euro 2024 qualifiers: Finland v Northern Ireland,/sport/live/football/67404766
Everton receive immediate 10-point deduction,/sport/football/67448714
Berlin's stunning indoor public pools,https://www.bbc.com/travel/article/20231116-the-hidden-beauty-of-berlins-indoor-pools
"WeWork fell – will coworking go, too?",https://www.bbc.com/worklife/article/20231115-after-weworks-bankruptcy-what-is-the-future-of-coworking
How clocks have shaped civilisation,https://www.bbc.com/future/article/20231117-how-clocks-and-watches-have-shaped-civilisation
The most British TV show ever made?,https://www.bbc.com/culture/article/20231116-why-doctor-who-is-the-ultimate-british-show
Apple to cross message divide but green bubbles stay,https://www.bbc.com/news/technology-67451724
The Indian artist who painted for British rulers,https://www.bbc.com/news/world-asia-india-67412025
Is Mean Girls too noughties to function in 2024?,https://www.bbc.com/news/entertainment-arts-67434696
Shop owners hope that tech can deter thieves,https://www.bbc.co.uk/news/business-67306737
"TikTok has changed the world, but is it changing us?",https://www.bbcselect.com/watch/tiktok-effect/?utm_source=BBC.com&utm_medium=Homepage&utm_campaign=tiktok
President 'understands excitement' of dog that bit him,/news/world-europe-67453626
President 'understands excitement' of dog...,/news/world-europe-67453626
Christ the Redeemer welcomes Taylor Swift to...,/news/world-latin-america-67456426
Watch: Emotional Vernon Kay finishes charity...,/news/uk-67455860
Iceland helicopter video shows giant cracks...,/news/world-europe-67445280
When Apec 'family photos' used to be fun,/news/world-us-canada-67446831
Meghan hits red carpet at Power of Women in...,/news/entertainment-arts-67451948
Sister of Sasha Skochilenko fears for jailed...,/news/world-europe-67438148
The school dropout with more than 1 billion...,/news/uk-england-london-67410664
How has Biden and Xi's relationship changed?,/news/world-us-canada-67432662
Ros Atkins on... Do the rules of war protect...,/news/world-middle-east-67431820
The Beatles' hits albums denied number one (again),https://www.bbc.co.uk/news/articles/cv2z8qzemdlo
Amazon to offer cars for purchase on US site,/news/business-67445642
The last chance to save a mighty river,https://www.bbc.co.uk/news/extra/3s2qsuikpf/mekong-the-last-chance-to-save-a-mighty-river
Gaza hospital boss says no water or oxygen left,/news/world-middle-east-67442045
Capturing hidden Wales,/newyddion/67453980
How to avoid a massive roaming charge phone bill,/news/technology-67449465
Vernon Kay completes Children in Need marathon,/news/entertainment-arts-67442924
"'I don't enter leadership awards, it's not about me'",https://www.bbc.co.uk/news/av/business-67420863
Could triple glazing become a UK standard?,https://www.bbc.com/news/business-67161076
Africa's top shots: Pirates and paper doves,/news/world-africa-67440655
"Royals, rallies and regattas: Africa's top shots",/news/world-africa-67342719
King Charles III delivers speech at State Opening of Parliament,/news/uk-politics-67344490
Damage and disruption: Storm Ciarán in pictures,/news/in-pictures-67298061
Elton John photography collection to go on display,/news/uk-england-london-67205468
