title,url
Ukraine backs UN call for nuclear plant safe zone,/news/world-europe-62816114
Applause and irony - world reacts to Truss,https://www.bbc.com/news/world-62796353
Seven dead in flooded South Korea car park after typhoon,https://www.bbc.com/news/world-asia-62816374
US bars 'advanced tech' factories in China for 10 years,https://www.bbc.com/news/62803224
How pop stars react when war breaks out,https://www.bbc.com/culture/article/20220906-the-ukrainian-pop-stars-bringing-hope
Canadian town 'shattered' amid stabbings manhunt,/news/world-us-canada-62815201
Truss rewards allies with top cabinet roles,/news/uk-politics-62813552
Body of missing heiress Eliza Fletcher identified,/news/world-us-canada-62811661
Champions League & Women's World Cup qualifying reaction,/sport/live/football/62817178
'Devastated' Kyrgios loses to Khachanov at US Open,/sport/tennis/62813615
Haaland scores twice as Man City thrash Sevilla,/sport/football/62800316
The Easter Island statues that 'walked',https://www.bbc.com/travel/article/20220906-the-walking-statues-of-easter-island
The biggest myths of the teenage brain,https://www.bbc.com/future/article/20220823-what-really-goes-on-in-teens-brains
Harry Styles' new film is a big miss,https://www.bbc.com/culture/article/20220905-dont-worry-darling-is-full-of-half-baked-risk-free-ideas
The search for 'meaning' at work,https://www.bbc.com/worklife/article/20220902-the-search-for-meaning-at-work
Marvelous films that transport you to unexpected places,https://www.bbc.com/culture/article/20220825-longshots-festival-six-films-that-take-us-on-a-journey
Juul to pay $438.5m in youth vaping probe,https://www.bbc.com/news/business-62813896
Short-flight joke lands PSG coach into trouble,https://www.bbc.com/news/world-europe-62809829
How India is building a pearl farming industry,https://www.bbc.com/news/business-62204515
'There were no women in my field so I found my own way',https://www.bbc.com/news/business-62719779
On a mission with China's pet detectives,/news/world-asia-62661308
On a mission with China's pet detectives,/news/world-asia-62661308
Liz Truss outlines her three priorities,/news/uk-62812691
What do voters think of Liz Truss?,/news/uk-politics-62815916
"Truss in, Johnson out - the day in 90 seconds",/news/uk-politics-62811785
Liz Truss's first Downing Street speech as PM...,/news/uk-politics-62808801
"'This is it, folks' - Johnson's speech in...",/news/uk-politics-62804887
Hermit faces eviction from beachside cave...,/news/world-middle-east-62799226
It is very nice to be back in the UK - Meghan,/news/uk-62799840
Sunak on his future: I don't plan on going...,/news/uk-politics-62798503
Moment Liz Truss announced as new Tory leader,/news/uk-politics-62795284
China approves inhaled Covid vaccine,/news/health-62793078
Fresh wave of sewage blights Britain's beaches,/news/science-environment-62813573
Octogenarian Alan Garner makes Booker shortlist,/news/entertainment-arts-62805073
Jetstar apologises to stranded passengers in Bali,/news/business-62803222
Instagram fined €405m over children's data privacy,/news/technology-62800884
Frozen Planet II returns with world-first footage,/news/science-environment-62797161
Saudis warn Netflix for violating 'Islamic values',/news/world-middle-east-62811522
The inside scoop on ice cream innovation,https://www.bbc.com/news/business-62745767
Moon Landing: The drama and danger of Apollo 11,https://www.bbcselect.com/watch/moon-landing/ ?utm_source=BBC.com&utm_medium=Homepage&utm_campaign=Moon+Landing
In pictures: Liz Truss becomes UK's 56th PM,/news/in-pictures-62810557
Boy's stunning stag shot scoops top award,/news/uk-england-london-62750748
Africa's top shots: Tears of joy and celebrating bishops,/news/world-africa-62751874
Is this ape really cuddling a pet mongoose?,/news/science-environment-62724822
In pictures: The life of Mikhail Gorbachev,/news/world-europe-62732829
