title,url
Ukraine claims major gains as Russia exits Kherson,/news/world-europe-63589297
Taliban ban women from Kabul parks,https://www.bbc.com/news/world-asia-63582047
Alex Jones to pay extra $473m over Sandy Hook claim,https://www.bbc.com/news/world-us-canada-63592386
"Spanish village on sale for €260,000",https://www.bbc.com/news/world-europe-63586271
Why the Nile is becoming 'desertified',https://www.bbc.com/future/bespoke/follow-the-food/the-ingredient-we-cant-do-without/
"As Russia retreats, Ukrainians still fear a trap",/news/world-europe-63587639
"We're on the right path, says Biden, as key Congress votes counted",/news/live/world-us-canada-63157389
The rise - and possible fall - of Lauren Boebert,/news/world-us-canada-63579561
"Maddison, Rashford and Wilson make England squad",/sport/football/63585869
EFL Cup: Man Utd 0-0 Aston Villa - Dalot heads over for hosts,/sport/live/football/63549894
England beat India to storm into World Cup final,/sport/cricket/63565435
Why four states banned slavery but Louisiana didn't,https://www.bbc.com/news/world-us-canada-63578133
The US has more female governors than ever before,https://www.bbc.com/news/world-us-canada-63564060
How many 2020 election deniers won?,https://www.bbc.com/news/world-us-canada-63568003
How a 90s ballad captivated the world,https://www.bbc.com/culture/article/20221109-i-will-always-love-you-the-power-ballad-that-changed-music
A 70-mile drive through remote England,https://www.bbc.com/travel/article/20221109-a39-englands-remote-atlantic-highway
The doctors prescribing 'blue' therapy,https://www.bbc.com/future/article/20221108-the-doctors-prescribing-blue-therapy
The exes trapped in shared homes,https://www.bbc.com/worklife/article/20221103-the-exes-forced-to-live-together-after-breaking-up
NFL and Commanders sued for 'deceiving' DC fans,https://www.bbc.com/news/world-us-canada-63586493
Musk tells Twitter staff remote working will end,https://www.bbc.com/news/business-63582273
KFC apologises after Kristallnacht promotion,https://www.bbc.com/news/world-europe-63499057
The shops that connect people with their home countries,https://www.bbc.com/news/business-63542786
Why some people are overlooked geniuses,https://www.bbc.com/future/article/20221028-why-theres-more-to-being-smart-than-intelligence
Driver sentenced for blocking ambulance on 999 call,/news/uk-england-berkshire-63586321
Driver sentenced for blocking ambulance on...,/news/uk-england-berkshire-63586321
Hurricane Nicole makes landfall in Florida,/news/world-us-canada-63586889
Moment UN chief realises he's reading the...,/news/world-63581486
In the epicentre of Uganda's Ebola outbreak,/news/world-africa-63583403
Biden chuckles at thought of Trump running...,/news/world-us-canada-63578645
The story of US election night in 60 seconds,/news/world-us-canada-63563189
Actor Sean Penn gives his Oscar to Zelensky,/news/world-europe-63561236
One-minute World News,/news/10462520
Watch: Man throws eggs at King Charles,/news/uk-england-york-north-yorkshire-63568598
WW2 evacuee: 'I thought I was going on a day...,/news/stories-63556039
Fossil fuel delegates spike at climate summit,/news/science-environment-63571610
US flu hospital cases rocket as vaccinations fall,/news/world-us-canada-63522871
The Crown's first official TV ratings revealed,/news/entertainment-arts-63584041
"Facebook-owner Meta to cut 11,000 staff",/news/technology-63568585
Warnings over growing 3D printed gun threat,/news/technology-63495123
Economists question 'black hole' in UK finances,/news/business-63573989
Tractors and crops targeted in rural crime wave,/news/uk-63517666
'One of the hottest start-up spaces in the US',https://www.bbc.com/news/business-63459642
Why an old train could point to a clean energy future,https://www.bbc.com/news/business-62619313
Lensman recaptures city pub scenes 40 years on,/news/uk-england-humber-63549572
Stunningly preserved bronze statues found in Italy,/news/world-europe-63564404
Crocodile close-up wins mangrove photo awards,/news/in-pictures-63472199
In pictures: Lula beats Bolsonaro,/news/world-latin-america-63451896
Africa's top shots: Red rings and seas of green,/news/world-africa-63411863
