title,url
How the Brittney Griner prisoner swap was done,/news/world-us-canada-63908670
"UK, Italy and Japan team up for new fighter jet",https://www.bbc.com/news/uk-63908284
Climate activist's jailing ignites row in Australia,https://www.bbc.com/news/world-australia-63883430
Does the Harry and Meghan series live up to the hype?,https://www.bbc.com/news/entertainment-arts-63890246
How vultures prevent rabies,https://www.bbc.com/future/article/20221206-why-we-should-value-scavengers
"Brittney Griner packs bags, leaves jail and boards plane",/news/world-us-canada-63911753
Russia swaps basketball star for 'Merchant of Death',/news/world-europe-63905112
Fired Twitter cleaners 'treated like garbage',/news/technology-63912116
Debutant Abrar takes five to put England in trouble - radio & text,/sport/live/cricket/62865927
World Cup: England latest and build-up to Brazil & Argentina quarter-finals,/sport/live/football/63813828
'Fabulous Friday' awaits with tasty World Cup ties,/sport/football/63889208
Asia's most beautiful train route?,https://www.bbc.com/travel/article/20221208-sri-lankas-most-beautiful-train-journey
The golden age of flavoured soft drinks,https://www.bbc.com/future/article/20221207-beyond-cola-the-strange-flavours-of-soft-drinks
'I'd rather just have been fired',https://www.bbc.com/worklife/article/20221021-the-bosses-who-silently-nudge-out-workers
The 21 best TV shows of 2022,https://www.bbc.com/culture/article/20220606-the-10-best-tv-shows-of-2022-so-far
Royals 'didn't understand need to protect Meghan',https://www.bbc.com/news/uk-63899515
Netherlands boss Van Gaal's private cancer ordeal,https://www.bbc.com/sport/football/63759127
Rare wave clouds amaze sky-watchers in Wyoming,https://www.bbc.com/news/world-us-canada-63912257
Second-hand tech booms as shoppers look for bargains,https://www.bbc.com/news/business-63779342
The changing relationship between the Royal Family and the press,https://www.bbcselect.com/watch/the-princes-and-the-press/?utm_source=BBC.com&utm_medium=Homepage&utm_campaign=Princes+and+the+Press
The brothers running the Great Wall of China,/news/world-asia-china-63757951
The brothers running the Great Wall of China,/news/world-asia-china-63757951
Pope breaks down in tears over Ukraine,/news/world-europe-63911202
Anne Sacoolas sentenced for Harry Dunn death,/news/uk-63909559
Ros Atkins On... UK's approval of a new coal...,/news/uk-63909561
Peru's political whirlwind in three moments,/news/world-latin-america-63894883
Hope and worry as Beijing relaxes zero-Covid...,/news/world-asia-china-63894878
One-minute World News,/news/10462520
Surgeons operate on baby in Kyiv blackout,/news/world-europe-63879681
Rare plesiosaur fossil found in Australian...,/news/world-australia-63883964
Fireworks and flares after historic Morocco...,/news/world-63879596
Elon Musk turns Twitter into 'hotel' for staff,/news/technology-63897608
China abandons key parts of zero-Covid strategy,/news/world-asia-china-63855508
Water companies 'letting down' customers,/news/science-environment-63901698
Selma Blair: 'Multiple sclerosis took my career down',/news/entertainment-arts-63792626
First UK space launch faces delay,/news/science-environment-63895835
How to tell if your Instagram posts are being hidden,/news/technology-63907699
Theranos executive gets nearly 13 years in prison,/news/world-us-canada-63895825
Should countries try to do everything themselves?,https://www.bbc.com/news/business-63780833
What would a green World Cup look like?,https://www.bbc.com/future/article/20221206-what-would-a-green-world-cup-look-like
The Meghan and Harry selfies we've never seen before,/news/in-pictures-63902679
In pictures: China bids farewell to Jiang Zemin,/news/world-asia-china-63869077
The photographer who puts little people in the frame,/news/uk-scotland-63781000
Africa's top shots: Dripping diamonds and football fever,/news/world-africa-63819552
In Pictures: Mauna Loa erupts,/news/in-pictures-63820551
