title,url
Biden defends sending cluster bombs to Ukraine,/news/world-us-canada-66140460
Why is US giving Ukraine 'abhorrent' weapons?,/news/world-europe-66133527
Dutch government collapses over asylum row,/news/world-europe-66139789
Ashes news: Build-up to crucial day of third England-Australia Test,/sport/live/cricket/64959135
The heat index explained in...90 seconds,/news/world-us-canada-66071216
Can France prevent tensions igniting again?,/news/world-europe-66133676
BBC visits Belarus camp offered to Wagner,/news/world-europe-66140699
No charges for security who blocked Britney Spears,/news/world-us-canada-66129605
Murray unsure he has motivation for Wimbledon return,/sport/tennis/66139993
England are in a 'winnable' position - Moeen,/sport/cricket/66134034
Van der Sar in intensive care after bleed on brain,/sport/football/66138530
The islands gifted as an unpaid debt,https://www.bbc.com/travel/article/20230706-the-viking-spirit-of-a-remote-scottish-archipelago
Sixteen of the best films of 2023,https://www.bbc.com/culture/article/20230402-8-of-the-best-films-of-2023-so-far
The maps revealing urban heat stress,https://www.bbc.com/future/article/20230706-the-simple-ways-cities-can-adapt-to-heatwaves
Why Wimbledon’s dress code is so strict,https://www.bbc.com/culture/article/20230707-wimbledon-the-controversy-of-tenniss-strict-146-year-old-dress-code
What would green shipping look like?,https://www.bbc.com/future/article/20230707-what-would-net-zero-shipping-look-like
Rava upma: warm and savoury semolina,https://www.bbc.com/travel/article/20230707-rava-upma-warm-and-savoury-semolina
The rise of job-searching burnout,https://www.bbc.com/worklife/article/20230628-why-unemployed-workers-are-so-burnt-out
Why America could be overtaken as the corn superpower,https://www.bbc.com/news/world-us-canada-66089408
Bruce Springsteen settles an old score in Hyde Park,https://www.bbc.com/news/entertainment-arts-66131282
'Almost every influencer will be hopping on Threads',https://www.bbc.com/news/technology-66122246
The latest technology news direct to your inbox,https://cloud.email.bbc.com/techdecoded-newsletter-signup
Theatres tempt new audiences with virtual reality,https://www.bbc.com/news/business-65949874
AI robot asked 'will you rebel against humans'?,/news/technology-66141835
AI robot asked 'will you rebel against...,/news/technology-66141835
Hail batters Spain creating icy urban scenes,/news/world-europe-66140574
At the scene the day after fatal Wimbledon...,/news/uk-66131233
Belarus leader pressed on nuclear weapons,/news/world-europe-66129555
Where is Yevgeny Prigozhin? And why does it...,/news/world-europe-66126005
Are wildfires in the US getting worse?,/news/world-us-canada-66114848
Australians smash Tina Turner dancing world...,/news/world-australia-66129928
Watch: Europe’s last Ariane-5 rocket blasts...,/news/world-europe-66117234
One-minute World News,/news/10462520
Best in show: Africa's top shots,/news/world-africa-66118610
Young adults see rise in severe distress - study,/news/health-66122386
BBC star 'accused of paying teen for explicit photos',/news/entertainment-arts-66140356
Shipping agrees net-zero goal but critics unmoved,/news/science-environment-66131038
Malmö is Swedish city chosen to host Eurovision,/news/entertainment-arts-66130777
Canada stops advertising with Facebook in news row,/news/world-us-canada-66104997
World records hottest day for third time in a week,/news/science-environment-66120297
Why this music producer smashed his platinum discs,https://www.bbc.com/news/business-65956519
Why Europe's 'lonely' tech entrepreneurs need help,https://www.bbc.com/news/business-65889259
In pictures: King Charles III celebrations,/news/uk-scotland-66108829
Mystery of Holocaust escape girls finally solved,/news/uk-england-tyne-66040197
Eid al-Adha around the world in pictures,/news/world-66041087
Photographer shares shots of famous musicians,/news/uk-wales-65989687
Millinery masterpieces at Royal Ascot,https://www.bbc.co.uk/news/articles/c3g1e00xgy2o
