title,url
Can the US live in Xi Jinping's world?,https://www.bbc.co.uk/news/world-asia-china-63386954
Biden warns US election denial is 'path to chaos',https://www.bbc.com/news/world-us-canada-63494618
Panic and fear drove iPhone factory breakout,https://www.bbc.com/news/world-asia-china-63481793
Houston makes baseball history with no-hitter,https://www.bbc.com/news/world-us-canada-63495470
What can you do about injustice?,https://www.bbc.com/future/article/20221102-injustice-is-everywhere-so-what-are-our-moral-duties
North Korea fires suspected long-range missile,/news/world-asia-63494751
Bolsonaro tells protesting truckers to clear roads,/news/world-latin-america-63494525
Russian commanders discussed using nuclear arms - US,/news/world-europe-63488547
Historic no-hitter helps Astros level World Series,/sport/baseball/63494689
Nadal beaten in first match since becoming father,/sport/tennis/63484284
Tottenham's Son needs surgery & is World Cup doubt,/sport/football/63492456
Coriander: The herb people love to hate,https://www.bbc.com/travel/article/20221102-coriander-the-unsung-hero-of-indian-cuisine
The nuclear novel that shaped Germany,https://www.bbc.com/culture/article/20221101-the-cloud-the-nuclear-novel-that-shaped-germany
How to cultivate a 'growth mindset',https://www.bbc.com/worklife/article/20221026-the-growth-mindset-all-workers-need-to-cultivate
What if we find life on other planets?,https://www.bbc.com/future/article/20221101-should-extraterrestrial-life-be-granted-sentient-rights
The most-streamed songs of 1952 to 2022 revealed,https://www.bbc.com/news/entertainment-arts-63490691
Magic-mushroom drug can treat severe depression,https://www.bbc.com/news/health-63475630
James Corden: Can you steal a joke?,https://www.bbc.com/news/newsbeat-63483918
The 'Achilles heel' of the US economy?,https://www.bbc.com/news/business-63260648
How solar farms in space might beam electricity to Earth,https://www.bbc.com/news/business-62636746
Iran protests: The video I dared not share,/news/world-middle-east-63486897
Iran protests: The video I dared not share,/news/world-middle-east-63486897
UK migrant language fuelling xenophobia -...,/news/uk-63492218
Driver and cyclist near misses caught on...,/news/uk-63492215
South Korea video shows missiles being fired,/news/world-asia-63492397
"Girl, 8, is youngest to get computerised knee...",/news/uk-england-bristol-63486321
The Ukrainian jet pilots hunting cruise...,/news/world-europe-63465297
One-minute World News,/news/10462520
Police dressed as superheroes in Peru drug...,/news/world-latin-america-63483024
Protests in Brazil follow Lula's election win,/news/world-latin-america-63479345
Police chief: Sometimes hip hop gets a bad...,/news/world-us-canada-63480431
Mariah Carey's Christmas hit lawsuit dropped,/news/world-asia-63492412
Shanghai Disney visitors trapped after lockdown,/news/world-asia-63456107
The refugees able to work remotely for firms around the world,https://www.bbc.co.uk/news/business-63468944
No glaciers on Kilimanjaro by 2050 - UN report,/news/science-environment-63489041
Apple store Glasgow workers unionise in UK first,/news/technology-63485697
Workers flee Covid lockdown at China iPhone factory,/news/world-asia-china-63447755
Death threat MP criticises 'stupid' ITV drama,/news/entertainment-arts-63487213
Your next job interview could take place in virtual reality,https://www.bbc.com/news/business-63311886
Elon Musk: Superhero or supervillain?,https://www.bbcselect.com/watch/elon-musk/
In pictures: Lula beats Bolsonaro,/news/world-latin-america-63451896
Africa's top shots: Red rings and seas of green,/news/world-africa-63411863
Lockdown laundry portraits win photo prize,/news/entertainment-arts-63397654
In pictures: Sunak becomes new UK prime minister,/news/in-pictures-63388207
Weather Watchers: Your pictures of autumn leaves,/weather/features/63345178
