title,url
Russian strike on Zelensky's home city kills six,/news/world-europe-66362769
The man who could bring down Donald Trump,https://www.bbc.com/news/world-us-canada-66341309
"Our sun bears are not humans in disguise, zoo says",https://www.bbc.com/news/world-asia-china-66362970
Could luggage be a thing of the past?,https://www.bbc.com/travel/article/20230730-are-luggage-free-trips-the-future
The truth about baby-led weaning,https://www.bbc.com/future/article/20230728-baby-led-weaning-what-are-the-risks-and-benefits
Pro-Trump group spends more than $40m on legal fees,/news/world-us-canada-66362100
Afghan Taliban burn ‘immoral’ musical instruments,/news/world-asia-66357611
'People call us the Ghosts of Bakhmut',/news/world-europe-66354363
Broad bowls England to series-levelling win,/sport/cricket/66362287
Fabinho makes move to Al-Ittihad from Liverpool,/sport/football/66259309
'Pure joy and happiness' - Broad on fairytale finale,/sport/cricket/66366996
Republic collect first point as Nigeria progress,https://www.bbc.com/sport/football/66352670
Benzina becomes first to wear hijab at World Cup,https://www.bbc.com/sport/football/66352632
'Best team we've seen' - can Japan go all the way?,https://www.bbc.com/sport/football/66360475
Why Twitter users feel betrayed,https://www.bbc.com/worklife/article/20230731-why-twitters-rebrand-to-x-feels-shocking-to-users
Wine's heat-beating weapon from the sea,https://www.bbc.com/future/article/20230727-the-microbes-that-could-protect-grapevines-from-climate-change
The wildlife capital of New Zealand,https://www.bbc.com/travel/article/20230730-six-of-the-best-ways-to-immerse-yourself-in-nature-around-dunedin
The most powerful letter in English,https://www.bbc.com/culture/article/20230728-twitters-rebrand-why-x-could-be-the-most-powerful-letter-in-english
"US nurse and child kidnapped in Haiti, says charity",https://www.bbc.com/news/world-latin-america-66351887
Etsy 'destroying' sellers by withholding money,https://www.bbc.com/news/business-66201042
Biden acknowledges seventh grandchild for first time,https://www.bbc.com/news/world-us-canada-66347362
The return of cargo-carrying sail ships,https://www.bbc.com/news/business-66300187
Tech Decoded: The latest news direct to your inbox,https://www.bbc.com/news/technology-65786969
Watch: Plane crashes into sea by busy US beach,/news/world-us-canada-66360359
Watch: Plane crashes into sea by busy US...,/news/world-us-canada-66360359
Ukraine's Motherland monument gets a makeover,/news/world-europe-66362122
Man saved after car flips in raging...,/news/world-asia-66359776
Watch: Man walks Qatar slackline 185m above...,/news/world-middle-east-66356638
Watch: Huge blast as drone explodes in Moscow,/news/world-europe-66353931
Husband plants surprise sunflower field as...,/news/world-us-canada-66350563
Riot police blast Turkey mine protesters with...,/news/world-europe-66351888
One-minute World News,/news/10462520
Watch: Injured horse flown to California...,/news/world-us-canada-66350512
Inside a 19th Century island time capsule,/news/uk-wales-66342173
Photographer catches 'once in a lifetime' picture,/news/uk-england-cornwall-66332656
Zuckerberg: Threads users down by more than a half,/news/technology-66336058
Cardi B throws microphone into crowd at gig,/news/entertainment-arts-66358971
Sunak insists new oil and gas 'entirely consistent' with net zero,/news/live/uk-politics-66357043
Midsomer Murders composer Jim Parker dies aged 88,/news/entertainment-arts-66360435
Was pro-Russian group behind Kenya cyber-attack?,/news/world-africa-66337573
NHS sees allergic reaction emergencies double,/news/health-66330268
Introducing a new Premier League newsletter,https://cloud.email.bbc.com/FootballExtra_Newsletter_Signup
Boston's five best oyster bars,https://www.bbc.com/travel/article/20230630-a-tour-of-bostons-five-best-oyster-bars-with-chef-michael-serpa
"Water, fire and oceans: Africa’s top shots",/news/world-africa-66323739
Sinéad O'Connor: Fans mourn in London and Dublin,/news/in-pictures-66333764
Sinéad O'Connor: Life in pictures,/news/in-pictures-66323955
In Pictures: Wildfires in Europe and North Africa,/news/in-pictures-66289156
See Africa unmasked through its own lens,/news/world-africa-66257772
