title,url
Five revelations from Nasa's public UFO meeting,/news/world-us-canada-65729356
A top soldier's defamation case rocks Australia,https://www.bbc.com/news/world-australia-65717684
Europa League final: Sevilla beat Roma on penalties - reaction,/sport/live/football/65769524
What is an 'orchid' parent?,https://www.bbc.com/future/article/20230525-the-rise-of-highly-sensitive-parents
New Spider-Verse is a 'disappointment' ★★★☆☆,https://www.bbc.com/culture/article/20230531-spider-man-across-the-spider-verse-is-disappointing
US debt deal heads to vote despite hard-line revolt,/news/world-us-canada-65759537
AI 'godfather' feels 'lost' over life's work,/news/technology-65760449
Amazon to pay $25m over Alexa privacy violations,/news/technology-65772154
Sevilla beat Roma on penalties to win Europa League,/sport/football/65752974
Messi set for decision on future - and it won't be Barcelona,/sport/football/65770318
Djokovic and Alcaraz advance in French Open,/sport/tennis/65766783
The isles where baguettes are regulated,https://www.bbc.com/travel/article/20230530-how-the-islands-of-tahiti-are-reclaiming-their-cuisine
The fight over children's classics,https://www.bbc.com/culture/article/20230530-roald-dahl-the-fierce-debate-over-rewriting-childrens-classics
The big myth about patriarchy,https://www.bbc.com/future/article/20230525-how-did-patriarchy-actually-begin
Why 'back-up careers' are disappearing,https://www.bbc.com/worklife/article/20230525-why-the-back-up-career-is-moving-further-out-of-reach
The first autism-friendly US city,https://www.bbc.com/travel/article/20230529-mesa-the-us-first-autism-friendly-city
Sia reveals autism diagnosis after film backlash,https://www.bbc.com/news/entertainment-arts-65764285
Air New Zealand weighing passengers before flying,https://www.bbc.com/news/business-65765801
The 'exploding' demand for giant heat pumps,https://www.bbc.com/news/business-65321487
The chip maker that became an AI superpower,https://www.bbc.com/news/business-65675027
Watch car fly off tow truck ramp on US motorway,/news/world-us-canada-65770238
Watch car fly off tow truck ramp on US...,/news/world-us-canada-65770238
Watch: Missile falls from sky onto busy Kyiv...,/news/world-europe-65763731
Why South Korea woke up to sirens... in 73...,/news/world-asia-65763730
Watch: Rick rolls on to BBC Breakfast in his...,/news/entertainment-arts-65763729
"Chinese jet buzzed US military plane, says...",/news/world-us-canada-65761741
Black bear walks into bakery and eats 60...,/news/world-us-canada-65762080
Elizabeth Holmes walks into prison to start...,/news/world-us-canada-65761524
Watch: Police find marijuana stash in...,/news/world-latin-america-65759925
Watch: Beachgoers run for cover as shooting...,/news/world-us-canada-65753335
Watch: Video appears to show drone flying...,/news/world-europe-65752254
Music industry responds to streaming pay anger,/news/technology-65753759
US actor Danny Masterson found guilty of rape,/news/world-us-canada-65772615
Peas that don't taste like peas could help planet,/news/science-environment-65610025
CBI boss admits vote on plans to change 'critical',/news/business-65756123
Every Canadian cigarette to carry health warning,/news/world-us-canada-65755793
Windrush generations mark 75th anniversary,/news/in-pictures-65682878
Using pig fat as green jet fuel 'will hurt planet',/news/science-environment-65727664
Why car parks are the hottest space in solar power,https://www.bbc.com/news/business-65626371
Protein's power is being uncovered and unleashed,https://www.bbc.com/news/business-65468298
Photographing history: The quarrymen of Wales,/news/uk-wales-65717619
Photographer blends Africa with Welsh communities,/news/uk-wales-65709322
Warm smiles and purple skies: Africa's top shots,/news/world-africa-65707712
In pictures: King and Queen visit Northern Ireland,/news/uk-northern-ireland-65701853
"Dad completes 1,000 days of toy car photos",/news/uk-scotland-north-east-orkney-shetland-65714184
