title,url
FBI took top secret documents from Trump's home,/news/world-us-canada-62527628
Rushdie on ventilator and may lose eye after attack,/news/world-us-canada-62528689
Ukraine to target Russian troops at nuclear plant,/news/world-europe-62537495
'We have lost a bright light' - Anne Heche family,/news/entertainment-arts-62506673
"'A joke', 'bullied' & 'rotten' - are Man Utd at rock bottom?",/sport/football/62536761
Rushdie suspect charged with attempted murder,/news/world-us-canada-62536592
Heavy winds cause havoc at Spanish festival,/news/world-europe-62531471
Taliban break up rare protest by Afghan women,/news/world-middle-east-62532839
Stalemate for Barcelona in La Liga opener,/sport/football/62537062
All Blacks end losing streak with epic S Africa win,/sport/rugby-union/62536708
How Jesus is lifting standards at Arsenal,/sport/football/62536005
Why open relationships are on the rise,https://www.bbc.com/worklife/article/20220725-the-rising-curiosity-behind-open-relationships
The 21st Century's ultimate film star,https://www.bbc.com/culture/article/20220804-why-brad-pitt-is-the-21st-centurys-ultimate-film-star
"An underground city of 20,000 people",https://www.bbc.com/travel/article/20220810-derinkuyu-turkeys-underground-city-of-20000-people
The puppet calling his creator racist,https://www.bbc.com/culture/article/20220811-meet-the-puppet-who-has-called-out-his-creator-for-racism
The language that doesn't use 'no',https://www.bbc.com/future/article/20220804-kusunda-the-language-isolate-with-no-word-for-no
The 'pasta revolution' sweeping Italy,https://www.bbc.com/travel/article/20220809-cacio-e-pepe-en-vessie-a-pasta-cooked-in-a-pigs-bladder
The new problem for 'overthinkers',https://www.bbc.com/worklife/article/20220803-why-overthinkers-struggle-with-remote-work
What did the FBI find in Trump's home?,https://www.bbc.com/news/world-us-canada-62528709
A Spanish town abandoned by mistake,https://www.bbc.com/travel/article/20220811-a-spanish-town-abandoned-by-mistake
King Goat removed from 'throne' as Irish heat soars,https://www.bbc.com/news/world-europe-62516259
High and low-tech ways to tackle India's water crisis,https://www.bbc.com/news/business-61965419
A life in 10 pictures: Elizabeth Taylor,https://www.bbcselect.com/watch/elizabeth-taylor/?utm_source=BBC&utm_medium=Homepage&utm_campaign=A+Life+in+10+Pictures+Elizabeth+Taylor
Pulling energy out of the sky,/news/science-environment-62513387
Pulling energy out of the sky,/news/science-environment-62513387
Tonnes of fish found dead in German-Polish...,/news/world-europe-62537130
We fled the Taliban for our Olympic dream,/news/world-asia-62498517
Ibiza: The birth of the 'party island',/news/stories-62506050
'I got told off for playing football',/news/uk-england-leicestershire-62522340
Video from the scene where Salman Rushdie was...,/news/world-us-canada-62525511
Megafire rips through swathes of land near...,/news/world-europe-62509411
Bear high on 'mad honey' rescued by rangers,/news/world-62519493
UK heatwave: Baby hedgehogs 'disorientated',/news/uk-62508378
Drought highlights dangers for electricity supply,/news/science-environment-62524551
'I'm a different person after having monkeypox',/news/world-us-canada-62438263
Comic Sadowitz has Edinburgh Fringe show cancelled,/news/uk-scotland-edinburgh-east-fife-62533592
People can't wait for energy help - Citizens Advice,/news/business-62509970
Presenter Helen Skelton completes Strictly line-up,/news/entertainment-arts-62532622
NHS IT supplier held to ransom by hackers,/news/technology-62506039
Britney Spears' ex guilty over crashing wedding,/news/entertainment-arts-62531945
Why more of us are trying to fix things ourselves,https://www.bbc.com/news/business-62476690
Mining boss: 'One person doesn't have all the answers',https://www.bbc.com/news/business-62476338
In pictures: Stunning Sturgeon Moon lights up skies,/news/in-pictures-62518102
"In pictures: Heatwaves, drought and wildfires",/news/in-pictures-62497772
"Africa's top shots: Laughs, leaps and prickly pears",/news/world-africa-62503581
Picture of wild cat hunting flamingo wins award,/news/in-pictures-62492855
Mexico indigenous groups celebrate their heritage,/news/world-latin-america-62491341
