title,url
Alex Jones must pay $4m for Sandy Hook hoax claims,/news/world-us-canada-62427918
US urges Russia to agree deal to free jailed Griner,https://www.bbc.com/news/world-us-canada-62431229
Thailand nightclub fire kills at least 13,https://www.bbc.com/news/world-asia-62333537
"UK will fall into recession this year, warns Bank",https://www.bbc.com/news/business-62405037
The nuclear weapons no one can find,https://www.bbc.com/future/article/20220804-the-lost-nuclear-bombs-that-no-one-can-find
China restarts drills as Pelosi vows Taiwan won't be isolated,/news/live/world-asia-62404233
Four critically hurt by lightning near White House,/news/world-us-canada-62431231
US police charged over death of Breonna Taylor,/news/world-us-canada-62427546
Commonwealth Games: 17 golds to be won on day eight,/sport/live/commonwealth-games/57276950
Premier League build-up and news conferences,/sport/live/football/62432298
"Major signings, new teams & rule changes - the big kick-off",/sport/football/61966887
The people exploring open relationships,https://www.bbc.com/worklife/article/20220725-the-rising-curiosity-behind-open-relationships
What comes after consumerism?,https://www.bbc.com/future/article/20220803-citizen-future-why-we-need-a-new-story-of-self-and-society
The 21st Century's ultimate film star,https://www.bbc.com/culture/article/20220804-why-brad-pitt-is-the-21st-centurys-ultimate-film-star
The public garden growing deadly plants,https://www.bbc.com/travel/article/20220804-the-uks-deadliest-garden
'Esports needs the same focus as physical events',https://www.bbc.com/news/newsbeat-62427420
World's biggest arts festival opens in Edinburgh,https://www.bbc.com/news/uk-scotland-edinburgh-east-fife-62427442
Workers in Iraq given day off as heat hits 50C,https://www.bbc.com/news/world-middle-east-62426302
Can drumming reconnect you to your colleagues?,https://www.bbc.com/news/business-62061572
Can North America's downtowns reverse their downturns?,https://www.bbc.com/news/business-62390097
The Japanese road washed away in a flood,/news/world-asia-pacific-62433639
The Japanese road washed away in a flood,/news/world-asia-pacific-62433639
The Battle for No 10: Key moments from the TV...,/news/uk-politics-62428665
Forrest Gump gets Bollywood treatment,/news/entertainment-arts-62429441
Call for medal to honour killed emergency...,/news/uk-62419394
Watch: China launches missiles in Taiwan...,/news/world-asia-62420764
Ukraine teenager's traumatic journey to...,/news/uk-62422942
"Iceland volcano was so beautiful, I had a...",/news/world-europe-62419427
Loud bangs as China begins Taiwan drills,/news/world-asia-62420763
Meet Australia's first hijab-wearing senator,/news/world-australia-62374371
One-minute World News,/news/10462520
How a small Hong Kong firm saw its shares soar,/news/business-62417010
Warning follows record Great Barrier Reef coral cover,/news/world-australia-62402891
Dating app Tinder swipes left on chief executive,/news/business-62402874
US declares monkeypox a public health emergency,/news/world-us-canada-62424157
Radio 2's Richie Anderson joins Strictly line-up,/news/entertainment-arts-62407451
'Forever chemicals' over safe levels in rainwater,/news/science-environment-62391069
Polio virus found in New York wastewater,/news/world-us-canada-62395325
Hard Rock boss: The shift I'll never forget,https://www.bbc.com/news/business-62381040
How rangers use AI to help protect India's tigers,https://www.bbc.com/news/business-61824904
Students use art to explore future of the planet,/news/in-pictures-61969406
In pictures: Fans celebrate historic England win,/news/uk-england-london-62370085
Photos reveal bygone way of life on peninsula,/news/uk-wales-62295592
Africa's top shots: Boat racing and record breakers,/news/world-africa-62332375
In pictures: Sheeran joins Snow Patrol at Latitude,/news/uk-england-suffolk-62290216
