title,url
Seven shot dead at Hamburg Jehovah's Witness hall,/news/world-europe-64910415
California warned storms pose 'great danger' to life,https://www.bbc.com/news/world-us-canada-64911139
How big are Trump's legal problems?,https://www.bbc.com/news/world-us-canada-61084161
Italy's impressive subterranean civilisation,https://www.bbc.com/travel/article/20230309-italys-impressive-subterranean-civilisation
What drives 'catty' workplace conflict,https://www.bbc.com/worklife/article/20230309-the-bias-that-drives-catty-workplace-conflict
Regulators take over US bank behind market slump,/news/business-64915616
Trump invited to testify in Stormy Daniels case,/news/world-us-canada-64913814
First vaccine for honeybees could save billions,/news/world-us-canada-64919705
Barcelona face corruption charges over payments,/sport/football/64918604
Klopp 'bit surprised' by Firmino's choice to leave,/sport/football/64915543
Fury-Usyk undisputed fight 'unlikely to happen next',/sport/boxing/64721812
The best pop star of her generation?,https://www.bbc.com/culture/article/20230309-why-miley-cyrus-is-the-ultimate-21st-century-pop-star
A better way to make concrete,https://www.bbc.com/future/article/20230309-how-carbon-negative-concrete-can-help-the-climate
The return of Europe's colourless food,https://www.bbc.com/travel/article/20230308-europes-forgotten-transalpine-cuisine
The young workers in a post-Me Too era,https://www.bbc.com/worklife/article/20230307-did-me-too-change-the-workplace-for-gen-z
The hardest language to spell?,https://www.bbc.com/future/article/20230302-can-dyslexia-change-in-other-languages
How the US power grid is a target for the far-right,https://www.bbc.com/news/world-us-canada-64832129
Britain's 'wonkiest pub' to be sold,https://www.bbc.com/news/uk-england-birmingham-64912966
Is there a better way to insulate our draughty homes?,https://www.bbc.com/news/business-64636384
UK microchip firms call for millions in investment,https://www.bbc.com/news/business-64872465
Video appears to show Hamburg suspect firing through window,/news/world-europe-64910862
Video appears to show Hamburg suspect firing...,/news/world-europe-64910862
Watch: On the ground at Israel's mass...,/news/world-middle-east-64908051
Sliding cars and snowball fights amid Spring...,/news/uk-64917863
Tearful Marine describes Afghan withdrawal...,/news/world-us-canada-64899291
Watch: China's leader and his two teacup...,/news/world-asia-china-64897273
What you need to know on Eurovision UK entry...,/news/entertainment-arts-64902446
The ex-RAF base used in WWII that could house...,/news/uk-england-64889909
Rare 'snow tornado' spotted by Shetland...,/news/uk-scotland-64900417
Police break up Georgia protests as crowds...,/news/world-europe-64888796
One-minute World News,/news/10462520
Chinese city draws backlash with flu lockdown idea,/news/world-asia-china-64911212
Lineker pulled from presenting after impartiality row,/news/uk-64920557
TikTokers target controversial Willow oil project,/news/science-environment-64906323
New idea for sucking up CO2 from air shows promise,/news/science-environment-64886116
Meta exploring plans for Twitter rival,/news/technology-64917397
Why do Chinese billionaires keep vanishing?,/news/business-64781986
Africa's top shots: Cool frames and gold nuggets,/news/world-africa-64902352
'Hate crimes and extreme politics' in India,https://www.bbcselect.com/ca/watch/india-the-modi-question/?utm_source=.com+homepage&utm_medium=Video&utm_campaign=India%3A+The+Modi+Question
'We cut our website's carbon emissions by 520kg in a year',https://www.bbc.co.uk/news/business-64623955
Robert Blake: From Hollywood to murder accused,/news/world-us-canada-64911059
Photographers capture March's 'worm moon',/news/uk-england-york-north-yorkshire-64887992
Turkish women defy protest ban to march in Istanbul,/news/world-europe-64897655
Sunrise swim celebrates International Women's Day,/news/uk-scotland-64889062
What a bird's eye view of Africa reveals,/news/world-africa-64862607
