title,url
FBI cites 'evidence of obstruction' in Trump search,/news/world-us-canada-62691011
Trump affidavit drops clues on scale of FBI probe,/news/world-us-canada-62696076
Desperation as monsoon floods devastate Pakistan,/news/world-asia-62699886
Russia blocks nuclear treaty over Ukraine reference,/news/world-us-canada-62699066
England surge to innings win to level series,/sport/cricket/62688624
Pastor arrested while watering neighbour's plants,/news/world-us-canada-62696077
US to appoint its first Arctic Ambassador,/news/world-us-canada-62699129
"Serbia-Kosovo ID document row settled, says EU",/news/world-europe-62702819
Is Haaland the 'final piece' in Man City jigsaw?,/sport/football/62702811
How Arteta is turning Arsenal into contenders,/sport/football/62703697
Williams sisters to play US Open doubles together,/sport/tennis/62703155
11 films to watch this September,https://www.bbc.com/culture/article/20220825-11-of-the-best-films-to-watch-this-september
Why your gut bacteria like a workout,https://www.bbc.com/future/article/20220825-how-exercise-can-give-your-gut-microbes-a-boost
The struggle with height discrimination,https://www.bbc.com/worklife/article/20220825-height-discrimination-how-heightism-affects-careers
Can Hawaii solve a global food crisis?,https://www.bbc.com/travel/article/20220818-ahupuaa-hawaiis-ancient-land-management-system
The meaning of Tolkien's iconic symbol,https://www.bbc.com/culture/article/20220824-the-ancient-roots-of-the-lord-of-the-rings
The workplace stigma that won't budge,https://www.bbc.com/worklife/article/20220819-is-workplace-stigma-around-mental-health-struggles-changing
Should we be avoiding contrails?,https://www.bbc.com/future/article/20220823-what-makes-up-a-planes-contrails
Did a ‘chance’ airport meeting lead to Rushdie fatwa?,https://www.bbc.com/news/world-62561895
Could Mario Kart be a victim of its own success?,https://www.bbc.com/news/entertainment-arts-62362647
Shaquille O'Neal backs Australian Indigenous vote,https://www.bbc.com/news/world-australia-62700244
How to stay cool the Japanese way,https://www.bbc.com/news/business-62659199
Lost at Sea: The disappearance of Keith Davis,https://www.bbcpodcasts.com/listen/lost-at-sea/?utm_source=BBC.com&utm_medium=Homepage&utm_campaign=Lost+at+Sea
Millions affected by heavy flooding in Pakistan,/news/world-asia-62696035
Millions affected by heavy flooding in...,/news/world-asia-62696035
China's severe drought from the air,/news/world-asia-china-62696115
‘My daughter happened because of the Gay...,/news/stories-62581051
Latvia brings down Soviet-era WW2 monument,/news/uk-62682771
A (nervous) day in the life of a GCSE student,/news/education-62678435
On call with Italy's horseback doctor,/news/world-europe-62662429
Band stuck in Calais queue perform surprise...,/news/world-europe-62667554
"CCTV shows moments before girl, 9, shot dead",/news/uk-62667553
Floods deluge parts of southern Pakistan,/news/world-asia-62662927
Kyiv residents reflect on six months of war,/news/world-europe-62656754
The 1975 top Leeds bill after Rage pull out,/news/entertainment-arts-62620409
Instagram says precise location is never shared,/news/technology-62686375
Gamers face price rise on PS5 but not Switch,/news/technology-62659688
Synthetic mouse embryo develops beating heart,/news/health-62679322
Bad Boy Chiller Crew get Leeds Festival bouncing,/news/entertainment-arts-62686220
A photographic mission to show us the Moon,/news/science-environment-62662685
S Korea records world's lowest fertility rate again,/news/world-asia-62670717
"'You're a good bloke, but you don't know how to mop'",https://www.bbc.com/news/business-62651212
What to do with clothes you no longer wear,https://www.bbc.co.uk/news/business-62176336
"Knight, kite and butterflies: Photos of the week",/news/in-pictures-62686075
Sunken medieval village reappears at reservoir,/news/uk-england-york-north-yorkshire-62677584
"Africa's top shots: Revellers, robots and rioters",/news/world-africa-62672601
Photographer heads home to shine light on refugees,/news/uk-england-tyne-62505144
Zoo animals hop on the scales for annual weigh-in,/news/uk-england-beds-bucks-herts-62647665
