title,url
Zelensky thanks ordinary Americans as he meets Biden,/news/live/world-us-canada-64055030
Putin says Russia not to blame for Ukraine war,/news/world-europe-64055018
Eight Canadian teen girls charged with killing man,/news/world-us-canada-64050711
The naked rodent with biological superpowers,https://www.bbc.com/future/article/20221206-what-naked-mole-rats-can-teach-us-about-treating-cancer
The violent TV universe gripping the US,https://www.bbc.com/culture/article/20221213-1923-and-the-rise-of-the-latest-divisive-tv-universe
Powerful winter storm disrupts holiday travel,/news/world-us-canada-64046520
Trump business losses sharply reduced his tax bill,/news/business-64059437
Man who made 'NFL's greatest play' dies at 72,/sport/american-football/64055339
"EFL Cup: Man Utd & Forest lead, Charlton holding Brighton",/sport/live/football/63630925
Scottish Premiership: Can Livingston find late leveller at Celtic?,/sport/live/football/63652837
Mead wins Sports Personality of the Year,/sport/sports-personality/64045751
The sex myth that destroys lives,https://www.bbc.com/future/article/20220419-how-the-hymen-myth-destroys-lives
Eight photos showing a US in crisis,https://www.bbc.com/culture/article/20220202-eight-photos-showing-a-us-in-crisis
The workers 'coasting' in their jobs,https://www.bbc.com/worklife/article/20220329-the-coasting-workers-whove-checked-out-of-their-jobs
America's greatest living writer?,https://www.bbc.com/culture/article/20221213-why-don-delillo-is-americas-greatest-living-writer
An answer to India's flower waste,https://www.bbc.com/future/article/20221208-fleather-the-vegan-leather-made-of-indias-flower-waste
Is Santa Claus buried in Ireland?,https://www.bbc.com/travel/article/20221213-is-santa-claus-buried-in-ireland
Why love and sex are changing,https://www.bbc.com/worklife/article/20221214-love-and-sex-in-2022-the-five-biggest-lessons-of-the-year
The language which has 400 words for snow,https://www.bbc.co.uk/ideas/videos/which-language-has-400-words-for-snow/p063vmwx?playlist=festive-picks
Five life lessons from classic Christmas movies,https://www.bbc.co.uk/programmes/articles/3vQ4k1JrSNC2L15JvtgwGvT/five-life-lessons-from-classic-christmas-movies
Shortcuts to make Christmas desserts sparkle,https://www.bbc.co.uk/food/articles/shortcuts_christmas_desserts
What makes Nashville a magnet for entrepreneurs?,https://www.bbc.com/news/business-63304623
The cargo hauling aircraft with no pilots on board,https://www.bbc.com/news/business-63595481
Baby pink iguanas spotted for first time,/news/science-environment-64052021
Baby pink iguanas spotted for first time,/news/science-environment-64052021
Ros Atkins on... China’s Covid surge,/news/world-asia-china-64042718
The crowd goes wild for Argentina... in...,/news/world-asia-64046666
BBC reporter mobbed by joyous Argentina fans,/news/world-latin-america-64037345
Watch Argentina get heroes' welcome in Buenos...,/news/world-latin-america-64037344
Venezuelans ignore dangers of Darién jungle,/news/world-latin-america-63919161
Chaos as severe turbulence hits Hawaiian...,/news/world-us-canada-64034756
'Argentina really needed this win',/news/world-latin-america-64022968
Fans react as Argentina win emotional...,/news/world-latin-america-64020244
"Cathedral allows girl choristers after 1,000...",/news/world-europe-64022963
Ex-FTX boss agrees to be extradited to US - lawyer,/news/technology-64051438
Lycett defends himself over Qatar hypocrisy charge,/news/entertainment-arts-64052197
India steps up Covid surveillance after China surge,/news/world-asia-india-64048789
Billionaire tech boss shares secret for sorting emails,https://www.bbc.co.uk/news/av/business-63988315
FTX boss agrees to be extradited to face charges,/news/business-64036615
UK space launch gets final approval,/news/uk-england-cornwall-64049483
US seizes enough fentanyl to kill every American,/news/world-us-canada-64047688
Why car dealers may face a bumpy road ahead,https://www.bbc.com/news/business-63901216
Skilled tech workers snapped up despite downturn,https://www.bbc.com/news/business-63871090
In pictures: An explosion of joy as Argentina wins,/news/world-latin-america-64026174
Argentina win 2022 World Cup final - in pictures,/sport/football/64020038
Great images from every men's World Cup final,https://www.bbc.co.uk/sport/extra/a7f6ujslg5/Best-World-Cup-final-pictures
Teenager's sunset hare shot wins top RSPCA prize,/news/uk-england-manchester-63991209
"Africa's top shots: Puppies, pageants and paddles",/news/world-africa-63983910
