title,url
"Donald Trump took US nuclear secrets and stored files in shower, charges say",/news/live/world-us-canada-65852074
Johnson: I've been forced out over Partygate report,https://www.bbc.com/news/uk-politics-65863267
US officer rescues woman in car mouthing 'help me',https://www.bbc.com/news/world-us-canada-65851440
French Open: Ruud beats Zverev to set up Djokovic final - radio & text,/sport/live/tennis/65672486
Why is there taurine in energy drinks?,https://www.bbc.com/future/article/20230609-why-is-there-taurine-in-energy-drinks
Ukraine's counter-offensive against Russia under way,/news/world-europe-65860294
Boris Johnson resigns as MP with immediate effect,/news/live/uk-politics-65860705
'Backpack hero' praised for facing France knifeman,/news/world-europe-65860077
Djokovic beats ailing Alcaraz to book final with Ruud,/sport/tennis/65860442
India have hope after third-day final fightback,/sport/cricket/65860402
Murray fights back to reach Surbiton semi-finals,/sport/tennis/65861252
The fading glamour of digital nomadism,https://www.bbc.com/worklife/article/20230531-the-workers-quitting-digital-nomadism
Will unhealthy US air change attitudes?,https://www.bbc.com/future/article/20230608-canada-wildfires-will-they-change-climate-attitudes-on-us-east-coast
11 of the best New York films,https://www.bbc.com/culture/article/20230608-from-taxi-driver-to-25th-hour-11-of-the-best-new-york-films
Why AI won't be a burnout cure,https://www.bbc.com/worklife/article/20230605-why-ai-wont-be-the-burnout-cure-weve-been-waiting-for
The drone that can put out wildfires,https://www.bbc.com/future/article/20230609-can-we-use-firefighting-drones-put-out-wildfires
Why this tart is a culinary mystery,https://www.bbc.com/travel/article/20230608-the-italian-tart-that-tricked-the-pope
The jacket that symbolises Britishness,https://www.bbc.com/culture/article/20230609-how-the-barbour-became-the-ultimate-british-symbol
The world's most underrated dive spots?,https://www.bbc.com/travel/article/20230607-the-worlds-best-hidden-dive-spots
Greta Thunberg graduates from 'school strike',https://www.bbc.com/news/science-environment-65858186
The divisive debate over California's anti-caste bill,https://www.bbc.com/news/world-asia-india-65819688
India attempts to revive its dwindling rubber industry,https://www.bbc.com/news/business-65543616
'Two of my gay friends have gone missing',https://www.bbcselect.com/watch/gay-under-the-taliban/?utm_source=BBC.com&utm_medium=Homepage&utm_campaign=Gay+Under+The+Taliban
Drone footage shows blaze at listed building,/news/uk-england-tyne-65856241
Drone footage shows blaze at listed building,/news/uk-england-tyne-65856241
Train smashes through truck on railway...,/news/world-us-canada-65859078
Drone footage shows extent Ukraine dam burst...,/news/world-europe-65853621
Watch: Driving test ends with crash into...,/news/world-latin-america-65852316
Wildfires continue to burn across Canada,/news/world-us-canada-65853623
Wind vortex seen over Kilauea volcano after...,/news/world-us-canada-65851094
Wolf pups practise howling for the first time,/news/world-us-canada-65848978
Annecy knife attack victim: 'There was no...,/news/world-europe-65856725
Biden calls Sunak 'president' by mistake,/news/uk-politics-65850274
Watch: West Ham trophy parade draws huge...,/news/uk-65851408
Surreal skies grip New Yorkers - in pictures,/news/in-pictures-65843841
Katie Waissel says she was 'ridiculed' on X Factor,/news/entertainment-arts-65842433
How AI is helping doctors spot breast cancers,/news/technology-65821552
US cancer drug shortage hits thousands of patients,/news/world-us-canada-65791190
Mediterranean-style wildfire fighting coming to UK,/news/science-environment-65848872
Dave and Central Cee set a new streaming record,/news/entertainment-arts-65859506
Is climate change fuelling Canada's wildfires?,/news/science-environment-65837040
Why millions of useable hard drives are being destroyed,https://www.bbc.com/news/business-65669537
The tech tricks that make computer games look real,https://www.bbc.com/news/business-65532128
Mosque plasterers and rock cutters: Africa's top shots,/news/world-africa-65843357
Strawberry Moon captured over England,/news/uk-england-leicestershire-65802574
Bywyd ar fferm fynydd Gymreig // Life on a Welsh hill farm,/newyddion/65828633
Top Scottish landscape photographers announced,https://www.bbc.co.uk/news/articles/c6p34zr7rz7o
Long lashes and fashion flair: Africa's top shots,/news/world-africa-65772200
