title,url
"I am not the President's lawyer, says US attorney general",/news/live/world-us-canada-66868827
India warns citizens in Canada to be cautious,https://www.bbc.com/news/world-asia-india-66851960
US child dies from fentanyl kept under nursery mat,https://www.bbc.com/news/world-us-canada-66861588
The rise of 'paid paid time off',https://www.bbc.com/worklife/article/20230918-the-companies-doling-out-thousands-for-workers-holidays
The superstar models who ruled the 90s,https://www.bbc.com/culture/article/20230919-the-super-models-how-linda-cindy-christy-naomi-and-tatjana-defined-an-era
Ceasefire deal as Karabakh forces agree to disarm,/news/world-europe-66863702
Musk's influence grows as world leaders flock to him,/news/world-us-canada-66777096
Rishi Sunak pushes back ban on new petrol and diesel cars to 2035,/news/live/uk-66863110
Rugby World Cup: Italy v Uruguay - radio & text,/sport/live/rugby-union/65867306
Spain players agree to end boycott,/sport/football/66863081
Solskjaer criticises some players from Man Utd reign,/sport/football/66865014
A one-pot wonder rice dish,https://www.bbc.com/travel/article/20230919-the-simple-art-of-rice-seafood-paella-with-lime
Could this win the best picture Oscar?,https://www.bbc.com/culture/article/20230919-american-fiction-review-could-jeffrey-wright-win-the-best-actor-oscar
Why heat is a 'silent killer',https://www.bbc.com/future/article/20230918-how-community-maps-can-protect-children-from-extreme-heat
How I rewired my brain in six weeks,https://www.bbc.com/future/article/20230912-how-i-hacked-my-brain
Where to find London's 'lost' palaces,https://www.bbc.com/travel/article/20230919-a-royal-tour-of-londons-best-palaces-and-parks-with-historian-tracy-borman
'I want to help others' - life as a gay NFL star,https://www.bbc.com/sport/american-football/66822469
Parents offered refunds for Fortnite purchases,https://www.bbc.com/news/technology-66866569
The turbo-charged plants that could boost farm output,https://www.bbc.com/news/business-66798680
Find the right BBC email newsletter for you,https://www.bbc.com/news/world-us-canada-66715271?&at_bbc_team=studios&at_medium=native&at_objective=acquisition&at_ptr_type=&at_ptr_name=bbc.com&at_format=Module&at_link_origin=bbchomepage&at_campaign=nleditorial&at_campaign_id=&at_adset_name=&at_adset_id=&at_creation=&at_creative_id=&at_campaign_type=owned
Watch: Seal pups tangled in nets freed by beachgoers,/news/world-africa-66862091
Watch: Seal pups tangled in nets freed by...,/news/world-africa-66862091
Watch: Wrestlers grapple on Japanese bullet...,/news/world-asia-66856413
Watch: Those viral 'alien corpses' get lab...,/news/world-66853551
Fire guts landmark Khartoum skyscraper,/news/world-africa-66838176
'All that's left is rubble and dirt and...,/news/world-africa-66833155
Rugby fans treat Nice to Welsh hymn in flash...,/news/uk-wales-66833895
On the shoreline where bodies are washing up,/news/world-africa-66830535
Drone footage shows extent of Derna...,/news/world-africa-66830533
Moment police officer dragged away by...,/news/world-us-canada-66827928
Watch: Lightning flashes over southern...,/news/uk-66842877
Channel 4 boss: Brand allegations are horrendous,/news/entertainment-arts-66863272
Why are US car workers on strike?,/news/business-66847747
Half-million-year-old wooden structure unearthed,/news/science-environment-66846772
Musk start-up seeks people for brain-implant trial,/news/technology-66865895
Meditate daily to beat stress blood pressure,/news/health-66807432
Chris Evans tells listeners he is now cancer free,/news/entertainment-arts-66863274
'Accidental' rock photographer wins lifetime prize,/news/entertainment-arts-66817901
The tiny island with a population of 16,https://www.bbc.com/reel/playlist/future-planet?vpid=p07gsk79
The firms hoping to take psychedelic drugs mainstream,https://www.bbc.com/news/business-66669641
Mesmerising marine life photos scoop world prize,/news/in-pictures-66810094
In pictures: Stars hit red carpet at Vogue World,/news/entertainment-arts-66808254
"Fish, flares and faces: Africa’s top shots",/news/world-africa-66807540
Stunning image of huge plasma arc wins award,/news/in-pictures-66807814
In pictures: Desperate search for flood survivors,/news/in-pictures-66805006
