title,url
China to begin reopening to the world in January,/news/world-asia-china-64097497
Winter storm traps Americans in cars for days,/news/world-us-canada-64099642
Taiwan extends mandatory military service to one year,/news/world-asia-64100577
"Liverpool agree deal to sign Gakpo, say PSV",/sport/football/64098641
Five ways Ukraine war could go in 2023,/news/world-us-canada-63987113
Serbian troops on high alert over Kosovo tensions,/news/world-europe-64099388
Iran stops family of football legend from leaving,/news/world-middle-east-64097382
S Korea sorry for not shooting down 'enemy' drones,/news/world-asia-64100974
Warner retires on 200 as Australia build big lead,/sport/cricket/64100556
Premier League makes bumper return after World Cup,/sport/football/64097104
England confirm rearranged Bangladesh tour dates,/sport/cricket/64101504
The forgotten way medieval people slept,https://www.bbc.com/future/article/20220107-the-lost-medieval-habit-of-biphasic-sleep
A stunning lake hidden in plain sight,https://www.bbc.com/travel/article/20220308-new-zealands-secret-lake-most-kiwis-dont-know
The millennials in sexless marriages,https://www.bbc.com/worklife/article/20221019-the-millennials-in-sexless-marriages
The fruit that once fed mastodons,https://www.bbc.com/travel/article/20220425-the-revival-of-a-forgotten-american-fruit
Why we brush our teeth wrong,https://www.bbc.com/future/article/20220718-the-best-way-to-brush-your-teeth
"The entry-level workers making $100,000",https://www.bbc.com/worklife/article/20220401-the-entry-level-workers-earning-six-figure-salaries
The greatest novel of the 20th Century?,https://www.bbc.com/culture/article/20220812-did-proust-write-the-greatest-novel-of-the-20th-century
50 best driving games of all time,https://www.topgear.com/car-news/gaming/these-are-50-best-driving-games-all-time
Quiz: How many 2022 sport moments do you remember?,https://www.bbc.com/sport/64086506
Prince Harry's Spare to kick off 2023 book bonanza,/news/entertainment-arts-63708229
Is the small business surge in the US sustainable?,https://www.bbc.com/news/business-62894499
Tech trends 2023: Flying taxis and satellite phones,https://www.bbc.co.uk/news/business-63130593
Loyle Carner and Jamie Oliver talk food and confidence,/news/entertainment-arts-64102062
Loyle Carner and Jamie Oliver talk food and...,/news/entertainment-arts-64102062
Winter storm continues to disrupt US and...,/news/world-us-canada-64091639
'I used to play piano so we couldn't hear the...,/news/world-europe-64076984
Pope's plea for 'immediate end to senseless...,/news/world-europe-64091253
How astronauts inspired the creation of...,/news/stories-63976499
King Charles's first Christmas Day message,/news/uk-64089749
Royals attend Christmas service at...,/news/uk-64089751
Saving donkeys in the Holy Land,/news/world-middle-east-64081350
Penguin pick-me-up for Christmas hospital...,/news/uk-england-gloucestershire-64053089
Fires burn after violent protests in Paris,/news/world-europe-64087161
The truth about a miracle cure that doesn’t exist,/news/blogs-trending-64070190
FTX founder released to parents on $250m bail,/news/business-64068810
King's first Christmas message tops 10m viewers,/news/entertainment-arts-64094088
"Young, female and addicted in Somalia",/news/world-africa-64032267
Japan's inflation rate hits 41-year high,/news/business-64072866
Can robots stop billions of litres of water leaks?,/news/science-environment-64052740
Television highlights to look out for in 2023,/news/entertainment-arts-64005663
Reindeer herders fear Lapland wind farm boom,https://www.bbc.com/news/business-63901217
The cargo hauling aircraft with no pilots on board,https://www.bbc.com/news/business-63595481
US winter storm in pictures,/news/in-pictures-64074758
Escaping Nile floods to a minefield,/news/world-africa-64032266
Young photographers scoop national awards,/news/uk-england-south-yorkshire-64002737
In pictures: An explosion of joy as Argentina wins,/news/world-latin-america-64026174
Argentina win 2022 World Cup final - in pictures,/sport/football/64020038
