title,url
Burning Man exit begins as boggy ground improves,/news/world-us-canada-66704749
"Jet ski tourists shot after warnings, says Algeria",https://www.bbc.com/news/world-africa-66704750
'I felt no control' - Swiatek stunned in US Open exit,https://www.bbc.com/sport/tennis/66704053
Pakistan's epic 'road trip of dreams',https://www.bbc.com/travel/article/20230903-the-karakoram-highway-the-road-thats-the-eighth-world-wonder
The Killer is a 'boring' disappointment ★★☆☆☆,https://www.bbc.com/culture/article/20230903-the-killer-is-a-boring-disappointment
Ukraine's defence minister dismissed by Zelensky,/news/world-europe-66702893
Gabon coup leader vows free elections - but no date,/news/world-africa-66705693
Barbie beats Super Mario Bros as 2023's top film,/news/entertainment-arts-66705597
Aberg gets wildcard spot in Europe's Ryder Cup team,/sport/golf/66709873
Premier League latest and Q&A on talking points,/sport/live/football/66704783
Police investigating alleged assault on Keane,/sport/football/66703473
Is it only humans that dream?,https://www.bbc.com/future/article/20230901-the-animals-that-dream-just-like-humans-do
Gen Z's new pro-union push,https://www.bbc.com/worklife/article/20230831-the-gen-zers-leading-a-new-pro-union-push
The iconic stew that means 'vitality',https://www.bbc.com/travel/article/20230901-maya-fellers-rastafarian-ital-stew
Mulligan 'has never been better',https://www.bbc.com/culture/article/20230902-maestro-review-bradley-coopers-bernstein-biopic-is-a-hit
Panama national team footballer killed by gunmen,https://www.bbc.com/news/world-latin-america-66706055
UK bees in danger as Asian hornet sightings rise,https://www.bbc.com/news/science-environment-66697968
Burning Man festivalgoers on the mood from the mud,https://www.bbc.com/news/world-us-canada-66705875
Start each day with the top headlines and expert analysis,https://cloud.email.bbc.com/bbcnewsignup2?&at_bbc_team=studios&at_medium=display&at_objective=acquisition&at_ptr_type=&at_ptr_name=bbc.comhp&at_format=Module&at_link_origin=homepage&at_campaign=newsbriefing&at_campaign_type=owned
"Premier League news, insights and gossip straight to your inbox",https://cloud.email.bbc.com/FootballExtra_Newsletter_Signup?&at_bbc_team=studios&at_medium=display&at_objective=acquisition&at_ptr_type=&at_ptr_name=bbc.comhp&at_format=Module&at_link_origin=homepage&at_campaign=footballextra&at_campaign_type=owned
Spectacular meteor streaks across night sky in Turkey,/news/world-europe-66698292
Spectacular meteor streaks across night sky...,/news/world-europe-66698292
Burning Man desert festival turns into mud...,/news/world-us-canada-66700233
Former Harrods boss Mohamed Al Fayed dies...,/news/uk-66694188
Watch Typhoon Saola ripping up trees in Hong...,/news/world-asia-china-66689462
Watch: Typhoon Saola and Storm Haikui seen...,/news/world-asia-66684666
Mother bear seen with cubs days before being...,/news/world-europe-66682329
One-minute World News,/news/10462520
Diver ‘Merman Mike’ finds your treasures...,/news/world-us-canada-66679211
Wiegman dedicates Uefa award to Spain...,/sport/av/football/66678942
Car flips and more: four moments from...,/news/world-us-canada-66677976
Gail Porter: 'Has anyone here been sectioned?',/news/disability-66669845
'We carried our heritage with us',/news/in-pictures-66594398
New tech boosts Dutch drive for sustainable farming,https://www.bbc.co.uk/news/business-66461769
Critically ill UK teen in legal fight with NHS,/news/health-66673511
How do you deal with having your period in Antarctica?,/news/science-environment-66659741
Google's search for an AI future as it turns 25,/news/technology-66659361
Irish music festival site to house refugees,https://www.bbc.co.uk/news/articles/c51r5qmd7n3o
The firms hoping to cut down on wasted cosmetics,https://www.bbc.com/news/business-66585299
The latest technology news direct to your inbox,https://cloud.email.bbc.com/techdecoded-newsletter-signup?&at_bbc_team=studios&at_medium=display&at_objective=acquisition&at_ptr_type=&at_ptr_name=bbc.comhp&at_format=Module&at_link_origin=homepage&at_campaign=techdecoded&at_campaign_type=owned
In pictures: Rare blue supermoon around the world,/news/in-pictures-66662857
Is wildlife photo a ghostly face or a fish?,/news/science-environment-66604630
In pictures: Hurricane Idalia brings destruction,/news/in-pictures-66664539
Wrestlers grapple in gravy at annual charity event,/news/uk-england-lancashire-66645681
Photographer documents 'UFO town dreamland',/news/uk-wales-66619326
