title,url
"Hamas-run health ministry says 9,000 killed in Gaza since 7 October",/news/live/world-middle-east-67281166
Joe Biden calls for 'pause' in Gaza conflict,https://www.bbc.com/news/world-us-canada-67294334
Donald Trump Jr testifies again in NYC fraud trial,/news/live/world-us-canada-67268643
'The day I saw the walls breathing',https://www.bbc.com/future/article/20231101-psychedelic-drugs-flashbacks-hallucinogen-persisting-perception-disorder-hppd
Why surge pricing is spreading,https://www.bbc.com/worklife/article/20231101-why-surge-pricing-is-coming-at-restaurants-online-retailers-and-more
Relaxed Trump Jr cracks jokes in courtroom debut,/news/world-us-canada-67293355
Thousands with no power as Storm Ciarán flood warnings rise,/news/live/uk-67285052
"Taylor Tomlinson, 29, fills James Corden's TV slot",/news/entertainment-arts-67296327
World Cup: India v Sri Lanka,/sport/live/cricket/66858826
When politics derailed England's World Cup campaign,/sport/cricket/67240832
Premier League news conferences & what is wrong at Man Utd?,https://www.bbc.co.uk/sport/football/live/clm0v828yjrt
How Massimo Bottura is redefining BBQ,https://www.bbc.com/travel/article/20231101-massimo-botturas-new-not-barbecue-restaurant
A frosty day at a Finnish forest school,https://www.bbc.com/future/article/20231031-how-forest-schools-boost-childrens-immune-systems
The style rebels who unbuttoned the UK,https://www.bbc.com/culture/article/20231031-how-virginia-woolf-and-the-bloomsbury-group-unbuttoned-britain
Why holiday shopping may surge,https://www.bbc.com/worklife/article/20231031-despite-financial-pressures-holiday-shoppers-will-still-spend-billions
Scotland's tiny isle of just 110 people,https://www.bbc.com/travel/article/20231025-the-isle-of-eigg-the-community-owned-island-that-powers-itself
Swiss village ding-dong over challenge to cowbells,https://www.bbc.com/news/world-europe-67296413
Hampshire apologises for Depp and Heard costume,https://www.bbc.com/news/entertainment-arts-67296157
'Pumpkins saved my business but almost squashed me',https://www.bbc.com/news/av/business-67265905
Portugal's tech boom challenged by tax change,https://www.bbc.co.uk/news/business-67087676
Watch: Inside Kibbutz house hostages were taken from,/news/world-middle-east-67278516
Watch: Inside Kibbutz house hostages were...,/news/world-middle-east-67278516
King tells of regret for British Empire...,/news/uk-67278510
Israeli attack in Gaza leaves massive crater,/news/world-middle-east-67278339
Woman runs up to Qantas plane on tarmac,/news/world-australia-67297954
Baby monitor captures moment window is blown...,/news/uk-67295305
Smashed windows and roofs damaged by storm,/news/uk-67297952
Watch: Pilot saved from wing of plane sinking...,/news/world-us-canada-67284282
Dancing Queen! Camilla joins dance on Kenya...,/news/uk-67289523
Nostalgic look back at London's Christmas...,/news/uk-england-london-67276577
Heidi Klum wows at her annual Halloween bash...,/news/entertainment-arts-67284280
Glastonbury ticket sale delayed by two weeks,/news/uk-67299788
Deep divisions ahead of crucial UN climate talks,/news/science-environment-67271688
"We must address dangers of AI, Sunak tells summit",/news/uk-politics-67296825
Olivia Rodrigo excited to sing in Hunger Games film,/news/entertainment-arts-67296455
Chronic water shortages fuel Zimbabwe's cholera crisis,/news/world-africa-67198511
Damage and disruption: Storm Ciarán in pictures,/news/in-pictures-67298061
Why are fewer women using AI than men?,https://www.bbc.co.uk/news/business-67217915
Would you drink genetically modified beer?,https://www.bbc.com/news/business-67193176
Find the right BBC email newsletter for you,https://www.bbc.com/news/world-us-canada-66715271?&at_bbc_team=studios&at_medium=native&at_objective=acquisition&at_ptr_type=&at_ptr_name=bbc.com&at_format=Module&at_link_origin=bbchomepage&at_campaign=nleditorial&at_campaign_id=&at_adset_name=&at_adset_id=&at_creation=&at_creative_id=&at_campaign_type=owned
Elton John photography collection to go on display,/news/uk-england-london-67205468
Skulls and flowers: Mexico's 'skeleton' parade,/news/in-pictures-67193453
Steely gaze of endangered tigress tops mangrove photo awards,/news/in-pictures-67155632
"Poses, pouts and poles: Africa's top shots",/news/world-africa-67155786
Sydney Opera House: The story of an icon in photos,/news/world-australia-67153713
