title,url
Last Soviet leader Mikhail Gorbachev dies at 91,/news/uk-62732447
Pakistan floods are monsoon on steroids - UN,https://www.bbc.com/news/world-asia-62722117
Spy for Canada smuggled Shamima Begum to Syria,https://www.bbc.com/news/uk-62726954
Raducanu's US Open defence ends at first hurdle,https://www.bbc.com/sport/tennis/62733471
The Himalaya's most sacred places,https://www.bbc.com/travel/article/20220830-the-himalayas-hidden-paradise-valleys
Tributes pour in for 'giant' who helped end Cold War,/news/live/world-europe-62732807
"'No water to drink, fight fires or flush toilets'",/news/world-us-canada-62727586
Should rap lyrics be allowed as evidence in court?,/news/world-us-canada-62087286
Not just a flair player: Quaresma's stand for Roma rights,/sport/football/62687226
Saints fight back for deserved win over Chelsea,/sport/football/62641729
'Smith's defection is a sickening blow to PGA Tour',/sport/golf/62730763
Why sex ed doesn't have to be awkward,https://www.bbc.com/future/article/20220823-how-to-talk-to-your-kids-about-sex
Is Quebec's French the 'real' French?,https://www.bbc.com/travel/article/20220829-the-royal-roots-of-quebecs-french
The new 'rockstars of mobility',https://www.bbc.com/worklife/article/20220825-the-remote-workers-swapping-homes
How human poo can save our soils,https://www.bbc.com/future/article/20220830-the-new-science-of-recycling-human-poo
Eight best opera houses in the world,https://www.bbc.com/culture/article/20220825-eight-of-the-most-stunning-opera-houses-in-the-world
Medieval bodies in well victims of anti-Semitism,https://www.bbc.com/news/uk-england-norfolk-62731151
Inventing Anna friend sues Netflix for defamation,https://www.bbc.com/news/entertainment-arts-62727106
UK looks to Sweden for a solution to nuclear waste,https://www.bbc.com/news/business-62677534
Flexible firms take break from fixed bank holidays,https://www.bbc.com/news/business-62491321
"Last Soviet leader, Mikhail Gorbachev, dies aged 91",/news/world-europe-62729199
"Last Soviet leader, Mikhail Gorbachev, dies...",/news/world-europe-62729199
Meet the Conservatives choosing the next PM,/news/uk-politics-62731003
Books and bomb shelters: Ukraine returns to...,/news/world-europe-62729196
A rare glimpse of the 'world's loneliest man',/news/world-latin-america-62723989
Tomato truck crash causes huge mess on US...,/news/world-us-canada-62729166
Boris Johnson refuses to rule out political...,/news/uk-politics-62725159
One-minute World News,/news/10462520
Helicopter lifts boy stranded in Pakistan...,/news/world-asia-62713213
Protesters storm Iraq's presidential palace,/news/world-middle-east-62716721
Man breaks Guinness World Record riding in a...,/news/world-us-canada-62716252
McDermid reveals legal threat from Christie estate,/news/entertainment-arts-62727105
Watchdog acts over location-data abortion fears,/news/technology-62654155
Ex-radio host Bolton: BBC spooked over young audience,/news/entertainment-arts-62727315
EU sends anti-radiation pills to Ukraine,/news/world-europe-62725485
Pakistan floods will cost us over $10bn - minister,/news/business-62719659
French tax officials use AI to find hidden pools,/news/world-europe-62717599
Nasa will try to launch Moon rocket on Saturday,/news/science-environment-62733267
How to stay cool the Japanese way,https://www.bbc.com/news/business-62659199
Lost at Sea: The disappearance of Keith Davis,https://www.bbcpodcasts.com/listen/lost-at-sea/?utm_source=BBC.com&utm_medium=Homepage&utm_campaign=Lost+at+Sea
"Knight, kite and butterflies: Photos of the week",/news/in-pictures-62686075
A photographic mission to show us the Moon,/news/science-environment-62662685
Sunken medieval village reappears at reservoir,/news/uk-england-york-north-yorkshire-62677584
"Africa's top shots: Revellers, robots and rioters",/news/world-africa-62672601
Photographer heads home to shine light on refugees,/news/uk-england-tyne-62505144
