title,url
Israel says evidence shows hospital blast came from Gaza as Biden lands,/news/live/world-middle-east-67141589
Biden's visit to Israel is a high-stakes gamble,https://www.bbc.com/news/world-us-canada-67142001
MI5 head warns of 'epic scale' of Chinese espionage,https://www.bbc.com/news/uk-67142161
Scotland's ambitious rewilding plan,https://www.bbc.com/travel/article/20231017-a-world-first-in-the-scottish-highlands
Why we don't all breathe the same air,https://www.bbc.com/future/article/20231017-why-clean-air-is-a-luxury-that-many-cant-afford
Biden arrives in Israel but Arab leaders meeting off,/news/world-middle-east-67142031
House in disarray as resistance hardens to Jordan,/news/world-us-canada-67138067
Putin praises Belt and Road as Xi charts way forward,/news/live/world-asia-china-67119723
World Cup: New Zealand v Afghanistan,/sport/live/cricket/66858177
"England reach Euros, NI & Scotland lose - reaction",/sport/live/football/67142634
Proper England fans don't boo players - Maguire,/sport/football/67142612
12 striking photos of a flooded world,https://www.bbc.com/culture/article/20231017-drowning-world-12-striking-photos-of-the-climate-in-crisis
A lonely drive to the edge of the Earth,https://www.bbc.com/travel/article/20231016-a-road-trip-to-the-edge-of-the-earth
How every workplace became 'toxic',https://www.bbc.com/worklife/article/20231012-how-every-workplace-became-toxic
How old can trees really get?,https://www.bbc.com/future/article/20231016-where-to-find-the-oldest-trees-in-the-world
Alec Baldwin may be recharged with Rust gun death,https://www.bbc.com/news/world-us-canada-67141319
Why The Matrix seems more relevant than ever in 2023,https://www.bbc.com/news/entertainment-arts-67126875
Britney Spears says in memoir she had abortion,https://www.bbc.com/news/world-us-canada-67136898
The incredible power of blue LEDs,https://www.bbc.com/news/business-67076032
Is the UK doing enough to monitor air pollution?,https://www.bbc.com/news/business-67074601
Protesters clash with security forces in Ramallah,/news/world-middle-east-67140284
Protesters clash with security forces in...,/news/world-middle-east-67140284
Watch: Fire after Gaza City hospital blast,/news/world-middle-east-67140939
Video shows moment girl is rescued in Rafah,/news/world-middle-east-67140283
Watch: Woman sees hostage sister in social...,/news/world-middle-east-67135420
Bear enters house and helps herself to frozen...,/news/world-us-canada-67140523
Footage shows Brussels gunman opening fire in...,/news/world-europe-67131634
Watch: Rockets soar above Tel Aviv as sirens...,/news/world-middle-east-67127824
Watch: Explosion at Rafah crossing between...,/news/world-middle-east-67128770
Hundreds of displaced Gazans queue for bread,/news/world-middle-east-67124297
One week on - survivor recalls fleeing...,/news/world-middle-east-67117157
Rick Astley faces chart challenge from new boy Ren,https://www.bbc.co.uk/news/articles/cx7wypdpng6o
Babbel boss: Baseball taught me a valuable lesson,https://www.bbc.co.uk/news/av/business-67135889
"Never start vaping, says girl with lung damage",/news/health-67081855
Google boss: AI too important not to get right,/news/technology-67132846
Toughen 'forever chemical' water rules - experts,/news/science-environment-67101179
John Grisham on threat from AI and The Firm sequel,/news/entertainment-arts-67134595
Stranded boats and dead fish: Amazon drought,/news/in-pictures-67087949
Camels and cauliflowers in focus: Africa's top shots,/news/world-africa-67087727
In pictures: Homes and lives destroyed in Afghan quakes,/news/world-asia-67088231
A tussle between two Nubian ibexes among photo award winners,/news/science-environment-67063835
Thames photographs reimagine historical events,/news/uk-england-london-67016295
NHS worker wins competition with pic of elusive boar,/news/uk-england-gloucestershire-67029398
