title,url
US lawyer Murdaugh guilty of killing wife and son,/news/world-us-canada-64832081
Cambodian opposition leader sentenced for treason,https://www.bbc.com/news/world-asia-64832748
Embattled Indian group Adani strikes $1.9bn US deal,https://www.bbc.com/news/business-64832362
Half of world could be overweight by 2035,https://www.bbc.com/news/world-64831848
Why Marlon Brando rejected an Oscar,https://www.bbc.com/culture/article/20230302-the-most-shocking-moment-in-oscars-history-50-years-on
How Alex Murdaugh hid his dark side,/news/world-us-canada-64832280
Tennessee curbs trans treatment and drag for children,/news/world-us-canada-64830835
Mental health gyms: A place to train your brain,/news/world-us-canada-64042267
Roy brings up fifty but Malan & Vince fall in second ODI v Bangaldesh,/sport/live/cricket/64797644
From peacetime team-mates to wartime enemies,/sport/football/64814253
Premier League news conferences & El Clasico reaction,/sport/live/football/64833443
A blouse that unites Southeast Asia,https://www.bbc.com/travel/article/20230302-the-asian-blouse-that-tells-a-tale-of-many-cultures
The largest objects in the Universe,https://www.bbc.com/future/article/20230302-the-giant-arcs-that-may-dwarf-everything-in-the-cosmos
The rise of the Gen Z side hustle,https://www.bbc.com/worklife/article/20230302-the-rise-of-the-gen-z-side-hustle
The greatest monster film ever made,https://www.bbc.com/culture/article/20230301-king-kong-at-90-the-greatest-monster-film-ever-made
How far is Brexit to blame for the UK tomato shortage?,https://www.bbc.com/news/64762429
Joy as songbird feared extinct seen in Madagascar,https://www.bbc.com/news/world-africa-64822787
Harry and Meghan told to 'vacate' Frogmore Cottage,https://www.bbc.com/news/uk-64815383
Robotaxi tech improves but can they make money?,https://www.bbc.com/news/business-64742934
Sake brewers toast big rise in global sales,https://www.bbc.com/news/business-64797853
Hong Kong skyscraper fire seen on city's skyline,/news/world-asia-64831692
Hong Kong skyscraper fire seen on city's...,/news/world-asia-64831692
Watch: Matt Hancock message row in 83 seconds,/news/uk-politics-64831398
Isabel Oakeshott: Why I leaked Hancock's...,/news/uk-64822872
Tears of relief after man found in Amazon...,/news/world-latin-america-64817080
At the crash site of 'no hope' - BBC reporter...,/news/world-europe-64808262
Dog found alive after 23 days under rubble,/news/world-europe-64817526
Watch Kate beat William in spin class...,/news/uk-64803331
Record numbers of guide dog volunteers after...,/news/uk-64806166
One-minute World News,/news/10462520
WATCH: Key moments from PM's NI Brexit deal...,/news/uk-64791359
Twitch streamer Kai Cenat breaks subscriber record,/news/technology-64811710
Guilt-free flying not in easy reach - scientists,/news/science-environment-64788106
Scotland first to ban anaesthetic over environment,/news/health-64347191
Pet crocs and red carpets: Africa's top shots,/news/world-africa-64823868
India court panel to probe Adani fraud allegations,/news/world-asia-india-64820716
What is carbon capture and can it fight climate change?,/news/science-environment-64723497
Ken Bruce says early Radio 2 exit 'seems a shame',/news/entertainment-arts-64821817
'We're flying the flag for Scottish rum',https://www.bbc.com/news/business-64719180
The high-tech weed sprayers cutting herbicide use,https://www.bbc.com/news/business-64742513
The devastated towns near Ukraine's front line,/news/world-europe-64819471
Pictures show devastation after Greece train disaster,/news/world-europe-64808123
Spectacular northern lights seen across UK,/news/uk-64782372
SAG Awards: The red carpet in pictures,/news/entertainment-arts-64781316
Vigils and flags: Ukraine war anniversary in pictures,/news/in-pictures-64757068
