title,url
Chaos at port as thousands rush to leave Sudan,/news/world-africa-65444282
Air strikes pound Sudan capital as truce extended,/news/world-africa-65440528
"Suspected IS chief killed in Syria, Turkey says",/news/world-middle-east-65445007
I don't know what Tierney has against us - Klopp,/sport/football/65443810
How coronation food reflects the times,https://www.bbc.com/travel/article/20230430-coronation-cuisine-the-food-fit-for-royalty
US bank makes last ditch bid to find rescuer,/news/business-65441302
What Europe's royals could teach King Charles,/news/world-europe-65409971
Watch: Flames engulf key bank in Sudan's capital,/news/world-africa-65444503
'Before Churchill?' - 50-up Haaland eyes 'impossible',/sport/football/65443667
"'A defining few weeks for Spurs, Kane & Levy'",/sport/football/65444421
Curry leads Warriors past Kings with 50-point haul,/sport/basketball/65445091
Are protein powders bad for you?,https://www.bbc.com/future/article/20230426-protein-powders-when-should-you-use-them
Dating culture's most toxic stereotype,https://www.bbc.com/culture/article/20230426-fatal-attraction-bunny-boiler-dating-toxic-stereotype
The Manhattan island sold for $1,https://www.bbc.com/travel/article/20230426-governors-island-the-uninhabited-isle-that-birthed-nyc
Why some people wake up unable to move,https://www.bbc.com/future/article/20230420-the-nightmares-that-paralyse-you-in-your-sleep
How are mums working without childcare?,https://www.bbc.com/worklife/article/20230426-the-mothers-working-from-home-without-childcare
Seven of the best Met Gala looks,https://www.bbc.com/culture/article/20230428-met-gala-2023-eight-of-the-best-looks-over-the-decades
A guide to afternoon tea in London,https://www.bbc.com/travel/article/20230430-where-to-have-afternoon-tea-in-london
Why an Indian comedian is challenging fake news rules,https://www.bbc.com/news/world-asia-india-65407990
Obama and friends surprise Barcelona restaurant,https://www.bbc.com/news/world-europe-65435879
Inside Thailand's 'weed wonderland',https://www.bbc.com/news/world-asia-65345274
Europe's modern monarchs - they're just like us?,https://www.bbcselect.com/watch/europes-royals-revealed/?utm_source=BBC.com&utm_medium=Homepage&utm_campaign=Europes+Royals+Revealed
Peru's 'fast and furious' blueberry boom,https://www.bbc.com/news/business-65190673
Armed heist at Paris luxury jewellery store in daylight,/news/world-europe-65445245
Armed heist at Paris luxury jewellery store...,/news/world-europe-65445245
Drone captures moment lost child is found,/news/world-us-canada-65443083
Watch: Massive flames rise from Crimea oil...,/news/world-europe-65437813
Baby meets father for first time after Sudan...,/news/world-65435205
Ros Atkins breaks down the BBC chairman loan...,/news/uk-65430947
"Schoolboy, 13, stops bus after driver passes...",/news/world-us-canada-65377864
Baby grabs Kate's handbag during royal...,/news/uk-65431141
Police form chain to save woman trapped in...,/news/uk-england-hereford-worcester-65428930
Watch: Philippines and China standoff in...,/news/world-asia-65424359
Riding the 'vomit comet' with first disabled astronaut,/news/science-environment-65380263
Sudanese NHS doctor finally allowed to return to UK,/news/uk-65423219
Parasols and prayers: Africa's top shots,/news/world-africa-65409697
Jessie Ware: Why the 'prudish' star is singing about sex,/news/entertainment-arts-65411319
WHO issues alert over another India-made cough syrup,/news/world-asia-india-65395716
The Israeli plan to fit a fusion reactor into a container,https://www.bbc.co.uk/news/business-65123116
Tom Cruise joins line-up for Coronation Concert,/news/uk-65430893
The wedding tech now at the heart of couples' nuptials,https://www.bbc.com/news/business-65322101
Fruit producers turn to nets for better crops,https://www.bbc.com/news/business-65242843
The photos that chronicle the cost of dying,/news/uk-scotland-65354687
Len Goodman obituary: From the East End to Strictly stardom,/news/entertainment-arts-58929590
Penarth: Nofio gyda'r wawr yn y môr // Sea swimming at dawn,/newyddion/65372997
In pictures: Muslims around the world celebrate Eid,/news/in-pictures-65346964
Garlands and gymnasts: Africa's top shots,/news/world-africa-65334211
