title,url
China's missiles 'imitating North Korea' - Taiwan,/news/world-asia-62419858
The view from Taiwan: 'We've had this for 70 years',https://www.bbc.com/news/world-asia-62404236
"Orban alone in Europe, among friends in Texas",https://www.bbc.com/news/world-europe-62408368
What comes after consumerism?,https://www.bbc.com/future/article/20220803-citizen-future-why-we-need-a-new-story-of-self-and-society
How an 'unfilmable' comic made it to Netflix,https://www.bbc.com/culture/article/20220803-the-sandman-how-an-unfilmable-comic-made-it-to-netflix
China condemns 'manic' visit as Pelosi continues tour,/news/world-asia-62419855
Russian prosecutors seek 9-year sentence for Griner,/news/world-europe-62424149
Man survives 16 hours in capsized boat in Atlantic,/news/world-europe-62413556
Premier League news conferences and latest transfer news,/sport/live/football/62418195
Mickelson and Poulter in lawsuit against PGA Tour,/sport/golf/62412590
"A season like no other, but some things won't change - Shearer",/sport/football/62354865
Why are companies revoking job offers?,https://www.bbc.com/worklife/article/20220729-why-companies-are-rescinding-job-offers
The next fried-chicken craze?,https://www.bbc.com/travel/article/20220803-the-next-fried-chicken-craze
Scotland's most misunderstood landscape,https://www.bbc.com/future/article/20220802-climate-change-the-promise-and-danger-of-scotlands-peat
The unsung legends of house music,https://www.bbc.com/culture/article/20220802-beyoncs-renaissance-album-and-the-unsung-legends-of-house
No sleep in Ukraine's relentlessly bombed city,https://www.bbc.com/news/world-europe-62407872
Batgirl directors shocked at film's cancellation,https://www.bbc.com/news/entertainment-arts-62419450
Remembering teen whose viral video saved her brother,https://www.bbc.com/news/world-asia-india-62403456
Can North America's downtowns reverse their downturns?,https://www.bbc.com/news/business-62390097
Hard Rock boss: The shift I'll never forget,https://www.bbc.com/news/business-62381040
Call for medal to honour killed emergency workers,/news/uk-62419394
Call for medal to honour killed emergency...,/news/uk-62419394
Watch: China launches missiles in Taiwan...,/news/world-asia-62420764
Ukraine teenager's traumatic journey to...,/news/uk-62422942
"Iceland volcano was so beautiful, I had a...",/news/world-europe-62419427
Loud bangs as China begins Taiwan drills,/news/world-asia-62420763
Meet Australia's first hijab-wearing senator,/news/world-australia-62374371
One-minute World News,/news/10462520
Nancy Pelosi lands in Taiwan amid China...,/news/world-us-canada-62398902
'Guardian angel' saves family from Kentucky...,/news/world-us-canada-62402619
Mystery as massive sinkhole appears in Chile,/news/world-latin-america-62392233
Warning follows record Great Barrier Reef coral cover,/news/world-australia-62402891
Dating app Tinder swipes left on chief executive,/news/business-62402874
Polio virus found in New York wastewater,/news/world-us-canada-62395325
Oil output to see small hike to ease energy prices,/news/business-62352272
'Forever chemicals' over safe levels in rainwater,/news/science-environment-62391069
BBC launches inquiry into DJ Tim Westwood response,/news/entertainment-arts-62338288
New Zealand fully reopens borders after Covid,/news/world-asia-62373913
How rangers use AI to help protect India's tigers,https://www.bbc.com/news/business-61824904
Shooting laser beams at trees to save forests,https://www.bbc.com/news/business-62264710
Students use art to explore future of the planet,/news/in-pictures-61969406
In pictures: Fans celebrate historic England win,/news/uk-england-london-62370085
Photos reveal bygone way of life on peninsula,/news/uk-wales-62295592
Africa's top shots: Boat racing and record breakers,/news/world-africa-62332375
In pictures: Sheeran joins Snow Patrol at Latitude,/news/uk-england-suffolk-62290216
