title,url
Drone crash near Moscow was failed attack - governor,/news/world-europe-64802453
US Supreme Court doubts student loan forgiveness,/news/world-us-canada-64802849
Ruling party takes strong lead in Nigeria election,/news/world-africa-64805024
"FA Cup: Blackburn stun Leicester, wins for Man City, Fulham & Brighton",/sport/live/football/64558780
A Nordic country's remedy for stress,https://www.bbc.com/travel/article/20230227-greenlands-natural-medicine-for-the-soul
JetBlue plane aborts landing to avoid private jet,/news/world-us-canada-64805935
Iran probes poisoning of almost 700 schoolgirls,/news/world-middle-east-64797957
Ancient mummy found in delivery man's bag,/news/world-latin-america-64797080
Championship Blackburn upset Leicester,/sport/football/64792079
Foden scores twice as Man City beat Bristol City,/sport/football/64788956
"After the Bash at the Basin, bring on the Ashes",/sport/cricket/64776695
The ultimate paragon of male beauty?,https://www.bbc.com/culture/article/20230227-the-original-and-most-iconic-male-model
The return of the US' lost language,https://www.bbc.com/travel/article/20230228-kouri-vini-the-return-of-the-us-lost-language
A new way to navigate work and life,https://www.bbc.com/worklife/article/20230227-what-does-work-life-balance-mean-in-a-changed-work-world
The clothes you can't recycle,https://www.bbc.com/future/article/20230227-how-to-recycle-your-clothes
Why the world faces a 'genomic gap',https://www.bbc.com/future/article/20230227-the-search-for-the-worlds-missing-genomes
"Cull grey squirrels and eat them, project urges",https://www.bbc.com/news/uk-england-somerset-64789834
Pilot circles plane to show passengers northern lights,https://www.bbc.com/news/uk-england-manchester-64795572
The tiny diamond sphere that could unlock clean power,https://www.bbc.com/news/business-64553796
The high-tech weed sprayers cutting herbicide use,https://www.bbc.com/news/business-64742513
New CCTV shows missing baby pair minutes before arrest,/news/uk-64806501
New CCTV shows missing baby pair minutes...,/news/uk-64806501
Watch Kate beat William in spin class...,/news/uk-64803331
Couple have not revealed missing baby...,/news/uk-64803151
WATCH: Key moments from PM's NI Brexit deal...,/news/uk-64791359
EU Chief on NI deal: 'We were honest with...,/news/uk-64791545
The 'smart suit' that is changing children's...,/news/uk-england-london-64791997
View from the cockpit of a Ukraine combat...,/news/world-europe-64779730
Watch: Skies sparkle as northern lights seen...,/news/uk-64783923
Teddies rain down on pitch during football...,/news/world-europe-64783651
Suspected gang members moved to El Salvador...,/news/world-latin-america-64769936
Jodie Comer and Paul Mescal up for Olivier Awards,/news/entertainment-arts-64795792
Guilt-free flying not in easy reach - scientists,/news/science-environment-64788106
Spectacular northern lights seen across UK,/news/uk-64782372
Canada bans TikTok on government devices,/news/world-us-canada-64792894
Blackpink lead top stars back on the road in Asia,https://www.bbc.co.uk/news/business-64286127
"China should be honest on Covid origin, says US envoy",/news/world-us-canada-64794008
What is carbon capture and can it fight climate change?,/news/science-environment-64723497
Mariupol: Tragic deaths and daring escapes,https://www.bbcselect.com/watch/mariupol-the-peoples-story/?utm_source=BBC+Select&utm_medium=Social&utm_campaign=Mariupol+the+peoples+story
Can technology clean up the shrimp farming business?,https://www.bbc.com/news/business-64496392
SAG Awards: The red carpet in pictures,/news/entertainment-arts-64781316
Vigils and flags: Ukraine war anniversary in pictures,/news/in-pictures-64757068
The 24-year photography project,/news/in-pictures-64723755
Outlaw-themed parade triumphs at Rio carnival,/news/world-latin-america-64742729
"Chukkas, cats and candles: Africa's top shots",/news/world-africa-64726122
