title,url
Inside the capital taken hostage by brutal gangs,/news/world-latin-america-63707429
"'They destroyed us, but we came together stronger'",https://www.bbc.com/news/world-europe-63834777
49ers end Miami's run and Watson booed on return,https://www.bbc.com/sport/american-football/63855156
The rich marine life under polar ice,https://www.bbc.com/future/article/20221202-the-rich-marine-life-under-frozen-ice
"The US' 2,000-year-old mystery mounds",https://www.bbc.com/travel/article/20221204-the-us-2000-year-old-mystery-mounds
Oil prices rise as cap on Russian crude kicks in,/news/business-63855030
Explosions hit two Russian airfields - reports,/news/world-europe-63857451
Julia Roberts turns George Clooney into a dress,/news/entertainment-arts-63857739
England secure all-time great win over Pakistan,/sport/cricket/63852484
World Cup: Reaction to England's 3-0 win & looking ahead to France match,/sport/live/football/63813347
Wales coach Pivac replaced by Gatland,/sport/rugby-union/63770196
The workers lured into oversold jobs,https://www.bbc.com/worklife/article/20221202-the-workers-lured-into-oversold-jobs
"Japan's wild, remote ski resort",https://www.bbc.com/travel/article/20221201-the-floating-mountain-japans-most-remote-ski-destination
The radical trend millennials love,https://www.bbc.com/culture/article/20221202-soft-girl-what-it-really-means-to-lead-a-soft-life
The Alpine villages powered by streams,https://www.bbc.com/future/article/20221129-the-alpine-villages-producing-their-own-power
Why is China struggling to vaccinate the elderly?,https://www.bbc.com/news/63798484
Should we put a price on nature?,https://www.bbc.co.uk/ideas/videos/should-we-put-a-price-on-nature/p0dl4kx3
Test your knowledge of the World Cup group stage,https://www.bbc.com/sport/football/63833063
India makes big strides in African healthcare,https://www.bbc.com/news/business-63476025
Knives Out director shares the method behind the magic,https://www.bbcpodcasts.com/spark-and-fire/?v=20221130&utm_source=BBC.Com&utm_medium=Homepage&utm_campaign=Spark+and+Fire
China fire was government's fault - victim's daughter,/news/world-asia-china-63844182
China fire was government's fault - victim's...,/news/world-asia-china-63844182
Out on a spacewalk with Nasa astronauts,/news/world-us-canada-63849682
England fans 'can't wait for the...,/news/uk-63854567
The 'life-changing' electric suit,/news/stories-63827708
Drone footage shows deadly Brazil flooding,/news/world-latin-america-63835789
Coca-Cola Christmas truck in flames in...,/news/world-europe-63829299
Do you need to change your accent to get a...,/news/uk-63838819
One-minute World News,/news/10462520
Escape of Sydney zoo lions caught on camera,/news/world-australia-63822386
Spectacular scenes as Hawaii volcano erupts,/news/world-us-canada-63814130
"Flo, Cat Burns and Gabriels tipped as Sound Of 2023",/news/entertainment-arts-63809715
Construction to begin on world's biggest telescope,/news/science-environment-63836496
Taiwan's front-line battle against mobile phone fraud,/news/business-63075729
Strep A: Why it can be dangerous and what to know,/news/health-63836093
Singing the praises of first female Commons Speaker,/news/entertainment-arts-63775575
BP stands to get 'blood money' - Ukraine adviser,/news/63821028
Final Tasmanian tiger's remains found in cupboard,/news/world-australia-63855426
'Israeli women and their Gulf sisters are so similar',https://www.bbc.com/news/business-63792841
The weird and wonderful art of AI,https://www.bbc.com/future/article/20221123-the-weird-and-wonderful-art-created-when-ai-and-humans-unite
The photographer who puts little people in the frame,/news/uk-scotland-63781000
Africa's top shots: Dripping diamonds and football fever,/news/world-africa-63819552
In Pictures: Mauna Loa erupts,/news/in-pictures-63820551
The photographer who preserved rural Indian life,/news/world-asia-india-63705190
'Photography helps me manage my PTSD',/news/uk-england-essex-63699954
