title,url
Hundreds held after Russia call-up sparks protests,/news/world-europe-62981293
Russia deserves just punishment for war - Zelensky,/news/live/world-62970683
Donald Trump hit by fraud lawsuit over family business,/news/world-us-canada-62986812
McGinn & Dykes earn Scotland vital win over Ukraine,/sport/football/62897957
Star Wars prequel series is 'uneven' ★★★☆☆,https://www.bbc.com/culture/article/20220920-star-wars-andor-review-prequel-series-is-uneven
Trump family 'inflated net worth by billions' - lawsuit,/news/live/world-62975721
Putin's 'outrageous acts' violate UN charter - Biden,/news/world-us-canada-62988010
US interest rates raised to highest in 14 years,/news/business-62973376
Mayweather wants to fight McGregor in 2023,/sport/boxing/62986197
The story behind why Griezmann is only playing 30 minutes per game,/sport/football/62970313
I stopped believing I could carry on - Federer,/sport/tennis/62975292
Why Gen Z are sober-curious,https://www.bbc.com/worklife/article/20220920-why-gen-zers-are-growing-up-sober-curious
A remote restaurant unreachable by road,https://www.bbc.com/travel/article/20220920-koks-in-greenland-an-epic-food-journey-in-the-arctic
India's sustainable cooling solution,https://www.bbc.com/future/article/20220920-how-indias-lattice-buildings-cool-without-air-con
Inside eight interior designers' homes,https://www.bbc.com/culture/article/20220921-eight-interiors-styles-as-seen-inside-designers-own-homes
Dementia's 'invisible second patients',https://www.bbc.com/future/article/20220907-caring-for-a-parent-with-dementia
How island became 'refuge' for William and Kate,https://www.bbc.com/news/uk-wales-62878958
Ringed Neptune captured by James Webb telescope,https://www.bbc.com/news/science-environment-62984658
Ring doorbell inventor: Why I don't take advice,https://www.bbc.com/news/business-62966924
Off-gridders take energy needs into their own hands,https://www.bbc.com/news/business-62351448
How a woman became a symbol of defiance in Iran,/news/world-middle-east-62985433
How a woman became a symbol of defiance in...,/news/world-middle-east-62985433
Russia's Putin announces partial military...,/news/world-62979126
Tremor hits Mexico on earthquake...,/news/world-latin-america-62969295
My son fell from a US military plane,/news/world-asia-62974963
Paying respects to the Queen from remote...,/news/world-asia-62962300
Watch the emotional farewell to the Queen,/news/uk-62962140
Queen's committal service held at St George's...,/news/uk-62961411
"Crown, orb and sceptre taken from Queen for...",/news/uk-62929467
Watch moments from the funeral of Queen...,/news/uk-62957322
One-minute World News,/news/10462520
"N America uniforms linked to ""forever chemicals""",/news/science-environment-62982397
Sheeran: I owe my career to Jamal Edwards,/news/entertainment-arts-62976468
Twitch announces slots and roulette gambling ban,/news/technology-62982509
CEO Secrets: 'My advice? Don't take advice!',https://www.bbc.co.uk/news/av/business-62966924
Abortion bans leave grey areas for complicated pregnancies,/news/world-us-canada-62921655
Gap to cut 500 jobs in US and Asia as sales sink,/news/business-62973377
My jailed stalker says he'll be back - Jeremy Vine,/news/uk-62977842
Should billboard advertising be banned?,https://www.bbc.com/news/business-62806697
How India is building a pearl farming industry,https://www.bbc.com/news/business-62204515
In pictures: The Queen's funeral,/news/in-pictures-62918196
The Queen's procession to Westminster Hall,/news/in-pictures-62900732
In pictures: Charles on first visit to NI as King,/news/uk-northern-ireland-62888529
In pictures: King Charles in Scotland and Westminster Hall,/news/in-pictures-62876296
In pictures: Queen's journey from Balmoral to Edinburgh,/news/in-pictures-62868466
