title,url
Ex-officers plead not guilty over Tyre Nichols death,/news/world-us-canada-64680815
"Bankrupt Alex Jones spends nearly $100,000 a month",https://www.bbc.com/news/world-us-canada-64644080
Woods hands Thomas a tampon during Genesis round,https://www.bbc.com/sport/golf/64673771
Italy's unusual vegetable ritual,https://www.bbc.com/travel/article/20230216-italys-unusual-vegetable-ritual
Can you dream in another language?,https://www.bbc.com/future/article/20230213-how-people-dream-in-foreign-languages
‘It’s wrecked us’ - life after Ohio rail crash,/news/world-us-canada-64671893
India accuses BBC of tax irregularities,/news/world-asia-india-64678922
First German tanks to be deployed to Kyiv 'very soon',/news/world-europe-64674200
West Indies begin chase of 138 in must-win Ireland game at T20 World Cup,/sport/live/cricket/64044921
'We can't stop watching' - Arsenal's reluctant rebel fans,/sport/football/64641090
Australia bowled out on day one of second India Test,/sport/cricket/64677302
The new age of the male stripper,https://www.bbc.com/culture/article/20230216-how-magic-mike-transformed-the-image-of-male-stripping
A walk through India's 'City of Death',https://www.bbc.com/travel/article/20230215-varanasi-indias-holy-city-of-death
The hidden reasons there's no male pill,https://www.bbc.com/future/article/20230216-the-weird-reasons-male-birth-control-pills-are-scorned
The 'permacrisis' hitting Gen Z workers,https://www.bbc.com/worklife/article/20230215-are-gen-z-the-most-stressed-generation-in-the-workplace
US cancer patient got 'uncontrollable' Irish accent,https://www.bbc.com/news/world-us-canada-64671894
Weekly quiz: What was a Super Bowl first?,https://www.bbc.com/news/world-64663435
"Bruce Willis has dementia, family announces",https://www.bbc.com/news/entertainment-arts-64670521
The race across Europe to build green steel plants,https://www.bbc.com/news/business-64538296
Bottled water booming despite worries over waste,https://www.bbc.com/news/business-64635190
'Never give up': Woman fights off attacker in US gym,/news/world-us-canada-64671767
'Never give up': Woman fights off attacker in...,/news/world-us-canada-64671767
Hugh Jackman: I want to score against Wrexham,/news/entertainment-arts-64683677
Zelensky: 'Big mistake' if Belarus involved...,/news/world-europe-64667449
Zelensky rules out territory concession peace...,/news/world-europe-64667448
Beirut banks attacked as financial crisis...,/news/world-middle-east-64669460
Huge fire engulfs Florida plant nursery,/news/world-us-canada-64660447
Watch: Anger erupts at Ohio train crash town...,/news/world-us-canada-64660445
Workers use fridge to navigate cyclone...,/news/world-asia-64659315
One-minute World News,/news/10462520
Unseen video shows Titanic after first...,/news/science-environment-64658463
How Helsinki became the mobile gaming capital of the world,/news/entertainment-arts-64655633
Anger after former conjoined twin dies of malaria,/news/uk-england-oxfordshire-64651816
Antarctica sea-ice hits new record low,/news/science-environment-64649596
Tesla denies firing workers over union campaign,/news/business-64665911
Africa's top shots: Sapeurs on show and skiers on slopes,/news/world-africa-64653451
King to host palace event backing action on nature,/news/science-environment-64665675
Teen embracing life after leg amputation,/news/uk-england-birmingham-64595081
How the Frozen songwriters create magic,https://link.chtbl.com/BBC-Homepage-Frozen
'Meetings are efficient' - When identical twins do business,https://www.bbc.com/news/business-64456871
A-list stars attend Vivienne Westwood memorial,/news/entertainment-arts-64666516
Raquel Welch: A life in pictures,/news/world-us-canada-64658155
Vigils held in UK and Ireland for Brianna Ghey,/news/uk-64658794
England's Big Picture: Images of the nation,/news/uk-england-64619278
In pictures: President Zelensky visits the UK,/news/in-pictures-64573568
