title,url
Professional soldiers to petty thieves - changing face of Russia's war dead,https://www.bbc.co.uk/news/resources/idt-829ea0ba-5b42-499b-ad40-6990f2c4e5d0
Japan rewrites sex crime laws in landmark move,https://www.bbc.com/news/world-asia-65887198
iPhone maker to shift to cars as US-China tensions soar,https://www.bbc.com/news/business-65886658
The people who feel guilty not working,https://www.bbc.com/worklife/article/20230614-the-quiet-guilt-of-self-employment
The film that Churchill tried to ban,https://www.bbc.com/culture/article/20230615-the-life-and-death-of-colonel-blimp-the-war-film-that-churchill-tried-to-ban
"Capsized boat had 100 children in hold, BBC told",/news/world-europe-65914476
Canada highway crash leaves at least 15 dead,/news/world-us-canada-65897829
McGregor accused of sex assault after NBA game,/news/world-us-canada-65924407
'Let the Ashes summer of love begin',/sport/cricket/65906469
Transfer news and build-up to Euro 2024 qualifiers,/sport/live/football/65911058
Fowler and Schauffele set US Open record to lead,/sport/golf/65923966
The giant planet scientists can't find,https://www.bbc.com/future/article/20210216-the-massive-planet-scientists-cant-find
Have we sent life to other planets?,https://www.bbc.com/future/article/20210510-could-the-perseverance-rover-have-carried-life-to-mars
Why the Moon is slipping from our grasp,https://www.bbc.com/future/article/20230303-how-the-moon-is-making-days-longer-on-earth
San Francisco's best LGBTQ+ spots,https://www.bbc.com/travel/article/20230615-peaches-christs-five-best-lgbtq-spots-in-san-francisco
A show that 'revels in its twists',https://www.bbc.com/culture/article/20230614-black-mirror-season-six-review-charlie-brookers-series-is-a-show-that-revels-in-its-twists
The hidden inflexibility of hybrid work,https://www.bbc.com/worklife/article/20230613-why-hybrid-return-to-office-mandates-arent-as-flexible-as-they-seem
The colours that can save your life,https://www.bbc.com/future/article/20230615-how-the-colour-of-your-swimsuit-can-save-your-life
The newest 'best chef' of the US South,https://www.bbc.com/travel/article/20230615-caldo-de-gallina-an-ancestral-dish-from-award-winning-natalia-vallejo
Spotify ends podcast deal with Harry and Meghan,https://www.bbc.co.uk/news/uk-65924584
My surgeon experimented on me and ruined my life,https://www.bbc.com/news/uk-scotland-65904293
The workers already replaced by artificial intelligence,https://www.bbc.co.uk/news/business-65906521
Kelly Hoppen: 'Music is design to me',https://www.bbc.com/news/business-65851081
Watch: Otter plays basketball to help ease arthritis,/news/world-us-canada-65921265
Watch: Otter plays basketball to help ease...,/news/world-us-canada-65921265
'My beautiful boy' - family tributes at...,/news/uk-65923671
Robber gets trapped under shop shutters,/news/uk-65922321
First look at Banksy's secret solo show in...,/news/uk-scotland-65913092
Heartbroken fathers address Nottingham vigil,/news/uk-65909793
Watch: What happened and where in Nottingham...,/news/uk-england-nottinghamshire-65898908
Video shows woman freed from Kramatorsk...,/news/world-europe-65914810
Trump's historic day in court... in 60...,/news/world-us-canada-65899504
Speeding police officer pulled over by...,/news/world-us-canada-65908677
'Smiling' snailfish spotted by deep-sea...,/news/world-us-canada-65907294
The British baked bean could soon be on our toast,/news/uk-england-lincolnshire-65908618
The pop band who ditched Mormonism and found themselves,/news/entertainment-arts-65819217
Twitter sued by music publishers for $250m,/news/business-65911727
Super-engineered vaccines created to help end polio,/news/health-65860202
Man trots globe blending scenes into film locations,/news/uk-england-essex-65786652
AI to stop water pollution before it happens,/news/science-environment-65913940
Sir Michael Caine leads tributes to Glenda Jackson,/news/uk-65916692
Can Amsterdam make the circular economy work?,https://www.bbc.com/news/business-65696083
Sacked workers tell the inside story of Musk's Twitter takeover,https://www.bbcselect.com/watch/elon-musks-twitter-storm/?utm_source=BBC.com+&utm_medium=Homepage&utm_campaign=Twitter+Storm
In pictures: Nottingham attack shakes city to core,/news/uk-65899897
Surreal skies grip New Yorkers - in pictures,/news/in-pictures-65843841
In Pictures: The biggest music acts to play Wales,/news/uk-wales-65860650
Mosque plasterers and rock cutters: Africa's top shots,/news/world-africa-65843357
Strawberry Moon captured over England,/news/uk-england-leicestershire-65802574
