title,url
US soldier in N Korea was held after fights in Seoul,/news/world-asia-66219603
Migrant girl death in US custody was 'preventable',https://www.bbc.com/news/world-us-canada-66244304
US police search house in Tupac Shakur case,https://www.bbc.com/news/world-us-canada-66240750
The dead Hollywood stars still working,https://www.bbc.com/future/article/20230718-how-ai-is-bringing-film-stars-back-from-the-dead
A guide to seeing Boston's universities,https://www.bbc.com/travel/article/20230718-a-tour-of-bostons-universities-with-local-guide-daniel-bodt
What we know so far about North Korea's detention of a US soldier,/news/world-asia-66240928
Russia strikes Ukraine grain after ending sea deal,/news/world-europe-66242446
Astonishing new finds in the ancient city of Pompeii,/news/science-environment-66226417
Ashes: Broad dismisses Head for 600th Test wicket,/sport/live/cricket/64959407
A visual guide to the Women's World Cup,https://www.bbc.co.uk/sport/extra/lrfY3Yfkt8/visual-guide-to-the-womens-world-cup
Vingegaard on brink of retaining Tour title,/sport/cycling/66248827
How automation could affect your salary,https://www.bbc.com/worklife/article/20230718-ai-artificial-intelligence-worker-wages-salaries
The 30 terms you need to understand AI,https://www.bbc.com/future/article/20230717-what-you-should-know-about-artificial-intelligence-from-a-z
The film that captured actors' AI fears,https://www.bbc.com/culture/article/20230717-how-2013-film-the-congress-predicted-hollywoods-current-ai-crisis
An unrivalled South Asian street food,https://www.bbc.com/travel/article/20230718-why-kfc-failed-to-master-karachis-famed-paratha-rolls
'Joyous' Barbie breaks the mould,https://www.bbc.com/culture/article/20230718-greta-gerwigs-bold-inventive-barbie-breaks-the-mould
The row over Europe's heatwave names,https://www.bbc.com/future/article/20230718-the-fiery-row-behind-europes-mythological-heatwave-names
A 500-year-old frozen dessert,https://www.bbc.com/travel/article/20230717-kulfi-indias-creamy-frozen-dessert
Is AI Gen Z's silver bullet?,https://www.bbc.com/worklife/article/20230717-can-ai-help-gen-z-workers-make-up-lost-ground
Afghan women protest against beauty salon closures,https://www.bbc.com/news/world-66244408
Pupils want more schools playing Quidditch,https://www.bbc.com/news/uk-england-hereford-worcester-66239598
Lean times hit the vertical farming business,https://www.bbc.com/news/business-66173872
Tech Decoded: The latest news direct to your inbox,https://www.bbc.com/news/technology-65786969
Peek inside life-size Barbie Dreamhouse,/news/uk-66242977
Peek inside life-size Barbie Dreamhouse,/news/uk-66242977
Watch: Fiery crash as train ploughs into...,/news/world-asia-66241233
Watch: Sailor and dog rescued after two...,/news/world-latin-america-66241231
Watch: Moment a charging e-bike battery...,/news/uk-england-birmingham-66238864
Watch: The asylum barge explained... in 60...,/news/uk-england-dorset-66236068
Watch moment new skydive record is set,/news/uk-england-nottinghamshire-66226551
WATCH: How hot is the northern hemisphere...,/news/world-66227145
BBC reporter sounds like 'Minnie Mouse' after...,/news/world-66234537
How wildfires have devastated parts of...,/news/world-europe-66222132
WATCH: How hot will it get in southern Europe...,/news/world-europe-66222174
In pictures: Europe's scorching heatwave,/news/in-pictures-66226313
Nick Clegg: AI language systems are 'quite stupid',/news/technology-66238004
New drugs for Alzheimer’s hailed as turning point,/news/health-66221116
Why some celebrities are embracing AI deepfakes,https://www.bbc.com/news/business-65995089
Indian space chief says no mystery over rocket debris,/news/world-asia-india-66234420
Critics give their verdicts on the Barbie movie,/news/entertainment-arts-66242100
Games companies to restrict loot box access in UK,/news/entertainment-arts-65855157
How brands hope to tempt you with videos on labels,https://www.bbc.com/news/business-66166552
Azerbaijan's ever-burning fire temples,https://www.bbc.com/travel/article/20230712-azerbaijan-the-caucasus-land-of-fire
Hilarious pictures of pets in comedy photographs,/newsround/66210126
Jane Birkin: Artist and style icon's life in pictures,/news/world-europe-66216663
Hidden history of city revealed in saved pictures,/news/uk-england-coventry-warwickshire-66090707
Cool shades and hot nights: Africa's top shots,/news/world-africa-66187685
In pictures: President Biden visits the UK,/news/in-pictures-66155089
