title,url
William and Kate meet crowds as parties mark Coronation,https://www.bbc.com/news/live/uk-65474716
Royals to drop in on Coronation lunch parties,https://www.bbc.com/news/uk-65516031
Stars gear up to perform at Coronation concert,https://www.bbc.com/news/entertainment-arts-65480420
'Mad panic' as Russia evacuates nuclear plant town,https://www.bbc.com/news/world-europe-65515443
Eight killed by gunman in Texas mall shooting,https://www.bbc.com/news/world-us-canada-65515915
Wagner 'promised ammunition' after retreat threat,/news/world-europe-65516633
Canadian province declares wildfire emergency,/news/world-us-canada-65515446
One governor's blueprint that could challenge Trump,/news/world-us-canada-65464667
Premier League: Newcastle host Arsenal - build up & team news,/sport/live/football/65429126
Scottish Premiership: Celtic close in on title with games goalless,/sport/live/football/65455682
WSL: Liverpool lead for second time against Man City & Villa 4-0 up,/sport/live/football/65401354
The Coronation: Six takeaways from a historic day,https://www.bbc.com/news/entertainment-arts-65488861
Royal Family tree: Charles III and the line of succession,https://www.bbc.com/news/uk-23272491
Penny Mordaunt's sword-wielding - and other top moments,https://www.bbc.com/news/uk-65510506
Six extraordinary gardens around the world,https://www.bbc.com/culture/article/20230505-five-extraordinary-gardens-around-the-world
What side-hustlers are really making,https://www.bbc.com/worklife/article/20230504-the-workers-sharing-their-side-hustle-incomes
12 TV series to watch this May,https://www.bbc.com/culture/article/20230504-12-of-the-best-tv-shows-to-watch-this-may
A Cold War time capsule is now open,https://www.bbc.com/travel/article/20230501-regan-vest-inside-denmarks-secret-nuclear-bunker
Vietnam records highest-ever temperature of 44.1C,https://www.bbc.com/news/world-asia-65518528
"US recalls 500,000 Covid tests over bacteria risk",https://www.bbc.com/news/world-us-canada-65503664
Tough calls made on Coronation arrests - minister,https://www.bbc.com/news/uk-65515769
Why teaching robots to blink is hard but important,https://www.bbc.com/news/business-65251892
Can Morocco solve Europe’s energy crisis?,https://www.bbc.com/news/business-65415529
William accepts drink from crowd in Windsor,/news/uk-65518730
William accepts drink from crowd in Windsor,/news/uk-65518730
Then and now: Watch two coronations 70 years...,/news/uk-65515302
Texas shooting: People flee as gunshots are...,/news/world-us-canada-65515303
King and Queen wave from Palace balcony,/news/uk-65511790
Coronation procession returns to Palace,/news/uk-65511789
King Charles crowned – watch events inside...,/news/uk-65510548
Watch the moment King Charles III is crowned,/news/uk-65414492
WATCH: Prince Harry at the King's coronation,/news/uk-65415507
Anti-monarchy protesters shout 'not my King',/news/uk-65511791
Penny Mordaunt carries sword ahead of the...,/news/uk-65511788
King's Coronation watched by more than 18 million,/news/uk-65518360
Ukraine's Eurovision winners start Liverpool party,/news/entertainment-arts-65495434
Banks warn of big increase in online scams,/news/technology-65486219
"Covid global health emergency is over, WHO says",/news/health-65499929
In pictures: Royal superfans camp out ahead of Coronation,/news/in-pictures-65484438
Animal tests for makeup resume after 25-year ban,/news/science-environment-65484552
North Carolina lawmakers pass 12-week abortion ban,/news/world-us-canada-65489803
Why there is serious money in kitchen fumes,https://www.bbc.com/news/business-65328579
The people turning time into a currency,https://www.bbc.com/news/business-65397192
Stylish singers and snipers: Africa's top shots,/news/world-africa-65480076
In pictures: Night-time Coronation rehearsal,/news/in-pictures-65467802
The 17 most eye-catching looks at the Met Gala,/news/entertainment-arts-65413976
Parasols and prayers: Africa's top shots,/news/world-africa-65409697
The photos that chronicle the cost of dying,/news/uk-scotland-65354687
