title,url
Biden promises 'no new Cold War' with China,/news/world-asia-63628454
Wagner chief defends brutal killing video,/news/world-europe-63623285
Race to control US House is going down to the wire,/news/world-us-canada-63627007
How a samurai forever shaped California,https://www.bbc.com/travel/article/20221113-kanaye-nagasawa-the-samurai-who-forever-changed-california
How common are female psychopaths?,https://www.bbc.com/future/article/20221111-what-its-like-living-with-psychopathy
What did Melania's former lawyer do? Our timed quiz...,/news/world-us-canada-63584818
Football players shot dead at University of Virginia,/news/world-us-canada-63624611
Roberta Flack unable to sing after ALS diagnosis,/news/world-us-canada-63630778
What's next for 'betrayed' Ronaldo at Man Utd?,/sport/football/63624621
England out in semi-finals after loss to New Zealand,/sport/rugby-league/63630559
'A desert World Cup and a dust-storm of controversy',/sport/football/63570556
Why indecision makes you smarter,https://www.bbc.com/worklife/article/20221111-why-indecision-makes-you-smarter
The weird and wonderful world of ASMR,https://www.bbc.com/culture/article/20221110-asmr-and-how-whispering-took-over-the-internet
"Pakistan's lost city of 40,000 people",https://www.bbc.com/travel/article/20221114-pakistans-lost-city-of-40000-people
The weird effect language has on time,https://www.bbc.com/future/article/20221103-how-language-warps-the-way-you-perceive-time-and-space
Anne and Edward to become stand-ins for King,https://www.bbc.com/news/uk-63626113
Tiny moth turns up 42 years after last UK sighting,https://www.bbc.com/news/uk-scotland-south-scotland-63587195
The artist who recreates the faces of the unknown dead,https://www.bbc.com/news/uk-scotland-highlands-islands-63457844
'Digital newsletters really humanise you to your readers',https://www.bbc.com/news/business-63565577
Why the Nile is becoming 'desertified',https://www.bbc.com/future/bespoke/follow-the-food/the-ingredient-we-cant-do-without/
President Zelensky visits liberated Kherson,/news/world-63626081
President Zelensky visits liberated Kherson,/news/world-63626081
King leads Remembrance Sunday ceremony,/news/uk-63613568
Soaring energy bills just to keep our son...,/news/uk-63602043
Two vintage planes collide in mid-air in...,/news/world-us-canada-63612535
How did Qatar get to host the World Cup?,/news/world-63611745
Finding the faces of forgotten comrades,/news/world-63601916
People rescued from cars after floods hit...,/news/world-europe-63611746
Ros Atkins on... Is the 1.5C climate target...,/news/science-environment-63607627
The moment an explosion rocks dam near...,/news/world-europe-63607625
Big Ben’s bongs return after restoration...,/news/uk-politics-63600578
Comedian Jay Leno 'OK' after being burned in a fire,/news/world-us-canada-63630772
Key 1.5C climate goal under threat at COP27 summit,/news/science-environment-63617400
China eases some Covid curbs despite rising cases,/news/world-asia-china-63594255
What do we know will be in the Autumn Statement?,/news/uk-politics-63622032
'Leap forward' in tailored cancer medicine,/news/health-63584355
Biggest crypto exchange urges new industry rules,/news/technology-63624890
Dua Lipa denies she is performing at Qatar WC,/news/entertainment-arts-63620686
Why smart thermostats don't always save you money,https://www.bbc.com/news/business-63511163
The shops that connect people with their home countries,https://www.bbc.com/news/business-63542786
Colourful cathedrals and pink lakes: Photos of the week,/news/in-pictures-63584441
"Africa's top shots: Bullseye, birds and ballet",/news/world-africa-63542247
Lensman recaptures city pub scenes 40 years on,/news/uk-england-humber-63549572
Stunningly preserved bronze statues found in Italy,/news/world-europe-63564404
Crocodile close-up wins mangrove photo awards,/news/in-pictures-63472199
