title,url
Ukraine hails 'historic day' as US and Germany deploy tanks,/news/live/world-europe-64396659
Why Germany delayed sending tanks to Ukraine,/news/world-europe-64402928
Covid losses mount in rural China: 'There are just too many',/news/world-asia-china-64347085
Are ski trips coming to an end?,https://www.bbc.com/future/article/20230124-how-climate-change-threatens-to-close-ski-resorts
The cheese that flourished after Covid,https://www.bbc.com/travel/article/20230124-why-italian-cheesemakers-buried-their-pecorino
Director speaks out on misogyny after Oscars snub,/news/entertainment-arts-64396730
Millions across US under winter storm watch,/news/world-us-canada-64401720
Eating chicken without killing chicken?,/news/world-us-canada-64381704
Reed is 'not living in reality' - McIlroy on snub,/sport/golf/64399598
Djokovic channels frustration to thrash Rublev,/sport/tennis/64395892
Watch: McIlroy snubs Reed after court summons,/sport/av/golf/64400605
This 21st-Century Columbo is a hit,https://www.bbc.com/culture/article/20230124-poker-face-review-a-deft-columbo-update-for-knives-out-fans
A flower found in one spot in the world,https://www.bbc.com/travel/article/20230123-tagimoucia-a-journey-to-earths-most-remote-flower
Are we at a turning point with burnout?,https://www.bbc.com/worklife/article/20230123-is-burnout-finally-high-profile-enough-for-leaders-to-act
Why is leprosy still with us?,https://www.bbc.com/future/article/20230124-leprosy-the-ancient-disease-scientists-cant-solve
Slow cooker recipes that won't hurt your wallet,https://www.bbc.com/food/collections/budget_slow_cooker_recipes
Rick and Morty creator and star Roiland dropped,https://www.bbc.com/news/entertainment-arts-64396728
US accuses Google of 'driving out' ad rivals,https://www.bbc.com/news/technology-64393868
The 'geeks' obsessing over their new heating systems,https://www.bbc.co.uk/news/business-64261457
Turning problem sea algae into a replacement for plastic,https://www.bbc.com/news/business-64317261
Peru's president calls for truce as protests flare,/news/world-latin-america-64400615
Peru's president calls for truce as protests...,/news/world-latin-america-64400615
Jacinda Ardern's last day as NZ prime...,/news/world-asia-64383638
Guillermo del Toro reacts to Oscar nomination,/news/entertainment-arts-64393162
Watch: The signals great apes use to...,/news/science-environment-64396575
Musk's Boring Company shows off Las Vegas...,/news/world-us-canada-64377359
Four year old boy joins Mensa,/news/uk-england-bristol-64373693
Brendan Fraser calls out bias against obese...,/news/entertainment-arts-64354173
"'Lisa Marie, my icon, my role model, my...",/news/world-us-canada-64368687
Armed police enter van of California shooting...,/news/world-us-canada-64373582
How to watch 2023's Oscar-nominated films,/news/entertainment-arts-64388101
Dentists warn of damage from braces ordered online,/news/uk-58038752
Twitter sued over antisemitic posts left online,/news/technology-64404590
Dante's Inferno and faux taxidermy grace Paris catwalks,/news/in-pictures-64384978
British shot putter criticises athletics' transgender plans,/sport/athletics/64396740
Twitter sued over alleged unpaid rent at UK HQ,/news/uk-64381582
Microsoft says services have recovered from outage,/news/technology-64397643
Composer of Wicked shares universal truth,https://link.chtbl.com/BBC_Wicked_HP
The race to make diesel engines run on hydrogen,https://www.bbc.com/news/business-64248564
The people left behind by coal mining's demise,/news/uk-wales-64330180
Africa's top shots: Celebrating 2973 and baptising Jesus,/news/world-africa-64325591
Aurora hunter treated by coastal lights display,https://www.bbc.co.uk/news/articles/ckdjzlq0eppo
The AI artist reimagining a stylish old age,/news/world-africa-64260739
Photos show challenges of 2020s Britain - creator,/news/uk-england-manchester-64190040
