title,url
'Major disaster' in Kentucky as floods toll rises,/news/world-us-canada-62351166
Top US judge mocks world leaders over abortion ban,/news/world-us-canada-62344354
Migrants break out of abandoned truck in Mexico,/news/world-us-canada-62344840
Ukraine's shadow army,https://www.bbc.co.uk/news/world-europe-62333795
Fraser helps England race away to team gold,/sport/commonwealth-games/62355775
Smith says Rock not ready to talk after slap,/news/entertainment-arts-62348252
Shakira tax case asks for eight-year prison term,/news/world-europe-62349773
Rebekah Vardy loses libel case against Coleen Rooney,/news/entertainment-arts-61719250
"Ferrari 'hard to beat' in Hungary, says Verstappen",/sport/formula1/62351003
England winning Euros would 'make a difference',/sport/football/62354710
Australia and Barbados seal opening day wins,/sport/commonwealth-games/62347160
The forest of dilapidated mansions,https://www.bbc.com/travel/article/20220725-yucatans-abandoned-henequen-haciendas
10 films to watch this August,https://www.bbc.com/culture/article/20220728-10-of-the-best-films-to-watch-this-august
The town where wi-fi is banned,https://www.bbc.com/future/article/20220728-the-town-with-the-cleanest-air-in-the-world
The companies giving up on hybrid,https://www.bbc.com/worklife/article/20220722-the-companies-doubling-down-on-remote-work
"Stop wearing ties to save energy, Spanish PM says",https://www.bbc.com/news/world-europe-62350019
The quest to find the perfect veggie burger,https://www.bbc.com/food/articles/quest_perfect_veggie_burger
Patients home within a day post-robotic surgery,https://www.bbc.com/news/uk-england-cambridgeshire-62345888
How graphene's superpowers could soon be unleashed,https://www.bbc.com/news/business-61913871
The PR and ad firms refusing fossil fuel clients,https://www.bbc.com/news/business-62303026
From wheelchair to walking on stage at graduation,/news/uk-northern-ireland-62339866
From wheelchair to walking on stage at...,/news/uk-northern-ireland-62339866
How a cartoon dog became a role model for...,/news/entertainment-arts-62335678
Wildfire spreads to hotel in Turkey,/news/world-europe-62354797
Will Smith acknowledges that Oscar slap was...,/news/entertainment-arts-62354796
Notre-Dame Cathedral on track to reopen in...,/news/world-europe-62341328
Ukrainians in constant stress since Feb -...,/news/world-europe-62335827
On set with the stars for the Neighbours...,/news/world-australia-62315068
First ever televised court sentencing takes...,/news/uk-62331434
Tears in the studio as Feltz announces radio...,/news/uk-62334099
Why Nadine Dorries called out Rishi Sunak's...,/news/uk-politics-62331432
40C heatwave has to be climate change - scientists,/news/science-environment-62335975
First monkeypox deaths reported outside Africa,/news/health-62350022
Eurovision's surprise viral TikTok enters UK chart,/news/entertainment-arts-62345254
Plastic bag usage down 20% since 10p charge,/news/science-environment-62350235
BA owner reports first profit since pandemic began,/news/business-62344654
First ever sales fall for Facebook owner Meta,/news/business-62322862
Million in Wuhan lockdown after four Covid cases,/news/world-asia-china-62322484
"'As CEO, my job is to get out of their way'",https://www.bbc.com/news/business-62310082
Why octopuses probably have feelings,https://www.bbc.com/future/article/20220720-do-octopuses-feel-pain
Africa's top shots: Boat racing and record breakers,/news/world-africa-62332375
In pictures: Sheeran joins Snow Patrol at Latitude,/news/uk-england-suffolk-62290216
In pictures: First Scottish tree hugging contest,/news/uk-scotland-highlands-islands-62291116
In pictures: Wildfires rage from Tenerife to Greece,/news/world-europe-62285090
'Underwater paradise' captured during heatwave,/news/uk-england-norfolk-62227836
