title,url
'Climate chaos' warning as COP27 summit begins,/news/science-environment-63517078
Tanzanian plane crashes into Lake Victoria,/news/world-africa-63532896
Why abortion matters in these crucial elections,/news/world-us-canada-63434895
"Trump, Obama and Biden descend on key swing state",/news/world-us-canada-63531155
The new Crown is a 'badly-told soap' ★★★☆☆,https://www.bbc.com/culture/article/20221104-the-crown-series-5-review-gripping-but-badly-told-soap
Italy stops adult male migrants from disembarking,/news/world-europe-63533769
US singer and rapper Aaron Carter dies aged 34,/news/entertainment-arts-63527899
WATCH: Moment woman saved from fire with rope,/news/world-us-canada-63532906
Premier League: Chelsea 0-0 Arsenal - Jesus heads wide from close range,/sport/live/football/63306645
Astros beat Phillies to clinch World Series title,/sport/baseball/63530761
India thrash Zimbabwe to set up England semi-final,/sport/cricket/63533507
The mindset employers want now,https://www.bbc.com/worklife/article/20221026-the-growth-mindset-all-workers-need-to-cultivate
The weird effect language has on time,https://www.bbc.com/future/article/20221103-how-language-warps-the-way-you-perceive-time-and-space
The unsung hero of Indian cuisine,https://www.bbc.com/travel/article/20221102-coriander-the-unsung-hero-of-indian-cuisine
The rise of the 'chief remote officer',https://www.bbc.com/worklife/article/20221027-the-rise-of-the-chief-remote-officer
The US' mysterious Viking runes,https://www.bbc.com/travel/article/20221030-the-mysterious-viking-runes-found-in-a-landlocked-us-state
The sand battery making waves in Finland,https://www.bbc.com/future/article/20221102-how-a-sand-battery-could-transform-clean-energy
"The worst drought in 1,200 years",https://www.bbc.com/future/article/20221031-how-tucson-arizona-is-facing-up-to-a-1200-year-drought
The horror that demonised older women,https://www.bbc.com/culture/article/20221103-how-what-ever-happened-to-baby-jane-demonised-older-women
Magic-mushroom drug can treat severe depression,https://www.bbc.com/news/health-63475630
Billions being spent in metaverse land grab,https://www.bbc.com/news/technology-63488059
The 'superpower' behind great art,https://www.bbc.com/culture/article/20221102-synaesthesia-the-superpower-behind-great-art
Elon Musk: Superhero or supervillain?,https://www.bbcselect.com/watch/elon-musk/
Rescuers search site of crashed plane in Tanzania,/news/world-africa-63534266
Rescuers search site of crashed plane in...,/news/world-africa-63534266
Fossil abstinence isn't working - climate...,/news/uk-politics-63534039
PM not aware of 'specific messages' from...,/news/uk-politics-63534037
Peru anti-government protest grips capital...,/news/world-latin-america-63531436
WATCH: Multiple Tornadoes hit southern US...,/news/world-us-canada-63530394
WATCH: Could this be the world's smallest...,/news/world-europe-63526199
One-minute World News,/news/10462520
At the scene of deadly nightclub fire in...,/news/world-europe-63527288
Parrot steals reporter's earphone live on air,/news/world-latin-america-63523009
Youth MPs: ‘We have fire in us to create...,/news/uk-politics-63520778
TikTok says staff in China can access UK user data,/news/business-63494951
Climate anxiety is rising - it might be a good thing,/news/science-environment-63516055
Panic and fear drove iPhone factory breakout,/news/world-asia-china-63481793
Glastonbury ticket sale hit by technical issue,/news/uk-england-bristol-63533949
Scholz asks China to press Russia to end its war,/news/world-europe-63496195
Apple store Glasgow workers unionise in UK first,/news/technology-63485697
The Crown: Seven takeaways from the latest series,/news/entertainment-arts-63512840
India gambles on building a leading drone industry,https://www.bbc.com/news/business-62966802
The refugees able to work remotely for firms around the world,https://www.bbc.com/news/business-63468944
Your pictures on the theme of 'sculpture',/news/in-pictures-63486977
"Northern Lights, Tutankhamun and cakes: Photos of the week",/news/in-pictures-63514358
Crocodile close-up wins mangrove photo awards,/news/in-pictures-63472199
In pictures: Lula beats Bolsonaro,/news/world-latin-america-63451896
Africa's top shots: Red rings and seas of green,/news/world-africa-63411863
