title,url
Thousands protest at Georgian 'foreign agent' bill,/news/world-europe-64882475
Republicans slam Fox News over Capitol riot video,https://www.bbc.com/news/world-us-canada-64883668
'I nearly died' - the Olympian wrongly sectioned for 26 days,https://www.bbc.com/sport/rugby-union/64876477
The untold story of the Grand Canyon,https://www.bbc.com/travel/article/20230307-mary-colter-the-woman-who-shaped-the-us-southwest
The young workers in a post-Me Too era,https://www.bbc.com/worklife/article/20230307-did-me-too-change-the-workplace-for-gen-z
Two Mexico kidnap victims recovering in US hospitals,/news/world-us-canada-64882744
Why a million Americans a year risk Mexico medical tourism,/news/world-us-canada-64832308
Musk apologises to Twitter worker over online row,/news/technology-64884287
Fernandes an 'inspiration' to Man Utd - Ten Hag,/sport/football/64888099
The 'damaging' idea that 'thinner is faster',/sport/64797365
The female-run MLS club inspiring girls and making history,/sport/football/64876237
A cult novel's 'dangerous' diary,https://www.bbc.com/culture/article/20230307-the-power-of-forbidden-notebooks-hidden-diary-entries
How Germany treats parental burnout,https://www.bbc.com/future/article/20230228-the-german-clinics-for-burnt-out-parents
"Europe's little-known, progressive city",https://www.bbc.com/travel/article/20230306-the-progressive-city-that-few-know
Why so many LGBTQ+ workers are quitting,https://www.bbc.com/worklife/article/20230303-the-discrimination-pushing-lgbtq-workers-to-quit
How to watch 2023's Oscar-nominated films,https://www.bbc.com/news/entertainment-arts-64388101
A sweet for India's festival of colours,https://www.bbc.com/travel/article/20230307-gujiya-a-flaky-pastry-to-celebrate-holi
How cycling carried two sisters out of the Taliban's reach,https://www.bbc.com/sport/cycling/63403027
'We cut our website's carbon emissions by 520kg in a year',https://www.bbc.co.uk/news/business-64623955
The mushrooms you can wear and build with,https://www.bbc.com/news/business-64810935
UK weather forecast: Will I get snow in my area tomorrow?,/news/uk-64893548
UK weather forecast: Will I get snow in my...,/news/uk-64893548
Woman hit with water cannon as she waves EU...,/news/world-europe-64888796
Why the High Seas Treaty brought this woman...,/news/world-us-canada-64881957
One fan's heartstopping go at getting...,/news/entertainment-arts-64882598
"Abortion law put our lives at risk, Texas...",/news/world-us-canada-64753593
Rob Burrow receives PM's ‘Points of...,/news/uk-64876195
One-minute World News,/news/10462520
Japan's H3 rocket self-destructs after launch,/news/world-asia-64873439
CCTV of Couzens moments before flashing...,/news/uk-64868540
The crane which refuses to leave its human...,/news/world-asia-india-64833175
Invasive plants outnumber British flora - report,/news/science-environment-64842402
iPhone maker sees revenue slump as demand weakens,/news/business-64858566
Why Lineker's comments present problem for the BBC,/news/entertainment-arts-64889868
Weight loss drug semaglutide approved for NHS use,/news/health-64874243
Bumblebees learn to solve puzzles by watching peers,/news/uk-64884107
TikTok launches plans to allay China security fears,/news/technology-64887704
Five women sue Texas over abortion access,/news/world-us-canada-64882712
Putin's 'frustration and resentment' against the West,https://www.bbcselect.com/watch/putin-vs-the-west/?utm_source=BBC.com&utm_medium=Homepage&utm_campaign=Putin+vs+the+west
Robotaxi tech improves but can they make money?,https://www.bbc.com/news/business-64742934
What a bird's eye view of Africa reveals,/news/world-africa-64862607
Do you know this baby? Putting names to archive photos,/news/world-africa-64451314
Pet crocs and red carpets: Africa's top shots,/news/world-africa-64823868
The devastated towns near Ukraine's front line,/news/world-europe-64819471
Pictures show devastation after Greece train disaster,/news/world-europe-64808123
