title,url
All five people on Titan sub dead after 'catastrophic implosion',/news/live/world-us-canada-65967464
Five dead on Titan sub were 'true explorers',/news/world-us-canada-65993579
The woman who wants to end abortion in America,/news/world-us-canada-65923956
What professional women often sacrifice,https://www.bbc.com/worklife/article/20230620-why-many-women-prioritise-their-partners-jobs
Europe's most expensive painting ever?,https://www.bbc.com/culture/article/20230621-klimts-lady-with-a-fan-the-painting-thats-valued-at-65m
Canada police name 16 victims in highway crash,/news/world-us-canada-65969968
Rust movie armorer charged with evidence tampering,/news/uk-65993965
Spate of mass brawls at German outdoor pools,/news/world-europe-65985004
'A huge opportunity to see if England have caught up',/sport/cricket/65986734
IOC strips IBA of recognition as governing body,/sport/boxing/65987324
Chelsea owners buy majority stake in Strasbourg,/sport/football/65992617
How will Titan investigators find out what happened?,https://www.bbc.com/news/science-environment-65994181
Key questions about the Titan's implosion,https://www.bbc.com/news/world-us-canada-65934887
"British father, son and explorer among sub victims",https://www.bbc.com/news/uk-65955554
Sweden's magical day of feasting,https://www.bbc.com/travel/article/20230622-a-celebratory-strawberry-cake-for-swedens-midsummer-festival
The Gen Xers making dream-career pivots,https://www.bbc.com/worklife/article/20230620-the-mid-career-workers-pivoting-to-dream-jobs
How dangerous is the Titanic wreck?,https://www.bbc.com/future/article/20230620-why-the-waters-around-the-titanic-are-still-treacherous
A show likely to get on viewers' nerves,https://www.bbc.com/culture/article/20230619-and-just-like-that-series-two-review-the-sex-and-the-city-sequel-is-still-annoying
Thompson twins hoping for NBA Draft history,https://www.bbc.com/sport/basketball/65981165
India man 'cons' posh hotel for two-year free stay,https://www.bbc.com/news/world-asia-india-65983209
German woman jailed for keeping Yazidi slave,https://www.bbc.com/news/world-europe-65981397
Airbus experiments with more control for the autopilot,https://www.bbc.com/news/business-65676421
The latest technology news direct to your inbox,https://cloud.email.bbc.com/techdecoded-newsletter-signup
How the story of the Titan sub unfolded,/news/world-us-canada-65994627
How the story of the Titan sub unfolded,/news/world-us-canada-65994627
US Coast Guard confirms Titan sub loss,/news/world-us-canada-65992579
'The only solace is that they didn't suffer...,/news/world-us-canada-65993552
Watch: Titanic sub passenger recalls losing...,/news/world-us-canada-65981914
Dozens killed in China restaurant fire,/news/world-asia-china-65982615
Louis Tomlinson fans hurt in wild hail storm,/news/world-us-canada-65992577
Paris building in flames after huge explosion,/news/world-europe-65978066
Watch: Stuck horse rescued from Florida pool,/news/world-us-canada-65985119
'Hi miss!': Hollywood star surprises sister...,/news/uk-65971519
Watch: Huge fire burns in Las Vegas,/news/world-us-canada-65974284
Cindy Beale returns to EastEnders after 25 years,/news/entertainment-arts-65986136
Barbados PM leads fight for climate cash shake-up,/news/science-environment-65962997
Police warn over new Android 999 call feature,/news/technology-65962942
Mosquito-borne diseases risk increasing in Europe,/news/health-65985838
"Rihanna, Lizzo and Marilyn shine in Divas exhibition",/news/entertainment-arts-65949434
Singapore fines firms over Wirecard payments scandal,/news/business-65981701
Satellite images reveal Ukraine canals drying up,/news/world-europe-65963403
The workers already replaced by artificial intelligence,https://www.bbc.co.uk/news/business-65906521
Kelly Hoppen: 'Music is design to me',https://www.bbc.com/news/business-65851081
Beauty of insects revealed in photo competition,/news/in-pictures-65876963
Dazzling ancient bronze sword found in Germany,/news/world-europe-65936594
Burna Boy bling and high flyers: Africa's top shots,/news/world-africa-65919659
Man trots globe blending scenes into film locations,/news/uk-england-essex-65786652
In pictures: Nottingham attack shakes city to core,/news/uk-65899897
