title,url
US club attack ended by dad and drag performer,/news/world-us-canada-63698165
Follow World Cup: Argentina v Saudi Arabia,https://www.bbc.com/sport/live/football/60976486
Kosovo flare-up fears over car number plate row,https://www.bbc.com/news/world-europe-63711841
The Indian liquor the British banned,https://www.bbc.com/travel/article/20221121-mahua-the-indian-liquor-the-british-banned
Why Canada aims to bring in 1.5m immigrants by 2025,https://www.bbc.com/news/world-us-canada-63643912
Many schoolchildren among Indonesia quake dead,/news/world-asia-63712461
'No fowl play' as Biden pardons Thanksgiving turkeys,/news/world-us-canada-63711681
What's banned from royal palace menus? Our timed quiz...,/news/world-us-canada-63698101
England collapse to record defeat against Australia,/sport/live/cricket/61630487
"World Cup news: England & Wales reaction, plus latest off-pitch issues",/sport/live/football/63706850
Chinese GP to be cancelled because of Covid policy,/sport/formula1/63713326
Why is there so much added time at the World Cup?,https://www.bbc.com/sport/football/63710986
What makes a World Cup Golden Boot winner?,https://www.bbc.com/sport/football/61823301
Messi 'in a great moment' for final World Cup bid,https://www.bbc.com/sport/football/63631779
How a menu can change our food habits,https://www.bbc.com/future/article/20221121-the-menu-tweaks-that-lower-diners-emissions
The tensions that fan in-law conflict,https://www.bbc.com/worklife/article/20221111-the-tensions-that-fan-tricky-in-law-relationships
A former slavery port faces its history,https://www.bbc.com/travel/article/20221120-in-charleston-a-museum-2300-years-in-the-making
The book that could corrupt a nation,https://www.bbc.com/culture/article/20221121-the-well-of-loneliness-the-most-corrosive-book-ever
How Covid is rising again in China,https://www.bbc.com/news/59882774
Ten years since IS kidnap of British journalist,https://www.bbc.com/news/uk-63711446
Is Zimbabwe any better off without Mugabe?,https://www.bbc.com/news/world-africa-63703145
Rwanda's electric vehicle push has a faltering start,https://www.bbc.com/news/business-63622624
Do we need a world without borders?,https://www.bbc.com/future/article/20221117-how-borders-might-change-to-cope-with-climate-migration
"'I walked 1,600km to the World Cup'",/news/world-63708304
"'I walked 1,600km to the World Cup'",/news/world-63708304
Indonesia quake injured rushed to hospital,/news/world-asia-63704742
Fans miss kick-off after Fifa ticket app...,/news/world-63709137
Police and anti-government protesters clash...,/news/world-latin-america-63699004
China factory blaze kills 38,/news/world-asia-china-63712628
Inside Qatar's £175-a-night fan village of...,/sport/av/football/63691286
Maluma walks out of Qatar human rights...,/news/world-middle-east-63693408
One-minute World News,/news/10462520
Giraffe's birth at zoo 'vital' for...,/news/uk-england-beds-bucks-herts-63701092
How a North Korean defector became a fight...,/news/world-asia-63644829
She Said stars praise women who accused Weinstein,/news/entertainment-arts-63707321
Superbug fight 'needs farms to cut antibiotic use',/news/science-environment-63666024
What does an unheated room do to your body?,/news/health-63602501
Row over visitor numbers to Unboxed Festival,/news/entertainment-arts-63656614
Twitter charity partners condemn 'dangerous' changes,/news/technology-63710997
Plan to beam solar energy wirelessly from space,/news/science-environment-62982113
C﻿uban musician Pablo Milanés dies aged 79,https://www.bbc.co.uk/news/articles/cn0497v1jdno
WhatsApp groups help get food to those who need it,https://www.bbc.com/news/business-63461678
Secrets to royal travel: Luxurious planes and trains,https://www.bbcselect.com/watch/secrets-of-royal-travel/?utm_source=BBC.com&utm_medium=Homepage&utm_campaign=Secrets+of+Royal+Travel
Historic images show 'how we used to live' in city,/news/uk-england-tyne-63674925
"Africa's top shots: Silk, beads and gold beauty queens",/news/world-africa-63661322
Inside the floating polar research laboratory,/news/uk-england-essex-63628208
"Africa's top shots: Bullseye, birds and ballet",/news/world-africa-63542247
Lensman recaptures city pub scenes 40 years on,/news/uk-england-humber-63549572
