title,url
Queen’s funeral date set as young royals join in mourning,/news/live/uk-62842089
Russian forces retreat as Ukraine takes key towns,/news/world-europe-62860774
Charles praises Queen's reign as he's proclaimed king,/news/uk-62860893
The big issue that could derail UK/US relations,/news/world-us-canada-62819799
Whale may have caused NZ boat flip that killed five,/news/world-asia-62860778
Five jailed in Hong Kong for children's books,/news/world-asia-china-62863622
"Dancing, digging, drinks: The Queen in North America",/news/world-us-canada-62854864
"What will happen to stamps, coins, banknotes and passports?",/news/uk-59596996
England hold slim advantage over South Africa,/sport/cricket/62838465
Swiatek wins US Open for second major title of 2022,/sport/tennis/62866285
Tributes paid to Queen before England v SA Test,/sport/cricket/62838463
Queen was with me at happiest and saddest times - William,https://www.bbc.com/news/uk-62864869
Queen's final Scottish journey charts life of service,/news/uk-scotland-62862379
Six times the Queen made us laugh,https://www.bbc.com/news/uk-62849166
The desert people who built a US city,https://www.bbc.com/travel/article/20220905-the-watery-secret-of-ancient-north-america
How to tweet like an Ancient Greek,https://www.bbc.com/future/article/20220901-the-epicurean-guide-to-digital-life
"A 'spectacular, action-filled epic'",https://www.bbc.com/culture/article/20220910-the-woman-king-review-a-spectacular-action-filled-epic
The neglected trait that drives success,https://www.bbc.com/worklife/article/20220831-curiosity-the-neglected-trait-that-drives-success
'The teenage girl who changed the world',https://www.bbc.com/reel/video/p0cyzd0q/-the-teenage-girl-who-changed-the-world-
Kim Kardashian launches private equity firm,https://www.bbc.com/news/business-62829733
Cancer rules rewritten by air-pollution discovery,https://www.bbc.com/news/health-62797777
Should billboard advertising be banned?,https://www.bbc.com/news/business-62806697
How India is building a pearl farming industry,https://www.bbc.com/news/business-62204515
"William, Kate, Harry and Meghan view tributes",/news/uk-62862575
"William, Kate, Harry and Meghan view tributes",/news/uk-62862575
Charles III proclaimed king in TV first,/news/uk-62862571
Watch: King Charles's first speech in full,/news/uk-62856345
A glimpse inside the King's first audience...,/news/uk-62854289
'I brought my nan's ashes to see the Queen',/news/uk-62854935
King greets mourners at Buckingham Palace,/news/uk-62853708
Outpouring of sympathy across the...,/news/world-62852412
'We will never see a Queen again in our...,/news/uk-62845415
A constant presence in a changing world,/news/uk-46523387
One-minute World News,/news/10462520
China approves inhaled Covid vaccine,/news/health-62793078
Nine shows to stream about the Queen,/news/entertainment-arts-62840145
Baby sticky tape skin test can predict eczema risk,/news/health-62808235
Apple reveals iPhone 14 Pro and Watch Ultra,/news/technology-62827774
British cultural stars join tributes to the Queen,/news/entertainment-arts-62844993
PM will explore energy market reform to cut bills,/news/science-environment-62832029
Emergency text averted possible California blackout,/news/technology-62832775
'There were no women in my field so I found my own way',https://www.bbc.com/news/business-62719779
The inside scoop on ice cream innovation,https://www.bbc.com/news/business-62745767
Queen Elizabeth II: A life in pictures,/news/in-pictures-61645231
In pictures: Royals view tributes as Charles becomes king,/news/in-pictures-62864071
Pictured: Sydney darkens opera house as world mourns,/news/world-us-canada-62841762
In pictures: King Charles' first full day on the throne,/news/in-pictures-62797450
In pictures: Tears and tributes for Queen across UK,/news/in-pictures-62844423
