title,url
Libyan official rejects blame for flood disaster,/news/world-africa-66822837
Diamonds and diplomacy: How a US envoy fell from grace,https://www.bbc.com/news/world-us-canada-66790328
Three men cleared of plotting to kidnap US governor,https://www.bbc.com/news/world-us-canada-66814555
New Zealand thrash Namibia but De Groot sent off,/sport/rugby-union/66826612
The brutal film on 'warped masculinity',https://www.bbc.com/culture/article/20230915-how-grisly-thriller-dead-mans-shoes-captured-british-small-town-violence
'The riverbank was not next to this mosque a week ago',/news/world-africa-66823715
Mourners flock to funeral of divisive Zulu leader,/news/world-africa-66818249
Kutcher quits charity after Masterson backlash,/news/world-us-canada-66827692
Car worse than expected in Singapore - Verstappen,/sport/formula1/66821464
England should take Roy to World Cup - Anderson,/sport/cricket/66827366
Ten Hag unsure if Sancho will play for Man Utd again,/sport/football/66827225
Are businesses ready for a Covid wave?,https://www.bbc.com/worklife/article/20230913-are-businesses-ready-for-another-wave-of-covid-19-cases
How old is too old to lead?,https://www.bbc.com/future/article/20230913-should-we-be-worried-about-older-politicians
Stunning music from an infamous US jail,https://www.bbc.com/culture/article/20230913-hear-stunning-music-recorded-inside-mississippis-infamous-parchman-prison
A crowd-pleasing chicken soup,https://www.bbc.com/travel/article/20230915-sancocho-a-panamanian-chicken-and-vegetable-soup
Workers are sliding into DMs for jobs,https://www.bbc.com/worklife/article/20230911-i-had-big-why-not-energy-the-workers-sliding-into-recruiters-dms
A new era of Jewish food in the US,https://www.bbc.com/travel/article/20230914-explore-new-york-citys-eight-best-jewish-eateries
Why men dominate Q&As so much,https://www.bbc.com/future/article/20230913-why-are-women-less-likely-to-ask-questions-in-public
What Diana's sheep jumper really means,https://www.bbc.com/culture/article/20230913-what-princess-dianas-sheep-jumper-really-means
Trevor Noah jumps into fan's car to beat traffic,https://www.bbc.com/news/world-africa-66822835
In Pictures: Stars hit red carpet at Vogue World,https://www.bbc.com/news/entertainment-arts-66808254
The tiny island with a population of 16,https://www.bbc.com/reel/playlist/future-planet?vpid=p07gsk79
The firms hoping to take psychedelic drugs mainstream,https://www.bbc.com/news/business-66669641
Moment police officer dragged away by escaping car,/news/world-us-canada-66827928
Moment police officer dragged away by...,/news/world-us-canada-66827928
Rubiales's day in court over World Cup...,/news/world-europe-66826930
Drone footage captures submerged Libya...,/news/world-africa-66808579
Ros Atkins on... Libya’s political turmoil...,/news/world-africa-66808449
CCTV shows US airport staff allegedly...,/news/world-us-canada-66816550
Moment puma cub found and rescued by police,/news/world-latin-america-66818671
How Diana's iconic sweater was lost...then...,/news/world-us-canada-66758333
"Tourist climbs Brussels statue, breaks it",/news/world-europe-66808450
Watch: 102-year-old abseils down 280ft...,/news/uk-66812958
Mesmerising marine life photos scoop world prize,/news/in-pictures-66810094
Guts and glory as Olivia Rodrigo tops album chart,/news/entertainment-arts-66824131
UK butterfly numbers at highest level since 2019,/news/uk-66812657
Indie game studios warn Unity fees could cause delays,/news/newsbeat-66810296
UK's first school set up with orchestra opens,/news/entertainment-arts-66799608
France sets out plan to ban disposable vapes,/news/world-europe-66797972
US fast food chain Chick-fil-A to try again in UK,/news/business-66813904
The case that sent shockwaves through Britain,https://www.bbcselect.com/watch/who-killed-lin-and-megan/?utm_source=BBC.com&utm_medium=Homepage&utm_campaign=Lin+and+Megan
What happened after this tiny island banned plastic,https://www.bbc.com/reel/playlist/future-planet?vpid=p07l59np
Stunning image of huge plasma arc wins award,/news/in-pictures-66807814
In pictures: Desperate search for flood survivors,/news/in-pictures-66805006
Photographs that shaped the urban landscape,/news/in-pictures-66784928
Finding beauty in rugged sights of the Black Country,/news/uk-england-birmingham-66706259
Oriel luniau: Ras Cefn y Ddraig 2023 // Photo gallery: The 2023 Dragon’s Back Race,/newyddion/66786559
