title,url
Hurricane Idalia strengthens to Category 3 as it nears Florida,/news/live/world-us-canada-66640995
Army officers say they are taking power in Gabon,https://www.bbc.com/news/world-africa-66654965
Do young children understand 'pranks'?,https://www.bbc.com/future/article/20230829-why-young-children-dont-understand-pranks
Is Hollywood self-destructing?,https://www.bbc.com/culture/article/20230829-venice-film-festival-is-hollywood-self-destructing
Today's football transfer rumours and gossip,https://www.bbc.com/sport/football/gossip
Florida hunkers down for 'unprecedented' hurricane,/news/world-us-canada-66641091
Kyiv hit by missile barrage as drones strike Russia warplanes,/news/live/world-europe-66654526
Wagner chief Prigozhin buried in private funeral,/news/world-europe-66649570
"EFL Cup reaction, football news & transfers latest",/sport/live/football/66655086
Richarlison scores but Fulham beat Spurs in shootout,/sport/football/66577560
Spanish FA exploring options to sack Vilda,/sport/football/66645618
The volcanic bugs that munch on CO2,https://www.bbc.com/future/article/20230829-the-bacteria-that-can-capture-carbon
Why is everyone crazy about Aperol?,https://www.bbc.com/travel/article/20230829-why-aperol-spritz-is-the-drink-of-the-summer
Why unhappy workers can't quit,https://www.bbc.com/worklife/article/20230828-workers-are-quiet-quitting-and-only-employers-can-stop-it
Why sequins are so exhilarating to wear,https://www.bbc.com/culture/article/20230825-why-sequins-are-so-exhilarating-to-wear
Do antibiotics ruin your gut health?,https://www.bbc.com/future/article/20230825-do-antibiotics-really-wipe-out-your-gut-bacteria
What's behind Netflix's expansion into gaming?,https://www.bbc.com/news/entertainment-arts-66639477
Can pop stars stop politicians using their music?,https://www.bbc.com/news/entertainment-arts-66646344
How long until a robot is doing your chores?,https://www.bbc.com/news/business-66288309
Why empty lorries are a problem and how to fix it,https://www.bbc.com/news/business-66461766
Watch: BBC gets as close as possible to Prigozhin grave,/news/world-europe-66653069
Watch: BBC gets as close as possible to...,/news/world-europe-66653069
Are hurricanes in the US getting worse?,/news/world-us-canada-66484030
Satellite images show lightning strikes...,/news/world-us-canada-66643296
Surgeon's shock at finding live worm in...,/news/world-australia-66645263
Watch: The day air traffic control went...,/news/uk-66642883
Covid tsunami unlikely despite spike in cases...,/news/world-us-canada-66643426
One-minute World News,/news/10462520
Texas man shoots through door to fend off...,/news/world-us-canada-66642965
Bears encroach on evacuated Canadian town,/news/world-us-canada-66621356
The view from the streets of Notting Hill...,/news/uk-england-london-66641843
Pollution rules to be scrapped to build more homes,/news/uk-politics-66642878
'A Strange Loop represents a cultural tilt',/news/uk-england-london-66647721
Wrestlers grapple in gravy at annual charity event,/news/uk-england-lancashire-66645681
How robotaxis are dividing San Francisco,/news/technology-66611513
Covid tsunami unlikely despite spike in cases - Fauci,/news/world-us-canada-66643426
Hundreds of tents left behind after Leeds Festival,/news/uk-england-leeds-66649535
The indigenous groups fighting the quest for 'white gold',/news/world-latin-america-66520097
Tech Decoded: The latest news direct to your inbox,https://www.bbc.com/news/technology-65786969
"Premier League news, insights and gossip direct to your inbox",https://www.bbc.com/sport/football/66291022
Religion and reggae: Africa’s top shots,/news/world-africa-66603513
Photo prize shortlist celebrates region's beauty,/news/uk-england-tyne-66594319
Sunflowers irresistible to Instagram photo hunters,/news/uk-wales-66514508
In pictures: Michael Parkinson and his star guests,/news/entertainment-arts-66430865
"Tricks, trials and salutes: Africa’s top shots",/news/world-africa-66532676
