title,url
Russia battles armed group that entered from Ukraine,/news/world-europe-65674773
US Senator Tim Scott launches 2024 White House bid,https://www.bbc.com/news/world-us-canada-65654865
Idaho murder suspect 'stands silent' at plea hearing,https://www.bbc.com/news/world-us-canada-65677187
The dangers of the 'naturalness bias',https://www.bbc.com/worklife/article/20230517-why-people-reward-innate-talent-over-hard-work
The first king to travel around the world,https://www.bbc.com/travel/article/20230521-king-david-laamea-kalkaua-the-first-king-to-travel-around-the-world
Satellites reveal Russian defences before major assault,https://www.bbc.co.uk/news/world-europe-65615184
UK rejects calls to return Ethiopian prince's body,/news/world-africa-65588663
Escaped water buffalo herd wreck new swimming pool,/news/uk-england-essex-65674881
Premier League: Newcastle 0-0 Leicester - hosts hit post for third time,/sport/live/football/65448496
Juve docked 10 points over transfer dealings,/sport/football/65677783
Real report Vinicius Jr racist abuse as hate crime,/sport/football/65669712
Where the sounds of nature are too quiet,https://www.bbc.com/future/article/20230519-the-sound-recordings-used-to-coax-back-species
The viruses hiding in our DNA,https://www.bbc.com/future/article/20230519-the-viruses-that-helped-to-make-you-human
A fairy tale 'for the age of Marvel movies' ★★★☆☆,https://www.bbc.com/culture/article/20230522-the-little-mermaid-review-a-spectacle-with-an-allure-and-vitality-of-its-own
The Dutch solution to stress,https://www.bbc.com/travel/article/20230522-the-dutch-solution-to-busyness-that-captivated-the-world
Why it's 'imperative' to start using AI,https://www.bbc.com/worklife/article/20230515-workplace-ai-how-artificial-intelligence-will-transform-the-workday
Mike Ashley thinks luxury Flannels shops 'bonkers',https://www.bbc.com/news/business-65613808
Picnics and blooms: The Chelsea Flower Show in pictures,https://www.bbc.com/news/in-pictures-65669737
Protein's power is being uncovered and unleashed,https://www.bbc.com/news/business-65468298
'We are selling a product that we hope gets discontinued',https://www.bbc.com/news/business-65572881
Watch: First pictures from scene of Madeleine search,/news/uk-65675817
Watch: First pictures from scene of Madeleine...,/news/uk-65675817
Watch: Braverman quizzed on speeding claims,/news/uk-politics-65671909
Watch: Mexican volcano spews ash into starry...,/news/world-latin-america-65671578
Naga Munchetty: ‘I’m in pain because I...,/news/uk-65670355
'Pay your writers!' Student chants interrupt...,/news/world-us-canada-65670039
Watch: Green flash as meteor blazes across...,/news/world-australia-65668065
One-minute World News,/news/10462520
Watch: Activists turn Trevi Fountain water...,/news/world-europe-65666775
Watch: Japan riot police pin G7 protesters to...,/news/world-asia-65663384
"Zelensky: For today, Bakhmut is only in our...",/news/uk-65662504
Ad-free search engine Neeva shuts down,/news/technology-65671468
'Boomer' Schwarzenegger won't wait to tackle climate change,/news/uk-65657186
How Ukraine is tackling the mental scars of war,/news/world-europe-65418075
Film critics fall for Little Mermaid's new Ariel,/news/entertainment-arts-65672642
Amazon's Jeff Bezos to help Nasa return to Moon,/news/science-environment-65635005
Hammond and O'Leary pay tribute to Schofield,/news/entertainment-arts-65669427
Ireland to introduce alcohol label health warning,https://www.bbc.co.uk/news/articles/c2j159ld7zvo
How computer games encourage kids to spend cash,https://www.bbc.com/news/business-65372710
Should social media face-altering filters be regulated?,https://www.bbc.com/news/business-65544054
"Showers, shopping and soccer: The best of British press photography",/news/in-pictures-65645239
"Dancers, divers and film-makers: Africa's top shots",/news/world-africa-65622722
Slurping Spaghetti and other food photo contest winners,/news/in-pictures-65549869
Scans of Titanic reveal wreck as never seen before,/news/science-environment-65602182
In pictures: Electric rally at an old coal mine,/news/uk-scotland-south-scotland-65596103
