title,url
Historic ocean treaty agreed after decade of talks,/news/science-environment-64815782
Russian reservists fighting with shovels - UK,https://www.bbc.com/news/world-europe-64855760
"The Murdaugh trial is over, but infamy lingers for town",https://www.bbc.com/news/world-us-canada-64844858
Premier League: Liverpool 1-0 Man Utd - Gapko opens scoring,/sport/live/football/64405191
Chris Rock jokes about Oscars slap in Netflix show,https://www.bbc.com/news/entertainment-arts-64852406
Greek PM seeks forgiveness over train crash,/news/world-europe-64853213
Disability rights activist Judy Heumann dies at 75,/news/world-us-canada-64854839
Huge fire engulfs Rohingya camp in Bangladesh,/news/world-asia-64854843
"Verstappen leads Red Bull one-two in Bahrain, Alonso third - reaction",/sport/live/formula1/63203612
Verstappen wins in Bahrain as Alonso takes podium,/sport/formula1/64856125
Follow Women's League Cup final: Arsenal v Chelsea build-up,/sport/live/football/64141092
Why Marlon Brando rejected an Oscar,https://www.bbc.com/culture/article/20230302-the-most-shocking-moment-in-oscars-history-50-years-on
How three widows came to rule Champagne,https://www.bbc.com/travel/article/20230301-the-little-known-history-of-champagne
The problem confronting women of colour,https://www.bbc.com/worklife/article/20230228-the-perfect-storm-keeping-women-of-colour-behind-at-work
The rise of the Gen Z side hustle,https://www.bbc.com/worklife/article/20230302-the-rise-of-the-gen-z-side-hustle
The return of the US' lost language,https://www.bbc.com/travel/article/20230228-kouri-vini-the-return-of-the-us-lost-language
The clothes you can't recycle,https://www.bbc.com/future/article/20230227-how-to-recycle-your-clothes
The most ingenious recycled homes,https://www.bbc.com/culture/article/20230302-the-most-ingenious-recycled-homes
Harry: I always felt different to rest of family,https://www.bbc.com/news/uk-64850024
"After Afghan TV fame, a new life in Ohio",https://www.bbc.com/news/world-us-canada-64562082
Toblerone to drop iconic Matterhorn from packaging,https://www.bbc.com/news/business-64854720
Putin's 'frustration and resentment' against the West,https://www.bbcselect.com/watch/putin-vs-the-west/?utm_source=BBC.com&utm_medium=Homepage&utm_campaign=Putin+vs+the+west
Robotaxi tech improves but can they make money?,https://www.bbc.com/news/business-64742934
Stephen Bear: The day Georgia Harrison got justice,/news/uk-64856782
Stephen Bear: The day Georgia Harrison got...,/news/uk-64856782
WATCH: Fire tears through Bangladesh refugee...,/news/world-asia-64855076
WATCH: Huge fire burns after Indonesia depot...,/news/world-asia-64847062
Australia's 'biggest drug bust' nets $700m of...,/news/world-australia-64847242
"Thanks, but no big speech, in Ken Bruce's...",/news/uk-64837224
Tear gas fired at Greece train crash...,/news/world-europe-64833807
Ros Atkins on... The creeping TikTok bans,/news/technology-64831583
Hong Kong skyscraper fire seen on city's...,/news/world-asia-64831692
Watch: Matt Hancock message row in 83 seconds,/news/uk-politics-64831398
One-minute World News,/news/10462520
Tech Tent: the pregnant worker who took on Google,https://www.bbc.co.uk/sounds/play/w3ct4kj7
Everything Everywhere wins big ahead of Oscars,/news/entertainment-arts-64852206
Ros Atkins on... The creeping TikTok bans,/news/technology-64831583
What is the plan to protect the high seas?,/news/science-environment-64839763
Half of world could be overweight by 2035,/news/world-64831848
Airlines sue Dutch government over flight cuts,/news/science-environment-64842394
Scotland first to ban anaesthetic over environment,/news/health-64347191
Sake brewers toast big rise in global sales,https://www.bbc.com/news/business-64797853
'We're flying the flag for Scottish rum',https://www.bbc.com/news/business-64719180
The devastated towns near Ukraine's front line,/news/world-europe-64819471
Pictures show devastation after Greece train disaster,/news/world-europe-64808123
Spectacular northern lights seen across UK,/news/uk-64782372
SAG Awards: The red carpet in pictures,/news/entertainment-arts-64781316
Vigils and flags: Ukraine war anniversary in pictures,/news/in-pictures-64757068
