title,url
A twisted moral code explains Mexico cartel's apology,/news/world-latin-america-64921765
Has Putin’s assault on Ukraine’s power grid failed?,/news/world-europe-64899045
US bank taken over in biggest failure since 2008,/news/business-64915616
How big are Trump's legal problems?,/news/world-us-canada-61084161
Premier League: Six matches including Bournemouth v Liverpool,/sport/live/football/64405193
Florida's battle over how race is taught in schools,/news/world-us-canada-64815035
'Pineapple Express' winter storm pummels California,/news/world-us-canada-64911139
First vaccine for honeybees could save billions,/news/world-us-canada-64919705
Hours of BBC sports shows dropped as Lineker row deepens,/news/live/entertainment-arts-64895316
Scottish Cup quarter-finals: Hearts host Celtic at Tynecastle,/sport/live/football/64857964
"BBC mistaken to suspend Lineker, ex-DG says",/news/uk-64918162
The hardest language to spell?,https://www.bbc.com/future/article/20230302-can-dyslexia-change-in-other-languages
The greatest pop star of her generation?,https://www.bbc.com/culture/article/20230309-why-miley-cyrus-is-the-ultimate-21st-century-pop-star
What drives 'catty' workplace conflict,https://www.bbc.com/worklife/article/20230309-the-bias-that-drives-catty-workplace-conflict
9 Oscars outfits once mocked now iconic,https://www.bbc.com/culture/article/20230309-nine-oscars-red-carpet-outfits-once-mocked-now-iconic
A better way to make concrete,https://www.bbc.com/future/article/20230309-how-carbon-negative-concrete-can-help-the-climate
The sacred stone stolen by the English,https://www.bbc.com/travel/article/20230305-the-disputed-history-of-the-coronation-stone
The young workers in a post-Me Too era,https://www.bbc.com/worklife/article/20230307-did-me-too-change-the-workplace-for-gen-z
Why do Chinese billionaires keep vanishing?,https://www.bbc.com/news/business-64781986
"US man, 81, survives week in snowbank on biscotti",https://www.bbc.com/news/world-us-canada-64911138
Britain's 'wonkiest pub' to be sold,https://www.bbc.com/news/uk-england-birmingham-64912966
Is there a better way to insulate our draughty homes?,https://www.bbc.com/news/business-64636384
UK microchip firms call for millions in investment,https://www.bbc.com/news/business-64872465
The Lineker tweet row - in 90 seconds,/news/uk-64922834
The Lineker tweet row - in 90 seconds,/news/uk-64922834
Video appears to show Hamburg suspect firing...,/news/world-europe-64910862
Watch: On the ground at Israel's mass...,/news/world-middle-east-64908051
Sliding cars and snowball fights amid Spring...,/news/uk-64917863
Tearful Marine describes Afghan withdrawal...,/news/world-us-canada-64899291
Watch: China's leader and his two teacup...,/news/world-asia-china-64897273
One-minute World News,/news/10462520
What you need to know on Eurovision UK entry...,/news/entertainment-arts-64902446
The ex-RAF base used in WWII that could house...,/news/uk-england-64889909
Rare 'snow tornado' spotted by Shetland...,/news/uk-scotland-64900417
Lineker decision comes at high price for BBC,/news/entertainment-arts-64922674
I was cut out of Covid origin debate - ex-CDC boss,/news/world-us-canada-64891745
Meta exploring plans for Twitter rival,/news/technology-64917397
Campaigners slam government river bathing decision,/news/science-environment-64919789
"Sleds, swimmers and street fighting: Photos of the week",/news/in-pictures-64891820
Asteroid could hit Earth on Valentine's 2046 - Nasa,/news/world-us-canada-64919125
MSF shuts hospital in Haiti over gang violence,/news/world-latin-america-64897375
'Hate crimes and extreme politics' in India,https://www.bbcselect.com/ca/watch/india-the-modi-question/?utm_source=.com+homepage&utm_medium=Video&utm_campaign=India%3A+The+Modi+Question
'We cut our website's carbon emissions by 520kg in a year',https://www.bbc.co.uk/news/business-64623955
Africa's top shots: Cool frames and gold nuggets,/news/world-africa-64902352
Robert Blake: From Hollywood to murder accused,/news/world-us-canada-64911059
Photographers capture March's 'worm moon',/news/uk-england-york-north-yorkshire-64887992
Turkish women defy protest ban to march in Istanbul,/news/world-europe-64897655
Sunrise swim celebrates International Women's Day,/news/uk-scotland-64889062
