title,url
US and China's top diplomats meet amid tensions,/news/live/world-asia-65920024
Young Burmese confront dashed dreams in exile,https://www.bbc.com/news/world-asia-65842149
What's drawing so many Indians to Australia?,https://www.bbc.com/news/world-asia-india-65889047
The homes built from cannabis,https://www.bbc.com/future/article/20230614-the-buildings-constructed-from-cannabis
Gen Z and Millennials' folk obsession,https://www.bbc.com/culture/article/20230616-gen-z-and-millennials-surprising-midsummer-obsession
On the front line as Ukraine attacks Russian trenches,/news/world-europe-65921377
Tracking data contradicts account of migrant shipwreck,/news/world-europe-65942426
Swiss voters back carbon cuts as glaciers melt,/news/world-europe-65946888
Transfer latest and build-up to international matches,/sport/live/football/65947704
Clark holds off McIlroy's challenge to win US Open,/sport/golf/65946664
Robinson 'does not care' about Khawaja celebration,/sport/cricket/65946176
Juneteenth: What is it and how important is the US holiday?,https://www.bbc.co.uk/newsround/53104555
Where to see Boston's Black culture,https://www.bbc.com/travel/article/20230616-the-six-best-places-to-see-bostons-african-american-culture-and-history
The last ship of the US slave trade,https://www.bbc.com/travel/article/20220207-the-last-known-ship-of-the-us-slave-trade
The film that Churchill tried to ban,https://www.bbc.com/culture/article/20230615-the-life-and-death-of-colonel-blimp-the-war-film-that-churchill-tried-to-ban
The Black farmer who inspired a US park,https://www.bbc.com/travel/article/20230618-sir-lancelot-jones-the-black-farmer-who-inspired-a-us-park
How MDMA changed a US white supremacist,https://www.bbc.com/future/article/20230614-how-a-dose-of-mdma-transformed-a-white-supremacist
How the job market leaves women at risk,https://www.bbc.com/worklife/article/20230615-why-its-getting-harder-for-some-women-to-report-harassment
"Iraq displays returned 2,800-year-old stone tablet",https://www.bbc.com/news/world-middle-east-65944282
Are we thinking about alien life all wrong?,https://www.bbc.co.uk/ideas/videos/are-we-thinking-about-alien-life-all-wrong/p0b6vpk4?playlist=made-in-partnership-with-the-open-university
Trauma of deepfake porn can be 'life-shattering',https://www.bbc.com/news/entertainment-arts-65854112
The latest tech news direct to your inbox,https://cloud.email.bbc.com/techdecoded-newsletter-signup
The workers already replaced by artificial intelligence,https://www.bbc.co.uk/news/business-65906521
Tracking data sheds new light on migrant shipwreck,/news/world-europe-65945527
Tracking data sheds new light on migrant...,/news/world-europe-65945527
Police spot boa constrictor in busy...,/news/uk-65945526
Souness swims Channel to raise £1m for...,/news/uk-65945528
Watch: Huge fire breaks out on Philippines...,/news/world-asia-65942742
Watch: What's in the new lockdown party video,/news/uk-politics-65942528
Watch: 'I have done nothing wrong' - Nicola...,/news/uk-politics-65942745
Watch: The King's birthday parade... in 57...,/news/uk-65937832
Watch: Thousands march on Warsaw streets for...,/news/world-europe-65941814
Royal children wave to Trooping the Colour...,/news/uk-65940386
Watch Biden confuse people with 'God save the...,/news/world-us-canada-65936994
"Floods, flowers and a festival: Photos of the week",/news/in-pictures-65926892
Why Spotify's big bet on Meghan fell flat,/news/business-65936228
Beauty of insects revealed in photo competition,/news/in-pictures-65876963
Hacker gang Clop publishes victim names on dark web,/news/business-65924327
Super-engineered vaccines created to help end polio,/news/health-65860202
The people constantly fleeing an angry volcano,/news/world-asia-65915686
Ryanair apologises for 'Tel Aviv in Palestine' row,/news/business-65927794
Kelly Hoppen: 'Music is design to me',https://www.bbc.com/news/business-65851081
Can Amsterdam make the circular economy work?,https://www.bbc.com/news/business-65696083
Dazzling ancient bronze sword found in Germany,/news/world-europe-65936594
Burna Boy bling and high flyers: Africa's top shots,/news/world-africa-65919659
Man trots globe blending scenes into film locations,/news/uk-england-essex-65786652
In pictures: Nottingham attack shakes city to core,/news/uk-65899897
Surreal skies grip New Yorkers - in pictures,/news/in-pictures-65843841
