title,url
Angry protests erupt over Greek rail disaster,/news/world-europe-64820085
India PM Modi urges G20 to overcome divisions,https://www.bbc.com/news/world-asia-india-64796718
Aboriginal spears taken in 1770 to return to Sydney,https://www.bbc.com/news/world-australia-64820618
The effect of TikTok's beauty filters,https://www.bbc.com/future/article/20230301-the-problems-with-tiktoks-controversial-beauty-filters
The surprising truth about Champagne,https://www.bbc.com/travel/article/20230301-the-little-known-history-of-champagne
Explosive found in check-in luggage at US airport,/news/world-us-canada-64819964
1894 shipwreck confirms tale of treacherous lifeboat,/news/world-us-canada-64819156
Havana Syndrome unlikely to have hostile cause - US,/news/world-us-canada-64814097
Reaction as record-breaking Grimsby shock Southampton & Arsenal win,/sport/live/football/64820932
'In title race to stay - Arsenal show mentality of champions',/sport/football/64819442
'No Kane regrets' as Spurs miss 'massive chance',/sport/football/64819131
The greatest monster film ever made,https://www.bbc.com/culture/article/20230301-king-kong-at-90-the-greatest-monster-film-ever-made
The return of the US' lost language,https://www.bbc.com/travel/article/20230228-kouri-vini-the-return-of-the-us-lost-language
The problem confronting women of colour,https://www.bbc.com/worklife/article/20230228-the-perfect-storm-keeping-women-of-colour-behind-at-work
The forests where trees go missing,https://www.bbc.com/future/article/20230301-the-complex-problem-of-firewood-theft
How 10% of Nigerian registered voters delivered victory,https://www.bbc.com/news/world-africa-64808775
Rare Jurassic-era bug found at Arkansas Walmart,https://www.bbc.com/news/world-us-canada-64814931
The devastated towns near Ukraine's front line,https://www.bbc.com/news/world-europe-64819471
'We're flying the flag for Scottish rum',https://www.bbc.com/news/business-64719180
The tiny diamond sphere that could unlock clean power,https://www.bbc.com/news/business-64553796
Tears of relief after man found in Amazon jungle,/news/world-latin-america-64817080
Tears of relief after man found in Amazon...,/news/world-latin-america-64817080
At the crash site of 'no hope' - BBC reporter...,/news/world-europe-64808262
Dog found alive after 23 days under rubble,/news/world-europe-64817526
Watch Kate beat William in spin class...,/news/uk-64803331
Record numbers of guide dog volunteers after...,/news/uk-64806166
One-minute World News,/news/10462520
WATCH: Key moments from PM's NI Brexit deal...,/news/uk-64791359
EU Chief on NI deal: 'We were honest with...,/news/uk-64791545
The 'smart suit' that is changing children's...,/news/uk-england-london-64791997
View from the cockpit of a Ukraine combat...,/news/world-europe-64779730
Covid origin likely China lab incident - FBI chief,/news/world-us-canada-64806903
Pictures show devastation after Greece train disaster,/news/world-europe-64808123
Twitch streamer Kai Cenat breaks subscriber record,/news/technology-64811710
Guilt-free flying not in easy reach - scientists,/news/science-environment-64788106
Sake brewers toast big rise in global sales,https://www.bbc.co.uk/news/business-64797853
What is carbon capture and can it fight climate change?,/news/science-environment-64723497
Eurovision tickets to go on sale next week,/news/entertainment-arts-64784428
The high-tech weed sprayers cutting herbicide use,https://www.bbc.com/news/business-64742513
Mariupol: Tragic deaths and daring escapes,https://www.bbcselect.com/watch/mariupol-the-peoples-story/?utm_source=BBC+Select&utm_medium=Social&utm_campaign=Mariupol+the+peoples+story
Spectacular northern lights seen across UK,/news/uk-64782372
SAG Awards: The red carpet in pictures,/news/entertainment-arts-64781316
Vigils and flags: Ukraine war anniversary in pictures,/news/in-pictures-64757068
The 24-year photography project,/news/in-pictures-64723755
Outlaw-themed parade triumphs at Rio carnival,/news/world-latin-america-64742729
