title,url
Last Soviet leader Mikhail Gorbachev dies at 91,/news/uk-62732447
"Gorbachev, who helped end Cold War, dies",/news/live/world-europe-62732807
'Heavy fighting' as Ukraine seeks to retake Kherson,/news/world-europe-62730439
"Premier League: Saints come from behind to beat Chelsea, Fulham edge past Brighton",/sport/live/football/62617970
The remote workers swapping homes,https://www.bbc.com/worklife/article/20220825-the-remote-workers-swapping-homes
"'No water to drink, fight fires or flush toilets'",/news/world-us-canada-62727586
In Canada fears of 'dangerous' politics mounting,/news/world-us-canada-62718193
Spy for Canada smuggled Shamima Begum to Syria,/news/uk-62726954
'Smith's defection is a sickening blow to PGA Tour',/sport/golf/62730763
Saints fight back for deserved win over Chelsea,/sport/football/62641729
Will US Open really be the end for Williams?,/sport/tennis/62720088
Why 'quiet quitting' is nothing new,https://www.bbc.com/worklife/article/20220825-why-quiet-quitting-is-nothing-new
Why plastic won't dry in a dishwasher,https://www.bbc.com/future/article/20220826-why-plastic-doesnt-dry-in-the-dishwasher
Eight best opera houses in the world,https://www.bbc.com/culture/article/20220825-eight-of-the-most-stunning-opera-houses-in-the-world
Is Quebec's French the 'real' French?,https://www.bbc.com/travel/article/20220829-the-royal-roots-of-quebecs-french
Medieval bodies in well victims of anti-Semitism,https://www.bbc.com/news/uk-england-norfolk-62731151
Inventing Anna friend sues Netflix for defamation,https://www.bbc.com/news/entertainment-arts-62727106
'I'm going make-up free in the Miss England final',https://www.bbc.com/news/uk-62713645
UK looks to Sweden for a solution to nuclear waste,https://www.bbc.com/news/business-62677534
Flexible firms take break from fixed bank holidays,https://www.bbc.com/news/business-62491321
Books and bomb shelters: Ukraine returns to school,/news/world-europe-62729196
Books and bomb shelters: Ukraine returns to...,/news/world-europe-62729196
A rare glimpse of the 'world's loneliest man',/news/world-latin-america-62723989
Tomato truck crash causes huge mess on US...,/news/world-us-canada-62729166
Boris Johnson refuses to rule out political...,/news/uk-politics-62725159
Helicopter lifts boy stranded in Pakistan...,/news/world-asia-62713213
Protesters storm Iraq's presidential palace,/news/world-middle-east-62716721
One-minute World News,/news/10462520
Man breaks Guinness World Record riding in a...,/news/world-us-canada-62716252
'I turned my front room into a full-time...,/news/business-62694027
Colombia holds huge concert to mark report...,/news/world-latin-america-62710432
McDermid reveals legal threat from Christie estate,/news/entertainment-arts-62727105
Watchdog acts over location-data abortion fears,/news/technology-62654155
Love Island won't face bullying and misogyny probe,/news/newsbeat-62724393
EU sends anti-radiation pills to Ukraine,/news/world-europe-62725485
US shares fall on threat of interest rate rises,/news/business-62712191
Instagram says precise location is never shared,/news/technology-62686375
"Be less squeamish over sewage water, says expert",/news/uk-62708413
How to stay cool the Japanese way,https://www.bbc.com/news/business-62659199
Lost at Sea: The disappearance of Keith Davis,https://www.bbcpodcasts.com/listen/lost-at-sea/?utm_source=BBC.com&utm_medium=Homepage&utm_campaign=Lost+at+Sea
"Knight, kite and butterflies: Photos of the week",/news/in-pictures-62686075
A photographic mission to show us the Moon,/news/science-environment-62662685
Sunken medieval village reappears at reservoir,/news/uk-england-york-north-yorkshire-62677584
"Africa's top shots: Revellers, robots and rioters",/news/world-africa-62672601
Photographer heads home to shine light on refugees,/news/uk-england-tyne-62505144
