title,url
Moscow buildings hit in rare drone attack after strikes in Kyiv,/news/live/world-europe-65751650
Elizbeth Holmes is going to jail. Will she pay victims too?,https://www.bbc.com/news/world-us-canada-65678967
"AI could lead to extinction, experts warn",https://www.bbc.com/news/uk-65746524
The rise of the 'no-wash' movement,https://www.bbc.com/culture/article/20230529-the-people-who-dont-wash-their-clothes
The first autism-friendly US city,https://www.bbc.com/travel/article/20230529-mesa-the-us-first-autism-friendly-city
Top Chinese scientist says don’t rule out Covid lab leak,/news/world-asia-65708746
"After a synagogue shooting, can a community heal?",/news/world-us-canada-65748629
Why did Sam Smith stop singing? Our quickfire quiz...,/news/world-us-canada-65744899
French Open: Medvedev levels match against Seyboth Wild - radio & text,/sport/live/tennis/62998403
Transfer latest and football news,/sport/live/football/65751613
How did winter World Cup shape Premier League season?,/sport/football/65708445
The big myth about patriarchy,https://www.bbc.com/future/article/20230525-how-did-patriarchy-actually-begin
The generation clocking the most hours,https://www.bbc.com/worklife/article/20230525-why-young-workers-are-putting-in-so-much-overtime
A staple recipe from Shanghai,https://www.bbc.com/travel/article/20230529-a-family-recipe-for-shanghai-wontons
The US' 113-mile 'floating' highway,https://www.bbc.com/travel/article/20230528-the-overseas-highway-the-us-floating-highway
12 TV series to watch this June,https://www.bbc.com/culture/article/20230526-12-of-the-best-tv-shows-to-watch-this-june
Booking.com guests turning up at family's home,https://www.bbc.com/news/uk-england-london-65726102
Gender-critical prof determined to do Oxford talk,https://www.bbc.com/news/education-65714821
The 'exploding' demand for giant heat pumps,https://www.bbc.com/news/business-65321487
The chip maker that became an AI superpower,https://www.bbc.com/news/business-65675027
Watch: Beachgoers run for cover as shooting breaks out,/news/world-us-canada-65753335
Watch: Beachgoers run for cover as shooting...,/news/world-us-canada-65753335
Watch: Video appears to show drone flying in...,/news/world-europe-65752254
Moscow drone attack: 'The windows of my home...,/news/world-europe-65752252
See how police freed a bear trapped inside a...,/news/world-us-canada-65751318
Watch rocket launch first Chinese civilian...,/news/world-asia-65750843
Watch: Cheese rollers run down near-vertical...,/news/uk-england-gloucestershire-65748725
Watch: Hosts defend This Morning after...,/news/entertainment-arts-65744701
Thousands line streets for Luton promotion...,/news/uk-england-beds-bucks-herts-65750061
Watch: Escaped bull charges into dancing...,/news/world-australia-65745451
One-minute World News,/news/10462520
Man attacked Cumberbatch's home with fish knife,/news/entertainment-arts-65752944
Singapore state fund cuts pay after failed FTX bet,/news/business-65743247
Precious cheetah cubs die in Indian national park,/news/world-asia-india-65692541
Alarm over cosmetic surgery-linked fungal outbreak,/news/health-65731544
Photographing history: The quarrymen of Wales,/news/uk-wales-65717619
Government defends oil boss to head climate talks,/news/science-environment-65708328
Glastonbury unveils full line-up and stage times,/news/entertainment-arts-65755115
Why car parks are the hottest space in solar power,https://www.bbc.com/news/business-65626371
Protein's power is being uncovered and unleashed,https://www.bbc.com/news/business-65468298
Photographer blends Africa with Welsh communities,/news/uk-wales-65709322
Warm smiles and purple skies: Africa's top shots,/news/world-africa-65707712
In pictures: King and Queen visit Northern Ireland,/news/uk-northern-ireland-65701853
"Dad completes 1,000 days of toy car photos",/news/uk-scotland-north-east-orkney-shetland-65714184
Tina Turner: A life in pictures,/news/entertainment-arts-65669988
