title,url
Ukraine seeks answers as more than 50 PoWs killed,/news/world-europe-62356211
Gazprom stops Latvia's gas in latest Russian cut to EU,/news/world-europe-62359890
Devastating Kentucky flood death toll rises to 19,/news/world-us-canada-62351166
An American dream's tragic end 800 miles from home,/news/world-latin-america-62338715
Hungarian Grand Prix final practice: heavy rain falling,/sport/live/formula1/58920017
Did the Pope's apology in Canada go far enough?,/news/world-us-canada-62353811
Smith says Rock not ready to talk after slap,/news/entertainment-arts-62348252
"I could step down - but not yet, says Pope",/news/world-us-canada-62360114
Red Bull and Porsche could work together - Horner,/sport/formula1/62355197
Leicester reject Newcastle's £40m bid for Maddison,/sport/football/62360543
Ronaldo says he will face Rayo Vallecano on Sunday,/sport/football/62354774
The film that demonised rural America,https://www.bbc.com/culture/article/20220727-how-rural-horror-deliverance-set-a-controversial-trend
Ghee: 'The purest food on earth',https://www.bbc.com/travel/article/20220726-the-purest-food-on-earth
The companies giving up on hybrid,https://www.bbc.com/worklife/article/20220722-the-companies-doubling-down-on-remote-work
The forest of dilapidated mansions,https://www.bbc.com/travel/article/20220725-yucatans-abandoned-henequen-haciendas
10 films to watch this August,https://www.bbc.com/culture/article/20220728-10-of-the-best-films-to-watch-this-august
How religion is saving species in India,https://www.bbc.com/future/article/20220726-how-religious-worship-is-boosting-conservation-in-india
A negative mindset that haunts so many,https://www.bbc.com/worklife/article/20220725-catastrophising-how-toxic-thinking-can-lead-down-dark-path
"Stop wearing ties to save energy, Spanish PM says",https://www.bbc.com/news/world-europe-62350019
The quest to find the perfect veggie burger,https://www.bbc.com/food/articles/quest_perfect_veggie_burger
Patients home within a day post-robotic surgery,https://www.bbc.com/news/uk-england-cambridgeshire-62345888
How graphene's superpowers could soon be unleashed,https://www.bbc.com/news/business-61913871
The PR and ad firms refusing fossil fuel clients,https://www.bbc.com/news/business-62303026
From wheelchair to walking on stage at graduation,/news/uk-northern-ireland-62339866
From wheelchair to walking on stage at...,/news/uk-northern-ireland-62339866
How a cartoon dog became a role model for...,/news/entertainment-arts-62335678
Wildfire spreads to hotel in Turkey,/news/world-europe-62354797
Will Smith acknowledges that Oscar slap was...,/news/entertainment-arts-62354796
Notre-Dame Cathedral on track to reopen in...,/news/world-europe-62341328
Ukrainians in constant stress since Feb -...,/news/world-europe-62335827
On set with the stars for the Neighbours...,/news/world-australia-62315068
First ever televised court sentencing takes...,/news/uk-62331434
Tears in the studio as Feltz announces radio...,/news/uk-62334099
Why Nadine Dorries called out Rishi Sunak's...,/news/uk-politics-62331432
40C heatwave has to be climate change - scientists,/news/science-environment-62335975
First monkeypox deaths reported outside Africa,/news/health-62350022
Mike Batt: Womble maestro turns to French dystopia,/news/entertainment-arts-62322352
Plastic bag usage down 20% since 10p charge,/news/science-environment-62350235
US economy shrinks again sparking recession fears,/news/business-62310355
First ever sales fall for Facebook owner Meta,/news/business-62322862
Million in Wuhan lockdown after four Covid cases,/news/world-asia-china-62322484
"'As CEO, my job is to get out of their way'",https://www.bbc.com/news/business-62310082
Why octopuses probably have feelings,https://www.bbc.com/future/article/20220720-do-octopuses-feel-pain
Body painting and sunflowers: Photos of the week,/news/in-pictures-62336344
Africa's top shots: Boat racing and record breakers,/news/world-africa-62332375
In pictures: Sheeran joins Snow Patrol at Latitude,/news/uk-england-suffolk-62290216
In pictures: First Scottish tree hugging contest,/news/uk-scotland-highlands-islands-62291116
In pictures: Wildfires rage from Tenerife to Greece,/news/world-europe-62285090
