title,url
Brazilian forces regain control after Congress stormed,/news/live/world-latin-america-64206148
Joy and long queues as China reopens borders,/news/world-asia-china-64201776
Sri Lanka's protesters have gone silent - for now,https://www.bbc.com/news/world-asia-64142694
US farmers win right to repair John Deere tractors,/news/business-64206913
The Greek island that banned wheels,https://www.bbc.com/travel/article/20230108-hydra-the-greek-island-that-banned-wheels
Lula vows to punish rioters who stormed key sites,/news/world-latin-america-64204860
WATCH: Brazil protesters smash top court's windows,/news/world-latin-america-64206298
Harry attacks lack of royal defence for Meghan,/news/uk-64205474
'Embarrassing & pathetic' - what next for Chelsea?,/sport/football/64205917
Stevenage stun Villa on 'magical' FA Cup weekend,/sport/football/64206007
Rodgers & Packers miss play-offs after Lions defeat,/sport/american-football/64207466
The rise of flashy new job titles,https://www.bbc.com/worklife/article/20230104-inventing-new-job-titles
The lost world of 'Britain's Area 51',https://www.bbc.com/future/article/20230106-the-eerie-emptiness-of-britains-area-51
The ancient Indian myths resonating now,https://www.bbc.com/culture/article/20230106-the-ancient-indian-myths-resonating-now
Japan's stunning locomotive anomaly,https://www.bbc.com/travel/article/20230104-japans-beloved-slow-motion-train
Will the metaverse be your new workplace?,https://www.bbc.com/news/business-64173594
The blind people who train their own guide dogs,https://www.bbc.com/news/disability-64175440
England to ban single-use cutlery and plates,https://www.bbc.com/news/business-64205460
The batteries made from wood,https://www.bbc.com/future/article/20221215-the-batteries-made-from-wood
Flying boats and other tech for cleaner shipping,https://www.bbc.com/news/business-63700540
Prince Harry claims Camilla was 'dangerous',/news/uk-64206300
Prince Harry claims Camilla was 'dangerous',/news/uk-64206300
A lot unexplained about Diana's death -...,/news/uk-64206292
Police fire tear gas at Bolsonaro supporters,/news/world-latin-america-64206295
Lula says 'true vandals' will be punished,/news/world-latin-america-64206553
Inside Brazil's stormed presidential palace,/news/world-latin-america-64206283
Video shows Brazil Supreme Court mass...,/news/world-latin-america-64206282
Watch as Congressman is restrained over...,/news/world-us-canada-64195940
Worshippers plunge into ice bath to mark new...,/news/world-asia-64204724
Gender-neutral Oscars inevitable - Sam Mendes,/news/entertainment-arts-64199673
Vehicle crashes and flips inside car wash,/news/world-us-canada-64193839
Historic UK rocket launch set to blast off,/news/science-environment-64190848
Are tech job cuts a warning for the wider economy?,/news/business-64189106
US bank Silvergate hit with $8bn crypto withdrawals,/news/technology-64176446
Celebrity deaths spark fears over China Covid toll,/news/world-asia-china-64173824
Year of culture kicks off despite Brexit blow,/news/entertainment-arts-64188547
Battle looms as Germany sacrifices village for coal,/news/world-europe-64187212
Gender-neutral Oscars inevitable - Sam Mendes,/news/entertainment-arts-64199673
How small businesses survive global market shocks,https://www.bbc.com/news/business-64151515
New York cleaners create new path to entrepreneurship,https://www.bbc.com/news/business-63221411
"Fishing, fireworks and funerals: Photos of the week",/news/in-pictures-64185167
In Pictures: Orthodox Christians mark Christmas,/news/world-64194408
In photos: Severe cold wave grips north India,/news/world-asia-india-64143204
"Africa's top shots: Minstrels, mourners and masques",/news/world-africa-64173286
Mourning for Mexican prison attack victims,/news/world-latin-america-64170753
