title,url
Orban casts doubt on Nato's Ukraine membership plan,/news/world-europe-65350589
The $5m 'Prove Mike Wrong' challenge that backfired,https://www.bbc.com/news/world-us-canada-65350125
Multiple Hillarys as Twitter blue ticks end,https://www.bbc.com/news/technology-65346263
Can 'direct action' on climate backfire?,https://www.bbc.com/future/article/20230421-earth-day-the-science-of-climate-change-protest
12 of the best books of the year so far,https://www.bbc.com/culture/article/20230420-12-of-the-best-books-of-the-year-so-far-2023
Russian warplane accidentally bombs own city,/news/world-europe-65344370
The homemade submarines smuggling cocaine to Europe,/news/world-europe-65337215
Gold stolen in C$20m heist at Toronto airport,/news/world-us-canada-65328968
England captain Williamson to miss World Cup,/sport/football/65349115
Kompany and Pochettino on Chelsea's shortlist,/sport/football/65345940
Tearful McColgan out of London Marathon with injury,/sport/athletics/65344437
Why you should never add ginger to sushi,https://www.bbc.com/travel/article/20230420-the-right-way-to-eat-sushi
The fading glamour of hustle culture,https://www.bbc.com/worklife/article/20230417-hustle-culture-is-this-the-end-of-rise-and-grind
How Earth Day was born,https://www.bbc.com/future/article/20200420-earth-day-2020-how-an-environmental-movement-was-born
'The most bizarre film of the year',https://www.bbc.com/culture/article/20230419-beau-is-afraid-is-the-most-bizarre-film-of-the-year
Europe's secret dyeing formula,https://www.bbc.com/travel/article/20230420-blaudruck-europes-secret-dyeing-formula
Picture of late Queen released to mark birthday,https://www.bbc.com/news/uk-65350728
'I got my fortune read - using asparagus',https://www.bbc.co.uk/food/articles/fortune_read_asparagus
The tech entrepreneur betting he can get younger,https://www.bbc.com/news/business-65238774
Every British royal from George III to Charles III,https://www.bbcselect.com/royal-succession?utm_source=BBC.com&utm_medium=Homepage&utm_campaign=Royal+Succession
Police stop car going wrong way in intentional crash,/news/world-us-canada-65353210
Police stop car going wrong way in...,/news/world-us-canada-65353210
BBC breaks down how SpaceX launch went - in...,/news/science-environment-65342246
Watch the moment Russian warplane bombs its...,/news/world-europe-65346486
Inside a homemade cocaine-smuggling submarine,/news/world-europe-65347312
Wild animal rescue: 'There's a bobcat in my...,/news/world-us-canada-65346484
Watch: William takes booking for unsuspecting...,/news/uk-england-birmingham-65337522
SpaceX Starship launches but ends in...,/news/world-65339852
Mourners leave notes on street for K-pop star...,/news/world-asia-65337853
Pet alligator removed from Philadelphia row...,/news/world-us-canada-65341398
Watch: Final farewell to Paul O'Grady,/news/entertainment-arts-65341260
Metallica land first number one album in 15 years,/news/entertainment-arts-65345911
US Supreme Court to decide on abortion pill access,/news/world-us-canada-65320035
Elon Musk promises second Starship launch in months,/news/science-environment-65334810
Buzzfeed News to close as media firm cuts jobs,/news/65341450
In pictures: Muslims around the world celebrate Eid,/news/in-pictures-65346964
Facebook $725m settlement fund opens to US claims,/news/technology-65338916
Seals sleep in the deep to avoid predators,/news/science-environment-65338500
Ukrainian vodka producers toast a rise in global sales,https://www.bbc.com/news/business-65308056
How LinkedIn is changing and why some are not happy,https://www.bbc.com/news/business-65123115
Garlands and gymnasts: Africa's top shots,/news/world-africa-65334211
Image of wounded pregnant woman wins World Press Photo,/news/in-pictures-65340265
Award-winning photo turns out to be AI creation,/news/entertainment-arts-65296763
In Pictures: Eryri in spring,/news/uk-wales-65277475
Rare photos of skyscraper completion rediscovered,/news/uk-england-london-65274803
