title,url
UN releases 'survival guide' to avert climate disaster,/news/science-environment-65000182
France's government faces two no-confidence votes,https://www.bbc.com/news/world-europe-65014336
Premier League title race: Who has the best run-in?,https://www.bbc.com/sport/football/65013772
4-day week: 'Too short-staffed to work',https://www.bbc.com/worklife/article/20230319-four-day-workweek-trial-the-firms-where-it-didnt-work
Why building a Moon base won't be easy,https://www.bbc.com/future/article/20230317-the-epic-quest-to-build-a-permanent-moon-base
"'Welcome, dear friend': Putin greets China's Xi at Kremlin",/news/live/world-europe-64993665
Rupert Murdoch set to marry for fifth time at 92,/news/65012754
What happens next if Trump is arrested on Tuesday?,/news/world-us-canada-65012096
"Rashford, Mount and Pope out of England squad",/sport/football/65006322
Six Nations try-feast - vote for your favourite,/sport/rugby-union/65004382
'They fear no-one' - Arsenal's 'beautiful' attitude,/sport/football/65008212
7 striking images by Africa's new wave,https://www.bbc.com/culture/article/20230317-seven-striking-images-by-africas-new-creative-wave
The ultimate solo adventure?,https://www.bbc.com/travel/article/20230319-a-one-of-a-kind-route-to-antarctica
Why layoffs hit workers of colour hard,https://www.bbc.com/worklife/article/20230308-why-layoffs-workers-of-colour-so-hard
How the climate is faring in 2023,https://www.bbc.com/future/article/20230317-the-state-of-the-climate-in-2023
A tiny tool Indian women use to fight sexual harassment,https://www.bbc.com/news/world-asia-india-64979731
The Weeknd settles Call Out My Name copyright case,https://www.bbc.com/news/entertainment-arts-65012702
Bruce Willis's wife reveals grief on his birthday,https://www.bbc.com/news/entertainment-arts-65012888
Are romance authors at risk from book-writing chatbots?,https://www.bbc.com/news/business-64975524
Putin's 'deep frustration and resentment against the West',https://www.bbcselect.com/watch/putin-vs-the-west/?utm_source=bbc.com&utm_medium=Homepage&utm_campaign=Putin+Vs+The+West
Watch: Putin tours Mariupol in occupied Ukraine,/news/world-65006169
Watch: Putin tours Mariupol in occupied...,/news/world-65006169
Mass protests grip Israel for 11th week,/news/world-middle-east-65004993
Imran Khan's chaotic court summons in 60...,/news/world-asia-64999864
Gary Lineker loses voice after 'nasty cold',/news/uk-65007791
Sharing of explicit images without consent...,/news/uk-65006170
'It's great to be here' - Lineker on BBC...,/news/uk-65002219
Watch: Can Putin actually be arrested?,/news/world-europe-64997048
Violence erupts in Paris as pension protests...,/news/world-europe-64997510
Millions of dead fish found in Australian...,/news/world-europe-64997455
Eight killed by deluge of potatoes after roof...,/news/world-asia-64987190
Def Leppard star thanks fans for support after attack,/news/entertainment-arts-65012750
The woman who brought sex to the High Street,/news/business-64994801
The New Zealand flood victims too scared to go home,/news/world-asia-64940342
"Puppeteers, superstars and dinosaurs: Africa's top shots",/news/world-africa-64976952
Drug giant becomes latest to cap US insulin prices,/news/world-us-canada-64991714
'A village's goodwill saved me from homelessness',/news/science-environment-64940840
Star footballer 'lucky to be alive' after cancer,/news/uk-northern-ireland-64966567
The revolution underway in India's diamond industry,https://www.bbc.com/news/business-64783843
Why sleeper trains are being revived across Europe,https://www.bbc.com/news/business-64950747
The 50 Paddy Irishmen banishing the stereotypes,/news/uk-northern-ireland-64913882
Brian May knighted by King at Buckingham Palace,/news/uk-64960536
The best fashion looks at the Oscars,/news/entertainment-arts-64935067
'I rarely saw people who looked like me',/news/uk-england-merseyside-64881091
Tributes paid to acclaimed documentary photographer,/news/uk-england-tyne-64918073
