title,url
Trump accused of asking employee to delete footage,/news/world-us-canada-66333370
Singapore executes first woman in almost 20 years,https://www.bbc.com/news/world-asia-66333776
Netflix touts $900k AI jobs amid Hollywood strikes,https://www.bbc.com/news/world-us-canada-66332876
Sinéad O'Connor's death not treated as suspicious,https://www.bbc.com/news/entertainment-arts-66325176
"Sydney's best beaches, beyond Bondi",https://www.bbc.com/travel/article/20230727-sydneys-best-beaches-by-bondi-lifeguard-bruce-hoppo-hopkins
Niger coup supporters set fire to ruling party HQ,/news/world-africa-66324875
Are arsonists behind Italy's devastating wildfires?,/news/world-europe-66332399
Kyiv claims success as southern fighting intensifies,/news/world-europe-66323354
Henderson's Saudi move has 'tarnished reputation',/sport/football/66324791
Superb Argentina comeback earns South Africa draw,/sport/football/66290748
Australia to make late call on Kerr's fitness,/sport/football/66333658
The Steel Roses of Chinese football are outkicking men,https://www.bbc.com/news/world-asia-china-66313636
Frustrated and misfiring - is USA dominance fading?,https://www.bbc.com/sport/football/66321567
Nigeria stun co-hosts Australia with comeback win,https://www.bbc.com/sport/football/66290741
Why we can't shake presenteeism,https://www.bbc.com/worklife/article/20230718-post-pandemic-presenteeism-overwork-culture
The US restaurant serving up sobriety,https://www.bbc.com/travel/article/20230726-eight-row-a-us-restaurant-that-celebrates-sobriety
The marine microbes heat-proofing vines,https://www.bbc.com/future/article/20230727-the-microbes-that-could-protect-grapevines-from-climate-change
Spectacular photos of supercell storms,https://www.bbc.com/travel/article/20230727-in-pictures-photos-from-a-us-storm-chaser
Ten films to watch in August,https://www.bbc.com/culture/article/20230727-from-blue-beetle-to-bottoms-10-of-the-best-films-to-watch-in-august
Girl missing for nearly four years turns up safe,https://www.bbc.com/news/world-us-canada-66325945
Colorado family die trying to live 'off the grid',https://www.bbc.com/news/world-us-canada-66321392
The best of Boston's hidden history,https://www.bbc.com/travel/article/20230725-the-best-of-bostons-hidden-history-with-author-and-guide-dina-vargo
Do you need a degree to work in tech?,https://www.bbc.com/news/business-66086450
The 'world's hottest month' explained... in 60 seconds,/news/world-66332670
The 'world's hottest month' explained... in...,/news/world-66332670
Ousted president's party HQ set ablaze in...,/news/world-africa-66332360
Rhodes fires: A walk along Glystra beach,/news/world-europe-66326435
Exonerated man describes first night of...,/news/uk-66322493
Sinéad O'Connor: In her own words,/news/entertainment-arts-66321024
Fire breaks out on ship with 3000 cars off...,/news/world-europe-66319222
Algeria fires destroy homes and belongings,/news/66318218
The moment an NYC crane catches fire and...,/news/world-us-canada-66316840
One-minute World News,/news/10462520
Spacey 'humbled' by outcome after being...,/news/uk-66317602
Kylie Minogue announces Las Vegas residency,/news/world-us-canada-66333482
You've got Mali: MoD accidentally emails Russian ally,/news/uk-politics-66333488
Sinéad O'Connor: Life in pictures,/news/in-pictures-66323955
Coutts Bank boss quits over Farage account row,/news/business-66328666
July set to be world's warmest month on record,/news/science-environment-66322608
Wall squats and planks best at lowering blood pressure,/news/health-66303982
Arctic Monkeys and Fred Again up for Mercury Prize,/news/entertainment-arts-66312276
How has Twitter changed since Musk's takeover?,https://www.bbcselect.com/watch/elon-musks-twitter-storm/?utm_source=BBC.Com&utm_medium=Homepage&utm_campaign=Elon
Tech Decoded: The latest news direct to your inbox,https://www.bbc.com/news/technology-65786969
"Water, fire and oceans: Africa’s top shots",/news/world-africa-66323739
In Pictures: Wildfires in Europe and North Africa,/news/in-pictures-66289156
See Africa unmasked through its own lens,/news/world-africa-66257772
In pictures: A dramatic 24 hours in politics,/news/in-pictures-66268013
Whistle-blowers and rainbows: Africa's top shots,/news/world-africa-66256175
