title,url
Cafe bomb in St Petersburg kills pro-war blogger,/news/world-europe-65155075
Trump 'gearing up for battle' at court hearing,https://www.bbc.com/news/world-us-canada-65142623
Sanna Marin defeated by Finland's conservatives,https://www.bbc.com/news/world-europe-65157357
Blue ticks disappear as Musk attacks NY Times,https://www.bbc.com/news/technology-65156216
How cell phones changed our lives,https://www.bbc.com/future/article/20230331-the-surprising-way-cellphones-changed-our-lives
Cleared off the streets into Taliban drug rehab,/news/world-asia-65138423
Anger and anxiety - inside pro-Trump online networks,/news/world-us-canada-65136641
Federal aid released to tornado-stricken Arkansas,/news/world-us-canada-65157245
Chelsea sack Potter after less than seven months,/sport/football/64205562
Newcastle beat Man Utd to climb up to third,/sport/football/65078743
"'A dramatic, bizarre GP - with echoes of Abu Dhabi'",/sport/formula1/65153096
Five countries that are safer for women,https://www.bbc.com/travel/article/20230402-five-countries-that-are-safer-for-women
Iconic artists who escaped the Nazis,https://www.bbc.com/culture/article/20230331-the-man-who-saved-2000-artists-and-writers-from-the-nazis
The mystery origins of Candida auris,https://www.bbc.com/future/article/20230331-the-mystery-origins-of-candida-auris
Why so many entrepreneurs have regrets,https://www.bbc.com/worklife/article/20230402-the-entrepreneurs-who-regret-starting-businesses
Why stars are choosing stadiums over arenas,https://www.bbc.com/news/entertainment-arts-65099480
Would you open up to a chatbot therapist?,https://www.bbc.com/news/business-65110680
The sinister attraction of Indian true crime shows,https://www.bbc.com/news/world-asia-india-65134376
Friend or foe: Can computer coders trust ChatGPT?,https://www.bbc.com/news/business-65086798
Spice sales boom as home cooks get more adventurous,https://www.bbc.com/news/business-65026330
Outside Tate brothers' villa on day one of house arrest,/news/world-europe-65150613
Outside Tate brothers' villa on day one of...,/news/world-europe-65150613
I am convinced Rwanda is safe - Home...,/news/uk-politics-65154365
Watch: Brutal damage of US tornadoes seen...,/news/world-us-canada-65152532
Man pours yoghurt over unveiled women in Iran...,/news/world-middle-east-65150611
Watch: Four times US tornadoes were caught on...,/news/world-us-canada-65147038
Video shows tornado moving across Little Rock,/news/world-us-canada-65145264
One-minute World News,/news/10462520
Watch: Andrew Tate and brother released from...,/news/world-europe-65144222
Watch: Weather presenter spots tornado live...,/news/world-us-canada-65145262
The Indian dancers fighting for their...,/news/world-asia-india-65134532
"Mescal, Comer and Totoro triumph at Olivier Awards",/news/entertainment-arts-65137911
Unlimited fines for water companies dumping sewage,/news/science-environment-65145953
UK-Asia trade deal to boost UK economy by 0.08%,/news/business-65124741
‘Blood test meant I was spared chemo’,/news/health-65042224
Utah first US state to limit teen social media use,/news/world-us-canada-65060733
"A film premiere, royals and a meatball: Photos of the week",/news/in-pictures-65136303
ChatGPT chatbot banned in Italy,/news/technology-65139406
"'It’s not how smart you are, it’s how are you smart'",https://www.bbc.com/news/business-65099236
Shamima Begum: The girl who joined IS,https://www.bbcselect.com/select-more/the-shamima-begum-story-the-girl-who-joined-isis/?utm_source=bbc.com&utm_medium=Homepage&utm_campaign=Shamima+Begum
In pictures: King Charles's state visit to Germany,/news/in-pictures-65123931
Royal murals and rare rhinos: Africa's top shots,/news/world-africa-65106486
Film fan creates hundreds of miniature movie sets,/news/uk-england-south-yorkshire-65112610
Southern Lights unusually vivid over New Zealand,/news/world-asia-65108333
Paul O'Grady: A life in pictures,/news/entertainment-arts-65107949
