title,url
Israel to allow more fuel into Gaza as UN says aid operation is 'impossible',/news/live/world-middle-east-67446662
Analysis: Ceasefire demands will grow without proof of Hamas HQ at Al-Shifa,https://www.bbc.com/news/world-middle-east-67453105
Track issues cause chaos in Las Vegas F1 practice,https://www.bbc.com/sport/formula1/67447322
How clocks have shaped civilisation,https://www.bbc.com/future/article/20231117-how-clocks-and-watches-have-shaped-civilisation
Berlin's stunning indoor public pools,https://www.bbc.com/travel/article/20231116-the-hidden-beauty-of-berlins-indoor-pools
Singer Cassie accuses Diddy of rape and abuse,/news/world-us-canada-67446570
China hails Xi-Biden meeting despite 'dictator' remark,/news/world-asia-china-67447121
Snoop Dogg: I’ve decided to give up smoke,https://www.bbc.co.uk/news/articles/c3g21x5yp81o
Everton receive immediate 10-point deduction,/sport/football/67448714
"Everton given 10-point deduction, plus Euro 2024 build-up",/sport/live/football/67447647
Alexander-Arnold wants 'big part' at Euro 2024,/sport/football/67376199
The eight best photo-ops in NYC,https://www.bbc.com/travel/article/20231115-discover-the-eight-best-photo-ops-in-new-york-city
Why you see Black Friday sales in July,https://www.bbc.com/worklife/article/20231116-why-you-see-black-friday-sales-in-july
How I reduced my pets' carbon paw print,https://www.bbc.com/future/article/20231115-how-i-made-my-pets-more-environmentally-friendly
10 of the most absurd trends of 2023,https://www.bbc.com/culture/article/20231115-alien-chic-to-clown-shoes-10-of-most-bizarre-style-trends-of-2023
Is Mean Girls too noughties to function in 2024?,https://www.bbc.com/news/entertainment-arts-67434696
Ukrainian men flee the draft in their thousands,https://www.bbc.com/news/world-europe-67120904
The Indian artist who painted for British rulers,https://www.bbc.com/news/world-asia-india-67412025
Shop owners hope that tech can deter thieves,https://www.bbc.co.uk/news/business-67306737
"TikTok has changed the world, but is it changing us?",https://www.bbcselect.com/watch/tiktok-effect/?utm_source=BBC.com&utm_medium=Homepage&utm_campaign=tiktok
Meghan hits red carpet at Power of Women in Hollywood,/news/entertainment-arts-67451948
Meghan hits red carpet at Power of Women in...,/news/entertainment-arts-67451948
Moldovan leader's dog bites Austrian...,/news/world-europe-67453626
Iceland helicopter video shows giant cracks...,/news/world-europe-67445280
When Apec 'family photos' used to be fun,/news/world-us-canada-67446831
Sister of Sasha Skochilenko fears for jailed...,/news/world-europe-67438148
The school dropout with more than 1 billion...,/news/uk-england-london-67410664
How has Biden and Xi's relationship changed?,/news/world-us-canada-67432662
Ros Atkins on... Do the rules of war protect...,/news/world-middle-east-67431820
One-minute World News,/news/10462520
Margot Robbie unable to speak at premiere,/news/entertainment-arts-67430193
Vernon Kay completes Children in Need marathon,/news/entertainment-arts-67442924
Amazon to offer cars for purchase on US site,/news/business-67445642
The last chance to save a mighty river,https://www.bbc.co.uk/news/extra/3s2qsuikpf/mekong-the-last-chance-to-save-a-mighty-river
Gaza hospital boss says no water or oxygen left,/news/world-middle-east-67442045
Africa's top shots: Pirates and paper doves,/news/world-africa-67440655
How to avoid a massive roaming charge phone bill,/news/technology-67449465
Author and critic AS Byatt dies aged 87,/news/entertainment-arts-67448696
"'I don't enter leadership awards, it's not about me'",https://www.bbc.co.uk/news/av/business-67420863
Could triple glazing become a UK standard?,https://www.bbc.com/news/business-67161076
"Royals, rallies and regattas: Africa's top shots",/news/world-africa-67342719
King Charles III delivers speech at State Opening of Parliament,/news/uk-politics-67344490
Damage and disruption: Storm Ciarán in pictures,/news/in-pictures-67298061
Elton John photography collection to go on display,/news/uk-england-london-67205468
Skulls and flowers: Mexico's 'skeleton' parade,/news/in-pictures-67193453
