title,url
Five officers charged over Tyre Nichols' death,/news/world-us-canada-64420124
Fear of flare-up after deadly Israeli raid in Jenin,/news/64417822
Djokovic's father filmed with Putin supporters,/sport/tennis/64409618
Criticism made me consider walking away - Southgate,/sport/football/64397469
The most beloved French writer ever,https://www.bbc.com/culture/article/20230125-colette-the-most-beloved-french-writer-of-all-time
Cameras show tornado ripping through Texas town,/news/world-us-canada-64420943
Tennessee students build a new hand for classmate,/news/world-us-canada-64418260
Canadian woman pleads guilty to sending Trump ricin,/news/world-us-canada-64419167
Vinicius Jr effigy prompts condemnation in Spain,/sport/football/64414425
Honouring the real-life 'Rocky' who floored Ali,/sport/64392108
Ex-Detriot Lions linebacker Lemonier dies aged 25,/sport/american-football/64420844
Who gets a four-day workweek?,https://www.bbc.com/worklife/article/20230125-how-widespread-could-the-four-day-workweek-really-be
The new word for 'dirty sunset',https://www.bbc.com/future/article/20230125-why-we-need-new-words-for-life-in-the-anthropocene
Another mystery hit from Mr Knives Out,https://www.bbc.com/culture/article/20230124-poker-face-review-a-deft-columbo-update-for-knives-out-fans
Canada's animal saved from extinction,https://www.bbc.com/travel/article/20230126-the-return-of-the-spirit-horse-to-canada
Dad's warning after girl dies from deodorant fumes,https://www.bbc.com/news/uk-england-derbyshire-62078939
Rick and Morty star Roiland dropped by more shows,https://www.bbc.com/news/entertainment-arts-64396728
Rare tree kangaroo emerges from mum's pouch,https://www.bbc.com/news/uk-england-merseyside-64410270
Subscription-based bike hire schemes on a roll,https://www.bbc.com/news/business-64371657
The 'geeks' obsessing over their new heating systems,https://www.bbc.co.uk/news/business-64261457
Tennessee official 'sickened' by bodycam footage,/news/world-us-canada-64418613
Tennessee official 'sickened' by bodycam...,/news/world-us-canada-64418613
Watch: Vehicle smashes into Colorado police...,/news/world-us-canada-64420010
Gaza's only all-girl boxing club finds a home,/news/world-middle-east-64420114
Lucky escape after bus plunges into Turkey...,/news/world-europe-64414073
BBC News presenter gets emotional in last...,/news/entertainment-arts-64418230
Drone footage shows extent of damage after...,/news/world-middle-east-64412719
One-minute World News,/news/10462520
Ros Atkins on… Germany’s Ukraine tank...,/news/world-64408085
Students detained over BBC Modi documentary,/news/world-asia-india-64407921
Texas hit by tornado as storms sweep the US,/news/world-us-canada-64407212
Government green heating scheme off to slow start,/news/science-environment-64414493
Trump to be allowed back on Facebook and Instagram,/news/business-64408306
Will a Picasso sold to flee the Nazis be returned?,/news/world-us-canada-64418638
Dentists warn of damage from braces ordered online,/news/uk-58038752
'Fen skating is a great metaphor for life',/news/uk-england-cambridgeshire-64399819
US hacks back against Hive ransomware crew,/news/technology-64418723
Japan on the brink due to falling birth rate - PM,/news/world-asia-64373950
Turning problem sea algae into a replacement for plastic,https://www.bbc.com/news/business-64317261
Composer of Wicked shares universal truth,https://link.chtbl.com/BBC_Wicked_HP
Dante's Inferno and faux taxidermy grace Paris catwalks,/news/in-pictures-64384978
The people left behind by coal mining's demise,/news/uk-wales-64330180
Africa's top shots: Celebrating 2973 and baptising Jesus,/news/world-africa-64325591
Aurora hunter treated by coastal lights display,https://www.bbc.co.uk/news/articles/ckdjzlq0eppo
The AI artist reimagining a stylish old age,/news/world-africa-64260739
