title,url
Secretive Saudi executions leave families in the dark,/news/world-middle-east-64338876
George Santos to step down from House committees,https://www.bbc.com/news/world-us-canada-64473260
Canada experiments with decriminalising hard drugs,https://www.bbc.com/news/world-us-canada-64461983
The images that reveal male fears,https://www.bbc.com/culture/article/20230130-femme-fatale-the-images-that-reveal-male-fears
How Covid might change your singing voice,https://www.bbc.com/future/article/20230130-should-you-sing-when-suffering-from-a-cold
West sends Ukraine mixed messages on war planes,/news/world-europe-64461613
Chicago prosecutor will drop charges against Kelly,/news/world-us-canada-64471490
Pamela Anderson memoir bares soul on fame and heartbreak,/news/entertainment-arts-64418262
Transfer news: Sabitzer flying to Manchester & Chelsea want Fernandez,/sport/live/football/64454518
Man Utd in talks over loan deal for Bayern's Sabitzer,/sport/football/64471734
Cancelo's Bayern loan is Guardiola 'flexing muscles',/sport/football/64463460
Norway's 496km engineering miracle,https://www.bbc.com/travel/article/20230130-the-highest-rail-route-in-northern-europe
11 TV shows to watch this February,https://www.bbc.com/culture/article/20230127-11-of-the-best-tv-shows-to-watch-this-february
How worker surveillance is backfiring,https://www.bbc.com/worklife/article/20230127-how-worker-surveillance-is-backfiring-on-employers
Why women with UTIs are frustrated,https://www.bbc.com/future/article/20230126-why-arent-there-better-treatments-for-cystitis
"What's tiny, radioactive and missing? Take our quick quiz",https://www.bbc.com/news/world-us-canada-64448492
US restores protections to largest national forest,https://www.bbc.com/news/world-us-canada-64428423
How a tote bag sparked a class debate in Singapore,https://www.bbc.com/news/world-asia-64342107
How to add 'sizzle' to meat-free products,https://www.bbc.com/news/business-64337616
The new tech offering relief from period pain,https://www.bbc.com/news/business-64397795
Protests against France pension age rise continue,/news/world-europe-64473280
Protests against France pension age rise...,/news/world-europe-64473280
LGBT people hunted by gangs and police in...,/news/world-africa-64460843
Mass funeral for Pakistan mosque blast...,/news/world-asia-64462327
Peculiar 'whirlpool' appears in sky above...,/news/world-us-canada-64458511
Another whale mysteriously washes ashore in...,/news/world-us-canada-64461666
Watch: Eurovision 2023 explained in under a...,/news/entertainment-arts-64430546
One-minute World News,/news/10462520
Chaotic scenes inside mosque after deadly...,/news/64454361
Rubik's cube fans go head-to-head at...,/news/uk-scotland-64442060
Police kick and punch Tyre Nichols during...,/news/world-us-canada-64435339
Everyone to live near green space or water - plan,/news/science-environment-64456455
"Welcome, bonsoir, pryvit! Liverpool gears up for Eurovision draw",/news/live/entertainment-arts-64415380
Children as young as nine exposed to pornography,/news/technology-64451984
China's Covid wave 'coming to an end' - officials,/news/world-asia-china-64449226
US to make it easier for gay men to donate blood,/news/world-us-canada-64433434
"More than 2,000 jobs to go at Tesco as it closes delis",/news/business-64463060
The defiant low-lying island 70 years after floods,/news/uk-england-essex-64255567
Joseph Gordon-Levitt: Take responsibility for your creativity,https://link.chtbl.com/JGL_BBCHomepage
Are ski trips coming to an end?,https://www.bbc.com/future/article/20230124-how-climate-change-threatens-to-close-ski-resorts
Songs of a drowning world in Nigeria,/news/world-africa-64416131
Survivors and leaders mark Holocaust Memorial Day,/news/in-pictures-64425194
Africa's top shots: Welcome parties and malted brews,/news/world-africa-64410690
'Fen skating is a great metaphor for life',/news/uk-england-cambridgeshire-64399819
Dante's Inferno and faux taxidermy grace Paris catwalks,/news/in-pictures-64384978
