title,url
Russia controls most of pounded salt mine town – UK,/news/world-europe-64219979
Five-year-old boy swept away in California storms,/news/world-us-canada-64213900
Classified files found at Biden's former office,/news/world-us-canada-64218179
A 'remarkable' zombie apocalypse drama,https://www.bbc.com/culture/article/20230109-the-last-of-us-review-the-best-video-game-adaptation-ever
What parents get wrong about milestones,https://www.bbc.com/future/article/20230109-what-parents-get-wrong-about-childhood-milestones
"Brazil's Bolsonaro admitted to hospital, wife says",/news/world-us-canada-64216519
Six-year-old who shot his teacher used mother's gun,/news/world-us-canada-64210387
What did Prince Harry break? Our timed quiz...,/news/world-us-canada-64206516
Transfer news & is Bale the greatest British player ever?,/sport/live/football/64219749
'Bale departs - the day Wales dreaded',/sport/football/64215777
Andretti bid row reflects troubled times in F1,/sport/formula1/64210632
WW2 secret 'as important as Bletchley',https://www.bbc.com/future/article/20230106-the-eerie-emptiness-of-britains-area-51
The ancient road that bridged kingdoms,https://www.bbc.com/travel/article/20230109-the-kings-highway-the-road-that-reveals-jordans-history
The parents who are 'one and done',https://www.bbc.com/worklife/article/20230110-only-child-or-siblings-one-and-done
An 'unapologetically Indian' universe,https://www.bbc.com/culture/article/20230106-the-ancient-indian-myths-resonating-now
UK space launch experiences failure in flight,https://www.bbc.co.uk/news/science-environment-64218883
Logan Paul apologises for crypto project failure,https://www.bbc.com/news/technology-64210289
Will Hollywood stars return to the Golden Globes?,https://www.bbc.co.uk/news/entertainment-arts-64155839
Could floating solar farms survive out at sea?,https://www.bbc.co.uk/news/business-63728020
Will the metaverse be your new workplace?,https://www.bbc.com/news/business-64173594
Business Secretary defends anti-strikes bill,/news/uk-politics-64220758
Business Secretary defends anti-strikes bill,/news/uk-politics-64220758
Thousands turn out for Brazil pro-democracy...,/news/world-latin-america-64220757
Ros Atkins on... Why the Brazil riots...,/news/world-latin-america-64214755
Uprooted trees and flooded street in...,/news/world-us-canada-64217419
How the chaos in Brasília unfolded,/news/world-latin-america-64209957
Prince Harry claims Camilla was 'dangerous',/news/uk-64206300
One-minute World News,/news/10462520
A lot unexplained about Diana's death -...,/news/uk-64206292
Police fire tear gas at Bolsonaro supporters,/news/world-latin-america-64206295
Lula says 'true vandals' will be punished,/news/world-latin-america-64206553
"Ozone layer may be restored in decades, UN says",/news/science-environment-64215660
Air India embarrassed by urination scandal,/news/world-asia-india-64207235
US bank Silvergate hit with $8bn crypto withdrawals,/news/technology-64176446
Nearly everyone in China province got Covid - official,/news/world-asia-china-64208127
Liverpool to get 'Eurovision keys' in handover show,/news/entertainment-arts-64220499
Battle looms as Germany sacrifices village for coal,/news/world-europe-64187212
Digital sales account for 90% of games in UK - ERA,/news/technology-64187547
The batteries made from wood,https://www.bbc.com/future/article/20221215-the-batteries-made-from-wood
Flying boats and other tech for cleaner shipping,https://www.bbc.com/news/business-63700540
Repairing broken gadgets for a better future,/news/in-pictures-63737951
Mastectomy photo project aims to empower women,/news/uk-england-manchester-64055153
In Pictures: Orthodox Christians mark Christmas,/news/world-64194408
In photos: Severe cold wave grips north India,/news/world-asia-india-64143204
"Africa's top shots: Minstrels, mourners and masques",/news/world-africa-64173286
