title,url
Bodies and burned buildings: Inside liberated Lyman,/news/world-europe-63130571
Lyman retreat sees rare criticism of Russian leaders,/news/world-europe-63127911
Paris joins boycott of World Cup fan zones,https://www.bbc.com/news/world-europe-63132995
Iran schoolgirls remove hijabs in protests,https://www.bbc.com/news/world-middle-east-63128184
How non-linear workdays are changing work,https://www.bbc.com/worklife/article/20220928-the-non-linear-workdays-changing-the-shape-of-productivity
Hurricane Ian death toll climbs to 99 in Florida,/news/world-us-canada-63120717
Eight explosive revelations from new Trump book,/news/world-us-canada-63125238
Queen of Country music Loretta Lynn dies aged 90,/news/entertainment-arts-63134852
I think there could be a space for me - Maddison,/sport/football/63126188
Bairstow wins Cricket Writers' Club award,/sport/cricket/63134676
BBC Women's Footballer of 2022 - the contenders,/sport/football/63009563
The time-mystery left by the Big Bang,https://www.bbc.com/future/article/20221003-why-does-time-go-forwards-not-backwards
The kids being raised without gender,https://www.bbc.com/worklife/article/20220929-the-parents-raising-their-children-without-gender
The hidden meanings in wearing black,https://www.bbc.com/culture/article/20221003-the-hidden-meanings-behind-fashions-most-dramatic-colour
The world's highest cash machine,https://www.bbc.com/travel/article/20221003-the-worlds-highest-atm-pakistans-mountaintop-bank-machine
The Indian period drama firing up the box office,https://www.bbc.com/news/world-asia-india-63085348
Jackpot? Questions raised as hundreds win lotto,https://www.bbc.co.uk/news/business-63126558
Helping others with one-handed life hacks,https://www.bbc.com/news/newsbeat-63122254
The DIY gadgets that could keep your energy bill down,https://www.bbc.com/news/business-62900202
Can electrical stimulation improve your gym workout?,https://www.bbc.com/news/business-62887379
Truss still wants to see top tax rate cut,/news/uk-politics-63131885
Truss still wants to see top tax rate cut,/news/uk-politics-63131885
Ros Atkins on... Iran protests,/news/world-middle-east-63125721
Candlelight vigil for Indonesia stadium...,/news/world-asia-63126014
PM declines to say she trusts her chancellor,/news/uk-politics-63128448
Coyote strays into California school toilets,/news/world-us-canada-63128933
The Green Energy Scandal Exposed,/news/science-environment-63123774
'I was representing all indigenous voices out...,/news/entertainment-arts-63125361
Why I covered my entire house with doodles,/news/entertainment-arts-63118482
One-minute World News,/news/10462520
Scores killed at Indonesia football match,/news/world-asia-63107182
Nobel rewards 'spooky science' of entanglement,/news/science-environment-63121287
Coldplay postpone gigs over frontman lung infection,/news/entertainment-arts-63136129
Inflation in Turkey surges to 83%,/news/world-europe-63120478
Randy Orton's tattoo artist wins WWE2K lawsuit,/news/newsbeat-63131467
Nobel Prize goes to Neanderthal DNA research,/news/health-63116304
New Manchester arts venue goes £100m over budget,/news/entertainment-arts-63131003
"Don’t backtrack on climate, Egypt tells Truss",/news/science-environment-63131958
Finland wants to transform how we make clothes,https://www.bbc.com/news/business-62806565
Why Trump's political comeback is not guaranteed,https://www.bbcselect.com/watch/trump-the-comeback/?utm_source=BBC.com&utm_medium=Homepage&utm_campaign=Trump+The+Comeback
In pictures: Floridians take in Hurricane Ian’s impact,/news/world-us-canada-63080969
Guernsey sunrise wins Pic of the Season,https://www.bbc.co.uk/weather/features/63078910
"Africa's top shots: Prayer, pride and pacing",/news/world-africa-63072006
Filming climate change in action for Frozen Planet,/news/uk-scotland-north-east-orkney-shetland-62925833
In pictures: The Queen's funeral,/news/in-pictures-62918196
