title,url
Heavy police presence after days of China protests,/news/world-asia-china-63785351
World Cup: Build-up to Portugal v Uruguay - radio & text,/sport/live/football/61047604
China's fury and fear of Covid puts Xi in a bind,/news/world-asia-china-63779250
The misery of middle managers,https://www.bbc.com/worklife/article/20221123-how-flexibility-made-managers-miserable
The first Asian settlement in the US,https://www.bbc.com/travel/article/20221127-saint-malo-the-first-asian-settlement-in-the-us
BBC journalist detained during China protests,/news/world-asia-china-63779176
Buffalo gunman pleads guilty to racist massacre,/news/world-us-canada-63786445
World's largest active volcano erupts in Hawaii,/news/world-us-canada-63783633
Casemiro hits winner as Brazil seal last-16 spot,/sport/football/63698283
'Wild' - World Cup comes to life on manic Monday,/sport/football/63783753
Woods influence apparent as we enter 'Tiger season',/sport/golf/63784084
Iran complain to Fifa over flag change post by US,https://www.bbc.com/sport/football/63776093
The 'invisible man' who is key to Brazil's hopes,https://www.bbc.com/sport/football/63770741
Sign up to Klinsmann's daily World Cup newsletter,https://www.bbc.com/sport/football/63750398
Has film reckoned with abusive men?,https://www.bbc.com/culture/article/20221123-weinstein-drama-she-said-and-the-films-taking-on-abusive-men
The weird and wonderful art of AI,https://www.bbc.com/future/article/20221123-the-weird-and-wonderful-art-created-when-ai-and-humans-unite
Why toxic in-laws are no stereotype,https://www.bbc.com/worklife/article/20221111-the-tensions-that-fan-tricky-in-law-relationships
The hidden tombs under Spain's beaches,https://www.bbc.com/travel/article/20221124-duna-de-bolonia-the-spanish-sand-dune-hiding-roman-ruins
A quick guide to China's white paper protests,https://www.bbc.com/news/world-asia-china-63781716
Bob Dylan apologises for printed 'signatures',https://www.bbc.com/news/entertainment-arts-63779904
Fortune givers: On hunt for a British Jeff Bezos,https://www.bbc.com/news/world-us-canada-63715064
The extraordinary phenomenon of frisson,https://www.bbc.com/culture/article/20221124-why-music-can-give-you-chills-or-goosebumps
"'I wouldn't leave South Africa, I have a kid here'",https://www.bbc.com/news/business-63646696
BBC journalist arrested covering China protests,/news/world-asia-china-63781250
BBC journalist arrested covering China...,/news/world-asia-china-63781250
Chinese police: Delete photos or face arrest...,/news/world-asia-china-63779736
Man rescued seconds before incoming train,/news/world-us-canada-63776227
Zero-Covid anger grows after deadly China...,/news/world-asia-china-63770974
At the scene of deadly Ischia mudslide,/news/world-europe-63773704
Mudslide sweeps across Italian island of...,/news/world-europe-63770262
Iran football manager confronts BBC...,/news/world-middle-east-63750753
Naked volunteers pose for Bondi Beach artwork,/news/world-australia-63767282
One-minute World News,/news/10462520
Sunday with Laura Kuenssberg...in under a...,/news/uk-politics-63776009
Monkeypox given new name by global health experts,/news/health-63782514
Meta fined €265m by Irish data watchdog,/news/technology-63784393
Jill Scott wins I'm a Celebrity with Hancock third,/news/entertainment-arts-63634455
BT and unions agree pay rise of up to 16%,/news/business-63785421
Why Trump isn't returning to Twitter (for now),/news/technology-63725948
Wasted UK methane gas 'a scandal',/news/science-environment-63744757
Ebola shuts schools early for Christmas in Uganda,/news/world-africa-63743956
What Springsteen reveals about memory,https://www.bbc.com/future/article/20221121-the-benefits-of-being-forgetful
Fuel your creativity with the Spark & Fire podcast,https://www.bbcpodcasts.com/spark-and-fire/?utm_source=BBC.Com&utm_medium=Homepage&utm_campaign=Spark+and+Fire
The photographer who preserved rural Indian life,/news/world-asia-india-63705190
'Photography helps me manage my PTSD',/news/uk-england-essex-63699954
Africa's top shots: Fan fashion and fighting fires,/news/world-africa-63741555
In pictures: King Charles hosts first state visit,/news/in-pictures-63714611
Historic images show 'how we used to live' in city,/news/uk-england-tyne-63674925
