title,url
Nashville school shooter hid guns in parents' home,/news/world-us-canada-65106976
UK civil service ban is politicising TikTok - China,https://www.bbc.com/news/uk-northern-ireland-65105923
Young Brits told to 'stay away' from Amsterdam,https://www.bbc.com/news/world-europe-65107405
Boss of failed crypto firm accused of China bribe,https://www.bbc.com/news/business-65104103
The long shadow of Covid-19 myths,https://www.bbc.com/future/article/20230328-the-long-shadow-of-covid-19-myths
Bodycam footage shows police response,/news/world-us-canada-65104632
"The trial with A-listers, a Fugee and a fugitive",/news/world-us-canada-65092101
"Paltrow 'shaken up' after ski crash, says daughter",/news/world-us-canada-65107933
Terrific Scotland stun Spain in seismic victory,/sport/football/65022207
Fury can 'redeem himself' by fighting me - Joshua,/sport/boxing/65099066
'Classy & clinical Scots give coming of age show',/sport/football/65107499
How Gen Z is seeing gender in new ways,https://www.bbc.com/worklife/article/20230327-how-young-people-are-shaking-off-gender-binaries
'It's sure to be popular',https://www.bbc.com/culture/article/20230328-dungeons-dragons-honour-among-thieves-warm-and-upbeat
The islanders who weave their dreams,https://www.bbc.com/travel/article/20230328-the-filipino-islanders-who-weave-their-dreams
Why male fertility is in decline,https://www.bbc.com/future/article/20230327-how-pollution-is-causing-a-male-fertility-crisis
Billionaire's son admits role in student's death,https://www.bbc.com/news/uk-65033048
'God created me and he knows why I am gay',https://www.bbc.com/news/world-africa-65087562
Captured baboon's death sparks outcry in Taiwan,https://www.bbc.com/news/world-asia-65096467
The tech helping driverless cars see round corners,https://www.bbc.com/news/business-65036895
The web firm that wants to stop you getting 'cancelled',https://www.bbc.com/news/business-65050160
"Who is Scotland's new first minister, Humza Yousaf?",/news/uk-scotland-65106632
"Who is Scotland's new first minister, Humza...",/news/uk-scotland-65106632
Car smashes into Cambridgeshire living room,/news/uk-65106417
Police release CCTV of US school shooter,/news/65100000
Man uses bare hands to rescue trapped gold...,/news/world-africa-65095295
Watch: Bike ride through UK's new super sewer,/news/science-environment-65091803
Orlando Bloom surprises children in Kyiv,/news/world-europe-65085212
Fire and fury as Israelis take to the streets,/news/world-middle-east-65083930
'My uncle's trailer was flattened - he was...,/news/world-us-canada-65083928
Prince Harry bumps into photographer outside...,/news/uk-65085209
Drama in the courtroom as Gwyneth Paltrow...,/news/world-us-canada-65072030
AI could affect 300 million jobs - report,/news/technology-65102150
Utah first US state to limit teen social media use,/news/world-us-canada-65060733
Push for climate decision at world’s top court,/news/science-environment-65097831
TV star Paul O'Grady dies aged 67,/news/entertainment-arts-65108130
Northern lights dazzle in parts of UK overnight,/weather/features/65061790
Swiss court case ties human rights to climate change,/news/world-europe-65107800
Trio named most premature surviving triplets,/news/uk-england-bristol-65090874
Crewless container ships appear on the horizon,/news/business-64875319
US firms 'more negative' about doing business in China,https://www.bbc.com/news/business-65034881
A lover's embrace and purple royals: Africa's top shots,/news/world-africa-65049764
Cherry blossoms draw spectators and photographers,/news/uk-england-birmingham-65043539
Photos saved from tip to be added to city archive,/news/uk-england-coventry-warwickshire-64980965
Living with water pollution in Guatemala,/news/world-latin-america-65047381
California battles deadly storm and flooding,/news/world-us-canada-64959807
