title,url
Millions advised to mask up due to wildfire smoke,/news/world-us-canada-65828469
Possible charges loom for Trump over documents,/news/world-us-canada-65839912
Catching the men who sell subway groping videos,https://www.bbc.com/news/world-asia-65811838
Why Ukraine dam sabotage is so catastrophic,https://www.bbc.com/future/article/20230607-ukraine-why-the-dam-breach-is-so-significant
Why Wales became the 'land of song',https://www.bbc.com/culture/article/20230607-bryn-terfel-why-wales-became-the-land-of-song
Hundreds of NYC flights delayed over smoky skies,/news/world-us-canada-65839336
Pence tears into Trump at 2024 campaign launch,/news/world-us-canada-65839793
Why this teen says he was rejected by top US colleges,/news/world-us-canada-65792148
West Ham win dramatic Europa Conference League final,/sport/football/65826820
Surviving Hitler - the Jewish star who shone amid Berlin's ruins,/sport/ice-hockey/65821199
'I've taken the decision' - Messi to join Inter Miami,/sport/football/65832658
Five myths about wildfires,https://www.bbc.com/future/article/20181113-five-myths-about-wildfires
How distant wildfires harm your health,https://www.bbc.com/future/article/20200821-how-wildfire-pollution-may-be-harming-your-health
The most intense firestorms in the world,https://www.bbc.com/future/article/20210513-the-most-intense-firestorms-in-the-world
The world's best 'hidden' dive spots,https://www.bbc.com/travel/article/20230607-the-worlds-best-hidden-dive-spots
The best comic book movies ever made,https://www.bbc.com/culture/article/20230606-why-the-spider-verse-films-are-the-greatest-comic-book-movies-ever-made
Why AI won't be a burnout cure,https://www.bbc.com/worklife/article/20230605-why-ai-wont-be-the-burnout-cure-weve-been-waiting-for
Why fish are finding it hard to breathe,https://www.bbc.com/future/article/20230607-as-ocean-oxygen-levels-dip-fish-face-an-uncertain-future
Misogyny helped jail a mother. Science freed her.,https://www.bbc.com/news/world-australia-65830799
Egypt bans Dutch archaeologists over Black music exhibit,https://www.bbc.com/news/world-middle-east-65835611
"We tried out Apple's $3,499 headset - what's the verdict?",https://www.bbc.com/news/technology-65829689
'Two of my gay friends have gone missing',https://www.bbcselect.com/watch/gay-under-the-taliban/?utm_source=BBC.com&utm_medium=Homepage&utm_campaign=Gay+Under+The+Taliban
Why millions of useable hard drives are being destroyed,https://www.bbc.com/news/business-65669537
Canada fires shroud New York City with orange haze,/news/world-us-canada-65840256
Canada fires shroud New York City with orange...,/news/world-us-canada-65840256
Ukraine drops water bottles to people...,/news/world-europe-65837846
Watch Hawaii's Kilauea volcano erupting in...,/news/world-us-canada-65837845
Watch moment woman is rescued from...,/news/world-europe-65837844
Ukraine dam breach rescue... in 62 seconds,/news/world-europe-65832665
Prince Harry arrives at the High Court for...,/news/uk-65832663
Colorado wildlife officer frees bear from car,/news/world-us-canada-65828941
Watch moment thief gives up on liquor store...,/news/world-australia-65830083
Strikes heard during BBC interview about...,/news/world-europe-65829076
Ros Atkins unpacks the Ukraine dam breach,/news/world-europe-65829075
Customers surprised by naturists dining in pub,https://www.bbc.com/news/uk-england-bristol-65831513
Why it took India 42 years to convict a 90-year-old of murder,https://www.bbc.com/news/world-asia-india-65788152
The Flash: Flash of genius or flash in the pan?,/news/entertainment-arts-65830526
Ghana patients in danger as nurses head for UK - medics,/news/world-africa-65808660
"Mind how you use brain data, watchdog warns",/news/technology-65822889
TV's Julie Goodyear reveals dementia diagnosis,/news/entertainment-arts-65831828
The only place in the world selling lab-grown meat,https://www.bbc.com/news/business-65784505
The tech tricks that make computer games look real,https://www.bbc.com/news/business-65532128
The 'exploding' demand for giant heat pumps,https://www.bbc.com/news/business-65321487
Bywyd ar fferm fynydd Gymreig // Life on a Welsh hill farm,/newyddion/65828633
Top Scottish landscape photographers announced,https://www.bbc.co.uk/news/articles/c6p34zr7rz7o
Long lashes and fashion flair: Africa's top shots,/news/world-africa-65772200
New Yorkers gather for Manhattanhenge,/news/world-us-canada-65761850
Photographing history: The quarrymen of Wales,/news/uk-wales-65717619
