title,url
Senate race neck and neck as Democrats win Arizona,/news/world-us-canada-63606917
Celebrations in Ukraine after 'extraordinary victory' in Kherson,/news/live/world-63607593
Undercover in the world’s dirtiest oil field,/news/science-environment-63560279
Star-studded service for Migos rapper Takeoff,/news/world-us-canada-63605477
Heartbreak for England as New Zealand win World Cup,/sport/rugby-union/63605799
Banksy unveils Ukraine mural on shelled building,/news/world-europe-63606658
Joni Mitchell says her music upset male artists,/news/entertainment-arts-63596059
Trouble in paradise as leaders gather for G20,/news/world-asia-63580224
Son in South Korea World Cup squad despite injury,/sport/football/63607340
Magnussen on shock Sao Paulo GP sprint pole,/sport/formula1/63603135
Best rugby league game ever? Australia win epic,/sport/rugby-league/63604493
The source of half the world's lithium,https://www.bbc.com/future/article/20221110-how-australia-became-the-worlds-greatest-lithium-supplier
The bizarre show that took over kids' TV,https://www.bbc.com/culture/article/20221110-teletubbies-the-bizarre-kids-tv-show-that-swept-the-world
The clever homes hidden from pirates,https://www.bbc.com/travel/article/20221110-the-greek-island-homes-hidden-from-pirates
How a 90s ballad captivated the world,https://www.bbc.com/culture/article/20221109-i-will-always-love-you-the-power-ballad-that-changed-music
A region once too rugged for travellers,https://www.bbc.com/travel/article/20221107-a-cutting-edge-tourism-model-in-newfoundland
The doctors prescribing 'blue' therapy,https://www.bbc.com/future/article/20221108-the-doctors-prescribing-blue-therapy
The exes trapped in shared homes,https://www.bbc.com/worklife/article/20221103-the-exes-forced-to-live-together-after-breaking-up
Celtic ruler's ring kept in cupboard for 28 years,https://www.bbc.com/news/uk-england-york-north-yorkshire-63590575
Batman voice actor Kevin Conroy dies aged 66,https://www.bbc.com/news/entertainment-arts-63597266
Inside the capture of a Russian oligarch's superyacht,https://www.bbc.com/news/world-63297797
Why smart thermostats don't always save you money,https://www.bbc.com/news/business-63511163
The shops that connect people with their home countries,https://www.bbc.com/news/business-63542786
Big Ben’s bongs return after restoration work,/news/uk-politics-63600578
Big Ben’s bongs return after restoration...,/news/uk-politics-63600578
Biden - Our mission is to avert climate...,/news/world-us-canada-63602180
WATCH: 'Finding my baby after 76 years is a...,/news/uk-england-manchester-63600461
Divers discover Challenger space shuttle...,/news/world-us-canada-63597343
Ros Atkins On… Elon Musk and Twitter,/news/technology-63592983
UK falls silent to mark Armistice Day,/news/uk-63598737
Blind boy translates World Cup stickers into...,/news/world-latin-america-63590882
Hurricane Nicole makes landfall in Florida,/news/world-us-canada-63586889
Moment UN chief realises he's reading the...,/news/world-63581486
Driver sentenced for blocking ambulance on...,/news/uk-england-berkshire-63586321
Twitter chaos after wave of blue tick impersonations,/news/technology-63599553
Amazon: Robots spread but 'we still need humans',/news/business-63593335
How Earth is dimming because of climate change,/news/science-environment-63585043
China eases some Covid curbs despite rising cases,/news/world-asia-china-63594255
Matt Hancock emotional as he asks for forgiveness,/news/entertainment-arts-63604403
Australia blames Russian criminals for medical hack,/news/technology-63596691
"Kate Winslet covers mum's £17,000 energy bill",/news/uk-scotland-tayside-central-63599369
Why some people are overlooked geniuses,https://www.bbc.com/future/article/20221028-why-theres-more-to-being-smart-than-intelligence
'One of the hottest start-up spaces in the US',https://www.bbc.com/news/business-63459642
"Africa's top shots: Bullseye, birds and ballet",/news/world-africa-63542247
Lensman recaptures city pub scenes 40 years on,/news/uk-england-humber-63549572
Stunningly preserved bronze statues found in Italy,/news/world-europe-63564404
Crocodile close-up wins mangrove photo awards,/news/in-pictures-63472199
In pictures: Lula beats Bolsonaro,/news/world-latin-america-63451896
