title,url
Sunak hails new Brexit deal but DUP concerns remain,/news/uk-politics-64789639
Supreme Court takes up student loan forgiveness,/news/world-us-canada-64752727
At least 12 injured as tornadoes strike central US,/news/world-us-canada-64789869
Root & Stokes keep England in contention after dramatic morning,/sport/live/cricket/62866144
Why scraping burnt toast may be wise,https://www.bbc.com/future/article/20230224-should-you-avoid-eating-burnt-food
Canada bans TikTok on government devices,/news/world-us-canada-64792894
FBI arrests 'sedition panda' in Capitol riot case,/news/world-us-canada-64788677
How Angela Bassett's thing became a thing,/news/entertainment-arts-64784258
Messi wins Best Fifa men's player award,/sport/football/64790342
Wiegman and Putellas win major Fifa awards,/sport/football/64789718
Canada Soccer president resigns amid dispute,/sport/football/64792987
How to relax like a Greenlander,https://www.bbc.com/travel/article/20230227-greenlands-natural-medicine-for-the-soul
11 TV shows to watch this March,https://www.bbc.com/culture/article/20230223-11-tv-shows-to-watch-this-march
The chatbots that say they can feel,https://www.bbc.com/future/article/20230224-the-ai-emotions-dreamed-up-by-chatgpt
The evolution of work-life balance,https://www.bbc.com/worklife/article/20230227-what-does-work-life-balance-mean-in-a-changed-work-world
Mudlarker discovers rare Tudor leather wrist guard,https://www.bbc.com/news/uk-england-london-64787840
Musk defends Dilbert creator's racist tirade,https://www.bbc.com/news/world-us-canada-64790657
SAG Awards: The red carpet in pictures,https://www.bbc.com/news/entertainment-arts-64781316
The high-tech weed sprayers cutting herbicide use,https://www.bbc.com/news/business-64742513
Mariupol: Tragic deaths and daring escapes,https://www.bbcselect.com/watch/mariupol-the-peoples-story/?utm_source=BBC+Select&utm_medium=Social&utm_campaign=Mariupol+the+peoples+story
WATCH: Key moments from the PM's NI Brexit deal speech,/news/uk-64791359
WATCH: Key moments from the PM's NI Brexit...,/news/uk-64791359
EU Chief on NI deal: 'We were honest with...,/news/uk-64791545
View from the cockpit of a Ukraine combat...,/news/world-europe-64779730
Watch: Skies sparkle as northern lights seen...,/news/uk-64783923
Teddies rain down on pitch during football...,/news/world-europe-64783651
Suspected gang members moved to El Salvador...,/news/world-latin-america-64769936
WATCH: One year of war in Ukraine in 87...,/news/world-europe-64750155
Five must-haves for reporting from the red...,/news/entertainment-arts-64762377
Rare snow carpets swathes of storm-hit...,/news/world-us-canada-64769935
New underwater footage shows royal wreck...,/news/uk-england-norfolk-64758552
Rediscovered Pratchett stories to be published,/news/entertainment-arts-64789059
Spectacular northern lights seen across UK,/news/uk-64782372
TikTok under investigation by Canadian privacy authorities,/news/technology-64759365
UK makes contingency plans over bird flu,/news/health-64763625
"I'm not talking down UK economy, says Starmer",/news/business-64780112
The mission to save the biggest frog on earth,/news/science-environment-64745722
Cambodian girl dies in rare bird flu case,/news/world-asia-64754462
Can technology clean up the shrimp farming business?,https://www.bbc.com/news/business-64496392
How hospitals could avoid future PPE chaos,https://www.bbc.com/news/business-64718017
Vigils and flags: Ukraine war anniversary in pictures,/news/in-pictures-64757068
The 24-year photography project,/news/in-pictures-64723755
Outlaw-themed parade triumphs at Rio carnival,/news/world-latin-america-64742729
"Chukkas, cats and candles: Africa's top shots",/news/world-africa-64726122
Ten photos before Ukrainian lives changed forever,/news/world-europe-64695153
