title,url
Russian tanker hit in attack near Crimea,/news/world-europe-66412842
Texas judge sides with women suing over abortion ban,https://www.bbc.com/news/world-us-canada-66412846
YouTuber Cenat faces charges for PS5 giveaway chaos,https://www.bbc.com/news/world-us-canada-66416366
Rugby World Cup warm-up: FT Wales 20-9 England - reaction,/sport/live/rugby-union/66376659
Have women got the kit they deserve?,https://www.bbc.com/culture/article/20230804-womens-world-cup-2023-how-female-players-have-finally-got-the-football-kit-they-deserve
Pakistan ex-PM Khan arrested after jail sentence,/news/world-asia-66414696
US approves first postpartum depression pill,/news/world-us-canada-66414446
"India mission enters Moon orbit, aiming for south pole",/news/world-asia-india-66402526
Ireland begin World Cup warm-up against Italy - live text,/sport/live/rugby-union/66373203
Whyte's 'adverse' dope test means Joshua bout cancelled,/sport/boxing/66416584
England to face Australia in historic World Cup final,/sport/netball/66415133
The town where people live underground,https://www.bbc.com/future/article/20230803-the-town-where-people-live-underground
The drink thought to fight heatstroke,https://www.bbc.com/travel/article/20230802-kokum-indias-naturally-cooling-fruit-juice
Eight people who rapped long before hip-hop,https://www.bbc.com/culture/article/20230803-eight-forgotten-forerunners-of-hip-hop-from-jazz-hep-cat-slim-gaillard-to-dirty-blues-singer-lucille-bogan
Meg 2: The Trench is 'plain awful',https://www.bbc.com/culture/article/20230803-meg-2-the-trench-review-ben-wheatleys-sequel-is-plain-awful
The sign workers are getting pushed out,https://www.bbc.com/worklife/article/20230718-pip-performance-improvement-plan-underperforming-workers-problem
"Pakistan's iconic, 'healthy pizza'",https://www.bbc.com/travel/article/20230804-chap-shuro-pakistans-iconic-healthy-pizza
How landscapes recover from wildfires,https://www.bbc.com/future/article/20230803-wildfires-the-changing-face-of-the-mediterranean-landscape
'This is only going to get worse' - Arab satirists hit back at ban,https://www.bbc.com/news/world-middle-east-66397036
Why Starbucks cannot crack coffee-loving Vietnam,https://www.bbc.com/news/world-asia-66167222
Russia widens its conscription net: 'I live in constant fear',https://www.bbc.com/news/world-europe-66388422
Tech Decoded: The latest news direct to your inbox,https://www.bbc.com/news/technology-65786969
Devastating wildfires spur new detection systems,https://www.bbc.com/news/business-66266186
Watch: Ukrainian sea drone targets Russian tanker,/news/world-europe-66414547
Watch: Ukrainian sea drone targets Russian...,/news/world-europe-66414547
German city hit by massive hail storm,/news/world-europe-66418007
Watch: Florida officer jumps onto a runaway...,/news/world-us-canada-66411750
Chaos breaks out at NYC giveaway event,/news/world-us-canada-66410112
Watch as RAF jets intercept 'zombie' Russian...,/news/uk-scotland-66405686
Trump's day in court for election lies...in...,/news/world-us-canada-66401963
One-minute World News,/news/10462520
Parents called on Florida teen driving 132mph,/news/world-us-canada-66400461
Helmet camera shows hiker rescue in extreme...,/news/world-us-canada-66378087
"Lizzo needs to be held accountable, say...",/news/entertainment-arts-66400669
Wannabe rapper guilty of $4.5bn Bitcoin laundering,/news/technology-66390639
What are semiconductors and how are they used?,/news/technology-66394406
Krishnan Guru-Murthy joins Strictly line-up,/news/entertainment-arts-66408141
World-first warnings for each cigarette in Canada,/news/world-us-canada-66364465
Tech shares fall as China mulls child phone limits,/news/business-66391263
Travis Scott in chart Utopia with first number one,/news/entertainment-arts-66408144
"Coronations, celebrations and coups: Africa’s top shots",/news/world-africa-66394367
New AI systems collide with copyright law,https://www.bbc.com/news/business-66231268
'We hand-ice millions of biscuits',https://www.bbc.com/news/business-66330395
In pictures: Supermoon lights up night sky,/news/world-66376332
'Dream come true' exhibition for city photographer,/news/uk-england-coventry-warwickshire-66371960
Photographer catches 'once in a lifetime' picture,/news/uk-england-cornwall-66332656
"Water, fire and oceans: Africa’s top shots",/news/world-africa-66323739
Sinéad O'Connor: Fans mourn in London and Dublin,/news/in-pictures-66333764
