title,url
Macron cancels Germany visit as France gripped by riots,/news/live/world-europe-66073728
Ukraine offensive to be long and bloody - US general,https://www.bbc.com/news/world-europe-66075786
Chaos looms over busiest weekend for US air travel,https://www.bbc.com/news/world-us-canada-66072552
The odd items on the WHO's cancer list,https://www.bbc.com/future/article/20230630-aspartame-what-else-is-possibly-cancerous
A pie from a railway lunch counter,https://www.bbc.com/travel/article/20230630-an-apple-caramel-pecan-pie-born-from-a-railway-lunch-counter
'This was a kid': Paris suburb rocked by killing and riots,/news/world-europe-66070033
The conservative court flexed its muscles. What comes next?,/news/world-us-canada-66061849
What we know about French teen's shooting by police,/news/world-europe-66075798
"Ashes: Australia dismissed for 279, leading by 370",/sport/live/cricket/64959132
England 0-0 Portugal - Stanway hits bar on stroke of half-time,/sport/live/football/66032241
Verstappen wins Austrian Grand Prix sprint race - reaction,/sport/live/formula1/63207798
The reality of marriage after babies,https://www.bbc.com/worklife/article/20230628-why-couples-fight-after-having-a-baby
The town where England began,https://www.bbc.com/travel/article/20230502-kingston-upon-thames-londons-town-of-kings-and-queens
The 'raunchy' hit that is anything but,https://www.bbc.com/culture/article/20230627-no-hard-feelings-jennifer-lawrence-in-hollywoods-coyest-sex-comedy
The recipe for Pompeii's 'pizza',https://www.bbc.com/travel/article/20230629-adoreum-the-newly-discovered-flatbread-fresco-of-pompeii
What to do when you see a bear,https://www.bbc.com/future/article/20230627-what-to-do-when-you-see-a-bear
10 of the best films to watch in July,https://www.bbc.com/culture/article/20230629-from-barbie-to-oppenheimer-10-of-the-best-films-to-watch-in-july
Boston's five best oyster bars,https://www.bbc.com/travel/article/20230630-a-tour-of-bostons-five-best-oyster-bars-with-chef-michael-serpa
The problem with 'fun' company retreats,https://www.bbc.com/worklife/article/20230623-what-happens-when-fun-corporate-retreats-cross-a-line
LGBT school policy change causes turmoil in Canada,https://www.bbc.com/news/world-us-canada-66061514
"Clarkson article sexist to Meghan, regulator rules",https://www.bbc.com/news/entertainment-arts-64489083
The latest technology news direct to your inbox,https://cloud.email.bbc.com/techdecoded-newsletter-signup
The quest to grow the perfect strawberry,https://www.bbc.com/news/business-66028645
Police remove Just Stop Oil protesters from Pride parade,/news/uk-66077406
Police remove Just Stop Oil protesters from...,/news/uk-66077406
Watch: Driver cornered in cul-de-sac rams...,/news/uk-66076804
The two Anita Anands joke about pains of...,/news/entertainment-arts-66070489
Watch what happened in the days after Paris...,/news/world-europe-66068964
Watch: Protesters attack Nike store in...,/news/world-europe-66062542
Clashes intensify on third night of French...,/news/world-europe-66062572
Virgin space plane takes off with first...,/news/science-environment-66060602
One-minute World News,/news/10462520
Iconic Tiffany and Co store catches fire in...,/news/world-us-canada-66059958
Mother's grief after son shot by police in...,/news/world-europe-66052958
Little Miss Sunshine actor Alan Arkin dies aged 89,/news/entertainment-arts-66063382
Watch Live: Europe's 'dark explorer' telescope launch,/news/live/science-environment-66075202
Terminally ill tech boss inspired to set up charity,/news/business-66065050
Gigantic leaps and party people: Africa's top shots,/news/world-africa-66052642
UK porn age checks raise privacy concerns,/news/technology-66065600
Aspartame - is it a possible cause of cancer?,/news/health-66057216
The outdoor shows that confirmed Bowie's superstardom,/news/uk-england-beds-bucks-herts-65988402
The athletes facing persecution for being LGBTQ,https://www.bbcselect.com/watch/illegal-to-be-me/?utm_source=BBC.com&utm_medium=Homepage&utm_campaign=Tom+Daley+Illegal+To+Be+Me
The women tackling the 'woeful' diversity in plumbing,https://www.bbc.com/news/business-65808712
Eid al-Adha around the world in pictures,/news/world-66041087
"Masks, fighters and witches: Student photographers on show",/news/in-pictures-65960401
Photographer shares shots of famous musicians,/news/uk-wales-65989687
Millinery masterpieces at Royal Ascot,https://www.bbc.co.uk/news/articles/c3g1e00xgy2o
"Rihanna, Lizzo and Marilyn shine in Divas exhibition",/news/entertainment-arts-65949434
