title,url
Biden cheers better-than-expected midterms results,/news/world-us-canada-63579442
Why a Republican 'wave' never happened,https://www.bbc.com/news/world-us-canada-63569850
Crypto market rocked as FTX rescue deal collapses,https://www.bbc.com/news/business-63577783
How a 90s ballad captivated the world,https://www.bbc.com/culture/article/20221109-i-will-always-love-you-the-power-ballad-that-changed-music
Why the Nile is becoming 'desertified',https://www.bbc.com/future/bespoke/follow-the-food/the-ingredient-we-cant-do-without/
Florida braces for unusual November hurricane,/news/world-us-canada-63579439
Harsher sentence for wife of spy convicted in US,/news/world-us-canada-63578924
Ukraine cautious over Russian withdrawal from key city,/news/live/world-63576212
Mesmerising England blast their way to verge of World Cup final,/sport/live/cricket/60119767
World Cup build-up,/sport/live/football/63580754
Southampton appoint Jones as new manager,/sport/football/63566631
The rise - and possible fall - of Lauren Boebert,https://www.bbc.com/news/world-us-canada-63579561
How bad was Donald Trump's night?,https://www.bbc.com/news/world-us-canada-63569844
Midterms results in maps and charts,https://www.bbc.com/news/world-us-canada-63556122
England's remote Atlantic Highway,https://www.bbc.com/travel/article/20221109-a39-englands-remote-atlantic-highway
The doctors prescribing 'blue' therapy,https://www.bbc.com/future/article/20221108-the-doctors-prescribing-blue-therapy
The woman whose naked body was a canvas,https://www.bbc.com/culture/article/20221108-carolee-schneemann-the-artist-whose-naked-body-was-a-canvas
The exes trapped in shared homes,https://www.bbc.com/worklife/article/20221103-the-exes-forced-to-live-together-after-breaking-up
The oil project being called a sin,https://www.bbc.com/news/world-africa-63567513
Brexit-backing Next boss says UK needs immigration,https://www.bbc.com/news/business-63573988
From refugee camp to World Cup - the rise of Mabil,https://www.bbc.com/sport/football/63543665
Why some people are overlooked geniuses,https://www.bbc.com/future/article/20221028-why-theres-more-to-being-smart-than-intelligence
'One of the hottest start-up spaces in the US',https://www.bbc.com/news/business-63459642
Moment UN chief realises he's reading the wrong speech,/news/world-63581486
Moment UN chief realises he's reading the...,/news/world-63581486
Biden chuckles at thought of Trump running...,/news/world-us-canada-63578645
The story of US election night in 60 seconds,/news/world-us-canada-63563189
Actor Sean Penn gives his Oscar to Zelensky,/news/world-europe-63561236
Watch: Man throws eggs at King Charles,/news/uk-england-york-north-yorkshire-63568598
WW2 evacuee: 'I thought I was going on a day...,/news/stories-63556039
One-minute World News,/news/10462520
Inside the BBC's Washington DC newsroom on...,/news/world-us-canada-63565935
Egyptian MP confronts sister of jailed...,/news/world-middle-east-63561235
Trump hints at run for presidency as he votes,/news/world-us-canada-63562025
Fossil fuel delegates spike at climate summit,/news/science-environment-63571610
US flu hospital cases rocket as vaccinations fall,/news/world-us-canada-63522871
Matt Hancock faces awkward questions in TV jungle,/news/entertainment-arts-63558418
"Facebook-owner Meta to cut 11,000 staff",/news/technology-63568585
Warnings over growing 3D printed gun threat,/news/technology-63495123
The shops that connect people with their home countries,https://www.bbc.co.uk/news/business-63542786
Tractors and crops targeted in rural crime wave,/news/uk-63517666
Why an old train could point to a clean energy future,https://www.bbc.com/news/business-62619313
'There really is more to life than posting on Instagram',https://www.bbc.com/news/business-63482162
Lensman recaptures city pub scenes 40 years on,/news/uk-england-humber-63549572
Stunningly preserved bronze statues found in Italy,/news/world-europe-63564404
Crocodile close-up wins mangrove photo awards,/news/in-pictures-63472199
In pictures: Lula beats Bolsonaro,/news/world-latin-america-63451896
Africa's top shots: Red rings and seas of green,/news/world-africa-63411863
