title,url
Thirty-six dead as Hawaii fires burn through resort town,/news/live/world-66461158
German official accused of spying for Russia,https://www.bbc.com/news/world-europe-66458090
Tottenham & Bayern agree deal in principle for Kane,https://www.bbc.com/sport/football/66412269
The growing promise of cord blood,https://www.bbc.com/future/article/20230809-the-promise-of-banking-umbilical-cord-blood
A big lesson from Lizzo's case,https://www.bbc.com/worklife/article/20230809-what-the-lizzo-allegations-show-about-harassment-in-entertainment
Hawaii wildfires scorched land 'like an apocalypse',/news/world-us-canada-66463595
Ecuador presidential candidate shot dead at rally,/news/world-latin-america-66457472
Russian convicts freed to fight accused of new crimes,/news/world-europe-66364272
"Open low, move fast, walk away - the art of the transfer deal",/sport/football/66439672
"Kane latest, West Ham sign Alvarez & Premier League news conferences",/sport/live/football/66457650
Premier League predictions: Who will be champions?,/sport/football/66434067
Can a parody song top the charts?,https://www.bbc.com/culture/article/20230809-planet-of-the-bass-how-a-ridiculous-eurodance-parody-song-became-the-most-addictive-song-of-the-summer
The indigenous guardians healing Canada,https://www.bbc.com/future/article/20230809-how-indigenous-guardians-are-protecting-canadas-environment
A 23-course meal in a remote fjord,https://www.bbc.com/travel/article/20230809-kvitnes-grd-a-23-course-meal-in-a-remote-fjord
The jobs that raise early red flags,https://www.bbc.com/worklife/article/20230808-when-a-job-raises-red-flags-immediately-should-workers-cut-and-run
US families face desperate choice: Food or insurance,https://www.bbc.com/news/business-66367224
Hopkins to play WW2 hero who saved 669 children,https://www.bbc.com/news/uk-wales-66439471
Journalist held in China sees 10 hours of sun a year,https://www.bbc.com/news/world-asia-china-66458771
How opera is aiming for net zero,https://www.bbc.com/culture/article/20230731-how-opera-is-aiming-for-net-zero-amid-the-climate-crisis
Will electric flying taxis live up to their promise?,https://www.bbc.com/news/business-66252187
Watch: How the weather influenced Hawaii fires,/news/world-us-canada-66460560
Watch: How the weather influenced Hawaii...,/news/world-us-canada-66460560
Presidential hopeful shot dead after Ecuador...,/news/world-latin-america-66460678
Tampa mayor finds 70lb of cocaine on fishing...,/news/world-us-canada-66455220
Telescope records stunning footage of Milky...,/news/world-us-canada-66453620
Bride and groom get stuck on mountain...,/news/world-us-canada-66457275
Watch: Floodwaters send mobile home crashing...,/news/world-europe-66456589
Robbers try to steal cash machine with...,/news/world-us-canada-66443490
Inside the housing barge after first asylum...,/news/uk-england-dorset-66444627
Crowds line street for Sinéad O'Connor's...,/news/entertainment-arts-66436816
"Mum, daughter and 80-year-old count down to space",/news/science-environment-66387543
Ex-Tennis star Annabel Croft joins Strictly,/news/entertainment-arts-66408141
‘Could abortion bans put my IVF at risk?’,/news/world-us-canada-66438294
Is AI a threat to the world of fabric design?,https://www.bbc.co.uk/news/business-66437928
How safe is my data after a hack or leak?,/news/technology-66451970
Rust armourer pleads not guilty over set death,/news/entertainment-arts-66458928
"Dolphins, tigers and turtles in focus",/news/in-pictures-66437556
Tech Decoded: The latest news direct to your inbox,https://www.bbc.com/news/technology-65786969
Devastating wildfires spur new detection systems,https://www.bbc.com/news/business-66266186
In Pictures: Sinéad O'Connor's funeral,/news/in-pictures-66440464
Alarming photos show typhoon floods engulfing Asia,/news/in-pictures-66400905
"Coronations, celebrations and coups: Africa’s top shots",/news/world-africa-66394367
In pictures: Supermoon lights up night sky,/news/world-66376332
'Dream come true' exhibition for city photographer,/news/uk-england-coventry-warwickshire-66371960
