title,url
Candidates in final sprint before US midterms,/news/live/world-us-canada-63525117
Italy stops adult male migrants from disembarking,https://www.bbc.com/news/world-europe-63533769
Tanzanian plane crashes into Lake Victoria,https://www.bbc.com/news/world-africa-63532896
Twitter users jump to Mastodon - but what is it?,https://www.bbc.com/news/technology-63534240
Premier League: Reaction as Liverpool survive Spurs fightback to win,/sport/live/football/63306645
US singer and rapper Aaron Carter dies aged 34,/news/entertainment-arts-63527899
US lotto rises to $1.9bn world record prize,/news/world-us-canada-63534576
Kyiv mayor warns of evacuations if power lost,/news/world-europe-63535263
Salah scores double as Liverpool beat Spurs,/sport/football/63443731
Emery era up and running as Villa beat Man Utd,/sport/football/63443729
Argentina upset England to secure famous win,/sport/rugby-union/63534786
The new Crown is a 'badly-told soap' ★★★☆☆,https://www.bbc.com/culture/article/20221104-the-crown-series-5-review-gripping-but-badly-told-soap
The weird effect language has on time,https://www.bbc.com/future/article/20221103-how-language-warps-the-way-you-perceive-time-and-space
The unsung hero of Indian cuisine,https://www.bbc.com/travel/article/20221102-coriander-the-unsung-hero-of-indian-cuisine
The rise of the 'chief remote officer',https://www.bbc.com/worklife/article/20221027-the-rise-of-the-chief-remote-officer
The US' mysterious Viking runes,https://www.bbc.com/travel/article/20221030-the-mysterious-viking-runes-found-in-a-landlocked-us-state
The sand battery making waves in Finland,https://www.bbc.com/future/article/20221102-how-a-sand-battery-could-transform-clean-energy
The horror that demonised older women,https://www.bbc.com/culture/article/20221103-how-what-ever-happened-to-baby-jane-demonised-older-women
Fact-checking misleading claims about the US midterms,https://www.bbc.com/news/63486497
Russians said they’d take my baby: A medic’s story,https://www.bbc.com/news/world-europe-63464868
Your pictures on the theme of 'sculpture',https://www.bbc.com/news/in-pictures-63486977
The 'superpower' behind great art,https://www.bbc.com/culture/article/20221102-synaesthesia-the-superpower-behind-great-art
Elon Musk: Superhero or supervillain?,https://www.bbcselect.com/watch/elon-musk/
Fireworks thrown at emergency service workers,/news/uk-63535473
Fireworks thrown at emergency service workers,/news/uk-63535473
Davey: If PM has any integrity he'd call an...,/news/uk-politics-63534747
Rescuers search site of crashed plane in...,/news/world-africa-63534266
Fossil abstinence isn't working - climate...,/news/uk-politics-63534039
PM not aware of 'specific messages' from...,/news/uk-politics-63534037
Peru anti-government protest grips capital...,/news/world-latin-america-63531436
One-minute World News,/news/10462520
WATCH: Multiple Tornadoes hit southern US...,/news/world-us-canada-63530394
WATCH: Could this be the world's smallest...,/news/world-europe-63526199
At the scene of deadly nightclub fire in...,/news/world-europe-63527288
TikTok says staff in China can access UK user data,/news/business-63494951
Climate anxiety is rising - it might be a good thing,/news/science-environment-63516055
Magic-mushroom drug can treat severe depression,/news/health-63475630
Glastonbury ticket sale hit by technical issue,/news/uk-england-bristol-63533949
Scholz asks China to press Russia to end its war,/news/world-europe-63496195
Apple store Glasgow workers unionise in UK first,/news/technology-63485697
How football fans led a fashion revolution,/news/entertainment-arts-63498068
India gambles on building a leading drone industry,https://www.bbc.com/news/business-62966802
The refugees able to work remotely for firms around the world,https://www.bbc.com/news/business-63468944
"Northern Lights, Tutankhamun and cakes: Photos of the week",/news/in-pictures-63514358
Crocodile close-up wins mangrove photo awards,/news/in-pictures-63472199
In pictures: Lula beats Bolsonaro,/news/world-latin-america-63451896
Africa's top shots: Red rings and seas of green,/news/world-africa-63411863
Lockdown laundry portraits win photo prize,/news/entertainment-arts-63397654
