title,url
Iran disbands morality police - attorney general,/news/world-middle-east-63850656
Trump's call for end of constitution condemned,https://www.bbc.com/news/world-us-canada-63851751
"Bodies of 2,500 seals found along Russian coast",https://www.bbc.com/news/world-europe-63852395
'Southgate's critics must admit he got it spot on again',https://www.bbc.com/sport/football/63854557
The workers lured into oversold jobs,https://www.bbc.com/worklife/article/20221202-the-workers-lured-into-oversold-jobs
Georgia Senate run-off looms after bitter campaign,/news/world-us-canada-63842781
"'They destroyed us, but we came together stronger'",/news/world-europe-63834777
Construction to begin on world's biggest telescope,/news/science-environment-63836496
How 'incredible' Mbappe upstaged history-maker Giroud,/sport/football/63853904
Bellingham backed to be 'world's best midfielder',/sport/football/63852600
Stokes and McCullum are 'pioneers' - Collingwood,/sport/cricket/63852479
"The US' 2,000-year-old mystery mounds",https://www.bbc.com/travel/article/20221204-the-us-2000-year-old-mystery-mounds
The radical trend millennials love,https://www.bbc.com/culture/article/20221202-soft-girl-what-it-really-means-to-lead-a-soft-life
The Alpine villages powered by streams,https://www.bbc.com/future/article/20221129-the-alpine-villages-producing-their-own-power
The misery of middle managers,https://www.bbc.com/worklife/article/20221123-how-flexibility-made-managers-miserable
Why is China struggling to vaccinate the elderly?,https://www.bbc.com/news/63798484
Should we put a price on nature?,https://www.bbc.co.uk/ideas/videos/should-we-put-a-price-on-nature/p0dl4kx3
Test your knowledge of the World Cup group stage,https://www.bbc.com/sport/football/63833063
India makes big strides in African healthcare,https://www.bbc.com/news/business-63476025
Knives Out director shares the method behind the magic,https://www.bbcpodcasts.com/spark-and-fire/?v=20221130&utm_source=BBC.Com&utm_medium=Homepage&utm_campaign=Spark+and+Fire
Out on a spacewalk with Nasa astronauts,/news/world-us-canada-63849682
Out on a spacewalk with Nasa astronauts,/news/world-us-canada-63849682
England fans 'can't wait for the...,/news/uk-63854567
The 'life-changing' electric suit,/news/stories-63827708
Drone footage shows deadly Brazil flooding,/news/world-latin-america-63835789
Coca-Cola Christmas truck in flames in...,/news/world-europe-63829299
Do you need to change your accent to get a...,/news/uk-63838819
One-minute World News,/news/10462520
Escape of Sydney zoo lions caught on camera,/news/world-australia-63822386
Spectacular scenes as Hawaii volcano erupts,/news/world-us-canada-63814130
Riot police in hazmat suits at China protests,/news/world-asia-china-63806141
"Flo, Cat Burns and Gabriels tipped as Sound Of 2023",/news/entertainment-arts-63809715
UK plastic-alternative maker wins Earthshot Prize,/news/business-63841761
No more airplane mode? EU allows calls on flights,/news/technology-63786591
Strep A: Why it can be dangerous and what to know,/news/health-63836093
Singing the praises of first female Commons Speaker,/news/entertainment-arts-63775575
BP stands to get 'blood money' - Ukraine adviser,/news/63821028
Lizards millions of years older than thought,/news/uk-england-bristol-63832928
'Israeli women and their Gulf sisters are so similar',https://www.bbc.com/news/business-63792841
The weird and wonderful art of AI,https://www.bbc.com/future/article/20221123-the-weird-and-wonderful-art-created-when-ai-and-humans-unite
Your pictures on the theme of 'in a rush',/news/in-pictures-63812501
"An erupting volcano, Northern Lights and Carnival: Photos of the week",/news/in-pictures-63834045
The photographer who puts little people in the frame,/news/uk-scotland-63781000
Africa's top shots: Dripping diamonds and football fever,/news/world-africa-63819552
In Pictures: Mauna Loa erupts,/news/in-pictures-63820551
