title,url
Italy's most-wanted mafia boss arrested in Sicily,/news/world-europe-64288928
German defence minister resigns after blunders,https://www.bbc.com/news/world-europe-64288267
Australian woman breaks record running length of country,https://www.bbc.com/news/world-australia-64286469
A road trip to Norway's best view,https://www.bbc.com/travel/article/20230115-a-road-trip-to-norways-best-view
Can the mammoth be resurrected?,https://www.bbc.com/future/article/20230113-how-extinct-animals-could-be-brought-back-from-the-dead
Romanian police widen investigation into Andrew Tate,/news/world-europe-64285341
California hit with one final round of storms,/news/world-us-canada-64288263
Ten little-known facts about Martin Luther King,/news/world-us-canada-64244643
Premier League news as Arsenal extend lead,/sport/live/football/64287341
Vunipola left out of England's Six Nations squad,/sport/rugby-union/64287374
Raducanu wins on injury return at Australian Open,/sport/tennis/64280237
The workers laid off for the first time,https://www.bbc.com/worklife/article/20230113-the-workers-laid-off-for-the-first-time
The song that changed the US,https://www.bbc.com/culture/article/20230113-martin-luther-king-day-the-song-that-changed-the-us
The Versailles most people don't see,https://www.bbc.com/travel/article/20230112-the-hidden-history-of-versailles
The simple error that 16% of us make,https://www.bbc.com/future/article/20230112-why-some-people-cant-tell-left-from-right
"My work day: 4am start, 7k run and cold showers",https://www.bbc.com/news/business-64225024
Going sober to ease the cost of living,https://www.bbc.com/news/newsbeat-64176409
The Last of Us 'breaks curse' of gaming TV crossover,/news/entertainment-arts-64261582
Lab-grown alternatives aim to cut palm oil dependence,https://www.bbc.com/news/business-64234577
India targets China's dominance in mobile phones,https://www.bbc.com/news/business-63806296
Woman rescued from rubble of Dnipro apartment building,/news/world-europe-64284986
Woman rescued from rubble of Dnipro apartment...,/news/world-europe-64284986
Video appears to show Nepal plane roll before...,/news/world-asia-64280707
Crowds gather at Nepal plane crash site,/news/world-asia-64280699
The man who first discovered plastic in the...,/news/stories-64250382
Thousands of Israelis hold legal reforms...,/news/world-middle-east-64279595
California's hydro-climate whiplash explained,/news/world-us-canada-64227619
One-minute World News,/news/10462520
Bursts of flames after Lithuania gas pipeline...,/news/world-europe-64269957
How drones could be the future of Indian...,/news/world-asia-india-64248510
I saw life and death on my first day in the...,/news/uk-northern-ireland-64247936
Why fungi are 'underloved and understudied',/news/science-environment-64251382
Brendan Fraser's emotional win at Critics Choice,/news/entertainment-arts-64288415
"China records 60,000 Covid-linked deaths in month",/news/world-asia-china-64276608
Apple boss to have pay cut by over 40% this year,/news/business-64258289
Tech Tent: will MRNA transform cancer treatment?,https://www.bbc.co.uk/sounds/play/w3ct4kj0
Takeaways face plastic ban in October,/news/science-environment-64253130
Covid cases in China touch 900 million - study,/news/world-asia-china-64258799
Pixar director on embracing your 'inner weirdo',https://link.chtbl.com/BBC-DomeeShi?at=1001l38zZ
Could floating solar farms survive out at sea?,https://www.bbc.co.uk/news/business-63728020
"Sand, sinkholes and sculptures: Photos of the week",/news/in-pictures-64261738
The AI artist reimagining a stylish old age,/news/world-africa-64260739
Photos show challenges of 2020s Britain - creator,/news/uk-england-manchester-64190040
"Africa's top shots: Angry rams, priest and prayers",/news/world-africa-64248968
Golden Globes: The red carpet in pictures,/news/entertainment-arts-64226431
