title,url
Mike Pence shares 'deep concern' over FBI search of Trump's home,/news/live/world-us-canada-62473806
Concerns as Russia launches Iranian satellite,https://www.bbc.com/news/world-europe-62482687
US police arrest man over murders of Muslim men,https://www.bbc.com/news/world-us-canada-62486387
Bolivia's unnamed ancient people,https://www.bbc.com/travel/article/20220808-the-ancient-people-who-reshaped-the-amazon
The visionaries making a black utopia,https://www.bbc.com/culture/article/20220729-the-visionary-artists-creating-a-black-utopia
Katty Kay: Will an FBI 'raid' supercharge Trump?,/news/world-us-canada-62486616
Blasts rock Russian airbase in annexed Crimea,/news/world-europe-62482425
"She TikToked her divorce, then her ex killed her",/news/world-us-canada-62427084
Champions League: Rangers defeat Union Saint Gilloise to make play-offs,/sport/live/football/62457864
Saving one of England's historic clubs from a wild ride to ruin,/sport/football/62377986
Scheffler 'frustrated' by LIV legal action,/sport/golf/62486354
The new problem for 'overthinkers',https://www.bbc.com/worklife/article/20220803-why-overthinkers-struggle-with-remote-work
Why do we die?,https://www.bbc.com/future/article/20220805-why-do-we-die
The backlash against the 'girlboss',https://www.bbc.com/culture/article/20220805-girlbosses-the-women-being-demonised-on-screen
The Saxon villages 'locked in time',https://www.bbc.com/travel/article/20220807-europes-remote-lost-in-time-villages
Tree of the Year contenders revealed,https://www.bbc.com/news/uk-england-derbyshire-62466806
Olive oil price warning as heatwave hits crops,https://www.bbc.com/news/business-62433295
Timed quiz: How did this diver make waves?,https://www.bbc.com/news/world-us-canada-62459845
Are we falling in love with robots?,https://www.bbc.com/news/business-62007675
The plans for giant seaweed farms in European waters,https://www.bbc.com/news/business-62407504
Crimea beachgoers run after airfield explosion,/news/world-europe-62486448
Crimea beachgoers run after airfield...,/news/world-europe-62486448
Drought leaves boats stranded on dried-up...,/news/world-europe-62483292
Nine-year-old recalls fear as Israeli strike...,/news/world-middle-east-62480381
Eight dead as floods submerge streets of...,/news/world-asia-62475872
Bolivia's 'death road' becomes wildlife haven,/news/world-latin-america-62471231
The people living in half-built homes,/news/world-asia-62436926
How I taught a vulture to fly with me,/news/world-latin-america-62468782
Campaigners call for artificial grass tax,/news/uk-62468199
Alps glaciers melting faster as heatwaves hit,/news/world-europe-62466095
The newborns fighting for survival in...,/news/world-asia-62458894
How China is reshaping the world order,https://www.bbcselect.com/watch/china-a-new-world-order/?utm_source=BBC.com&utm_medium=Homepage&utm_campaign=China+A+New+World+Order
Can drumming reconnect you to your colleagues?,https://www.bbc.com/news/business-62061572
Issey Miyake's fashion in pictures,/news/in-pictures-62481031
The bull that has stolen Brummie hearts,/news/uk-england-birmingham-62469114
Northern Lights create summer coastal showcase,/news/uk-england-norfolk-62462822
Butterfly image wins World Sports Photography Awards,/news/in-pictures-62398456
In pictures: England's bare lawns and parched parks,/news/uk-62432844
