title,url
Imran Khan supporters clash with police outside court,/news/world-asia-64998922
Biden welcomes court's Putin arrest warrant,/news/world-europe-64998165
Wyoming becomes first US state to ban abortion pills,/news/world-us-canada-64998920
The mountain town buried by California winter chaos,/news/world-us-canada-64995904
Follow: Can Scotland extend six-point lead? Or will Italy hit back again?,/sport/live/rugby-union/61410358
The Wire star Lance Reddick dies aged 60,/news/world-us-canada-64959805
Thousands may have lost out to crypto trading app,/news/technology-64939146
Watch: Can Putin actually be arrested?,/news/world-europe-64997048
Saudi GP final practice & where else could Hamilton race?,/sport/live/formula1/63205258
"Premier League: Build-up to four games, with Wolves v Leeds & Saints v Spurs",/sport/live/football/64405206
Ireland face wounded England for historic Grand Slam,/sport/rugby-union/64988703
The disease driven by an addictive nut,https://www.bbc.com/future/article/20230315-how-the-addictive-areca-nut-drives-monkey-fever-in-india
Six ancient Norse myths resonating now,https://www.bbc.com/culture/article/20230316-the-six-ancient-norse-myths-that-still-resonate-today
An Arctic diner under the Aurora Borealis,https://www.bbc.com/travel/article/20230316-dans-diner-a-wild-dinner-in-a-roving-tundra-buggy
Three facts about... recycling,https://www.bbc.com/future/article/20230317-how-recycling-can-help-the-climate-and-other-facts
The American designers who were ignored,https://www.bbc.com/culture/article/20230317-the-american-designers-who-were-ignored
Going phone-free 'sets up for failure',https://www.bbc.com/worklife/article/20230313-is-it-possible-to-digital-detox-anymore
A cuisine without a country,https://www.bbc.com/travel/article/20230317-shirini-zereshk-palau-sweet-barberry-pilaf
Will Vladimir Putin ever face a war crimes trial?,https://www.bbc.com/news/world-64994992
Actor Sam Neill reveals cancer diagnosis,https://www.bbc.com/news/entertainment-arts-64969344
The prison experience Holmes is desperate to avoid,https://www.bbc.com/news/world-us-canada-64970156
Putin's 'deep frustration and resentment against the West',https://www.bbcselect.com/watch/putin-vs-the-west/?utm_source=bbc.com&utm_medium=Homepage&utm_campaign=Putin+Vs+The+West
The revolution underway in India's diamond industry,https://www.bbc.com/news/business-64783843
Imran Khan mobbed by supporters as he leaves for court,/news/world-asia-64999864
Imran Khan mobbed by supporters as he leaves...,/news/world-asia-64999864
Violence erupts in Paris as pension protests...,/news/world-europe-64997510
Millions of dead fish found in Australian...,/news/world-europe-64997455
Eight killed by deluge of potatoes after roof...,/news/world-asia-64987190
Iraq amputee: I can hug my son with my feet,/news/world-middle-east-64976639
Protests as Macron pushes through pension...,/news/world-europe-64981376
Watch: Man clings on for life in harrowing...,/news/world-64977487
US releases footage of Russian jet crashing...,/news/world-us-canada-64974825
Flames engulf Russian security building in...,/news/world-europe-64974827
Drug giant becomes latest to cap US insulin prices,/news/world-us-canada-64991714
Credit Suisse: Lessons learned from the past?,/news/business-64976316
'A village's goodwill saved me from homelessness',/news/science-environment-64940840
Taylor Swift launches Eras tour with 44-song set,/news/entertainment-arts-64999388
"Puppeteers, superstars and dinosaurs: Africa's top shots",/news/world-africa-64976952
How many other Hemsbys are waiting to happen?,/news/uk-england-norfolk-64944384
YouTube reinstates Donald Trump's channel,/news/technology-64993603
Why sleeper trains are being revived across Europe,https://www.bbc.com/news/business-64950747
Has social media killed the famous advert?,https://www.bbc.com/news/business-64801683
Brian May knighted by King at Buckingham Palace,/news/uk-64960536
The best fashion looks at the Oscars,/news/entertainment-arts-64935067
'I rarely saw people who looked like me',/news/uk-england-merseyside-64881091
Tributes paid to acclaimed documentary photographer,/news/uk-england-tyne-64918073
Robert Blake: From Hollywood to murder accused,/news/world-us-canada-64911059
