title,url
'We’re ready to begin counter-offensive' - Ukraine,/news/world-65725004
Hundreds of expelled Germans set to leave Russia,/news/world-europe-65731546
US debt talks continue with new 5 June deadline,/news/world-us-canada-65713732
How rhythm rules our lives,https://www.bbc.com/future/article/20230526-how-rhythm-shapes-our-lives
India's new wave of shocking films,https://www.bbc.com/culture/article/20230525-is-agra-the-most-shocking-indian-film-ever-made
Erdogan and rival clash in desperate race for votes,/news/world-europe-65708268
Passenger who opened plane door mid-air arrested,/news/world-asia-65705276
Alarm over cosmetic surgery-linked fungal outbreak,/news/health-65731544
Bundesliga: Bayern Munich champions as it stands with Dortmund trailing,/sport/live/football/65722081
Monaco Grand Prix qualifying: Can Alonso cause an upset?,/sport/live/formula1/63207080
WSL: Chelsea double lead & Man Utd drawing - Blues closing in on title,/sport/live/football/65448663
What's the best language for maths?,https://www.bbc.com/future/article/20230511-whats-the-best-language-for-learning-maths
Why is the US banning children's books?,https://www.bbc.com/culture/article/20230525-how-book-banning-escalated-in-the-us
A singular American sandwich,https://www.bbc.com/travel/article/20230525-maryland-crab-sammy-a-singular-american-sandwich
Is talent or hard work more important?,https://www.bbc.com/worklife/article/20230517-why-people-reward-innate-talent-over-hard-work
Why we need more female electricians,https://www.bbc.com/future/article/20230525-how-more-us-female-electricians-helps-climate-change
David Lynch on 'the beauty in the dark',https://www.bbc.com/culture/article/20230525-david-lynch-interview-how-the-mulholland-drive-director-worked-with-composer-angelo-badalamenti
Istanbul's five best hammams,https://www.bbc.com/travel/article/20230526-istanbuls-five-best-hammams
Celine Dion cancels entire tour over poor health,https://www.bbc.com/news/entertainment-arts-65725250
"Amazing pictures of 5,000 new species found in the Pacific Ocean",https://www.bbc.com/news/science-environment-65722878
Precious cheetah cubs die in Indian national park,https://www.bbc.com/news/world-asia-india-65692541
The chip maker that became an AI superpower,https://www.bbc.com/news/business-65675027
Why car parks are the hottest space in solar power,https://www.bbc.com/news/business-65626371
We're ready to retake our country - Ukraine security boss,/news/world-65731596
We're ready to retake our country - Ukraine...,/news/world-65731596
Car swept backwards in raging Spanish...,/news/world-europe-65729775
Footage from cabin as plane door opens...,/news/world-asia-65722391
Did Ukrainian drone boats attack Russian...,/news/world-65715348
What happened during Madeleine reservoir...,/news/uk-65715534
Supercell mesmerises storm watchers in New...,/news/world-us-canada-65642958
One-minute World News,/news/10462520
Gushing winds rip through Guam during typhoon,/news/world-us-canada-65717067
Moment car crashes into Downing Street gates,/news/uk-65715347
Ed Sheeran's surprise concert for high school...,/news/world-us-canada-65714612
Warm smiles and purple skies: Africa's top shots,/news/world-africa-65707712
"JP Morgan cuts 1,000 jobs after US bank takeover",/news/business-65717724
ITV investigated rumours of Schofield relationship,/news/entertainment-arts-65732039
Musk brain chip firm's human study approved,/news/health-65717487
US doctor fined for speaking about child's abortion,/news/world-us-canada-65714672
Government defends oil boss to head climate talks,/news/science-environment-65708328
Schofield admits lying about affair with colleague,/news/entertainment-arts-65729361
Protein's power is being uncovered and unleashed,https://www.bbc.com/news/business-65468298
'We are selling a product that we hope gets discontinued',https://www.bbc.com/news/business-65572881
In pictures: King and Queen visit Northern Ireland,/news/uk-northern-ireland-65701853
"Dad completes 1,000 days of toy car photos",/news/uk-scotland-north-east-orkney-shetland-65714184
Tina Turner: A life in pictures,/news/entertainment-arts-65669988
Ray Stevenson's film and TV career in pictures,/news/entertainment-arts-65679323
Picnics and blooms: The Chelsea Flower Show in pictures,/news/in-pictures-65669737
