title,url
Key takeaways from leaked Pentagon files,/news/world-us-canada-65238951
Biden lands in Belfast to mark Good Friday Agreement,/news/uk-northern-ireland-65208880
"Western special forces inside Ukraine, leak shows",/news/world-europe-65245065
Man City take control against Bayern in quarters,/sport/football/65233785
A horror dubbed 'the number one nasty',https://www.bbc.com/culture/article/20230406-the-evil-dead-the-horror-shocker-that-set-off-a-culture-war
Gun in deadly Louisville shooting will be sold off,/news/world-us-canada-65234314
Mysterious dark matter mapped in finest detail yet,/news/science-environment-65243132
Michael Jordan's trainers sell for record $2.2m,/news/world-us-canada-65246682
Lukaku scores as Inter Milan win at Benfica,/sport/football/65233792
England's unbeaten run ends as Kerr stars for Australia,/sport/football/65232235
England will not change approach for Ashes - Stokes,/sport/cricket/65240951
A game-changer for breast cancer?,https://www.bbc.com/future/article/20230406-the-blind-women-detecting-early-stage-breast-cancer-in-india
Has quitting become too trendy?,https://www.bbc.com/worklife/article/20230411-the-great-resignation-has-quitting-become-too-cool
A Ramadan dish that symbolises unity,https://www.bbc.com/travel/article/20230410-heure-bleues-traditional-harira
The creative Asian city few know,https://www.bbc.com/travel/article/20230410-battambang-cambodias-creative-second-city
'The greatest episode of TV this year',https://www.bbc.com/culture/article/20230406-succession-episode-3-the-greatest-episode-of-tv-this-year
"How secret files appeared online, then began to vanish",https://www.bbc.com/news/65240603
Millie Bobby Brown announces her engagement,https://www.bbc.com/news/entertainment-arts-65240158
Elon Musk: Superhero or supervillain?,https://www.bbcselect.com/watch/elon-musk/?utm_source=BBC.com&utm_medium=Elsewhere&utm_campaign=Elon+Musk+-+Superhero+or+Supervillian
Why robotic worms could one day dig beneath your feet,https://www.bbc.com/news/business-64874027
Watch: Biden lands in Belfast,/news/uk-northern-ireland-65246855
Watch: Biden lands in Belfast,/news/uk-northern-ireland-65246855
Watch: Macron interrupted by hecklers during...,/news/world-europe-65245141
Singing strikers on the junior doctors'...,/news/uk-65244747
'Ash Angels' made in Russian village after...,/news/world-europe-65238816
Video shows petrol bombs thrown at...,/news/uk-northern-ireland-65237692
WATCH: Building collapses onto road in Mexico,/news/world-latin-america-65234499
A look at the King's golden coronation day...,/news/uk-65231561
Giant sketch in field marks Picasso death...,/news/world-europe-65223575
Video shows avalanche in French Alps,/news/world-europe-65228240
Songs of grief for sisters killed in occupied...,/news/world-middle-east-65227761
Jodie Whittaker to star in second series of Time,/news/entertainment-arts-65239892
The ship graveyard which has claimed many lives,/news/uk-wales-57853220
The India start-up gala that exploded into a scandal,/news/world-asia-india-65200441
Poultry to be allowed outside as bird flu eases,/news/science-environment-65244151
"People were taking drugs in Spain 3,000 years ago",/news/world-europe-65211722
Years of abortion pills stockpiled after ruling,/news/world-us-canada-65233537
Tesla to build new battery factory in Shanghai,/news/business-65228927
'We turned down a client to uphold gay rights',https://www.bbc.com/news/business-65173246
Would you open up to a chatbot therapist?,https://www.bbc.com/news/business-65110680
Green leaves and yawning soldiers: Africa's top shots,/news/world-africa-65200809
In pictures: King Charles's state visit to Germany,/news/in-pictures-65123931
Royal murals and rare rhinos: Africa's top shots,/news/world-africa-65106486
Film fan creates hundreds of miniature movie sets,/news/uk-england-south-yorkshire-65112610
Southern Lights unusually vivid over New Zealand,/news/world-asia-65108333
