title,url
"Rupert Murdoch, 92, steps down as chair of News Corp and Fox",/news/live/business-66881282
How Norway outstrips US on Ukraine spending,https://www.bbc.com/news/66870559
India suspends visas for Canadians as row escalates,https://www.bbc.com/news/world-asia-india-66851964
Why tech firms are ceasing remote work,https://www.bbc.com/worklife/article/20230920-zoom-and-grindr-return-to-office-techs-surprising-remote-work-u-turn
The children leaving the Mafia,https://www.bbc.com/future/article/20230919-the-kids-leaving-mafia-families
Rupert Murdoch steps down in favour of son Lachlan,/news/business-66881306
Poland no longer supplying weapons to Ukraine - PM,/news/world-europe-66873495
'I don't care about sportswashing',/sport/66874723
Premier League news conferences & European build-up,/sport/live/football/66872915
De Kock's knee refusal due to CSA 'interference',/sport/cricket/66870049
'Spain row a seminal point & catalyst for change',/sport/football/66873595
The dress that shocked the world,https://www.bbc.com/culture/article/20230921-lady-gaga-meat-dress-the-outfit-that-shocked-the-world
The rise of 'paid paid' time off,https://www.bbc.com/worklife/article/20230918-the-companies-doling-out-thousands-for-workers-holidays
The ancient cider drunk by Vikings,https://www.bbc.com/travel/article/20230920-the-rebirth-of-norways-cider-tradition
Why heat is a 'silent killer',https://www.bbc.com/future/article/20230918-how-community-maps-can-protect-children-from-extreme-heat
Where to find London's 'lost' palaces,https://www.bbc.com/travel/article/20230919-a-royal-tour-of-londons-best-palaces-and-parks-with-historian-tracy-borman
"US offers almost 500,000 Venezuelans legal status",https://www.bbc.com/news/world-us-canada-66875264
Game of Thrones author sues ChatGPT-owner OpenAI,https://www.bbc.com/news/technology-66866577
The biggest scandal in British history,https://www.bbcselect.com/watch/countdown-to-abdication/?utm_source=BBC.com&utm_medium=Homepage&utm_campaign=Abdication
The turbo-charged plants that could boost farm output,https://www.bbc.com/news/business-66798680
Police taser school band director at football game,/news/world-us-canada-66869906
Police taser school band director at football...,/news/world-us-canada-66869906
Charles gives French toast at star-studded...,/news/world-europe-66873139
'Vive le roi!': King Charles meets fans in...,/news/uk-66872025
Violent tornado sends sparks flying in...,/news/world-66864549
New footage shows historic World War II...,/news/world-us-canada-66850193
One-minute World News,/news/10462520
Video shows Aston Martin get carjacked in...,/news/world-us-canada-66870287
Watch: Seal pups tangled in nets freed by...,/news/world-africa-66862091
Watch: Paris ceremony for King Charles in...,/news/world-europe-66870751
Watch: Wrestlers grapple on Japanese bullet...,/news/world-asia-66856413
GB News monitoring Dan Wootton allegations,/news/entertainment-arts-66875133
Inside the star-studded banquet for King and Queen,/news/in-pictures-66867649
Critics and fans get first taste of FF7 Rebirth,/news/newsbeat-66842873
Where Ukraine’s amputees go to repair their lives,/news/world-europe-66843991
Will it be possible to regulate artificial intelligence?,https://www.bbc.co.uk/news/business-66853057
"Get a grip on pollution rules, government told",/news/science-environment-66868895
Ozzy has final surgery: 'I can't do it any more',/news/entertainment-arts-66876167
The tiny island with a population of 16,https://www.bbc.com/reel/playlist/future-planet?vpid=p07gsk79
The firms hoping to take psychedelic drugs mainstream,https://www.bbc.com/news/business-66669641
Adeiladau anghofiedig Cymru // Wales' forgotten buildings,/newyddion/66858159
'Accidental' rock photographer wins lifetime prize,/news/entertainment-arts-66817901
Mesmerising marine life photos scoop world prize,/news/in-pictures-66810094
In pictures: Stars hit red carpet at Vogue World,/news/entertainment-arts-66808254
"Fish, flares and faces: Africa’s top shots",/news/world-africa-66807540
