title,url
"Grand jury wanted charges against Graham, Loeffler and others",/news/live/world-us-canada-66755941
Rugby World Cup: France v New Zealand opening ceremony,https://www.bbc.com/sport/live/rugby-union/65866812
Lee a category five hurricane and still intensifying,https://www.bbc.com/news/world-us-canada-66746800
An early fear of a nuclear end,https://www.bbc.com/future/article/20230907-the-fear-of-a-nuclear-fire-that-would-consume-earth
"'Dazzling, logic-defying images' ★★★★★",https://www.bbc.com/culture/article/20230908-the-boy-and-the-heron-review-miyazakis-last-film-is-a-masterpiece
The juror who backed Trump and other Georgia takeaways,/news/world-us-canada-66744573
"Khalife spotted walking from food van, police say",/news/live/uk-66749354
Musk says he withheld Starlink over Crimea to avoid escalation,/news/world-europe-66752264
Euro 2024 qualifying: Cyprus v Scotland - Adams & Gilmour start,/sport/live/football/66721236
England post 291-6 in first New Zealand ODI – text,/sport/live/cricket/66605879
Yamal becomes Spain's youngest player and scorer,/sport/football/66679258
Olivia Rodrigo is not just a Gen Z star,https://www.bbc.com/culture/article/20230907-how-pop-star-olivia-rodrigo-became-a-defining-voice-of-gen-z
A 'British' town outside Britain,https://www.bbc.com/travel/article/20230907-le-touquet-the-most-british-of-french-resorts
The Darwinian factor in medicine,https://www.bbc.com/future/article/20230905-how-darwinism-is-changing-medicine
Burning Man: The cost to attend,https://www.bbc.com/worklife/article/20230907-how-much-it-costs-to-attend-the-burning-man-festival
Kim Jong Un reveals 'nuclear attack submarine',https://www.bbc.com/news/world-asia-66747891
Roblox coming to PlayStation 4 and PS5,https://www.bbc.com/news/technology-66755095
Cat burglar caught red handed after crime spree,https://www.bbc.com/news/uk-wales-66754819
Urban oases combine roof gardens and solar panels,https://www.bbc.com/news/business-66054688
What defines a Queen's reign?,https://www.bbcselect.com/watch/the-golden-queens/?utm_source=BBC.com&utm_medium=Homepage&utm_campaign=Golden+Queens
Sylvester Stallone shadow boxes with the Pope,/news/world-66757105
Sylvester Stallone shadow boxes with the Pope,/news/world-66757105
Gun salutes mark King Charles' first year on...,/news/uk-66755397
Officer imitates dog to lure suspects from...,/news/world-us-canada-66746002
Wrong-way driver calls police on himself by...,/news/world-us-canada-66745802
Japan joins race to Moon with successful...,/news/world-asia-66739236
Watch: Inmate escapes by scaling prison walls,/news/world-us-canada-66677979
One-minute World News,/news/10462520
Rolling Stones confirm first original album...,/news/entertainment-arts-66733789
Moment police officer rescues driver from...,/news/world-us-canada-66739850
Baby turtles make it to sea from rare nesting...,/news/world-us-canada-66739848
Another former FTX executive pleads guilty,/news/business-66747694
Has Australia cleaned up its act on climate?,/news/world-australia-65606208
Jimmy Fallon sorry over toxic workplace claims,/news/world-us-canada-66746801
New Covid variant behind care home outbreak,/news/health-66750359
S Club hope to help 'save' a life with heart charity,/news/entertainment-arts-66749108
"Masks, mourners and megaphones: Africa's top shots",/news/world-africa-66738714
Apple shares slide after China iPhone ban reports,/news/business-66748092
Find the right BBC email newsletter for you,https://www.bbc.com/news/world-us-canada-66715271?&at_bbc_team=studios&at_medium=native&at_objective=acquisition&at_ptr_type=&at_ptr_name=bbc.com&at_format=Module&at_link_origin=bbchomepage&at_campaign=nleditorial&at_campaign_id=&at_adset_name=&at_adset_id=&at_creation=&at_creative_id=&at_campaign_type=owned
Why affection remains for fading long wave radio,https://www.bbc.com/news/business-66644709
Landmark captured on camera made out of beer can,/news/uk-england-bristol-66709749
'We carried our heritage with us',/news/in-pictures-66594398
"Flags, football and figure skating: Africa's top shots",/news/world-africa-66670677
In pictures: Rare blue supermoon around the world,/news/in-pictures-66662857
Is wildlife photo a ghostly face or a fish?,/news/science-environment-66604630
