title,url
Dozens killed after two trains collide in Greece,/news/live/world-europe-64807384
Survivors describe 'nightmarish seconds' as trains crashed,https://www.bbc.com/news/world-europe-64806678
Ruling party wins Nigeria's presidential election,https://www.bbc.com/news/world-africa-64760226
The problem confronting women of colour,https://www.bbc.com/worklife/article/20230228-the-perfect-storm-keeping-women-of-colour-behind-at-work
The return of the US' lost language,https://www.bbc.com/travel/article/20230228-kouri-vini-the-return-of-the-us-lost-language
Devastation at scene of deadly Greece train crash,/news/world-europe-64808068
Covid origin likely China lab incident - FBI chief,/news/world-us-canada-64806903
Trump lashes out at Murdoch over vote fraud case,/news/world-us-canada-64806437
Rashid removes Shanto to leave Bangladesh 159-5 in first ODI,/sport/live/cricket/64797494
FA Cup reaction & Premier League build-up,/sport/live/football/64808173
Foden scores twice as Man City beat Bristol City,/sport/football/64788956
The 1991 video game phenomenon,https://www.bbc.com/culture/article/20230228-street-fighter-ii-the-1991-video-game-that-packs-a-punch
A new way to navigate work and life,https://www.bbc.com/worklife/article/20230227-what-does-work-life-balance-mean-in-a-changed-work-world
The Greek meatballs packed with history,https://www.bbc.com/travel/article/20230228-soutzoukakia-the-greek-meatballs-packed-with-history
Why the world faces a 'genomic gap',https://www.bbc.com/future/article/20230227-the-search-for-the-worlds-missing-genomes
A Nordic country's remedy for stress,https://www.bbc.com/travel/article/20230227-greenlands-natural-medicine-for-the-soul
Why is Israel-Palestinian violence surging?,https://www.bbc.com/news/world-middle-east-64757995
Daily walk prevents one in 10 early deaths - study,https://www.bbc.com/news/health-64790527
The tiny diamond sphere that could unlock clean power,https://www.bbc.com/news/business-64553796
The high-tech weed sprayers cutting herbicide use,https://www.bbc.com/news/business-64742513
New CCTV shows missing baby pair minutes before arrest,/news/uk-64806501
New CCTV shows missing baby pair minutes...,/news/uk-64806501
Watch Kate beat William in spin class...,/news/uk-64803331
Couple have not revealed missing baby...,/news/uk-64803151
WATCH: Key moments from PM's NI Brexit deal...,/news/uk-64791359
EU Chief on NI deal: 'We were honest with...,/news/uk-64791545
The 'smart suit' that is changing children's...,/news/uk-england-london-64791997
View from the cockpit of a Ukraine combat...,/news/world-europe-64779730
Watch: Skies sparkle as northern lights seen...,/news/uk-64783923
Teddies rain down on pitch during football...,/news/world-europe-64783651
Suspected gang members moved to El Salvador...,/news/world-latin-america-64769936
Pictures show devastation after Greece train disaster,/news/world-europe-64808123
Guilt-free flying not in easy reach - scientists,/news/science-environment-64788106
YouTube accused of collecting UK children's data,/news/technology-64786968
Eurovision festival to feature submarines and raves,/news/entertainment-arts-64802552
Relief as Hong Kong lifts 945-day mask mandate,/news/world-asia-china-64806987
What is carbon capture and can it fight climate change?,/news/science-environment-64723497
Blackpink lead top stars back on the road in Asia,https://www.bbc.co.uk/news/business-64286127
Mariupol: Tragic deaths and daring escapes,https://www.bbcselect.com/watch/mariupol-the-peoples-story/?utm_source=BBC+Select&utm_medium=Social&utm_campaign=Mariupol+the+peoples+story
Can technology clean up the shrimp farming business?,https://www.bbc.com/news/business-64496392
Spectacular northern lights seen across UK,/news/uk-64782372
SAG Awards: The red carpet in pictures,/news/entertainment-arts-64781316
Vigils and flags: Ukraine war anniversary in pictures,/news/in-pictures-64757068
The 24-year photography project,/news/in-pictures-64723755
Outlaw-themed parade triumphs at Rio carnival,/news/world-latin-america-64742729
