title,url
Russia hits Ukraine blood transfusion centre - Zelensky,/news/world-europe-66419331
Trump social media post flagged to judge in court filing,/news/world-us-canada-66417168
The Russians hunting for cheap flats in occupied Mariupol,/news/world-66393949
Watch Fifa Women's World Cup: Netherlands 1-0 South Africa,/sport/live/football/66183773
Alarming photos show typhoon floods engulfing Asia,/news/in-pictures-66400905
MrBeast: How the world's biggest YouTuber made his millions,/news/technology-66372679
"Before key abortion vote, Republicans try to change the rules",/news/world-us-canada-66375877
Italian fugitive caught after seen cheering football,/news/world-europe-66416101
England boost as Walsh returns to training,/sport/football/66419943
Wales defeat disappointing England in Cardiff,/sport/rugby-union/66412166
Can £72m Hojlund rival Haaland in Manchester?,/sport/football/66243517
The town where people live underground,https://www.bbc.com/future/article/20230803-the-town-where-people-live-underground
The drink thought to fight heatstroke,https://www.bbc.com/travel/article/20230802-kokum-indias-naturally-cooling-fruit-juice
Eight people who rapped long before hip-hop,https://www.bbc.com/culture/article/20230803-eight-forgotten-forerunners-of-hip-hop-from-jazz-hep-cat-slim-gaillard-to-dirty-blues-singer-lucille-bogan
Have women got the kit they deserve?,https://www.bbc.com/culture/article/20230804-womens-world-cup-2023-how-female-players-have-finally-got-the-football-kit-they-deserve
The sign workers are getting pushed out,https://www.bbc.com/worklife/article/20230718-pip-performance-improvement-plan-underperforming-workers-problem
"Pakistan's iconic, 'healthy pizza'",https://www.bbc.com/travel/article/20230804-chap-shuro-pakistans-iconic-healthy-pizza
The truth about baby-led weaning,https://www.bbc.com/future/article/20230728-baby-led-weaning-what-are-the-risks-and-benefits
'This is only going to get worse' - Arab satirists hit back at ban,https://www.bbc.com/news/world-middle-east-66397036
Why Starbucks cannot crack coffee-loving Vietnam,https://www.bbc.com/news/world-asia-66167222
Russia widens its conscription net: 'I live in constant fear',https://www.bbc.com/news/world-europe-66388422
Tech Decoded: The latest news direct to your inbox,https://www.bbc.com/news/technology-65786969
Devastating wildfires spur new detection systems,https://www.bbc.com/news/business-66266186
Watch: Ukrainian sea drone targets Russian tanker,/news/world-europe-66414547
Watch: Ukrainian sea drone targets Russian...,/news/world-europe-66414547
German city hit by massive hail storm,/news/world-europe-66418007
Watch: Florida officer jumps onto a runaway...,/news/world-us-canada-66411750
Chaos breaks out at NYC giveaway event,/news/world-us-canada-66410112
Watch as RAF jets intercept 'zombie' Russian...,/news/uk-scotland-66405686
Trump's day in court for election lies...in...,/news/world-us-canada-66401963
One-minute World News,/news/10462520
Parents called on Florida teen driving 132mph,/news/world-us-canada-66400461
Helmet camera shows hiker rescue in extreme...,/news/world-us-canada-66378087
"Lizzo needs to be held accountable, say...",/news/entertainment-arts-66400669
Wannabe rapper guilty of $4.5bn Bitcoin laundering,/news/technology-66390639
What are semiconductors and how are they used?,/news/technology-66394406
Krishnan Guru-Murthy joins Strictly line-up,/news/entertainment-arts-66408141
Chance discovery helps fight against malaria,/news/health-66394117
Tech shares fall as China mulls child phone limits,/news/business-66391263
Travis Scott in chart Utopia with first number one,/news/entertainment-arts-66408144
"Coronations, celebrations and coups: Africa’s top shots",/news/world-africa-66394367
New AI systems collide with copyright law,https://www.bbc.com/news/business-66231268
'We hand-ice millions of biscuits',https://www.bbc.com/news/business-66330395
In pictures: Supermoon lights up night sky,/news/world-66376332
'Dream come true' exhibition for city photographer,/news/uk-england-coventry-warwickshire-66371960
Photographer catches 'once in a lifetime' picture,/news/uk-england-cornwall-66332656
"Water, fire and oceans: Africa’s top shots",/news/world-africa-66323739
Sinéad O'Connor: Fans mourn in London and Dublin,/news/in-pictures-66333764
