title,url
US midterms: Final hours of voting as key races on knife-edge,/news/live/world-us-canada-63157389
"'Angry, petrified...' US voters share their fears",https://www.bbc.com/news/world-us-canada-63548188
Norway princess gives up royal duties,https://www.bbc.com/news/world-europe-63562191
'Superior to most superhero films',https://www.bbc.com/culture/article/20221108-black-panther-wakanda-forever-superior-to-most
The non-verbal rules for digital life,https://www.bbc.com/worklife/article/20221104-how-non-verbal-communication-is-going-digital
Williamson resigns after bullying claims,/news/uk-politics-63563263
Winner announced in historic $2bn US Powerball draw,/news/world-us-canada-63545192
Awarding Qatar the World Cup a mistake - Blatter,/sport/football/63554507
"EFL Cup: Cherries cruise past Everton, Leicester beating Newport",/sport/live/football/63476334
Liverpool for sale? What's going on at Anfield,/sport/football/63555465
Rugby World Cup final to set new attendance record,/sport/rugby-union/63563147
The big moments to watch for on election night,https://www.bbc.com/news/world-us-canada-63402244
Why Kentucky might deliver a shock abortion vote,https://www.bbc.com/news/world-us-canada-63537475
How might midterms impact around the world?,https://www.bbc.com/sounds/play/p0dcqc2l
The exes trapped in shared homes,https://www.bbc.com/worklife/article/20221103-the-exes-forced-to-live-together-after-breaking-up
The secret language men don't know,https://www.bbc.com/culture/article/20221107-nushu-chinas-secret-female-only-language
One of Earth's last 'un-owned' lands,https://www.bbc.com/travel/article/20221108-the-north-pole-one-of-earths-last-un-owned-lands
How a cold home harms your health,https://www.bbc.com/future/article/20221107-energy-crisis-how-living-in-a-cold-home-affects-your-health
Actor Leslie Phillips dies aged 98,https://www.bbc.com/news/entertainment-arts-63557414
Putin allies who criticise Russia's war machine,https://www.bbc.com/news/world-europe-63468600
BBC presenter got sepsis after doing awareness interview,https://www.bbc.com/news/uk-scotland-63546160
Why an old train could point to a clean energy future,https://www.bbc.com/news/business-62619313
'There really is more to life than posting on Instagram',https://www.bbc.com/news/business-63482162
Actor Sean Penn gives his Oscar to Zelensky,/news/world-europe-63561236
Actor Sean Penn gives his Oscar to Zelensky,/news/world-europe-63561236
Trump hints at run for presidency as he votes,/news/world-us-canada-63562025
How climate change can fuel the spread of...,/news/science-environment-63556927
In the name of atheism: The case of Mubarak...,/news/world-africa-63496455
Boris Johnson at COP27 in 'purely supportive...,/news/science-environment-63541982
Barbados PM's plea to rich nations at COP27,/news/science-environment-63557041
William talks football and mental health with...,/news/uk-63541633
Fireworks thrown at emergency service workers,/news/uk-63535473
Rescuers search site of crashed plane in...,/news/world-africa-63534266
Fossil abstinence isn't working - climate...,/news/uk-politics-63534039
"COP27: Pay climate bill, insist nations at risk",/news/science-environment-63559426
Stolen $3bn Bitcoin mystery ends with popcorn tin,/news/technology-63547765
The Crown's cast defend show after 'big fuss',/news/entertainment-arts-63559862
US flu hospital cases rocket as vaccinations fall,/news/world-us-canada-63522871
EastEnders star Bill Treacher dies aged 92,/news/entertainment-arts-63558420
Facebook owner Meta expected to make big job cuts,/news/technology-63541591
Ten days of Twitter chaos,/news/technology-63539246
The 'superpower' behind great art,https://www.bbc.com/culture/article/20221102-synaesthesia-the-superpower-behind-great-art
Elon Musk: Superhero or supervillain?,https://www.bbcselect.com/watch/elon-musk/
Your pictures on the theme of 'sculpture',/news/in-pictures-63486977
"Northern Lights, Tutankhamun and cakes: Photos of the week",/news/in-pictures-63514358
Crocodile close-up wins mangrove photo awards,/news/in-pictures-63472199
In pictures: Lula beats Bolsonaro,/news/world-latin-america-63451896
Africa's top shots: Red rings and seas of green,/news/world-africa-63411863
