title,url
US banking shares start to rebound after SVB collapse,/news/business-64949786
"Facebook-owner Meta to cut 10,000 staff",https://www.bbc.com/news/technology-64954124
Paris holds its nose as waste piles up in strike,https://www.bbc.com/news/world-europe-64950503
The slowest train journey in India,https://www.bbc.com/travel/article/20230313-the-slowest-train-journey-in-india
Did this condition inspire Lewis Carroll?,https://www.bbc.com/future/article/20230313-the-mystery-of-alice-in-wonderland-syndrome
US shares rebound after Silicon Valley Bank turmoil,/news/live/business-64940883
'Customers freaked': Silicon Valley Bank saga in 80 seconds,/news/world-us-canada-64952039
Russian soldier held 'after six months in hiding',/news/world-europe-64949000
Premier League news conferences & Champions League build-up,/sport/live/football/64948883
The King and his kids - inside Hagi's plan to restore Romania's glory,/sport/football/64920773
Bangladesh complete T20 clean sweep over England,/sport/cricket/64944029
Why layoffs hit workers of colour hard,https://www.bbc.com/worklife/article/20230308-why-layoffs-workers-of-colour-so-hard
Why bushcraft is booming again,https://www.bbc.com/travel/article/20230312-why-bushcraft-is-booming-again
The 'sleeping giant' of sea level rise,https://www.bbc.com/future/article/20230309-climate-change-the-sea-level-rise-locked-in-east-antarctica
John Wick: Chapter 4 'soars',https://www.bbc.com/culture/article/20230313-john-wick-chapter-4-soars-above-most-action-films
"Everything Everywhere explained, All At Once",https://www.bbc.com/news/entertainment-arts-64938320
When might the asteroid hit Earth?,https://www.bbc.com/news/world-us-canada-64938134
Avril Lavigne confronts topless protester onstage,https://www.bbc.com/news/entertainment-arts-64949073
Could waste plastic become a useful fuel source?,https://www.bbc.com/news/business-64703976
The tech helping women manage the menopause,https://www.bbc.com/news/business-64899189
Baby kangaroo rescued from crocodile-infested waters,/news/world-australia-64952199
Baby kangaroo rescued from crocodile-infested...,/news/world-australia-64952199
Inside Oscars A-list after-party,/news/entertainment-arts-64946198
Michelle Yeoh's mum in tears after Oscars win,/news/entertainment-arts-64942684
'Not affected by one party or other' - BBC...,/news/uk-64937660
Lineker: The BBC director general's interview...,/news/uk-64937658
Chancellor on HSBC buying UK arm of Silicon...,/news/business-64937654
Best Oscars acceptance speeches... in 61...,/news/entertainment-arts-64935382
"I can't say anything at the moment, I'm sorry...",/news/uk-64932702
A weekend of BBC football show chaos... in 90...,/news/uk-64929759
The best fashion looks at the Oscars,/news/entertainment-arts-64935067
Man sues women for helping ex-wife get abortion,/news/world-us-canada-64944416
UK engineers help Turkey assess earthquake damage,/news/science-environment-64920236
US government approves Alaska Willow oil project,/news/world-us-canada-64943603
Global bank stocks slump despite Biden reassurances,/news/world-us-canada-64935170
Stormzy and Dua Lipa to appear at Hay Festival,/news/uk-wales-64950349
Wild swan conservation success gives cause for hope,/news/science-environment-64944172
Is there a better way to insulate our draughty homes?,https://www.bbc.com/news/business-64636384
UK microchip firms call for millions in investment,https://www.bbc.com/news/business-64872465
'I rarely saw people who looked like me',/news/uk-england-merseyside-64881091
Tributes paid to acclaimed documentary photographer,/news/uk-england-tyne-64918073
Africa's top shots: Cool frames and gold nuggets,/news/world-africa-64902352
Robert Blake: From Hollywood to murder accused,/news/world-us-canada-64911059
Photographers capture March's 'worm moon',/news/uk-england-york-north-yorkshire-64887992
