title,url
Hollywood actors announce start of historic strike,/news/entertainment-arts-66196357
El Salvador's secretive mega-jail,https://www.bbc.co.uk/news/resources/idt-81749d7c-d0a0-48d0-bb11-eaab6f1e6556
India set to launch historic Moon mission,https://www.bbc.com/news/world-asia-india-66185565
The most intense lightning ever seen,https://www.bbc.com/future/article/20230713-how-the-tonga-hunga-volcano-produced-the-most-intense-lightning-ever-seen
France's illustrious blue lobster,https://www.bbc.com/travel/article/20230712-frances-illustrious-blue-breton-lobster
What happens next as Hollywood grinds to a halt,/news/entertainment-arts-66196019
Stars walk Oppenheimer red carpet - then leave,/news/entertainment-arts-66196311
Lisa Marie Presley's cause of death revealed,/news/world-us-canada-66195853
Dele Alli says he was sexually abused as a child,/sport/football/66187943
The 'African king' leading a revolution,/sport/cycling/66186949
Jabeur wins thriller to set up Vondrousova final,/sport/tennis/66191815
The maps revealing urban heat stress,https://www.bbc.com/future/article/20230706-the-simple-ways-cities-can-adapt-to-heatwaves
In pictures: Heatwave hits parts of Europe,https://www.bbc.com/news/world-europe-66187056
The ancient Chinese way to cool homes,https://www.bbc.com/future/article/20230712-how-ancient-skywells-are-keeping-chinese-homes-cool
The 10 best TV shows of 2023 so far,https://www.bbc.com/culture/article/20230713-best-tv-shows-of-2023
Who was the real Robert Oppenheimer?,https://www.bbc.com/future/article/20230712-robert-oppenheimer-manhattan-project-nuclear-scientist-atomic-bomb
A surprising effect of high living cost,https://www.bbc.com/worklife/article/20230713-how-the-cost-of-living-crisis-is-fuelling-job-quits
Azerbaijan's ever-burning fire temples,https://www.bbc.com/travel/article/20230712-azerbaijan-the-caucasus-land-of-fire
Hundreds of golden retrievers gather in Highlands,https://www.bbc.com/news/uk-scotland-highlands-islands-65954415
America's oldest craft brewery shuts after 127 years,https://www.bbc.com/news/business-66193315
Is cricket's next big disruptor coming from the USA?,https://www.bbc.com/sport/cricket/66143470
The US military revives an idea for stealthy sea power,https://www.bbc.com/news/business-65958967
The flatpack homes rehousing Ukrainian families,https://www.bbc.com/news/business-66044111
Drone shows great white sharks swimming under surfers,/news/world-us-canada-66194670
Drone shows great white sharks swimming under...,/news/world-us-canada-66194670
Watch: Water thrown at Kosovo PM in...,/news/world-europe-66193089
North Korean state TV shows latest missile...,/news/world-asia-66184881
Watch: The Huw Edwards story so far... in 87...,/news/entertainment-arts-66181610
'This is such dramatic news' - Katie Razzall,/news/entertainment-arts-66181603
Footage shows devastating floods in Vermont,/news/world-us-canada-66170640
One-minute World News,/news/10462520
South Korea welcomes first panda twins,/news/world-asia-66172308
Watch: Drone captures Icelandic volcano...,/news/world-europe-66161173
BBC Boss Tim Davie says claims are damaging...,/news/entertainment-arts-66165183
'Nerve-shredding' film explores perils of freediving,/news/entertainment-arts-65855143
US refuses climate reparations for developing nations,/news/world-us-canada-66197366
Rise in school-leavers picking computing courses,/news/technology-66178247
Semenya wins court appeal on human rights grounds,/sport/athletics/66162083
China accused of hacking US government emails,/news/business-66184678
In pictures: President Biden visits the UK,/news/in-pictures-66155089
Watch man catch Florida’s longest-ever Burmese python,/news/world-us-canada-66197675
The entrepreneurs celebrating their past failures,https://www.bbc.com/news/business-66096066
The latest technology news direct to your inbox,https://cloud.email.bbc.com/techdecoded-newsletter-signup
The Scot who photographs life underwater,/news/uk-scotland-south-scotland-66109289
Best in show: Africa's top shots,/news/world-africa-66118610
In pictures: King Charles III celebrations,/news/uk-scotland-66108829
Mystery of Holocaust escape girls finally solved,/news/uk-england-tyne-66040197
Eid al-Adha around the world in pictures,/news/world-66041087
