title,url
"More than 2,600 dead in Turkey and Syria after major earthquakes",/news/live/64533954
Turkish Roman-era castle destroyed by earthquake,https://www.bbc.com/news/world-europe-64541894
Second balloon over Latin America is ours - China,https://www.bbc.com/news/world-64537098
Planes narrowly avoid collision at Texas airport,https://www.bbc.com/news/world-us-canada-64541670
Why the world feels so uncertain,https://www.bbc.com/future/article/20230203-why-the-world-feels-so-unstable-right-now
Turkey earthquake toll may rise eight-fold - WHO,/news/world-europe-64533851
What can the US learn from Chinese balloon debris?,/news/world-us-canada-64541671
New footage emerges of derailed train in Ohio,/news/world-us-canada-64547226
Man City charged with breaking financial rules,/sport/football/64536785
Leeds sack boss Marsch after less than year in role,/sport/football/63339426
Joshua to face Franklin in comeback fight,/sport/boxing/64542479
The ripple effects of layoffs,https://www.bbc.com/worklife/article/20230203-stress-anxiety-global-layoffs
The lost people of a Mediterranean isle,https://www.bbc.com/travel/article/20230205-menorcas-mysterious-tables-for-giants
Cinema's ultimate scene-stealers,https://www.bbc.com/culture/article/20230203-eo-cinemas-ultimate-scene-stealers
America's missing eastern dinosaurs,https://www.bbc.com/future/article/20230202-the-weird-dinosaurs-of-americas-lost-continent
The eyewitnesses who captured the quake on social media,https://www.bbc.com/news/world-64541194
Five takeaways from the 2023 Grammy Awards,https://www.bbc.com/news/entertainment-arts-64535376
Digital cameras back in vogue after online revival,https://www.bbc.co.uk/news/technology-64512059
'Investing in the artist makes me feel more involved in the song',https://www.bbc.com/news/business-64486877
The next frontier for heat pumps,https://www.bbc.com/future/article/20230131-can-city-dwellers-ever-have-heat-pumps
Second quake hits while Turkish TV crew are on air,/news/world-europe-64539131
Second quake hits while Turkish TV crew are...,/news/world-europe-64539131
On the ground near earthquake epicentre,/news/world-europe-64539605
Building collapses in Turkey after deadly...,/news/world-europe-64535666
Tearful rescuer begs world for help after...,/news/world-middle-east-64535668
Aerials of totally destroyed buildings in...,/news/world-middle-east-64539126
'People are still trapped under the rubble',/news/world-europe-64535665
One-minute World News,/news/10462520
Toddler rescued from collapsed Syria building,/news/world-middle-east-64535667
CCTV captures moment deadly earthquake struck,/news/world-europe-64535549
Fire engulfs Buddhist temple in Australia,/news/world-australia-64536038
Grammys 2023: Red carpet fashion in pictures,/news/entertainment-arts-64533242
'Sensational' Happy Valley finale praised,/news/entertainment-arts-64533515
Google launches ChatGPT rival called Bard,/news/technology-64546299
Number of staff suing Twitter 'goes up daily',/news/technology-64512053
Infected blood inquiry: Five things we have learned,/news/health-64497868
The 'alien' sounds you have probably never heard,/news/science-environment-64514258
Free DIY home HIV tests offered in England,/news/health-64513915
How we fell out of love with voice assistants,/news/business-64371426
Can Sri Lanka trade its way back to prosperity?,https://www.bbc.com/news/business-64464220
Image of 'vulnerable' plant wins photo award,/news/in-pictures-64472234
Africa's top shots: Yellow disguises and bird chasers,/news/world-africa-64497630
In pictures: Up Helly Aa,/news/uk-scotland-64464271
Heavy snow disrupts life in India's Himalayan states,/news/world-asia-india-64462193
The defiant low-lying island 70 years after floods,/news/uk-england-essex-64255567
