title,url
Nashville shooter bought seven guns legally - police,/news/live/world-us-canada-65087221
Where does US gun control go from here?,https://www.bbc.com/news/world-us-canada-61591236
New cars sold in EU must be zero-emission from 2035,https://www.bbc.com/news/world-europe-65105129
'The horizon turned black' - riding the world's biggest wave,https://www.bbc.com/sport/surfing/65056499
Why male fertility is in decline,https://www.bbc.com/future/article/20230327-how-pollution-is-causing-a-male-fertility-crisis
Bodycam footage shows police response,/news/world-us-canada-65104632
Beloved school head among Nashville shooting victims,/news/world-us-canada-65095355
Russian whose daughter drew anti-war picture flees jail term,/news/world-europe-65102392
Euro 2024 qualifier: Are astonishing Scotland really about to beat Spain?,/sport/live/football/65053060
Euro 2024 qualifier: Wales 1-0 Latvia - Moore heads Wales in front,/sport/live/football/65091668
Fury can 'redeem himself' by fighting me - Joshua,/sport/boxing/65099066
The return of the X-planes?,https://www.bbc.com/future/article/20230324-how-x-planes-may-solve-the-sonic-boom-problem
The 12 best TV shows to watch in April,https://www.bbc.com/culture/article/20230327-the-12-best-tv-shows-to-watch-in-april
The outlawed drink making a comeback,https://www.bbc.com/travel/article/20230327-chicha-the-banned-drink-of-colombia
How Gen Z is seeing gender in new ways,https://www.bbc.com/worklife/article/20230327-how-young-people-are-shaking-off-gender-binaries
Who is Scotland's new leader Humza Yousaf?,https://www.bbc.com/news/uk-scotland-scotland-politics-64874821
Amateur Australian gold digger finds massive nugget,https://www.bbc.com/news/world-australia-65095925
Alexa Bliss cancer scare highlights sunbeds concern,https://www.bbc.com/news/newsbeat-65069697
The tech helping driverless cars see round corners,https://www.bbc.com/news/business-65036895
The web firm that wants to stop you getting 'cancelled',https://www.bbc.com/news/business-65050160
Five things to know about Scotland's new first minister,/news/uk-scotland-65106632
Five things to know about Scotland's new...,/news/uk-scotland-65106632
Car smashes into Cambridgeshire living room,/news/uk-65106417
Police release CCTV of US school shooter,/news/65100000
Man uses bare hands to rescue trapped gold...,/news/world-africa-65095295
Watch: Bike ride through UK's new super sewer,/news/science-environment-65091803
Orlando Bloom surprises children in Kyiv,/news/world-europe-65085212
Fire and fury as Israelis take to the streets,/news/world-middle-east-65083930
'My uncle's trailer was flattened - he was...,/news/world-us-canada-65083928
Prince Harry bumps into photographer outside...,/news/uk-65085209
Drama in the courtroom as Gwyneth Paltrow...,/news/world-us-canada-65072030
Five planets line up with Moon in night sky,/news/science-environment-65056407
Binance accused of breaking US financial laws,/news/business-65091480
Gary Lineker wins appeal over £4.9m tax bill,/news/entertainment-arts-65103265
Facial recognition used nearly 1m times by US police,/news/technology-65057011
Utah first US state to limit teen social media use,/news/world-us-canada-65060733
'We hardly get by - but it's better than begging',/news/world-middle-east-65058100
Northern lights dazzle in parts of UK overnight,/weather/features/65061790
Crewless container ships appear on the horizon,/news/business-64875319
US firms 'more negative' about doing business in China,https://www.bbc.com/news/business-65034881
A lover's embrace and purple royals: Africa's top shots,/news/world-africa-65049764
Cherry blossoms draw spectators and photographers,/news/uk-england-birmingham-65043539
Photos saved from tip to be added to city archive,/news/uk-england-coventry-warwickshire-64980965
Living with water pollution in Guatemala,/news/world-latin-america-65047381
California battles deadly storm and flooding,/news/world-us-canada-64959807
