title,url
Zelensky says Russia blew up dam as thousands evacuated from flood,/news/live/world-europe-65816109
"PGA Tour, LIV Golf & DP World Tour in shock merger",https://www.bbc.com/sport/golf/65825327
Cuba Gooding Jr settles rape lawsuit ahead of civil trial,https://www.bbc.com/news/entertainment-arts-65825715
Why are there mountains inside Earth?,https://www.bbc.com/future/article/20230605-the-hidden-mountains-lurking-deep-within-our-planet
Why AI won't be a burnout cure,https://www.bbc.com/worklife/article/20230605-why-ai-wont-be-the-burnout-cure-weve-been-waiting-for
"Sources were behind Harry stories, not hacking - Mirror lawyer",/news/live/uk-65818773
Inside the Taliban's crackdown on opium,https://www.bbc.co.uk/news/world-asia-65787391
The fake job that snared FBI agent spying for Moscow,/news/world-us-canada-65820220
Liang and Li handed lifetime bans for match-fixing,/sport/snooker/65641122
Listen: French Open - Djokovic leads Khachanov by two sets and break,/sport/live/tennis/65672280
Tottenham name Postecoglou as new manager,/sport/football/65819185
The chatbots that say they can feel,https://www.bbc.com/future/article/20230224-the-ai-emotions-dreamed-up-by-chatgpt
Tech Decoded: The latest news direct to your inbox,https://www.bbc.com/news/technology-65786969
'Ducking hell' to disappear from Apple autocorrect,https://www.bbc.com/news/technology-65823482
James Beard Award winners announced,https://www.bbc.com/travel/article/20230605-james-beard-award-winners-2023
Why personalised medicine hasn't arrived,https://www.bbc.com/future/article/20230602-are-we-entering-the-era-of-personalised-medicine
Will a four-day week get workers back?,https://www.bbc.com/worklife/article/20230530-will-the-four-day-workweek-get-employees-back-in-office
The 1983 film decades ahead of its time,https://www.bbc.com/culture/article/20230605-local-hero-why-the-iconic-scottish-environmental-film-was-decades-ahead-of-its-time
Europe's under-the-radar gay hotspot,https://www.bbc.com/travel/article/20230605-torremolinos-where-spains-gay-rights-movement-began
What we know about Ukraine dam attack,https://www.bbc.com/news/world-europe-65818705
First sprinter to run 100m in under 10 seconds dies,https://www.bbc.com/news/world-us-canada-65692022
Why millions of useable hard drives are being destroyed,https://www.bbc.com/news/business-65669537
The tech tricks that make computer games look real,https://www.bbc.com/news/business-65532128
Building floats along flooded Dnipro river,/news/world-europe-65825444
Building floats along flooded Dnipro river,/news/world-europe-65825444
Watch: Water gushes through damaged Ukraine...,/news/world-europe-65818715
Swans seen swimming through Nova Kakhovka,/news/world-europe-65818722
Haiti floods: Residents shelter on rooftops,/news/world-latin-america-65820863
Cat upstages royal historian mid-BBC...,/news/uk-65816316
Why is Prince Harry heading to the High...,/news/uk-65768596
Wreckage cleared from tracks after India...,/news/world-asia-india-65805709
'Chaos' outside hospital after India train...,/news/world-asia-india-65799373
Brian Cox 'hasn't watched Succession finale',/news/entertainment-arts-65803015
Uganda's Ghetto Kids seek glory in UK talent...,/news/world-africa-65796860
Love Island summer launch loses 1m TV viewers,/news/entertainment-arts-65818567
Ghana patients in danger as nurses head for UK - medics,/news/world-africa-65808660
"Apple unveils $3,499 mixed reality headset",/news/technology-65809408
Girl from Ipanema singer Astrud Gilberto dies,/news/entertainment-arts-65818566
How is my country doing tackling climate change?,/news/science-environment-65754296
Strawberry Moon captured over England,/news/uk-england-leicestershire-65802574
Could ultra-processed foods be harmful for us?,/news/health-65754290
The 'exploding' demand for giant heat pumps,https://www.bbc.com/news/business-65321487
The chip maker that became an AI superpower,https://www.bbc.com/news/business-65675027
Top Scottish landscape photographers announced,https://www.bbc.co.uk/news/articles/c6p34zr7rz7o
Long lashes and fashion flair: Africa's top shots,/news/world-africa-65772200
New Yorkers gather for Manhattanhenge,/news/world-us-canada-65761850
Photographing history: The quarrymen of Wales,/news/uk-wales-65717619
Photographer blends Africa with Welsh communities,/news/uk-wales-65709322
