title,url
Insurgents defeated after rare border raid - Russia,/news/world-europe-65683374
Intercepting Russian 'Zombies' at a Nato airbase,https://www.bbc.com/news/world-europe-65673272
Why DeSantis's risky feud with Disney may pay off,https://www.bbc.com/news/world-us-canada-65676131
The 'flawed' skill that shaped history,https://www.bbc.com/future/article/20230518-foresight-the-mental-talent-that-shaped-the-world
The number one children's book revealed,https://www.bbc.com/culture/article/20230522-where-the-wild-things-are-the-best-childrens-book-ever
Canada inquiry into election meddling ruled out,/news/world-us-canada-65688455
Prince Harry loses challenge to pay for security,/news/uk-65609209
Driver charged after truck crash near White House,/news/world-us-canada-65679329
Arsenal forward Saka signs new long-term contract,/sport/football/65686263
Hooked on risk - gambling's grip on elite sport,/sport/65601190
Guardiola hails Brighton's 'influential' De Zerbi,/sport/football/65687254
The 100 greatest children's books of all time,https://www.bbc.com/culture/article/20230522-the-100-greatest-childrens-books-of-all-time
What global experts think about the top 20 books,https://www.bbc.com/culture/article/20230522-the-20-greatest-childrens-books-ever-what-the-voters-say
The dark side of Roald Dahl,https://www.bbc.com/culture/article/20160912-the-dark-side-of-roald-dahl
The Dutch solution to stress,https://www.bbc.com/travel/article/20230522-the-dutch-solution-to-busyness-that-captivated-the-world
Why NYC is sinking under its own weight,https://www.bbc.com/future/article/20230523-new-yorks-skyscrapers-are-causing-it-to-sink-what-can-be-done-about-it
A fairy tale 'for the age of Marvel movies' ★★★☆☆,https://www.bbc.com/culture/article/20230522-the-little-mermaid-review-a-spectacle-with-an-allure-and-vitality-of-its-own
An iconic New York Jewish food,https://www.bbc.com/travel/article/20230522-simple-homemade-gravlax
How embracing AI gets workers ahead,https://www.bbc.com/worklife/article/20230522-ai-optimism-how-embracing-artificial-intelligence-is-getting-workers-ahead
Who are the fighters infiltrating Russia from Ukraine?,https://www.bbc.com/news/world-europe-65681806
Thor and Star Wars actor Ray Stevenson dies at 58,https://www.bbc.com/news/uk-northern-ireland-65677440
Why car parks are the hottest space in solar power,https://www.bbc.com/news/business-65626371
Protein's power is being uncovered and unleashed,https://www.bbc.com/news/business-65468298
Could police search solve Madeleine McCann mystery?,/news/uk-65685094
Could police search solve Madeleine McCann...,/news/uk-65685094
Cardiff riot: It was complete chaos,/news/uk-wales-65680982
Watch: Mexican volcano spews ash into starry...,/news/world-latin-america-65671578
Sinfield describes carrying Burrow over...,/news/uk-65685212
'Pay your writers!' Student chants interrupt...,/news/world-us-canada-65670039
First pictures from scene of Madeleine search,/news/uk-65675817
Watch: Green flash as meteor blazes across...,/news/world-australia-65668065
One-minute World News,/news/10462520
Watch: Activists turn Trevi Fountain water...,/news/world-europe-65666775
Naga Munchetty: ‘I’m in pain because I...,/news/uk-65670355
What can art tell us about the story of Britain?,/news/entertainment-arts-65653851
Brazil declares emergency over bird flu cases,/news/world-latin-america-65679328
Indian banks start exchanging withdrawn top currency,/news/world-asia-india-65679657
AI scanner used in hundreds of US schools misses knives,/news/technology-65342798
Ivory ban to extend to hippos and killer whales,/news/science-environment-65673951
How Ukraine is tackling the mental scars of war,/news/world-europe-65418075
Rushdie reveals he is writing again after attack,/news/entertainment-arts-65686590
'We are selling a product that we hope gets discontinued',https://www.bbc.com/news/business-65572881
How computer games encourage kids to spend cash,https://www.bbc.com/news/business-65372710
Ray Stevenson's film and TV career in pictures,/news/entertainment-arts-65679323
Picnics and blooms: The Chelsea Flower Show in pictures,/news/in-pictures-65669737
"Showers, shopping and soccer: The best of British press photography",/news/in-pictures-65645239
"Dancers, divers and film-makers: Africa's top shots",/news/world-africa-65622722
Slurping Spaghetti and other food photo contest winners,/news/in-pictures-65549869
