title,url
India expels Canadian diplomat as Sikh murder row escalates,/news/live/world-66851939
US citizens freed from Iran in $6bn prisoner swap,https://www.bbc.com/news/world-middle-east-66841137
Debris found from F-35 jet after US pilot ejected,https://www.bbc.com/news/world-us-canada-66850422
Musk suggests Twitter could go behind paywall,https://www.bbc.com/news/technology-66850821
How I rewired my brain in six weeks,https://www.bbc.com/future/article/20230912-how-i-hacked-my-brain
YouTube suspends Russell Brand from advert income,/news/entertainment-arts-66851698
Police smash in car window to save flood-trapped man,/news/world-us-canada-66847675
Why unity is thin on the ground as UN meets in New York,/news/world-us-canada-66846608
Champions League build-up and Premier League reaction,/sport/live/football/66847065
Spain squad shows 'nothing has changed' - Hermoso,/sport/football/66852359
Chubb suffers serious knee injury in Browns defeat,/sport/american-football/66851631
The cleanest air on Earth?,https://www.bbc.com/travel/article/20230918-a-picturesque-island-with-the-cleanest-air-on-earth
Why do we name scary things?,https://www.bbc.com/future/article/20230914-why-we-personify-threatening-events
"Why 'wear, wash, repeat' makes sense",https://www.bbc.com/culture/article/20230918-why-wearing-one-favourite-garment-all-the-time-makes-sense
The rise of 'finfluencers',https://www.bbc.com/worklife/article/20230915-should-you-trust-personal-finance-advice-from-a-finfluencer
Artist took the money and ran - now it's payback time,https://www.bbc.com/news/world-europe-66847139
Rare dinosaur 'Barry' up for sale at Paris auction,https://www.bbc.com/news/world-europe-66841201
Russell Brand gives a sobering reminder of the noughties,https://www.bbc.com/news/entertainment-arts-66843160
The turbo-charged plants that could boost farm output,https://www.bbc.com/news/business-66798680
Find the right BBC email newsletter for you,https://www.bbc.com/news/world-us-canada-66715271?&at_bbc_team=studios&at_medium=native&at_objective=acquisition&at_ptr_type=&at_ptr_name=bbc.com&at_format=Module&at_link_origin=bbchomepage&at_campaign=nleditorial&at_campaign_id=&at_adset_name=&at_adset_id=&at_creation=&at_creative_id=&at_campaign_type=owned
Fire guts landmark Khartoum skyscraper,/news/world-africa-66838176
Fire guts landmark Khartoum skyscraper,/news/world-africa-66838176
'All that's left is rubble and dirt and...,/news/world-africa-66833155
Rugby fans treat Nice to Welsh hymn in flash...,/news/uk-wales-66833895
On the shoreline where bodies are washing up,/news/world-africa-66830535
Drone footage shows extent of Derna...,/news/world-africa-66830533
Moment police officer dragged away by...,/news/world-us-canada-66827928
Watch: Lightning flashes over southern...,/news/uk-66842877
One-minute World News,/news/10462520
Rubiales's day in court over World Cup...,/news/world-europe-66826930
'The riverbank was not next to this mosque a...,/news/world-africa-66823715
Manson fined for blowing nose on camerawoman,/news/world-us-canada-66850232
Mike Ashley firm in talks to sell Missguided to Shein,/news/business-66836670
Mesmerising marine life photos scoop world prize,/news/in-pictures-66810094
Meditate daily to beat stress blood pressure,/news/health-66807432
"£690,000 grants aim to boost black scientists",/news/science-environment-66825633
TikTok fined €345m over children's data privacy,/news/technology-66819174
Katy Perry sells catalogue for reported $225m,/news/entertainment-arts-66853047
The tiny island with a population of 16,https://www.bbc.com/reel/playlist/future-planet?vpid=p07gsk79
The firms hoping to take psychedelic drugs mainstream,https://www.bbc.com/news/business-66669641
In pictures: Stars hit red carpet at Vogue World,/news/entertainment-arts-66808254
"Fish, flares and faces: Africa’s top shots",/news/world-africa-66807540
Stunning image of huge plasma arc wins award,/news/in-pictures-66807814
In pictures: Desperate search for flood survivors,/news/in-pictures-66805006
Photographs that shaped the urban landscape,/news/in-pictures-66784928
