title,url
Bordeaux town hall set on fire in French protests,/news/world-europe-65057249
The child whose drawing sparked a police investigation,https://www.bbc.com/news/world-europe-65015289
Five key moments in TikTok CEO's Congress grilling,https://www.bbc.co.uk/news/65047087
How Mario became a global icon,https://www.bbc.com/culture/article/20230323-super-mario-bros-the-ultimate-video-game-icon
The planes powered by seaweed,https://www.bbc.com/future/article/20230323-climate-change-how-seaweed-could-power-planes
Judge rejects Paltrow team offer of court 'treats',/news/entertainment-arts-65050951
Capitol rioter who stormed Pelosi's office jailed,/news/world-us-canada-65060096
US and Canada reach deal to reject asylum seekers,/news/world-us-canada-65047438
Reaction to Kane record & who is England's greatest ever player?,/sport/live/football/65061554
Stand-in keeper to record breaker - the makings of Kane,https://www.bbc.co.uk/sport/live/football/57944801
Messi scores 800th goal in top-level football,/sport/football/64894452
A remote-work change of heart?,https://www.bbc.com/worklife/article/20230317-the-workers-quietly-backtracking-on-return-to-office
Hollywood's most extreme actors,https://www.bbc.com/culture/article/20230322-jeremy-strong-and-hollywoods-most-extreme-actors
The tiny restaurant winning accolades,https://www.bbc.com/travel/article/20230323-dept-of-culture-new-yorks-hottest-west-african-table
How clean should your home be?,https://www.bbc.com/future/article/20230323-why-spring-cleaning-wont-benefit-your-health
'I had no idea AirTag could be used to stalk me',https://www.bbc.com/news/newsbeat-65030359
What could a TikTok ban mean for creators?,https://www.bbc.co.uk/news/newsbeat-65057760
Quiz of the week: Why was Lindsay Lohan in trouble?,https://www.bbc.com/news/world-65040607
Crewless container ships appear on the horizon,/news/business-64875319
US firms 'more negative' about doing business in China,https://www.bbc.com/news/business-65034881
Bouncer wrestles gunman trying to enter strip club,/news/world-us-canada-65058329
Bouncer wrestles gunman trying to enter strip...,/news/world-us-canada-65058329
Australian senator ends up on ground in...,/news/world-australia-65060626
Stumbling lawyers steal spotlight at Paltrow...,/news/world-us-canada-65056961
'Yes or no?' US politicians grill TikTok boss,/news/world-us-canada-65058744
What are abortion pills and could they be...,/news/world-us-canada-65047194
Bordeaux's historic town hall in flames,/news/world-europe-65058331
Mounds of rubbish and e-scooters on fire in...,/news/world-europe-65058330
Rare tornado hits Los Angeles area,/news/world-us-canada-65056771
Watch: Zebra on the loose in Seoul after zoo...,/news/world-asia-65057699
"Watch: 'Hand on heart, I did not lie' -...",/news/uk-politics-65043513
BBC suspends proposed closure of the BBC Singers,/news/entertainment-arts-65063238
Man Utd bids deadline extended amid confusion,/sport/football/65043304
Gene-edited food now legal to be sold in England,/news/science-environment-64596453
Northern lights dazzle in display across the UK,/weather/features/65061790
Utah first US state to limit teen social media use,/news/world-us-canada-65060733
What is gene-edited food and is it safe to eat?,/news/science-environment-64559210
India firm's licence cancelled after cough syrup deaths,/news/world-asia-india-65048188
A front row seat to Trump's unpredictable presidency,https://www.bbcselect.com/watch/the-trump-show/?utm_source=bbc.com&utm_medium=Homepage&utm_campaign=The+Trump+Show
'I left teaching to train as a heat pump engineer',https://ichef.bbci.co.uk/news/976/cpsprodpb/A4AD/production/_128875124_weech.2.jpg.webp
Living with water pollution in Guatemala,/news/world-latin-america-65047381
A lover's embrace and purple royals: Africa's top shots,/news/world-africa-65049764
California battles deadly storm and flooding,/news/world-us-canada-64959807
England's high streets championed in photographs,/news/uk-england-65029453
Recording a city's ghost signs before they vanish,/news/uk-england-leeds-64798380
