title,url
Senate race neck and neck as Democrats win Arizona,/news/world-us-canada-63606917
"War not over, officials warn as Ukraine celebrates",https://www.bbc.com/news/world-europe-63607568
Banksy unveils Ukraine mural on shelled building,https://www.bbc.com/news/world-europe-63606658
Undercover in the world’s dirtiest oil field,https://www.bbc.com/news/science-environment-63560279
"Premier League: Newcastle 0-0 Chelsea after wins for Liverpool, Forest & Spurs",https://www.bbc.com/sport/live/football/62619646
Ukrainian forces receive rapturous welcome in Kherson,/news/world-europe-63607628
How Republican Ron DeSantis conquered Florida,/news/world-us-canada-63565224
Joni Mitchell says her music upset male artists,/news/entertainment-arts-63596059
Premiership: Aberdeen 0-0 Dundee Utd - can hosts go third again?,/sport/live/football/63554915
England beaten in semi-final golden-point thriller,/sport/rugby-league/63609522
Nunez scores two as Jones' first game ends in defeat,/sport/football/63523917
The source of half the world's lithium,https://www.bbc.com/future/article/20221110-how-australia-became-the-worlds-greatest-lithium-supplier
The bizarre show that took over kids' TV,https://www.bbc.com/culture/article/20221110-teletubbies-the-bizarre-kids-tv-show-that-swept-the-world
The clever homes hidden from pirates,https://www.bbc.com/travel/article/20221110-the-greek-island-homes-hidden-from-pirates
How a 90s ballad captivated the world,https://www.bbc.com/culture/article/20221109-i-will-always-love-you-the-power-ballad-that-changed-music
A region once too rugged for travellers,https://www.bbc.com/travel/article/20221107-a-cutting-edge-tourism-model-in-newfoundland
The doctors prescribing 'blue' therapy,https://www.bbc.com/future/article/20221108-the-doctors-prescribing-blue-therapy
The exes trapped in shared homes,https://www.bbc.com/worklife/article/20221103-the-exes-forced-to-live-together-after-breaking-up
Emulsifiers: should we be avoiding them?,https://www.bbc.co.uk/food/articles/emulsifiers
"Kate Winslet covers mum's £17,000 energy bill",https://www.bbc.com/news/uk-scotland-tayside-central-63599369
Inside the capture of a Russian oligarch's superyacht,https://www.bbc.com/news/world-63297797
Why smart thermostats don't always save you money,https://www.bbc.com/news/business-63511163
The shops that connect people with their home countries,https://www.bbc.com/news/business-63542786
Ros Atkins on... Is the 1.5C climate target still possible?,/news/science-environment-63607627
Ros Atkins on... Is the 1.5C climate target...,/news/science-environment-63607627
The moment an explosion rocks dam near...,/news/world-europe-63607625
Big Ben’s bongs return after restoration...,/news/uk-politics-63600578
Biden - Our mission is to avert climate...,/news/world-us-canada-63602180
WATCH: 'Finding my baby after 76 years is a...,/news/uk-england-manchester-63600461
Divers discover Challenger space shuttle...,/news/world-us-canada-63597343
Ros Atkins On… Elon Musk and Twitter,/news/technology-63592983
UK falls silent to mark Armistice Day,/news/uk-63598737
Blind boy translates World Cup stickers into...,/news/world-latin-america-63590882
Many thousands in scramble for Peter Kay tickets,/news/entertainment-arts-63608866
Amazon: Robots spread but 'we still need humans',/news/business-63593335
How Earth is dimming because of climate change,/news/science-environment-63585043
China eases some Covid curbs despite rising cases,/news/world-asia-china-63594255
Matt Hancock emotional as he asks for forgiveness,/news/entertainment-arts-63604403
Twitter chaos after wave of blue tick impersonations,/news/technology-63599553
Biden issues climate rallying cry to world leaders,/news/science-environment-63599415
Why some people are overlooked geniuses,https://www.bbc.com/future/article/20221028-why-theres-more-to-being-smart-than-intelligence
'One of the hottest start-up spaces in the US',https://www.bbc.com/news/business-63459642
"Africa's top shots: Bullseye, birds and ballet",/news/world-africa-63542247
Lensman recaptures city pub scenes 40 years on,/news/uk-england-humber-63549572
Stunningly preserved bronze statues found in Italy,/news/world-europe-63564404
Crocodile close-up wins mangrove photo awards,/news/in-pictures-63472199
In pictures: Lula beats Bolsonaro,/news/world-latin-america-63451896
