title,url
Biden expands border wall - but can it stop crossings?,/news/world-us-canada-67024002
Trump endorses Jim Jordan for House Speaker,/news/world-us-canada-67029759
US tourist held over smashed Israel Museum statues,/news/world-middle-east-67027881
Scorsese fears for the future of cinema,https://www.bbc.com/culture/article/20231006-hy-martin-scorsese-fears-for-the-future-of-cinema
The small shops that run NYC,https://www.bbc.com/travel/article/20231005-bodegas-the-small-corner-shops-that-run-nyc
Drake taking break from music to focus on health,/news/world-us-canada-67035523
How a chatbot encouraged a man who wanted to kill the Queen,/news/technology-67012224
Jailed women's rights campaigner wins Nobel Peace prize,/news/world-middle-east-67026216
Rugby World Cup: Classy France heading for quarter-finals - radio & text,/sport/live/rugby-union/65868008
WSL: Man Utd 2-1 Arsenal - Malard scores on debut to put hosts ahead,/sport/live/football/66740166
Super League semi-final: St Helens overturn Catalans' lead - radio & text,/sport/live/rugby-league/66971974
Why Latino doulas are essential,https://www.bbc.com/worklife/article/20231005-one-latina-doula-on-the-push-for-better-births
The odd way eclipses affect radio,https://www.bbc.com/future/article/20231005-eclipses-do-odd-things-to-radio-waves-to-learn-more-an-army-of-american-amateurs-will-broadcast-during-the-next-ones
The film that caused a US moral panic,https://www.bbc.com/culture/article/20231005-the-exorcist-and-why-demonic-possession-taps-into-our-darkest-fears
How humble oats have fuelled a nation,https://www.bbc.com/travel/article/20231004-oats-the-humble-grain-that-fuelled-scotland
Animals fear human voices more than lions - study,https://www.bbc.com/news/world-africa-67023033
Haim on their first decade: 'No-one wanted to sign us!',https://www.bbc.com/news/entertainment-arts-66993259
The mysteries of a mass graveyard of early Indians,https://www.bbc.com/news/world-asia-india-66562257
The extreme robot arm that can chop up a ship,https://www.bbc.com/news/business-66881323
"'If you can't see it, you can't be it'",https://www.bbc.com/news/business-66854695
Watch: 'A miracle that no-one was seriously hurt',/news/uk-england-beds-bucks-herts-67026743
Watch: 'A miracle that no-one was seriously...,/news/uk-england-beds-bucks-herts-67026743
Moment Tupac's murder suspect gets arrested,/news/world-us-canada-67032696
Watch: Where will get hot weather this...,/news/uk-67030011
At the scene of 'deliberate' Russian missile...,/news/world-europe-67034347
Watch: Sparks fly in precarious plane landing,/news/world-us-canada-67025726
New York City rat takes road trip to wedding,/news/67023823
One-minute World News,/news/10462520
Fire breaks out at Ryder Cup venue in Rome,/news/world-europe-67024146
Watch: Inside Paris flat as bedbugs take over...,/news/world-europe-67010255
Police rescue man handcuffed by fake officer,/news/67023245
Man in court over 'plot to kidnap Holly Willoughby',/news/entertainment-arts-67027015
Jeff Bezos joins satellite internet race,/news/science-environment-67023719
High fashion: Prada to design Nasa's new Moon suit,/news/science-environment-67022619
"Stars, bars and beans: Africa’s top shots",/news/world-africa-67017528
Ed Sheeran bags seventh straight number one album,/news/entertainment-arts-67032473
Children in hospital after eating cannabis sweets,/news/world-latin-america-66991933
New Assassin's Creed takes giant leap on language,/news/newsbeat-67016675
CEO: 'Why I take customer service calls',https://www.bbc.com/news/av/business-66981636
Can tech stop India wasting so much of its harvest?,https://www.bbc.com/news/business-66717353
"Bears, birds and kangaroos: Comedy Wildlife Photo Awards",/news/in-pictures-67004896
Sir Michael Gambon: A career in pictures,/news/in-pictures-66950664
Vintage style and bonfires: Africa’s top shots,/news/world-africa-66947006
In pictures: Storm Agnes sweeps across Scotland,/news/uk-scotland-66947142
The day sea-dipping elephants stunned a Welsh town,/news/uk-wales-66855122
