title,url
New noises heard as Titanic sub search widens - Coast Guard,/news/live/world-us-canada-65967464
Experts had warned about safety of missing sub,/news/science-environment-65977432
More than 30 injured after Paris explosion,/news/uk-65979245
A show likely to get on viewers' nerves ★★☆☆☆,https://www.bbc.com/culture/article/20230619-and-just-like-that-series-two-review-the-sex-and-the-city-sequel-is-still-annoying
The aircraft that can 'see' underwater,https://www.bbc.com/future/article/20230621-titanic-sub-how-do-surveillance-planes-detect-ocean-submersibles
Could Russia really play nuclear roulette in Ukraine?,/news/world-europe-65976256
Amazon accused of tricking Prime customers,/news/business-65978053
"If US firms 'go woke', do they really go broke?",/news/world-us-canada-65918155
Man City's Gundogan to join Barcelona on free,/sport/football/65980397
Arsenal agree £65m deal for Chelsea forward Havertz,/sport/football/65972567
England will go 'harder' at Australia - McCullum,/sport/cricket/65934474
What professional women often sacrifice,https://www.bbc.com/worklife/article/20230620-why-many-women-prioritise-their-partners-jobs
A big disappointment from Wes Anderson,https://www.bbc.com/culture/article/20230615-asteroid-city-review-even-wes-anderson-fans-may-be-irritated-by-this-empty-and-cartoonish-film
How dangerous is the Titanic wreck?,https://www.bbc.com/future/article/20230620-why-the-waters-around-the-titanic-are-still-treacherous
A unique safari through remote Brazil,https://www.bbc.com/travel/article/20230621-a-unique-safari-through-the-brazilian-pantanal
Vietnamese comfort food for the soul,https://www.bbc.com/travel/article/20230621-thit-kho-vietnamese-braised-pork-with-eggs
Toxic algae kills hundreds of dolphins and sea lions,https://www.bbc.com/news/world-us-canada-65966075
Morgan and Rapinoe named in USA World Cup squad,https://www.bbc.com/sport/football/65978315
Airbus experiments with more control for the autopilot,https://www.bbc.com/news/business-65676421
Today's newsletter: Zuckerberg’s astonishing comeback,https://cloud.email.bbc.com/techdecoded-newsletter-signup
Watch: The missing Titanic sub... in 77 seconds,/news/world-us-canada-65966721
Watch: The missing Titanic sub... in 77...,/news/world-us-canada-65966721
How tapping sounds might reach rescue teams,/news/world-us-canada-65977282
Paris building in flames after huge explosion,/news/world-europe-65978066
'Hi miss!': Hollywood star surprises sister...,/news/uk-65971519
Watch: Huge fire burns in Las Vegas,/news/world-us-canada-65974284
Watch: Glastonbury fan gets the giggles live...,/news/uk-65971631
How the search for the Titanic sub is...,/news/world-us-canada-65966716
St John's hoping for missing sub's safe...,/news/world-us-canada-65968507
Watch: Inside Titanic sub before it went...,/news/world-us-canada-65958697
Search expert describes friends missing on...,/news/world-65963515
"Hackers claim not to have BBC, Boots and BA data",/news/technology-65965453
"Southgate play hits back of the net, critics say",/news/entertainment-arts-65971102
Future of UK fossil fuels at stake in test case,/news/science-environment-65965119
"Rihanna, Lizzo and Marilyn shine in Divas exhibition",/news/entertainment-arts-65949434
Ex-medical officer close to tears over Covid deaths,/news/uk-politics-65962091
Global monkey torture ring exposed by BBC,/news/world-65951188
Elliot Page: 'I'm living my life for the first time',/news/entertainment-arts-65953877
The workers already replaced by artificial intelligence,https://www.bbc.co.uk/news/business-65906521
Kelly Hoppen: 'Music is design to me',https://www.bbc.com/news/business-65851081
Beauty of insects revealed in photo competition,/news/in-pictures-65876963
Dazzling ancient bronze sword found in Germany,/news/world-europe-65936594
Burna Boy bling and high flyers: Africa's top shots,/news/world-africa-65919659
Man trots globe blending scenes into film locations,/news/uk-england-essex-65786652
In pictures: Nottingham attack shakes city to core,/news/uk-65899897
