title,url
Iranian women arrested after yoghurt hurled at them,/news/world-middle-east-65150135
Fury as Russia becomes UN Security Council president,/news/world-europe-65146557
Deadly storm caves in roof at packed US rock gig,/news/world-us-canada-65145104
Three British men held by Taliban in Afghanistan,/news/uk-65118681
'I take responsibility' - Chelsea boss Potter,/sport/football/65152234
'I'm still alive' jokes Pope as he leaves hospital,/news/world-europe-65147392
Polley told to return Oscar in April Fools’ prank,/news/entertainment-arts-65152276
See luxury villa where Tates are under house arrest,/news/world-europe-65150613
Joshua beats Franklin on points in London,/sport/boxing/65148794
Wood takes English record 5-14 in IPL,/sport/cricket/65151589
'One of Scotland's greatest in any age & any sport',/sport/boxing/65148580
South India's iconic breakfast dish,https://www.bbc.com/travel/article/20230330-idli-steamed-rice-cakes-with-lentils
The abandoned mines heating homes,https://www.bbc.com/future/article/20230324-how-old-coal-mines-can-help-the-climate
Why is Gwyneth Paltrow so divisive?,https://www.bbc.com/culture/article/20230331-gwyneth-paltrow-verdict-why-she-divides-and-fascinates
The rise of the minimalist wardrobe,https://www.bbc.com/culture/article/20230331-the-rise-of-the-minimalist-wardrobe
Why daily grind videos are going viral,https://www.bbc.com/worklife/article/20230329-the-employees-posting-about-their-workday-experiences
The outlawed drink making a comeback,https://www.bbc.com/travel/article/20230327-chicha-the-banned-drink-of-colombia
The mystery origins of Candida auris,https://www.bbc.com/future/article/20230331-the-mystery-origins-of-candida-auris
The intercontinental ATM heist that netted $14m in two hours,https://www.bbc.com/news/world-65130220
'QAnon Shaman' freed early from federal prison,https://www.bbc.com/news/world-us-canada-65132475
Deepest ever fish caught on camera off Japan,https://www.bbc.com/news/science-environment-65148876
Friend or foe: Can computer coders trust ChatGPT?,https://www.bbc.com/news/business-65086798
Spice sales boom as home cooks get more adventurous,https://www.bbc.com/news/business-65026330
Man pours yoghurt over unveiled women in Iran shop,/news/world-middle-east-65150611
Man pours yoghurt over unveiled women in Iran...,/news/world-middle-east-65150611
Watch: Four times US tornadoes were caught on...,/news/world-us-canada-65147038
Video shows tornado moving across Little Rock,/news/world-us-canada-65145264
Watch: Andrew Tate and brother released from...,/news/world-europe-65144222
Watch: Weather presenter spots tornado live...,/news/world-us-canada-65145262
The Indian dancers fighting for their...,/news/world-asia-india-65134532
One-minute World News,/news/10462520
King's first foreign visit as monarch... in...,/news/world-europe-65138731
Gwyneth Paltrow's unusual trial - in 2...,/news/world-us-canada-65130714
ChatGPT chatbot banned in Italy,/news/technology-65139406
Author Blume concerned about intolerance in the US,/news/entertainment-arts-65142127
‘Blood test meant I was spared chemo’,/news/health-65042224
Unlimited fines for water companies dumping sewage,/news/science-environment-65145953
Japan plans to restrict some chip-making exports,/news/business-65134017
"A film premiere, royals and a meatball: Photos of the week",/news/in-pictures-65136303
Telling my daughter about Thailand's poisonous air,/news/world-asia-65120502
"'It’s not how smart you are, it’s how are you smart'",https://www.bbc.com/news/business-65099236
Shamima Begum: The girl who joined IS,https://www.bbcselect.com/select-more/the-shamima-begum-story-the-girl-who-joined-isis/?utm_source=bbc.com&utm_medium=Homepage&utm_campaign=Shamima+Begum
In pictures: King Charles's state visit to Germany,/news/in-pictures-65123931
Royal murals and rare rhinos: Africa's top shots,/news/world-africa-65106486
Film fan creates hundreds of miniature movie sets,/news/uk-england-south-yorkshire-65112610
Southern Lights unusually vivid over New Zealand,/news/world-asia-65108333
Paul O'Grady: A life in pictures,/news/entertainment-arts-65107949
