title,url
Wagner boss says he will pull troops out of Bakhmut,/news/world-europe-65493008
King hosting dignitaries from around the world at palace reception,https://www.bbc.com/news/live/uk-65483426
Trainer suspended after horses die at Kentucky track,https://www.bbc.com/sport/horse-racing/65492312
12 TV series to watch this May,https://www.bbc.com/culture/article/20230504-12-of-the-best-tv-shows-to-watch-this-may
The real meaning of carne asada,https://www.bbc.com/travel/article/20230504-asada-the-true-essence-of-mexican-barbecue
What it's like inside Russia 14 months after invasion,/news/world-europe-65454203
Vow to disarm Serbia after mass shootings,/news/world-europe-65500203
"Covid global health emergency is over, WHO says",/news/health-65499929
Miami Grand Prix first practice - radio & text,/sport/live/formula1/63206798
Nadal withdraws from Rome but injury 'improving',/sport/tennis/65502314
Is 'limitless' Osimhen a £100m player?,/sport/football/65403393
Why you might carry royal DNA,https://www.bbc.com/future/article/20230503-coronation-of-king-charles-iii-do-you-carry-royal-dna
The 81-year-old sleeping out to see the King,https://www.bbc.com/news/uk-scotland-65494649
Royal chef Mark Flanagan's Coronation quiche,https://www.bbc.com/travel/article/20230430-royal-chef-mark-flanagans-coronation-quiche
What does 1.5C living actually look like?,https://www.bbc.com/future/article/20230504-the-people-living-ultra-low-carbon-lifestyles
The films 'too bad for the cinema',https://www.bbc.com/culture/article/20230504-ghosted-the-films-too-bad-for-the-cinema
The true story of the Kentucky Derby,https://www.bbc.com/travel/article/20230503-the-kentucky-derbys-forgotten-black-past
What side-hustlers are really making,https://www.bbc.com/worklife/article/20230504-the-workers-sharing-their-side-hustle-incomes
The 'super-deep' diamonds in the crown,https://www.bbc.com/future/article/20220922-the-super-deep-royal-diamonds-revealing-earths-secrets
Police officers ordered to shave off beards,https://www.bbc.com/news/uk-scotland-65482560
TikTok tracked UK journalist via her cat's account,https://www.bbc.com/news/technology-65126056
Why teaching robots to blink is hard but important,https://www.bbc.com/news/business-65251892
Can Morocco solve Europe’s energy crisis?,https://www.bbc.com/news/business-65415529
Fight after Russian snatches Ukrainian MP's flag,/news/world-europe-65493246
Fight after Russian snatches Ukrainian MP's...,/news/world-europe-65493246
Drone shot down over Kyiv burns through sky,/news/world-europe-65489911
Ukraine's first lady and PM's wife embrace...,/news/uk-65487352
How well does William pull a pint?,/news/uk-65486228
Watch space junk drift away into the dark,/news/science-environment-65484030
Ros Atkins on... the videos showing 'Kremlin...,/news/world-europe-65476367
Russian media's muted response to Kremlin...,/news/world-europe-65484031
Inside hospital where oxygen runs out,/news/world-asia-65459682
Which route will the King take to his...,/news/uk-65468057
Watch man arrested at Buckingham Palace gates,/news/uk-65466363
Bluey episode edited over 'fat-shaming' claims,/news/entertainment-arts-65496426
Ex-Uber security chief sentenced for hack cover up,/news/technology-65497186
Animal tests for makeup resume after 25-year ban,/news/science-environment-65484552
"World not ready for next pandemic, says Bupa boss",/news/business-65419126
In pictures: Royal superfans camp out ahead of Coronation,/news/in-pictures-65484438
North Carolina lawmakers pass 12-week abortion ban,/news/world-us-canada-65489803
"Kanye West Yeezy loss is hurting us, admits Adidas",/news/business-65492142
Why there is serious money in kitchen fumes,https://www.bbc.com/news/business-65328579
The people turning time into a currency,https://www.bbc.com/news/business-65397192
Stylish singers and snipers: Africa's top shots,/news/world-africa-65480076
In pictures: Night-time Coronation rehearsal,/news/in-pictures-65467802
The 17 most eye-catching looks at the Met Gala,/news/entertainment-arts-65413976
Parasols and prayers: Africa's top shots,/news/world-africa-65409697
The photos that chronicle the cost of dying,/news/uk-scotland-65354687
