title,url
US secures deal on bases to complete arc around China,/news/world-asia-64479712
Anger and hope for change at Tyre Nichols funeral,https://www.bbc.com/news/world-us-canada-64494062
North Korea led 'biggest year ever' of crypto hacks,https://www.bbc.com/news/world-asia-64494094
The high-rises with heat pumps,https://www.bbc.com/future/article/20230131-can-city-dwellers-ever-have-heat-pumps
The Arctic's forgotten food,https://www.bbc.com/travel/article/20230201-the-chefs-reviving-the-arctics-forgotten-food
Russian army officer: Our troops tortured Ukrainians,/news/world-europe-64470092
Why ballroom dancing thrives in Asian communities,/news/world-us-canada-64377362
Black history syllabus changed after 'woke' claims,/news/world-us-canada-64493289
EFL Cup reaction and Premier League build-up,/sport/live/football/64494981
'It's about winning it' for Man Utd as Sancho returns,/sport/football/64493654
NFL player charged with rape before Super Bowl,/news/world-us-canada-64492886
The Gen Z friendship problem,https://www.bbc.com/worklife/article/20230201-can-gen-z-make-friends-in-the-pandemic-era
The world's most influential school?,https://www.bbc.com/future/article/20230131-does-the-montessori-method-actually-work
In search of a Dutch homeland,https://www.bbc.com/travel/article/20230131-the-people-living-between-sea-and-sky
Have we reached mass-media overload?,https://www.bbc.com/culture/article/20230201-have-we-reached-mass-media-overload
King Charles will not be on new Australia $5 note,https://www.bbc.com/news/business-64493849
MrBeast: 'Charity porn' or raising awareness?,https://www.bbc.com/news/newsbeat-64490431
Pigeon 'dyed pink for gender reveal' found in NYC,https://www.bbc.com/news/world-us-canada-64491049
How to add 'sizzle' to meat-free products,https://www.bbc.com/news/business-64337616
The new tech offering relief from period pain,https://www.bbc.com/news/business-64397795
Decade-old footage of Tyre Nichols skating goes viral,/news/world-us-canada-64492792
Decade-old footage of Tyre Nichols skating...,/news/world-us-canada-64492792
Viking warriors parade at Up Helly Aa in...,/news/uk-scotland-64485413
BBC guest's phone keeps going off during...,/news/entertainment-arts-64480824
Dancing and huge crowds for Pope's DR Congo...,/news/world-africa-64484329
'You know I'm innocent' - Andrew Tate yells...,/news/world-europe-64481845
Floating pirate restaurant sinks off Thailand...,/news/world-asia-64477412
Protests against France pension age rise...,/news/world-europe-64473280
One-minute World News,/news/10462520
LGBT people hunted by gangs and police in...,/news/world-africa-64460843
Mass funeral for Pakistan mosque blast...,/news/world-asia-64462327
Can Sri Lanka trade its way back to prosperity?,https://www.bbc.co.uk/news/business-64464220
Avian flu spills over from birds to mammals in UK,/news/science-environment-64474594
Nolly: Helena Bonham Carter on soaps and sexism,/news/entertainment-arts-64375326
Canada experiments with decriminalising hard drugs,/news/world-us-canada-64461983
China's Covid wave 'coming to an end' - officials,/news/world-asia-china-64449226
ChatGPT firm trials $20 monthly subscription fee,/news/technology-64492750
In pictures: Up Helly Aa,/news/uk-scotland-64464271
Joseph Gordon-Levitt: Take responsibility for your creativity,https://link.chtbl.com/JGL_BBCHomepage
Are ski trips coming to an end?,https://www.bbc.com/future/article/20230124-how-climate-change-threatens-to-close-ski-resorts
Heavy snow disrupts life in India's Himalayan states,/news/world-asia-india-64462193
The defiant low-lying island 70 years after floods,/news/uk-england-essex-64255567
Survivors and leaders mark Holocaust Memorial Day,/news/in-pictures-64425194
Africa's top shots: Welcome parties and malted brews,/news/world-africa-64410690
'Fen skating is a great metaphor for life',/news/uk-england-cambridgeshire-64399819
