title,url
Republican rivals rally around Trump after indictment,/news/live/world-us-canada-65852074
Could Donald Trump go to prison over secret files?,https://www.bbc.com/news/world-us-canada-65852340
'The level of cruelty... it's like Stalin's time',https://www.bbc.com/news/world-europe-65838473
The jacket that symbolises Britishness,https://www.bbc.com/culture/article/20230609-how-the-barbour-became-the-ultimate-british-symbol
The fading glamour of digital nomadism,https://www.bbc.com/worklife/article/20230531-the-workers-quitting-digital-nomadism
"'We are dying, slowly' - Pleas for help after Ukraine dam breach",/news/live/world-europe-65851660
Canada fires spread quickly - help is on the way,/news/world-us-canada-65850628
Air quality relief in some major US cities,/news/world-us-canada-65846080
French Open: Alcaraz in close second set against Djokovic - radio & text,/sport/live/tennis/65672486
World Test Championship final: Warner falls cheaply,/sport/live/cricket/65032625
"Champions League build-up, greatest boss debate and transfer news",/sport/live/football/65852818
Will unhealthy US air change attitudes?,https://www.bbc.com/future/article/20230608-canada-wildfires-will-they-change-climate-attitudes-on-us-east-coast
In pictures: Smoke from wildfires turns US skies orange,https://www.bbc.com/news/resources/idt-7ebd3f65-cb83-4860-a760-b303b66e00db
How to protect yourself from Canada wildfire smoke,https://www.bbc.com/news/world-us-canada-65843485
11 of the best New York films,https://www.bbc.com/culture/article/20230608-from-taxi-driver-to-25th-hour-11-of-the-best-new-york-films
Why this tart is a culinary mystery,https://www.bbc.com/travel/article/20230608-the-italian-tart-that-tricked-the-pope
Why AI won't be a burnout cure,https://www.bbc.com/worklife/article/20230605-why-ai-wont-be-the-burnout-cure-weve-been-waiting-for
Why fish are finding it hard to breathe,https://www.bbc.com/future/article/20230607-as-ocean-oxygen-levels-dip-fish-face-an-uncertain-future
The world's most underrated dive spots?,https://www.bbc.com/travel/article/20230607-the-worlds-best-hidden-dive-spots
'There's no one way to be autistic',https://www.bbc.co.uk/ideas/videos/theres-no-one-way-to-be-autistic/p0fqdsrd
Quiz of the week: Which book changed Stormzy's life?,https://www.bbc.com/news/world-65844555
India attempts to revive its dwindling rubber industry,https://www.bbc.com/news/business-65543616
'Two of my gay friends have gone missing',https://www.bbcselect.com/watch/gay-under-the-taliban/?utm_source=BBC.com&utm_medium=Homepage&utm_campaign=Gay+Under+The+Taliban
Train smashes through truck on railway crossing,/news/world-us-canada-65859078
Train smashes through truck on railway...,/news/world-us-canada-65859078
Drone footage shows impact of burst dam,/news/world-europe-65853621
Watch: Driving test ends with crash into...,/news/world-latin-america-65852316
Wildfires continue to burn across Canada,/news/world-us-canada-65853623
Wind vortex seen over Kilauea volcano after...,/news/world-us-canada-65851094
Wolf pups practise howling for the first time,/news/world-us-canada-65848978
Annecy knife attack victim: 'There was no...,/news/world-europe-65856725
Biden calls Sunak 'president' by mistake,/news/uk-politics-65850274
Watch: West Ham trophy parade draws huge...,/news/uk-65851408
Canada fires shroud New York City with orange...,/news/world-us-canada-65840256
Supreme Court backs Jack Daniel's in dog toy row,/news/world-us-canada-65839800
Joseph Fiennes on playing 'steely' Gareth Southgate,/news/entertainment-arts-65838564
How AI is helping doctors spot breast cancers,/news/technology-65821552
US cancer drug shortage hits thousands of patients,/news/world-us-canada-65791190
Mediterranean-style wildfire fighting coming to UK,/news/science-environment-65848872
Mosque plasterers and rock cutters: Africa's top shots,/news/world-africa-65843357
What to expect from the 'middle-aged' Love Island,/news/entertainment-arts-65857058
Why millions of useable hard drives are being destroyed,https://www.bbc.com/news/business-65669537
The tech tricks that make computer games look real,https://www.bbc.com/news/business-65532128
Strawberry Moon captured over England,/news/uk-england-leicestershire-65802574
Bywyd ar fferm fynydd Gymreig // Life on a Welsh hill farm,/newyddion/65828633
Top Scottish landscape photographers announced,https://www.bbc.co.uk/news/articles/c6p34zr7rz7o
Long lashes and fashion flair: Africa's top shots,/news/world-africa-65772200
New Yorkers gather for Manhattanhenge,/news/world-us-canada-65761850
