title,url
Which criminal case may be hardest for Trump to win?,/news/world-us-canada-66404233
Bullock praised for the way she cared for partner,https://www.bbc.com/news/entertainment-arts-66437720
Fatal family lunch mystery grips Australia,https://www.bbc.com/news/world-australia-66391325
Japan's innovative cooling solutions,https://www.bbc.com/travel/article/20230807-want-to-cope-with-heatwaves-look-to-japans-creative-cooling-solutions
Three siblings and a mystery illness,https://www.bbc.com/future/article/20230807-undiagnosed-diseases-the-mysterious-syndromes-without-a-name
Russia blames Ukraine for call-up centre fires,/news/world-europe-66440752
Tory Lanez to be sentenced for shooting Megan Thee Stallion,/news/live/world-us-canada-66431305
Why Ohio's rare summer vote is so controversial,/news/world-us-canada-66442370
The Hundred: Allen falls to leave Brave 33-2 against Spirit,/sport/live/cricket/66307807
France end Morocco dream to cruise into quarters,/sport/football/66425335
"Blood, cocaine and questions - the death of 'the Pirate'",/sport/cycling/66373364
Colombia 'dream big' at World Cup with England next,https://www.bbc.com/sport/football/66439542
England's James apologises for World Cup red card,https://www.bbc.com/sport/football/66438007
Have women got the kit they deserve?,https://www.bbc.com/culture/article/20230804-womens-world-cup-2023-how-female-players-have-finally-got-the-football-kit-they-deserve
Obama's Indonesian comfort food,https://www.bbc.com/travel/article/20230807-mie-bakso-rice-noodle-soup-with-meatballs
The workers getting multiple bonuses,https://www.bbc.com/worklife/article/20230727-points-bonuses-accolades-why-some-workers-are-cashing-in-on-year-round
The sinister side to female robots?,https://www.bbc.com/future/article/20230804-is-there-a-sinister-side-to-the-rise-of-female-robots
A 200km hike to 'the end of the Earth',https://www.bbc.com/travel/article/20230806-the-lighthouse-way-walking-spains-other-camino
The forgotten 'godfathers' of hip-hop,https://www.bbc.com/culture/article/20230807-the-last-poets-and-watts-prophets-the-radical-poets-overshadowed-by-hip-hop
Weight-loss drug heart benefit 'significant',https://www.bbc.com/news/health-66440808
"UPS drivers in US to get $170,000 pay package",https://www.bbc.com/news/business-66445496
How opera is aiming for net zero,https://www.bbc.com/culture/article/20230731-how-opera-is-aiming-for-net-zero-amid-the-climate-crisis
Will electric flying taxis live up to their promise?,https://www.bbc.com/news/business-66252187
Inside the housing barge after first asylum seekers board,/news/uk-england-dorset-66444627
Inside the housing barge after first asylum...,/news/uk-england-dorset-66444627
Crowds line street to watch Sinéad...,/news/entertainment-arts-66436816
Meet the cats at Battersea looking for a home,/news/uk-england-london-66433731
Fans visit steps from The Exorcist in...,/news/world-us-canada-66435261
Watch: Is this it for summer in the UK?,/news/uk-66429117
A Moscow summer with war on people's minds,/news/world-europe-66432068
One-minute World News,/news/10462520
Watch: First migrants board Bibby Stockholm...,/news/uk-66428449
WATCH: Moment Alaska house collapses into...,/news/world-us-canada-66426385
Man saved after 35 hours at sea in flooded...,/news/world-us-canada-66424828
Fiery ‘meteor’ over Australia probably Russian space rocket,/news/world-australia-66436211
Sinéad O'Connor 'brought joy to countless people',https://www.bbc.co.uk/news/articles/c3g1yy5yxyvo
Zuckerberg 'not holding breath' over Musk cage fight,/news/business-66424364
Chance discovery helps fight against malaria,/news/health-66394117
"Dolphins, tigers and turtles in focus",/news/in-pictures-66437556
Publisher Simon & Schuster to be sold for $1.6bn,/news/business-66434690
Mother and daughter first to go to space together,/news/uk-scotland-north-east-orkney-shetland-66405219
Tech Decoded: The latest news direct to your inbox,https://www.bbc.com/news/technology-65786969
Devastating wildfires spur new detection systems,https://www.bbc.com/news/business-66266186
In Pictures: Sinéad O'Connor's funeral,/news/in-pictures-66440464
Alarming photos show typhoon floods engulfing Asia,/news/in-pictures-66400905
"Coronations, celebrations and coups: Africa’s top shots",/news/world-africa-66394367
In pictures: Supermoon lights up night sky,/news/world-66376332
'Dream come true' exhibition for city photographer,/news/uk-england-coventry-warwickshire-66371960
