title,url
Earth in uncharted waters as climate records tumble,/news/science-environment-66229065
Crimea bridge closed after fuel depot hit - Russia,https://www.bbc.com/news/entertainment-arts-66276788
Jamie Foxx says sister and daughter saved him,https://www.bbc.com/news/entertainment-arts-66276785
Ashes: England resume hunt for Australia wickets after rain delay,/sport/live/cricket/64959410
The return of an Ancient Mexican food,https://www.bbc.com/travel/article/20230721-prickly-pear-cactus-tacos
Polarised Spain eyes the hard-right ahead of vote,/news/world-europe-66268330
Festival axed as 1975 singer attacks Malaysian LGBT laws,/news/world-asia-66275913
New Greece heatwave warning as fires still burn,/news/world-europe-66273287
Hungarian Grand Prix qualifying - radio and text,/sport/live/formula1/63208178
The Open: Rahm charges & McIlroy starts well in pursuit of Harman,/sport/live/golf/66239241
England win World Cup opener after tough Haiti test,/sport/football/66265569
How a careless slip killed a physicist,https://www.bbc.com/future/article/20230719-the-blue-flash-louis-slotin-accident-manhattan-project-oppenheimer-atomic-bomb
The three job categories safe from AI,https://www.bbc.com/worklife/article/20230507-the-jobs-ai-wont-take-yet
18 of the best books of the year so far,https://www.bbc.com/culture/article/20230420-12-of-the-best-books-of-the-year-so-far-2023
What does 'Barbenheimer' really mean?,https://www.bbc.com/culture/article/20230720-what-does-barbenheimer-really-mean-for-hollywood
The British isle with its own language,https://www.bbc.com/travel/article/20230716-jerrais-the-secret-british-language-that-was-used-to-outwit-the-nazis
How automation could affect your salary,https://www.bbc.com/worklife/article/20230718-ai-artificial-intelligence-worker-wages-salaries
How Barbie is aiding Moon exploration,https://www.bbc.com/future/article/20230721-barbies-surprising-role-in-moon-exploration
New photo of Prince George to mark 10th birthday,https://www.bbc.com/news/uk-66272639
"Dancing, boats and birds: Photos of the week",https://www.bbc.com/news/in-pictures-66266632
Biden nominates first woman to lead US Navy,https://www.bbc.com/news/world-us-canada-66275531
Tech Decoded: The latest news direct to your inbox,https://www.bbc.com/news/technology-65786969
Explore the oldest university in the US,https://www.bbc.com/travel/article/20230718-a-tour-of-bostons-universities-with-local-guide-daniel-bodt
Smoke as Russia claims fuel depot in Crimea hit,/news/world-europe-66278472
Smoke as Russia claims fuel depot in Crimea...,/news/world-europe-66278472
Video captures moment tornado rips off a roof,/news/world-us-canada-66273034
Excited filmgoers: 'Barbie is everything',/news/world-us-canada-66273037
Berlin 'lioness' on loose 'is a wild boar',/news/world-europe-66265769
What's next for US soldier detained in North...,/news/world-asia-66261925
Waterfalls form at train station after heavy...,/news/world-asia-china-66266940
'Horrifying!': Movie critic reacts to AI...,/news/technology-66103532
Argentine woman's lucky escape in car crash,/news/world-latin-america-66262083
Hundreds of baby seahorses released in Sydney...,/news/world-australia-66264370
Watch the moment divers free trapped whale...,/news/world-asia-66254335
AI will 'lead to more games and more gaming jobs',/news/entertainment-arts-66058906
Pulp review: The mischievous Jarvis Cocker in party mode,/news/entertainment-arts-66276151
Drones are showing us sharks like never before,/news/world-us-canada-66252146
Medics use body-bag ice treatment in US heatwave,/news/world-us-canada-66237583
In pictures: A dramatic 24 hours in politics,/news/in-pictures-66268013
Warcraft fans trick AI article bot with Glorbo hoax,/news/newsbeat-66266344
New drugs for Alzheimer’s hailed as turning point,/news/health-66221116
Can houseplants purify the air in your home?,https://www.bbc.com/news/business-66186492
Can Barbie be the new Iron Man?,https://www.bbc.com/news/business-66072812
Whistle-blowers and rainbows: Africa's top shots,/news/world-africa-66256175
In pictures: Europe's scorching heatwave,/news/in-pictures-66226313
Hilarious pictures of pets in comedy photographs,/newsround/66210126
Jane Birkin: Artist and style icon's life in pictures,/news/world-europe-66216663
Hidden history of city revealed in saved pictures,/news/uk-england-coventry-warwickshire-66090707
