title,url
Biden believes deal for Hamas to release hostages is close,/news/live/world-middle-east-67466779
Euro 2024 qualifier: Lewis makes England debut v North Macedonia,/sport/live/football/67404802
Red-wine headache explained - and it is not volume,https://www.bbc.com/news/health-67449509
Travellers are snubbing US budget airlines,https://www.bbc.com/worklife/article/20231116-do-travellers-still-want-to-fly-budget-airlines
Is this France's best dining bargain?,https://www.bbc.com/travel/article/20231116-relais-routiers-is-this-the-best-dining-bargain-in-france
Sam Altman: What on earth is happening at OpenAI?,/news/technology-67474879
OpenAI staff demand board quit over Altman sacking,/news/business-67470876
Court sceptical of Trump bid to halt DC gag order,/news/world-us-canada-67477880
Euro 2024 qualifier: Northern Ireland v Denmark,/sport/live/football/67408352
Ex-South Africa rugby star dies in car crash,/news/world-africa-67472422
"'Cricket World Cup should be enjoyed, not endured'",/sport/cricket/67470006
The climate benefits of wildebeest,https://www.bbc.com/future/article/20231120-wildebeest-and-wolves-a-secret-weapon-against-climate-change
Did a magician help vanquish the Nazis?,https://www.bbc.com/culture/article/20231117-did-a-magician-help-vanquish-the-nazis-in-world-war-two
How did 'ESG' become meaningless?,https://www.bbc.com/worklife/article/20231114-how-esg-came-to-mean-everything-and-nothing
San Francisco's five best cocktail bars,https://www.bbc.com/travel/article/20231119-a-tour-of-san-franciscos-best-cocktail-bars-from-mixologist-josh-harris
Disgraced country star sweeps Billboard awards,https://www.bbc.co.uk/news/articles/cpep7kezzjpo
Suki Waterhouse and Robert Pattinson expecting child,https://www.bbc.com/news/entertainment-arts-67472557
Is it time for America's elder statesmen to retire?,https://www.bbc.com/news/world-us-canada-67453344
Find the right BBC email newsletter for you,https://www.bbc.com/news/world-us-canada-66715271?&at_bbc_team=studios&at_medium=native&at_objective=acquisition&at_ptr_type=&at_ptr_name=bbc.com&at_format=Module&at_link_origin=bbchomepage&at_campaign=nleditorial&at_campaign_id=&at_adset_name=&at_adset_id=&at_creation=&at_creative_id=&at_campaign_type=owned
Shop owners hope that tech can deter thieves,https://www.bbc.co.uk/news/business-67306737
BBC assesses footage of tunnel and hostages released by Israel,/news/world-middle-east-67478425
BBC assesses footage of tunnel and hostages...,/news/world-middle-east-67478425
MPs set off coloured smoke flares in Albanian...,/news/world-europe-67479830
'Johnson not only Western leader to struggle...,/news/uk-politics-67473531
IDF releases CCTV it says shows Hamas...,/news/world-middle-east-67469779
Watch: Rosalynn Carter's life of adventure as...,/news/world-us-canada-67470996
Evacuated premature babies arrive at Gaza...,/news/world-middle-east-67469987
Taylor Swift appears out of breath at Rio...,/news/world-latin-america-67469778
Watch: Crane topples from high rise after...,/news/world-asia-67469186
"SpaceX rocket launches, separates and loses...",/news/science-environment-67461791
President 'understands excitement' of dog...,/news/world-europe-67453626
Ballet teacher on trial over sex attack charges,/news/uk-scotland-glasgow-west-67476386
Extreme weather 'biggest threat' to National Trust,/news/science-environment-67432755
"Flowers, protest and parade: Photos of the week",/news/in-pictures-67449995
Apple to cross message divide but green bubbles stay,/news/technology-67451724
Gaza hospital boss says no water or oxygen left,/news/world-middle-east-67442045
I'm A Celeb: Viewing figures fall by two million,/news/entertainment-arts-67449085
Elon Musk's rocket flies further but self-destructs,/news/science-environment-67462116
"TikTok has changed the world, but is it changing us?",https://www.bbcselect.com/watch/tiktok-effect/?utm_source=BBC.com&utm_medium=Homepage&utm_campaign=tiktok
"'I don't enter leadership awards, it's not about me'",https://www.bbc.co.uk/news/av/business-67420863
Capturing hidden Wales,/newyddion/67453980
Africa's top shots: Pirates and paper doves,/news/world-africa-67440655
"Royals, rallies and regattas: Africa's top shots",/news/world-africa-67342719
King Charles III delivers speech at State Opening of Parliament,/news/uk-politics-67344490
Damage and disruption: Storm Ciarán in pictures,/news/in-pictures-67298061
