title,url
Alex Murdaugh cross-examined in double murder trial,/news/live/world-us-canada-64748208
US lawmaker asks if fatal child abuse saves money,https://www.bbc.com/news/world-us-canada-64726727
Harvey Weinstein gets 16 more years in prison,https://www.bbc.com/news/world-us-canada-64736678
Japan’s mystery ball removed from the beach,https://www.bbc.com/news/world-asia-64748346
Nigeria's anthem of defiance,https://www.bbc.com/culture/article/20230222-nigerias-anthem-of-defiance
UN condemns Russian invasion ahead of war anniversary,/news/live/world-64742349
R. Kelly gets extra prison time after latest trial,/news/world-us-canada-64736677
TV reporter and child killed in Florida attack,/news/world-us-canada-64740209
Antony puts Man Utd ahead against Barcelona,/sport/live/football/64321942
New Zealand v England - second Test toss and team news,/sport/live/cricket/62866119
'One of Australia's best wins' or did India lose it?,/sport/cricket/64751037
The university that changed the world,https://www.bbc.com/travel/article/20230222-nalanda-the-university-that-changed-the-world
The Gen Z friendship problem,https://www.bbc.com/worklife/article/20230201-can-gen-z-make-friends-in-the-pandemic-era
The cities full of 'useless' flowers,https://www.bbc.com/future/article/20230222-the-beautiful-flowers-that-bees-cant-use
A B-movie about a drug-crazed bear,https://www.bbc.com/culture/article/20230223-cocaine-bear-review-a-b-movie-about-a-drug-crazed-bear
Paul Mescal's fury after 'creepy' fan groped him,https://www.bbc.com/news/entertainment-arts-64743226
Outlaw-themed parade triumphs at Rio carnival,https://www.bbc.com/news/world-latin-america-64742729
How Russia's 35-mile column came to nothing,https://www.bbc.com/news/world-europe-64664944
How hospitals could avoid future PPE chaos,https://www.bbc.com/news/business-64718017
How ASML became Europe's most valuable tech firm,https://www.bbc.com/news/business-64514573
Latvian MP swears at Russia during protest walkout,/news/world-europe-64752483
Latvian MP swears at Russia during protest...,/news/world-europe-64752483
Welsh island awarded 'best night sky' status,/news/uk-wales-64736076
WATCH: Mystery sphere inspected on Japan...,/news/world-asia-64740088
Brazil landslides: 'I knew most of the people...,/news/world-latin-america-64739626
Blair and Hague: UK should embrace tech...,/news/uk-politics-64730829
Putin and Biden's speeches compared in under...,/news/world-europe-64726390
"‘Why I, a Russian, went to Argentina to...",/news/world-latin-america-64722803
Woman trampled by moose while walking dog,/news/world-us-canada-64725512
The key locations in the Nicola Bulley case,/news/uk-64713389
Jully Black explains her change to Canada's...,/news/world-us-canada-64727188
Welsh island has one of the world's darkest skies,/news/uk-wales-64731286
Decongestant safety review due to rare brain risk,/news/health-64742221
European Commission bans TikTok on staff devices,/news/technology-64743991
Rihanna to perform Lift Me Up at the Oscars,/news/entertainment-arts-64727715
Ten photos before Ukrainian lives changed forever,/news/world-europe-64695153
Government green heating plan 'seriously failing',/news/science-environment-64710225
Arsenal Women's pay rises 30% but still behind men,/news/business-64735639
The tech helping people get a better night's sleep,https://www.bbc.com/news/business-64580342
The race across Europe to build green steel plants,https://www.bbc.com/news/business-64538296
England's Big Picture: Images of the nation,/news/uk-england-64698563
The Baftas red carpet in pictures,/news/entertainment-arts-64699045
Africa's top shots: Sapeurs on show and skiers on slopes,/news/world-africa-64653451
A-list stars attend Vivienne Westwood memorial,/news/entertainment-arts-64666516
Raquel Welch: A life in pictures,/news/world-us-canada-64658155
