title,url
Biden in UK amid concern at Ukraine cluster bombs,/news/world-europe-66146457
Did Yellen's trip to Beijing boost US-China relations?,/news/world-asia-66146889
BBC suspends presenter over explicit images claims,/news/live/uk-66147560
Wimbledon 2023: Follow live coverage on day seven,/sport/live/tennis/65584743
France bans buying of fireworks for Bastille Day,/news/world-europe-66147920
Azarenka booed off after Wimbledon loss to Svitolina,/sport/tennis/66150367
Twitter blue tick accounts fuel Ukraine misinformation,/news/world-europe-66113460
England win thriller to keep Ashes series alive,/sport/cricket/66148643
Headingley delivers again to ensure Ashes show goes on,/sport/cricket/66149867
Verstappen beats Norris to British Grand Prix win,/sport/formula1/66148503
Woods wins first Tour stage on Puy de Dome,/sport/cycling/66149084
The reason sharks attack humans,https://www.bbc.com/future/article/20190808-why-do-sharks-attack-humans
A long-lost city found in the Americas,https://www.bbc.com/travel/article/20230704-ocomtn-a-long-lost-maya-city-that-was-just-discovered
Mission Impossible 7 is 'ultra-modern' ★★★★☆,https://www.bbc.com/culture/article/20230705-mission-impossible-dead-reckoning-is-ideal-escapism
Sixteen of the best films of 2023,https://www.bbc.com/culture/article/20230402-8-of-the-best-films-of-2023-so-far
Hunting the hidden moons of Saturn,https://www.bbc.com/future/article/20230703-why-saturns-moons-have-remained-hidden-from-view
The rebellious city with a dark past,https://www.bbc.com/travel/article/20230709-the-english-city-facing-up-to-its-troubled-past
How workers can get 'love bombed',https://www.bbc.com/worklife/article/20230705-work-love-bombing-when-companies-come-on-too-strong
Elton John ends farewell tour after 52 years of 'pure joy',https://www.bbc.com/news/entertainment-arts-66145901
Your serve: ace recipes for Wimbledon weekend,https://www.bbc.co.uk/food/collections/wimbledon_recipes
'I was off my head' - man rescued from remote isle,https://www.bbc.com/news/66145229
The latest technology news direct to your inbox,https://cloud.email.bbc.com/techdecoded-newsletter-signup
Theatres tempt new audiences with virtual reality,https://www.bbc.com/news/business-65949874
Watch: The BBC presenter story in 64 seconds,/news/uk-66150125
Watch: The BBC presenter story in 64 seconds,/news/uk-66150125
Inside the camp meant for Wagner after revolt,/news/world-europe-66140699
"Meet Sammy, the surfing seal from San Diego",/news/world-us-canada-66146766
James Norton on why he has to hide food on...,/news/entertainment-arts-66147064
Watch: Cars plough through floodwater in...,/news/world-asia-66146038
AI robot asked 'will you rebel against...,/news/technology-66141835
One-minute World News,/news/10462520
Hail batters Spain creating icy urban scenes,/news/world-europe-66140574
At the scene the day after fatal Wimbledon...,/news/uk-66131233
Belarus leader pressed on nuclear weapons,/news/world-europe-66129555
BBC star faces new allegations over explicit photos,/news/entertainment-arts-66145747
The new normal - why this summer has been so very hot,/news/science-environment-66143682
'Almost every influencer will be hopping on Threads',/news/technology-66122246
Best in show: Africa's top shots,/news/world-africa-66118610
Unusual rise in child type 1 diabetes after Covid,/news/health-66054946
Wealthier might have to pay more for BBC - Sharp,/news/uk-66140890
Shipping agrees net-zero goal but critics unmoved,/news/science-environment-66131038
Why this music producer smashed his platinum discs,https://www.bbc.com/news/business-65956519
Why Europe's 'lonely' tech entrepreneurs need help,https://www.bbc.com/news/business-65889259
In pictures: King Charles III celebrations,/news/uk-scotland-66108829
Mystery of Holocaust escape girls finally solved,/news/uk-england-tyne-66040197
Eid al-Adha around the world in pictures,/news/world-66041087
Photographer shares shots of famous musicians,/news/uk-wales-65989687
Millinery masterpieces at Royal Ascot,https://www.bbc.co.uk/news/articles/c3g1e00xgy2o
