title,url
Israel military confirms deadly strike on Gaza refugee camp,/news/live/world-middle-east-67258466
Anti-war protesters disrupt US Senate hearing,/news/world-us-canada-67275665
Teen taken hostage by Hamas back home in Chicago,/news/world-us-canada-67276547
The harm of dehumanising language,https://www.bbc.com/future/article/20231030-the-real-life-harm-caused-by-dehumanising-language
The 'Christmas creep' of holiday candy,https://www.bbc.com/worklife/article/20231030-christmas-creep-why-holiday-candy-hits-shelves-so-early
Friends stars 'devastated' by Matthew Perry's death,/news/entertainment-arts-67260551
"How social media fuelled antisemitic violence in Dagestan, Russia",/news/world-europe-67269477
Watch: Spain's Princess Leonor turns 18 and swears oath,/news/world-europe-67273657
Women's Nations League: Belgium equalise before interval against England,/sport/live/football/67276280
Watch: Dutch hit woodwork but still 0-0 with Scots,/sport/live/football/67258241
"Watch: Hungary leading Northern Ireland, Republic beat Albania",/sport/live/football/67196016
A US mystery you can see but not touch,https://www.bbc.com/travel/article/20231025-the-paulding-light-a-us-mystery-you-can-see-but-not-touch
'Lost demon' uncovered in Joshua Reynolds painting,https://www.bbc.com/news/entertainment-arts-67271251
The 'poltergeist' that shocked the UK,https://www.bbc.com/culture/article/20231026-the-enfield-poltergeist-why-the-unexplained-mystery-that-shocked-1970s-britain-continues-to-disturb
Why 'Slut' is Swift's call to arms,https://www.bbc.com/culture/article/20231030-taylor-swifts-1989-the-real-meaning-of-the-song-slut
The world's best tourism villages,https://www.bbc.com/travel/article/20231030-the-worlds-best-tourism-villages-in-2023
The revival of a coveted lost US corn,https://www.bbc.com/travel/article/20231031-jimmy-red-corn-grits-with-egg-yolks
How right to repair might change tech,https://www.bbc.com/future/article/20231027-how-the-right-to-repair-might-change-technology
The 'overburdened' workers on strike,https://www.bbc.com/worklife/article/20231027-why-so-many-healthcare-workers-are-walking-off-the-job
De Niro takes stand to deny discrimination claim,https://www.bbc.com/news/entertainment-arts-67271246
What China wants from Israel-Hamas war,https://www.bbc.com/news/world-asia-china-67237146
Portugal's tech boom challenged by tax change,https://www.bbc.co.uk/news/business-67087676
Would you drink genetically modified beer?,https://www.bbc.com/news/business-67193176
Explosion at Gaza refugee camp leaves massive crater,/news/world-middle-east-67278339
Explosion at Gaza refugee camp leaves massive...,/news/world-middle-east-67278339
Moment injured Gaza girl sees baby sister is...,/news/world-middle-east-67268584
Cliff Richard sings 'without artificial...,/news/entertainment-arts-67261414
Drone footage shows aftermath of India train...,/news/world-asia-india-67258761
Video shows anti-Israel mob storming Russian...,/news/world-europe-67258760
Video said to show inside Al-Quds hospital...,/news/world-middle-east-67257337
Streets of rubble: Gaza destruction from the...,/news/world-middle-east-67254766
Gazans asking 'where do we want to be when we...,/news/uk-politics-67254147
Czech president knocks soldier's hat off with...,/news/world-europe-67252981
Bankman-Fried pressed in court over past comments,/news/world-us-canada-67272395
Scientists warn of faster threat to climate limit,/news/science-environment-67242386
Little Britain sketch 'racist and outdated',/news/entertainment-arts-67273423
Austrians fall ill after taking fake weight-loss drug,/news/world-europe-67217729
Facebook and Instagram to offer paid subscriptions,/news/technology-67226394
Band walk 870 miles on tour around Welsh coast,/news/uk-wales-67219848
Elton John photography collection to go on display,/news/uk-england-london-67205468
Find the right BBC email newsletter for you,https://www.bbc.com/news/world-us-canada-66715271?&at_bbc_team=studios&at_medium=native&at_objective=acquisition&at_ptr_type=&at_ptr_name=bbc.com&at_format=Module&at_link_origin=bbchomepage&at_campaign=nleditorial&at_campaign_id=&at_adset_name=&at_adset_id=&at_creation=&at_creative_id=&at_campaign_type=owned
What happens after a nuclear power station is closed?,https://www.bbc.com/news/business-67087673
Skulls and flowers: Mexico's 'skeleton' parade,/news/in-pictures-67193453
Steely gaze of endangered tigress tops mangrove photo awards,/news/in-pictures-67155632
"Poses, pouts and poles: Africa's top shots",/news/world-africa-67155786
Sydney Opera House: The story of an icon in photos,/news/world-australia-67153713
Stranded boats and dead fish: Amazon drought,/news/in-pictures-67087949
