title,url
Miami ready for protests before Trump court appearance,/news/live/world-us-canada-65883731
Nine injured in US shooting after basketball game,https://www.bbc.com/news/world-us-canada-65888631
US sprinter died from complications in childbirth,https://www.bbc.com/sport/athletics/65887510
"The temple feeding 100,000 people a day",https://www.bbc.com/travel/article/20230612-amritsar-the-indian-city-where-no-one-goes-hungry
Van Gogh's darkest symbol,https://www.bbc.com/culture/article/20230612-from-the-starry-night-to-a-wheatfield-van-goghs-darkest-symbol
Trump's court appearance explained in 90 seconds,/news/world-us-canada-65883857
Eleven dead after Russia strikes Zelensky's home city,/news/live/world-europe-65885857
Counter-terror team on Nottingham case - but police keep 'open mind',/news/live/uk-england-nottinghamshire-65888114
"Transfer news - Mbappe latest, Arsenal close in on Rice",/sport/live/football/65887372
"Danger, beauty & carbon - why Le Mans is more important than you realise",/sport/motorsport/65874444
Mbappe told PSG last year he would not extend deal,/sport/football/65882905
The way some Republicans defend Trump is revealing,https://www.bbc.com/news/world-us-canada-65863399
"Who is Walt Nauta, the indicted Trump aide?",https://www.bbc.com/news/65862112
Here's how Trump's historic day in court will unfold,https://www.bbc.com/news/world-us-canada-65881780
A pie synonymous with America,https://www.bbc.com/travel/article/20230612-sweet-tea-peach-pie-from-georgia
Why 'coming out' can take a lifetime,https://www.bbc.com/future/article/20230608-how-families-can-support-lgbt-teens
The film that 'scared kids witless',https://www.bbc.com/culture/article/20230609-how-steven-spielberg-felt-that-jurassic-park-was-jaws-on-land
Is 'burning bridges' a career killer?,https://www.bbc.com/worklife/article/20230607-why-burning-bridges-may-not-be-a-career-killer
Rare Roman mausoleum unearthed in London,https://www.bbc.com/news/uk-england-london-65890080
McCartney says AI enabled a 'final' Beatles song,https://www.bbc.com/news/entertainment-arts-65881813
'Dead' woman found breathing in coffin at own funeral,https://www.bbc.com/news/world-latin-america-65886245
Can Amsterdam make the circular economy work?,https://www.bbc.com/news/business-65696083
Sacked workers tell the inside story of Musk's Twitter takeover,https://www.bbcselect.com/watch/elon-musks-twitter-storm/?utm_source=BBC.com+&utm_medium=Homepage&utm_campaign=Twitter+Storm
Nottingham attack eyewitness: 'I wish I never saw it',/news/uk-65889744
Nottingham attack eyewitness: 'I wish I never...,/news/uk-65889744
New video shows plane crash children found in...,/news/world-latin-america-65889091
Are Russians optimistic about the war in...,/news/world-europe-65884940
Watch: Trapper wrestles massive alligator...,/news/world-us-canada-65883859
Thousands of fish wash up on Texas coast,/news/world-us-canada-65885497
What Trump's rivals have to say about his...,/news/world-us-canada-65885949
Cars in London push through thunderstorm...,/news/uk-65884939
WATCH: Memorable moments from Silvio...,/news/world-europe-65877716
Busy US highway collapses after oil tanker...,/news/world-us-canada-65873232
Josh Homme reveals he is recovering from cancer,/news/entertainment-arts-65889069
Man trots globe blending scenes into film locations,/news/uk-england-essex-65786652
India threatened to shut Twitter - Jack Dorsey,/news/world-asia-india-65886825
Senior Tory MP calls for abortion law rethink,/news/uk-65886472
Tata Steel boss calls for subsidies to be greener,/news/uk-wales-65880253
Flight turbulence increasing as planet heats up,/news/science-environment-65844901
MPs challenge BBC boss on local radio cuts,/news/entertainment-arts-65889239
The best of Boston's Seaport District,https://www.bbc.com/travel/article/20230609-the-five-best-things-to-do-in-bostons-seaport-district
India attempts to revive its dwindling rubber industry,https://www.bbc.com/news/business-65543616
Surreal skies grip New Yorkers - in pictures,/news/in-pictures-65843841
In Pictures: The biggest music acts to play Wales,/news/uk-wales-65860650
Mosque plasterers and rock cutters: Africa's top shots,/news/world-africa-65843357
Strawberry Moon captured over England,/news/uk-england-leicestershire-65802574
Bywyd ar fferm fynydd Gymreig // Life on a Welsh hill farm,/newyddion/65828633
