title,url
Four Proud Boys guilty in US Capitol riot case,/news/world-us-canada-65307770
US denies masterminding Moscow drone attack,/news/world-europe-65485960
Napoli win Italian title for first time in 33 years,/sport/football/65488842
What side-hustlers are really making,https://www.bbc.com/worklife/article/20230504-the-workers-sharing-their-side-hustle-incomes
Do you own too many clothes?,https://www.bbc.com/future/article/20230502-how-to-make-your-wardrobe-sustainable
Top US judge under fresh scrutiny over school fees,/news/world-us-canada-65472812
Ed Sheeran wins Thinking Out Loud copyright case,/news/entertainment-arts-65480293
"Trump mistook rape accuser for ex-wife, trial told",/news/world-us-canada-65486437
"A tour of a lost world, before football changed forever",https://www.bbc.co.uk/sport/extra/DqkhZA6FP7/around-the-92-in-the-1980s
Brighton score late penalty to beat Man Utd,/sport/football/64929888
"The rise, fall and rise again of Steven Finn",/sport/cricket/65474220
What kings wore from Tudor times to now,https://www.bbc.com/culture/article/20230503-what-a-kings-personal-style-reveals
What to look out for in the coronation processions,https://www.bbc.com/news/uk-65473848
The 'super-deep' diamonds in the crown,https://www.bbc.com/future/article/20220922-the-super-deep-royal-diamonds-revealing-earths-secrets
A Mexican party that can't be missed,https://www.bbc.com/travel/article/20230504-asada-the-true-essence-of-mexican-barbecue
How the ISS will meet a fiery end,https://www.bbc.com/future/article/20230502-a-fiery-end-how-the-iss-will-end-its-life-in-orbit
Can remote-work gossip backfire?,https://www.bbc.com/worklife/article/20230427-the-perks-and-perils-of-remote-work-gossip
The rappers risking the death penalty,https://www.bbc.com/culture/article/20230502-hichkas-the-song-that-became-an-iranian-protest-anthem
A regal scone made for King Charles III,https://www.bbc.com/travel/article/20230503-marthas-collisons-coronation-crown-scones
Artist makes King Charles out of Marmite on toast,https://www.bbc.com/news/articles/cxxy40p39wzo
Discord makes everyone change their username,https://www.bbc.com/news/technology-65483184
Can Morocco solve Europe’s energy crisis?,https://www.bbc.com/news/business-65415529
Why there is serious money in kitchen fumes,https://www.bbc.com/news/business-65328579
Drone shot down over Kyiv burns through sky,/news/world-europe-65489911
Drone shot down over Kyiv burns through sky,/news/world-europe-65489911
Ukraine's first lady and PM's wife embrace...,/news/uk-65487352
How well does William pull a pint?,/news/uk-65486228
Watch bundle of junk drift away in space,/news/science-environment-65484030
Ros Atkins on... the videos showing 'Kremlin...,/news/world-europe-65476367
Russian media's muted response to Kremlin...,/news/world-europe-65484031
Inside hospital where oxygen runs out,/news/world-asia-65459682
Which route will the King take to his...,/news/uk-65468057
Watch man arrested at Buckingham Palace gates,/news/uk-65466363
Branson on 'painful' media coverage during...,/news/business-65479696
Carrie Fisher family row eclipses Hollywood honour,/news/entertainment-arts-65480084
"Meta putting child users at risk, regulator says",/news/technology-65478062
Europe's new weather satellite takes first photos,/news/science-environment-65476909
US approves world's first RSV vaccine,/news/world-us-canada-65477747
The 17 most eye-catching looks at the Met Gala,/news/entertainment-arts-65413976
Rise in UK measles cases causing concern,/news/health-65481976
Biden nominee gets top World Bank job,/news/business-65474459
The people turning time into a currency,https://www.bbc.com/news/business-65397192
Europe's modern monarchs - they're just like us?,https://www.bbcselect.com/watch/europes-royals-revealed/?utm_source=BBC.com&utm_medium=Homepage&utm_campaign=Europes+Royals+Revealed
Parasols and prayers: Africa's top shots,/news/world-africa-65409697
The photos that chronicle the cost of dying,/news/uk-scotland-65354687
Len Goodman obituary: From the East End to Strictly stardom,/news/entertainment-arts-58929590
Penarth: Nofio gyda'r wawr yn y môr // Sea swimming at dawn,/newyddion/65372997
In pictures: Muslims around the world celebrate Eid,/news/in-pictures-65346964
