title,url
Nasa cancels Moon rocket launch because of engine problem,/news/live/science-environment-62681827
Dutch commando dies after shooting outside US hotel,/news/world-us-canada-62712298
Dominant Iraqi political leader quits,/news/world-middle-east-62713026
'World's loneliest man' and last of his tribe dies,/news/world-latin-america-62712318
10 TV shows to watch this September,https://www.bbc.com/culture/article/20220826-10-of-the-best-tv-shows-to-watch-this-september
Swift announces new album as she wins top VMA,/news/entertainment-arts-62712148
Former White House pastry chef Mesnier dies at 78,/news/world-us-canada-62708872
Hundreds saved from floods in Pakistan air rescues,/news/world-asia-62713213
Williams' goodbye & Raducanu's defence top US Open bill,/sport/tennis/62638082
Premier League news conferences and transfer latest,/sport/live/football/62711464
Kenyan cyclist Kangangi dies in crash,/sport/africa/62712921
Why 'quiet quitting' is nothing new,https://www.bbc.com/worklife/article/20220825-why-quiet-quitting-is-nothing-new
11 films to watch this September,https://www.bbc.com/culture/article/20220825-11-of-the-best-films-to-watch-this-september
How whiskey changes with the climate,https://www.bbc.com/future/article/20220826-how-whiskey-is-shaped-by-the-weather-and-climate
Britain's disputed 'in between' isles,https://www.bbc.com/travel/article/20220828-the-british-islands-that-disappear-every-day
Gibraltar is officially a city - 180 years late,https://www.bbc.com/news/uk-62710553
The sudden silencing of Guantanamo's artists,https://www.bbc.com/news/world-us-canada-62399826
Charli XCX: I was always up for getting down and dirty,https://www.bbc.com/news/entertainment-arts-62690604
How to stay cool the Japanese way,https://www.bbc.com/news/business-62659199
Lost at Sea: The disappearance of Keith Davis,https://www.bbcpodcasts.com/listen/lost-at-sea/?utm_source=BBC.com&utm_medium=Homepage&utm_campaign=Lost+at+Sea
Taking a chance on Venus and Serena Williams,/news/world-62654566
Taking a chance on Venus and Serena Williams,/news/world-62654566
The female stonemason saving a little piece...,/news/uk-england-derbyshire-62597425
The Palestinians facing mass eviction,/news/world-middle-east-62635675
Bike protest takes over German motorway,/news/world-europe-62710430
"Music, food and excitement as Carnival...",/news/uk-62708423
Bed frames used to pull victims over...,/news/world-asia-62705242
California freeway split in half by monsoon...,/news/world-us-canada-62705240
Electricity and drought killing white storks,/news/world-europe-62690344
Millions affected by heavy flooding in...,/news/world-asia-62696035
China's severe drought from the air,/news/world-asia-china-62696115
Anger as presenter removed from Radio 4 show,/news/entertainment-arts-62712155
Instagram says precise location is never shared,/news/technology-62686375
Synthetic mouse embryo develops beating heart,/news/health-62679322
Firm denies turning call centre voices 'white',/news/technology-62633188
Arctic Monkeys close Leeds with huge singalong,/news/entertainment-arts-62620630
Twitter and Meta take down pro-US propaganda,/news/technology-62674860
Nasa calls off new Moon rocket launch,/news/science-environment-62715616
"'You're a good bloke, but you don't know how to mop'",https://www.bbc.com/news/business-62651212
What to do with clothes you no longer wear,https://www.bbc.co.uk/news/business-62176336
"Knight, kite and butterflies: Photos of the week",/news/in-pictures-62686075
A photographic mission to show us the Moon,/news/science-environment-62662685
Sunken medieval village reappears at reservoir,/news/uk-england-york-north-yorkshire-62677584
"Africa's top shots: Revellers, robots and rioters",/news/world-africa-62672601
Photographer heads home to shine light on refugees,/news/uk-england-tyne-62505144
