title,url
King Charles says he is deeply touched by public's support ahead of funeral,/news/live/uk-62921700
Saudi Crown Prince not expected at Queen's funeral,/news/uk-62948145
"'Get on with it', Queen told Ardern on motherhood",/news/uk-62945316
Top Russian pop star condemns war in Ukraine,/news/world-europe-62948146
'A different Arsenal - but not title contenders yet',/sport/football/62946685
Hurricane Fiona knocks out Puerto Rico electricity,/news/world-us-canada-62947900
Lady Gaga forced to stop show amid lightning storm,/news/entertainment-arts-62946148
Sell-out crowd at 'immoral' Ugandan music festival,/news/world-africa-62945974
"Nwaneri, 15, becomes youngest Premier League player",/sport/football/62946036
Real Madrid beat Atletico to continue 100% start,/sport/football/62950553
Alcaraz helps Spain to Davis Cup quarter-finals,/sport/tennis/62949113
Why Hollywood has failed Gen Z,https://www.bbc.com/culture/article/20220915-have-film-and-tv-got-gen-z-all-wrong
"France's field of 3,000 standing stones",https://www.bbc.com/travel/article/20220914-carnac-alignments-brittanys-mysterious-standing-stones
What's the right age to get a phone?,https://www.bbc.com/future/article/20220914-whats-the-right-age-to-get-a-smartphone
The US' notorious border dispute,https://www.bbc.com/travel/article/20220911-the-us-island-that-nearly-ignited-a-war
Why fast fashion needs a makeover,https://www.bbc.com/future/article/20220913-how-to-fix-unsustainable-fast-fashion
The jobs employers can't fill,https://www.bbc.com/worklife/article/20220908-the-jobs-employers-just-cant-fill
10 revealing images of artists' studios,https://www.bbc.com/culture/article/20220914-behind-the-scenes-10-artists-studios-through-the-centuries
Who should win the LongShots Festival?,https://www.bbc.com/reel/playlist/longshots-2022-films
Spielberg's The Fabelmans wins Toronto top prize,https://www.bbc.com/news/entertainment-arts-62948675
Cheetahs make a return to India after 70 years,https://www.bbc.com/news/world-asia-india-62899981
Should billboard advertising be banned?,https://www.bbc.com/news/business-62806697
How India is building a pearl farming industry,https://www.bbc.com/news/business-62204515
UK marks one-minute silence for Queen Elizabeth II,/news/uk-62949023
UK marks one-minute silence for Queen...,/news/uk-62949023
Putin failing on all strategic objectives -...,/news/world-europe-62945380
"Grieving a loved one in public not easy,...",/news/uk-62945381
Camilla remembers Queen's smile in tribute,/news/uk-62942351
Queen's grandchildren take part in historic...,/news/uk-62942374
King and Prince William greet queuing...,/news/uk-62940482
The cowboy and the Queen who bonded over...,/news/world-us-canada-62931524
Police stop rollerblader near King Charles's...,/news/uk-62939586
Rehearsals by moonlight ahead of Queen's...,/news/uk-62939728
Queen's children hold vigil at Westminster...,/news/uk-62936375
Thousands affected by French air traffic strike,/news/business-62924064
Why Bastille are making music for 'dystopian' days,/news/entertainment-arts-62821133
Abortion bans leave grey areas for complicated pregnancies,/news/world-us-canada-62921655
Tech Tent: a cryptocurrency revolution,https://www.bbc.co.uk/sounds/play/w3ct375m
Bill Turnbull's colleagues pay tribute at funeral,/news/uk-england-suffolk-62924487
Nasa's Mars rover collects 'amazing' rock samples,/news/science-environment-62950404
Rapper Cardi B pleads guilty to assault charges,/news/entertainment-arts-62925113
'There were no women in my field so I found my own way',https://www.bbc.com/news/business-62719779
The inside scoop on ice cream innovation,https://www.bbc.com/news/business-62745767
The Queen's procession to Westminster Hall,/news/in-pictures-62900732
In pictures: Charles on first visit to NI as King,/news/uk-northern-ireland-62888529
In pictures: King Charles in Scotland and Westminster Hall,/news/in-pictures-62876296
In pictures: Queen's journey from Balmoral to Edinburgh,/news/in-pictures-62868466
Queen Elizabeth II: A life in pictures,/news/in-pictures-61645231
