title,url
Republican uproar over FBI search of Trump's home,/news/world-us-canada-62486406
War must end with liberation of Crimea – Zelensky,https://www.bbc.com/news/world-europe-62487303
Whale winched out of French river in rescue mission,https://www.bbc.com/news/world-europe-62487300
How Aamir Khan adapted Forrest Gump to Bollywood,https://www.bbc.com/news/world-asia-india-62427992
Is staying at the same company unwise?,https://www.bbc.com/worklife/article/20220808-can-you-stay-in-a-job-for-too-long
Katty Kay: Will an FBI 'raid' supercharge Trump?,/news/world-us-canada-62486616
US police arrest suspect in murders of Muslim men,/news/world-us-canada-62486387
Dogs expertly ride waves at surfing championships,/news/world-us-canada-62487600
Transfer window latest and Champions League reaction,/sport/live/football/62488828
Rousing Rangers stun Union to make play-offs,/sport/football/62460304
LIV trio lose FedEx Cup Play-offs legal action,/sport/golf/62486354
The play still going after 388 years,https://www.bbc.com/culture/article/20220809-oberammergau-passion-388-year-old-play-thats-still-going
Is this the ultimate cacio e pepe?,https://www.bbc.com/travel/article/20220809-cacio-e-pepe-en-vessie-a-pasta-cooked-in-a-pigs-bladder
The new problem for 'overthinkers',https://www.bbc.com/worklife/article/20220803-why-overthinkers-struggle-with-remote-work
The world's most invaded sea,https://www.bbc.com/future/article/20220809-how-the-mediterranean-became-the-worlds-most-invaded-sea
The language that doesn't use 'no',https://www.bbc.com/future/article/20220804-kusunda-the-language-isolate-with-no-word-for-no
Domino's pulls out of the birthplace of pizza,https://www.bbc.com/news/business-62487788
Issey Miyake's fashion in pictures,https://www.bbc.com/news/in-pictures-62481031
Are we falling in love with robots?,https://www.bbc.com/news/business-62007675
The plans for giant seaweed farms in European waters,https://www.bbc.com/news/business-62407504
Disabled student calls for better access to campus,/news/uk-england-london-62480037
Disabled student calls for better access to...,/news/uk-england-london-62480037
Cuban fuel depot fire spreads to third tank,/news/world-latin-america-62475873
Crimea beachgoers run after airfield...,/news/world-europe-62486448
Drought leaves boats stranded on dried-up...,/news/world-europe-62483292
Nine-year-old recalls fear as Israeli strike...,/news/world-middle-east-62480381
Eight dead as floods submerge streets of...,/news/world-asia-62475872
Bolivia's 'death road' becomes wildlife haven,/news/world-latin-america-62471231
The people living in half-built homes,/news/world-asia-62436926
How I taught a vulture to fly with me,/news/world-latin-america-62468782
Campaigners call for artificial grass tax,/news/uk-62468199
Eurovision 2023 will force other shows to make way,/news/entertainment-arts-62434757
Tech Tent: the future of medical virtual reality,https://www.bbc.co.uk/sounds/play/w3ct375f
Mining boss: 'One person doesn't have all the answers',https://www.bbc.co.uk/news/business-62476338
Wildlife under stress as dry spell shrinks rivers,/news/science-environment-62465805
The family tragedy behind Jayde Adams' Strictly booking,/news/entertainment-arts-62463731
US Senate passes sweeping $700bn economic package,/news/world-us-canada-62457386
US doctor warns of many undiagnosed polio cases,/news/health-62469534
How China is reshaping the world order,https://www.bbcselect.com/watch/china-a-new-world-order/?utm_source=BBC.com&utm_medium=Homepage&utm_campaign=China+A+New+World+Order
Can drumming reconnect you to your colleagues?,https://www.bbc.com/news/business-62061572
The bull that has stolen Brummie hearts,/news/uk-england-birmingham-62469114
Northern Lights create summer coastal showcase,/news/uk-england-norfolk-62462822
Butterfly image wins World Sports Photography Awards,/news/in-pictures-62398456
In pictures: England's bare lawns and parched parks,/news/uk-62432844
Africa's top shots: Discus diva and pink ladies,/news/world-africa-62420179
