title,url
Putin silent after Wagner boss Prigozhin 'killed in plane crash',/news/live/world-66599774
"Rosenberg: Wagner defied Putin, now its leader may be dead",https://www.bbc.com/news/world-europe-66601553
China retaliates as Japan releases Fukushima water,https://www.bbc.com/news/world-asia-66577769
Who were the Republican debate winners and losers?,https://www.bbc.com/news/world-us-canada-66601291
"Bad skin influences age, not just looks",https://www.bbc.com/future/article/20230823-the-curious-ways-your-skin-shapes-your-health
What Republicans said (and didn't say) about climate,/news/world-us-canada-66603577
Trump's surrender at Georgia jail explained,/news/world-us-canada-66601604
Japan's seafood takes a hit in Fukushima row,/news/world-asia-66603831
Reaction to another Messi win plus transfers latest,/sport/live/football/66602302
Wolves reject £47m bid from Man City for Nunes,/sport/football/66604463
'I threw 16 years in the sport at the last 200m',/sport/athletics/66595352
The sandwich as 'sacred' as paella,https://www.bbc.com/travel/article/20230823-almuerzo-and-the-super-sandwiches-of-valencia
The hidden danger of 'girl' trends,https://www.bbc.com/worklife/article/20230823-girl-trends-are-sticky-and-fun-but-they-can-also-be-problematic
The 10 best films to watch in September,https://www.bbc.com/culture/article/20230823-from-dumb-money-to-saw-x-10-of-the-best-films-to-watch-in-september
Five top countries for expats in 2023,https://www.bbc.com/travel/article/20230822-five-of-the-best-countries-for-expats-in-2023
Why 'hanger' is a real thing,https://www.bbc.com/future/article/20230822-how-hunger-can-warp-our-minds
Dolphin spotters shaken by porpoise killing,https://www.bbc.com/news/uk-wales-66589355
Gaslighting and shame: Uncovering the Magdalene Laundries,https://www.bbc.com/news/entertainment-arts-66376157
'Be honest when you mess up',https://www.bbc.com/news/business-66524349
Can narrowboat owners break up with fossil fuels?,https://www.bbc.com/news/business-66370302
Video shows plane crash in Russian village,/news/world-europe-66597449
Video shows plane crash in Russian village,/news/world-europe-66597449
Ros Atkins on... Wagner leader Yevgeny...,/news/world-europe-66601033
India: Scenes from the Sairang bridge...,/news/world-asia-india-66598510
WATCH: Drone shows people trapped in Pakistan...,/news/world-asia-66597447
India PM Modi speaks after Chandrayaan-3's...,/news/world-asia-india-66597446
'My goodness!' - BBC reporter's live reaction...,/news/world-asia-66590446
Watch dramatic rescue mission to save...,/news/world-asia-66590441
The man confronting Cambridge's bike thieves,/news/uk-66585713
Four moments reveal how quickly floodwater...,/news/world-us-canada-66586047
Bletchley Park to host AI safety talks in November,/news/technology-66604123
Conductor pulls out of Proms after alleged assault,/news/entertainment-arts-66604555
Protests and seafood bans as Japan releases Fukushima water,/news/live/world-asia-66599189
On the warpath: AI's role in the defence industry,https://www.bbc.co.uk/news/business-66459920
Photo prize shortlist celebrates region's beauty,/news/uk-england-tyne-66594319
Netflix exec says docs fixated on female victims,/news/entertainment-arts-66596029
Hopes MRI scans can screen men for prostate cancer,/news/health-66507893
Virtual reality brings new vision to training,https://www.bbc.com/news/business-66393315
Tech Decoded: The latest news direct to your inbox,https://www.bbc.com/news/technology-65786969
Sunflowers irresistible to Instagram photo hunters,/news/uk-wales-66514508
In pictures: Michael Parkinson and his star guests,/news/entertainment-arts-66430865
"Tricks, trials and salutes: Africa’s top shots",/news/world-africa-66532676
WW2 aerial photos opened to public for first time,/news/uk-england-manchester-66511918
Stunning photos as Perseid meteors light up skies,/news/uk-66486813
