title,url
Jailed women's rights campaigner wins Nobel Peace prize,/news/world-middle-east-67026216
Trump endorses Jim Jordan for House Speaker,/news/world-us-canada-67029759
Qatar Grand Prix Friday practice - live updates,https://www.bbc.com/sport/live/formula1/63208686
Why Latino doulas are essential,https://www.bbc.com/worklife/article/20231005-one-latina-doula-on-the-push-for-better-births
The film that caused a US moral panic,https://www.bbc.com/culture/article/20231005-the-exorcist-and-why-demonic-possession-taps-into-our-darkest-fears
Biden faces growing criticism over new border wall,/news/world-us-canada-67024003
BBC sees Chinese ships blocking Philippine supply boats,/news/world-asia-67015857
UK space satellite maps heat at Earth's surface,/news/science-environment-67010377
World Cup: Pakistan v Netherlands - live text,/sport/live/cricket/66854208
"Man City, Man Utd and Arsenal among news conferences",/sport/live/football/67025243
Pogba's B sample confirms positive drugs test,/sport/football/67031763
Why eclipses do odd things to radio,https://www.bbc.com/future/article/20231005-eclipses-do-odd-things-to-radio-waves-to-learn-more-an-army-of-american-amateurs-will-broadcast-during-the-next-ones
The small shops that run NYC,https://www.bbc.com/travel/article/20231005-bodegas-the-small-corner-shops-that-run-nyc
Saltburn is 'deliriously enjoyable',https://www.bbc.com/culture/article/20231005-saltburn-film-review-lurid-comedy-skewers-britains-super-rich
Are free returns over?,https://www.bbc.com/worklife/article/20231004-why-more-fashion-retailers-are-charging-return-fees
Animals fear human voices more than lions - study,https://www.bbc.com/news/world-africa-67023033
Haim on their first decade: 'No-one wanted to sign us!',https://www.bbc.com/news/entertainment-arts-66993259
The mysteries of a mass graveyard of early Indians,https://www.bbc.com/news/world-asia-india-66562257
The extreme robot arm that can chop up a ship,https://www.bbc.com/news/business-66881323
"'If you can't see it, you can't be it'",https://www.bbc.com/news/business-66854695
Moment Tupac's murder suspect gets arrested,/news/world-us-canada-67032696
Moment Tupac's murder suspect gets arrested,/news/world-us-canada-67032696
Watch: Where will get hot weather this...,/news/uk-67030011
Watch: Sparks fly in precarious plane landing,/news/world-us-canada-67025726
New York City rat takes road trip to wedding,/news/67023823
Fire breaks out at Ryder Cup venue in Rome,/news/world-europe-67024146
Watch: Inside Paris flat as bedbugs take over...,/news/world-europe-67010255
Police rescue man handcuffed by fake officer,/news/67023245
One-minute World News,/news/10462520
Stag charges at officer during rescue,/news/world-us-canada-67010833
Bodycam shows rescue of woman stuck under a...,/news/world-us-canada-67013732
Man in court over 'plot to kidnap Holly Willoughby',/news/entertainment-arts-67027015
Jeff Bezos set to join satellite internet race,/news/science-environment-67023719
High fashion: Prada to design Nasa's new Moon suit,/news/science-environment-67022619
"Stars, bars and beans: Africa’s top shots",/news/world-africa-67017528
Jason Derulo sued for sexual harassment,/news/entertainment-arts-67026450
Children in hospital after eating cannabis sweets,/news/world-latin-america-66991933
How a chatbot encouraged a man who wanted to kill the Queen,/news/technology-67012224
CEO: 'Why I take customer service calls',https://www.bbc.com/news/av/business-66981636
Can tech stop India wasting so much of its harvest?,https://www.bbc.com/news/business-66717353
"Bears, birds and kangaroos: Comedy Wildlife Photo Awards",/news/in-pictures-67004896
Sir Michael Gambon: A career in pictures,/news/in-pictures-66950664
Vintage style and bonfires: Africa’s top shots,/news/world-africa-66947006
In pictures: Storm Agnes sweeps across Scotland,/news/uk-scotland-66947142
The day sea-dipping elephants stunned a Welsh town,/news/uk-wales-66855122
