title,url
Russia pilots reckless in drone collision - US,/news/world-europe-64960384
On the prowl for the wolves returning to Europe,https://www.bbc.com/news/world-europe-64940584
It just got harder to see every place in the world,https://www.bbc.com/news/world-64730548
An alternative to digital detox,https://www.bbc.com/worklife/article/20230313-is-it-possible-to-digital-detox-anymore
The big challenge for deep-sea mining,https://www.bbc.com/future/article/20230310-what-does-the-high-seas-treaty-mean-for-deep-sea-mining
The US drone crash is a moment fraught with danger,/news/world-europe-64959498
Taiwan ally Honduras seeks diplomatic switch to China,/news/world-asia-china-64960744
Argentina inflation soars past 100% mark,/news/world-latin-america-64960385
Champions League reaction after Haaland scores five in Man City rout,/sport/live/football/64961529
Raducanu beaten by Swiatek at Indian Wells,/sport/tennis/64961711
Klopp will give '1%' comeback chance a try in Madrid,/sport/football/64959699
A special soup cooked by an ambassador,https://www.bbc.com/travel/article/20230314-ajiaco-chicken-corn-and-potato-soup
Why layoffs hit workers of colour hard,https://www.bbc.com/worklife/article/20230308-why-layoffs-workers-of-colour-so-hard
Inside Europe's Moon mission factory,https://www.bbc.com/future/article/20230314-the-factory-making-spacecraft-for-new-moon-missions
The 'new Bayeux tapestries',https://www.bbc.com/culture/article/20230314-the-new-bayeux-tapestries-revealing-hidden-histories
The slowest train journey in India,https://www.bbc.com/travel/article/20230313-the-slowest-train-journey-in-india
Japan YouTuber MP expelled for never going to work,https://www.bbc.com/news/world-asia-64950117
Is conflict between China and the West getting closer?,https://www.bbc.com/news/world-asia-china-64959500
Could waste plastic become a useful fuel source?,https://www.bbc.com/news/business-64703976
The tech helping women manage the menopause,https://www.bbc.com/news/business-64899189
Imran Khan: Look at the tear gas shells fired at my home,/news/world-asia-64963543
Imran Khan: Look at the tear gas shells fired...,/news/world-asia-64963543
Baby kangaroo rescued from crocodile-infested...,/news/world-australia-64952199
'Customers freaked': Silicon Valley Bank saga...,/news/world-us-canada-64952039
Inside Oscars A-list after-party,/news/entertainment-arts-64946198
Michelle Yeoh's mum in tears after Oscars win,/news/entertainment-arts-64942684
'Not affected by one party or other' - BBC...,/news/uk-64937660
One-minute World News,/news/10462520
Lineker: The BBC director general's interview...,/news/uk-64937658
Chancellor on HSBC buying UK arm of Silicon...,/news/business-64937654
Best Oscars acceptance speeches... in 61...,/news/entertainment-arts-64935382
Man sues women for helping ex-wife get abortion,/news/world-us-canada-64944416
OpenAI announces ChatGPT successor GPT-4,/news/technology-64959346
Brian May knighted by King at Buckingham Palace,/news/uk-64960536
"Christine McGuinness: I was sexually abused, like so many autistic women",/news/uk-64953941
UK engineers help Turkey assess earthquake damage,/news/science-environment-64920236
Wild swan conservation success gives cause for hope,/news/science-environment-64944172
"Vasectomies even safer than reported, doctors say",/news/health-64899943
Is there a better way to insulate our draughty homes?,https://www.bbc.com/news/business-64636384
UK microchip firms call for millions in investment,https://www.bbc.com/news/business-64872465
The best fashion looks at the Oscars,/news/entertainment-arts-64935067
'I rarely saw people who looked like me',/news/uk-england-merseyside-64881091
Tributes paid to acclaimed documentary photographer,/news/uk-england-tyne-64918073
Africa's top shots: Cool frames and gold nuggets,/news/world-africa-64902352
Robert Blake: From Hollywood to murder accused,/news/world-us-canada-64911059
