title,url
At least 26 dead as storms ravage parts of US,/news/world-us-canada-65150138
Drone footage shows scale of US tornado wreckage,/news/world-us-canada-65152532
Braverman to be quizzed by Kuenssberg on Rwanda plan,/news/live/uk-politics-65136202
Finns vote as PM Sanna Marin fights for survival,/news/world-europe-65141461
Verstappen wins in Australia as incident-packed race finishes under safety car - reaction,/sport/live/formula1/63206443
Florida protesters: Trump will be our next president,/news/world-us-canada-65152112
Large cemetery stone revealed as Nazi monument,/news/world-europe-65099516
Polley told to return Oscar in April Fools’ prank,/news/entertainment-arts-65152276
'I take responsibility' - Chelsea boss Potter,/sport/football/65152234
Joshua beats Franklin on points in London,/sport/boxing/65148794
Wood takes English record 5-14 in IPL,/sport/cricket/65151589
South India's iconic breakfast dish,https://www.bbc.com/travel/article/20230330-idli-steamed-rice-cakes-with-lentils
The abandoned mines heating homes,https://www.bbc.com/future/article/20230324-how-old-coal-mines-can-help-the-climate
Why is Gwyneth Paltrow so divisive?,https://www.bbc.com/culture/article/20230331-gwyneth-paltrow-verdict-why-she-divides-and-fascinates
The rise of the minimalist wardrobe,https://www.bbc.com/culture/article/20230331-the-rise-of-the-minimalist-wardrobe
Why daily grind videos are going viral,https://www.bbc.com/worklife/article/20230329-the-employees-posting-about-their-workday-experiences
The outlawed drink making a comeback,https://www.bbc.com/travel/article/20230327-chicha-the-banned-drink-of-colombia
The return of the X-planes?,https://www.bbc.com/future/article/20230324-how-x-planes-may-solve-the-sonic-boom-problem
The intercontinental ATM heist that netted $14m in two hours,https://www.bbc.com/news/world-65130220
'QAnon Shaman' freed early from federal prison,https://www.bbc.com/news/world-us-canada-65132475
Deepest ever fish caught on camera off Japan,https://www.bbc.com/news/science-environment-65148876
Friend or foe: Can computer coders trust ChatGPT?,https://www.bbc.com/news/business-65086798
Spice sales boom as home cooks get more adventurous,https://www.bbc.com/news/business-65026330
Outside Tate brothers' villa on day one of house arrest,/news/world-europe-65150613
Outside Tate brothers' villa on day one of...,/news/world-europe-65150613
Man pours yoghurt over unveiled women in Iran...,/news/world-middle-east-65150611
Watch: Four times US tornadoes were caught on...,/news/world-us-canada-65147038
Video shows tornado moving across Little Rock,/news/world-us-canada-65145264
Watch: Andrew Tate and brother released from...,/news/world-europe-65144222
One-minute World News,/news/10462520
Watch: Weather presenter spots tornado live...,/news/world-us-canada-65145262
The Indian dancers fighting for their...,/news/world-asia-india-65134532
King's first foreign visit as monarch... in...,/news/world-europe-65138731
ChatGPT chatbot banned in Italy,/news/technology-65139406
Author Blume concerned about intolerance in the US,/news/entertainment-arts-65142127
‘Blood test meant I was spared chemo’,/news/health-65042224
Unlimited fines for water companies dumping sewage,/news/science-environment-65145953
Branson's rocket company cuts majority of workforce,/news/business-65133099
"A film premiere, royals and a meatball: Photos of the week",/news/in-pictures-65136303
Telling my daughter about Thailand's poisonous air,/news/world-asia-65120502
"'It’s not how smart you are, it’s how are you smart'",https://www.bbc.com/news/business-65099236
Shamima Begum: The girl who joined IS,https://www.bbcselect.com/select-more/the-shamima-begum-story-the-girl-who-joined-isis/?utm_source=bbc.com&utm_medium=Homepage&utm_campaign=Shamima+Begum
In pictures: King Charles's state visit to Germany,/news/in-pictures-65123931
Royal murals and rare rhinos: Africa's top shots,/news/world-africa-65106486
Film fan creates hundreds of miniature movie sets,/news/uk-england-south-yorkshire-65112610
Southern Lights unusually vivid over New Zealand,/news/world-asia-65108333
Paul O'Grady: A life in pictures,/news/entertainment-arts-65107949
