title,url
Covid protests in Chinese city after deadly fire,/news/world-asia-china-63766125
World Cup: Poland lead and Szczesny saves Saudi Arabia penalty,/sport/live/football/60976490
"Misogyny, racism and bullying found in fire service",https://www.bbc.com/news/uk-england-london-63749444
Naked volunteers pose for Bondi Beach artwork,https://www.bbc.com/news/world-australia-63764448
Fame singer Irene Cara dies aged 63,https://www.bbc.com/news/world-us-canada-63767710
Landslide tears through homes on Italian island,/news/world-europe-63767660
Russian atrocities bring Nato closer than ever,/news/world-europe-63754799
Cruise passenger rescued after 15 hours in the sea,/news/world-us-canada-63766365
Ronaldo a 'total genius' for winning penalty,/sport/football/63766703
'England turn clock back to dismal summer but are still on track',/sport/football/63764304
Southgate's England 'lacked creativity' - and Foden,/sport/football/63760307
Neymar out of two World Cup games with ankle injury,https://www.bbc.com/sport/football/63760430
Iran players sing national anthem against Wales,https://www.bbc.com/sport/football/63753096
Rate the players as England face USA in World Cup,https://www.bbc.com/sport/football/63763202
The Mars rovers that 'came to life',https://www.bbc.com/future/article/20221118-the-martian-robots-that-came-to-life
11 films to watch this December,https://www.bbc.com/culture/article/20221124-11-films-to-watch-this-december
A former slavery port faces its history,https://www.bbc.com/travel/article/20221120-in-charleston-a-museum-2300-years-in-the-making
Why toxic in-laws are no stereotype,https://www.bbc.com/worklife/article/20221111-the-tensions-that-fan-tricky-in-law-relationships
The Crown's Corrin calls for gender neutral awards,https://www.bbc.com/news/entertainment-arts-63741519
Eight glasses of water a day 'may be too much',https://www.bbc.com/news/uk-scotland-north-east-orkney-shetland-63755475
Mercedes plans annual payments for speed-up boost,https://www.bbc.com/news/technology-63743597
What Springsteen reveals about memory,https://www.bbc.com/future/article/20221121-the-benefits-of-being-forgetful
Bargains galore in the market for office furniture,https://www.bbc.com/news/business-63228999
Protests erupt after deadly China residential fire,/news/world-asia-china-63767153
Protests erupt after deadly China residential...,/news/world-asia-china-63767153
Iran football manager confronts BBC...,/news/world-middle-east-63750753
Naked volunteers pose for Bondi Beach artwork,/news/world-australia-63767282
Using artificial intelligence to spot breast...,/news/stories-63755128
World Cup: What has and hasn't been banned?,/news/world-63735559
Kiburi the gorilla finds new home at London...,/news/uk-63759407
Camilla gives children late Queen's...,/news/uk-63750752
One-minute World News,/news/10462520
Chaotic scenes as Sierra Leone lawmakers...,/news/world-africa-63743220
Five-year-old rescued days after Indonesia...,/news/world-asia-63698902
An incomplete history of pop on BBC television,/news/entertainment-arts-63647648
Sharks and songbirds get new trade protections,/news/science-environment-63748189
Record Covid cases for China despite tough action,/news/world-asia-china-63739617
US bans sale of Chinese tech amid security fears,/news/world-us-canada-63764450
Tutankhamun's inspiring 21st Century afterlife,/news/world-middle-east-63742475
Squid Game actor charged with sexual misconduct,/news/world-asia-63764444
Ebola shuts schools early for Christmas in Uganda,/news/world-africa-63743956
The little-known nut that may save at-risk rainforests,https://www.bbc.com/news/business-63713096
Fuel your creativity with the Spark & Fire podcast,https://www.bbcpodcasts.com/spark-and-fire/?utm_source=BBC.Com&utm_medium=Homepage&utm_campaign=Spark+and+Fire
Africa's top shots: Fan fashion and fighting fires,/news/world-africa-63741555
In pictures: King Charles hosts first state visit,/news/in-pictures-63714611
Historic images show 'how we used to live' in city,/news/uk-england-tyne-63674925
"Africa's top shots: Silk, beads and gold beauty queens",/news/world-africa-63661322
Inside the floating polar research laboratory,/news/uk-england-essex-63628208
