title,url
Signal fault likely cause of rail crash - India minister,/news/world-asia-india-65801807
Why do trains in India go off the tracks?,/news/world-asia-india-65795960
How many Russians have left during war - and who are they?,/news/world-europe-65790759
"Cup final reaction, Benzema to leave Real & transfer latest",/sport/live/football/65801755
Benzema set for Saudi move after Real confirm exit,/sport/football/65803169
Harry finally faces questions in hacking case showdown,/news/uk-65730884
Parents clash in Pride protest at US primary school,/news/world-us-canada-65688615
Arrests in Hong Kong on Tiananmen Square anniversary,/news/world-asia-china-65803053
Spanish Grand Prix build-up,/sport/live/formula1/63207464
Man City have set the standard - how can Man Utd catch up?,/sport/football/65799012
Australia's Hazlewood out of Test against India,/sport/cricket/65803265
New Spider-Verse is a 'disappointment' ★★★☆☆,https://www.bbc.com/culture/article/20230531-spider-man-across-the-spider-verse-is-disappointing
The most anticipated US museum opens,https://www.bbc.com/travel/article/20230531-the-us-most-anticipated-museum-opens
The invention of 'heterosexuality',https://www.bbc.com/future/article/20170315-the-invention-of-heterosexuality
The generation clocking the most hours,https://www.bbc.com/worklife/article/20230525-why-young-workers-are-putting-in-so-much-overtime
8 ways to make your clothes last longer,https://www.bbc.com/culture/article/20230601-eight-ways-to-make-your-clothes-last-longer
A compelling new theory of Stonehenge,https://www.bbc.com/travel/article/20230601-what-did-stonehenge-sound-like
The first lab-grown burger: 10 years on,https://www.bbc.com/future/article/20230601-why-cultivated-meat-is-still-so-hard-to-find-in-restaurants
How old is too old to be a dad?,https://www.bbc.com/future/article/20230602-what-are-the-risks-of-being-an-older-father
Scotland's most famous letter goes on display,https://www.bbc.com/news/uk-scotland-tayside-central-65780375
Anger in Belgium over verdict in student's hazing death,https://www.bbc.com/news/world-europe-65767457
Sign up for the latest tech news direct to your inbox,https://www.bbc.com/news/technology-65786969
The tech tricks that make computer games look real,https://www.bbc.com/news/business-65532128
Why Brian Cox hasn't watched the Succession finale,/news/entertainment-arts-65803015
Why Brian Cox hasn't watched the Succession...,/news/entertainment-arts-65803015
'Chaos' outside hospital after India train...,/news/world-asia-india-65799373
Uganda's Ghetto Kids seek glory in UK talent...,/news/world-africa-65796860
Protester dragged from track at Epsom Derby,/news/uk-65796257
Drone shows extent of India train crash...,/news/world-asia-india-65796254
Eyewitnesses describe pain and agony of India...,/news/world-asia-india-65797910
Do Russians really hate the West?,/news/world-europe-65785664
India train crash leaves scores of people...,/news/world-asia-india-65793684
How ref got caught in fiery Euro final...,/news/world-65787765
One-minute World News,/news/10462520
Esports helps F1 to find stars of the future,/news/newsbeat-65791039
Brics ministers call for rebalancing of global order,/news/world-africa-65784030
Blood test for 50 cancers excites scientists,/news/health-65775159
EastEnders wins best soap at British Soap Awards,/news/entertainment-arts-65801743
Solar panels - an eco-disaster waiting to happen?,/news/science-environment-65602519
Heartstopper series two 'will be a little bit darker',/news/entertainment-arts-65798044
Your pictures on the theme of 'bridges',/news/in-pictures-65753973
The 'exploding' demand for giant heat pumps,https://www.bbc.com/news/business-65321487
The chip maker that became an AI superpower,https://www.bbc.com/news/business-65675027
"Performance, protest and pigs: Photos of the week",/news/in-pictures-65789708
Long lashes and fashion flair: Africa's top shots,/news/world-africa-65772200
Windrush generations mark 75th anniversary,/news/in-pictures-65682878
New Yorkers gather for Manhattanhenge,/news/world-us-canada-65761850
Photographing history: The quarrymen of Wales,/news/uk-wales-65717619
