title,url
US tracking suspected Chinese surveillance balloon,/news/world-us-canada-64507225
Putin says Russia facing German tanks again,https://www.bbc.com/news/world-europe-64502504
Nick Kyrgios pleads guilty to assault of ex-girlfriend,/news/world-australia-64507997
Apple sales in biggest fall since 2019,/news/business-64506940
North America's lost dinosaur continent,https://www.bbc.com/future/article/20230202-the-weird-dinosaurs-of-americas-lost-continent
Republicans oust Ilhan Omar from House committee,/news/world-us-canada-64493018
Tyre Nichols rumour fits victim-blaming pattern,/news/world-us-canada-64404830
"This six-year-old ran up a $1,000 takeaway bill",/news/world-us-canada-64507403
Real Madrid beat Valencia to close gap to Barcelona,/sport/football/64500528
'I felt a fraud' - the double life of a rugby league legend,/sport/64484125
Mason Greenwood attempted rape charges dropped,/news/uk-england-manchester-64502021
Do undersea cables affect marine life?,https://www.bbc.com/future/article/20230201-how-undersea-cables-may-affect-marine-life
Italy's ancient homes for dodging taxes,https://www.bbc.com/travel/article/20230202-italys-ancient-conical-homes
How Shania Twain became a Gen Z icon,https://www.bbc.com/culture/article/20230201-how-country-pop-superstar-shania-twain-became-a-gen-z-icon
The Gen Z friendship problem,https://www.bbc.com/worklife/article/20230201-can-gen-z-make-friends-in-the-pandemic-era
Gates would rather pay for vaccines than go to Mars,https://www.bbc.com/news/technology-64499635
"When a celebrity dies, who gets what can get messy",https://www.bbc.com/news/world-us-canada-64489807
Why TikTok has got us talking about 'mascara',https://www.bbc.com/news/newsbeat-64465583
How we fell out of love with voice assistants,/news/business-64371426
Can Sri Lanka trade its way back to prosperity?,https://www.bbc.com/news/business-64464220
'I apologise to the whole Ukrainian nation',/news/world-europe-64495520
'I apologise to the whole Ukrainian nation',/news/world-europe-64495520
Decade-old footage of Tyre Nichols skating...,/news/world-us-canada-64492792
Bringing music to the masses... on a tram,/news/entertainment-arts-64500904
Green comet captured from back garden,/news/uk-england-nottinghamshire-64499694
BBC guest's phone keeps going off during...,/news/entertainment-arts-64480824
Viking warriors parade at Up Helly Aa in...,/news/uk-scotland-64485413
Dancing and huge crowds for Pope's DR Congo...,/news/world-africa-64484329
'You know I'm innocent' - Andrew Tate yells...,/news/world-europe-64481845
Floating pirate restaurant sinks off Thailand...,/news/world-asia-64477412
Protests against France pension age rise...,/news/world-europe-64473280
Bird flu 'spills over' to otters and foxes in UK,/news/science-environment-64474594
BBC News channel announces new presenter line-up,/news/entertainment-arts-64496388
Infected blood scandal: Five facts we have learned,/news/health-64497868
Cancer as a young person: 'A blood test saved me',/news/health-64505734
North Korea led 'biggest year ever' of crypto hacks,/news/world-asia-64494094
Image of 'vulnerable' plant wins photo award,/news/in-pictures-64472234
"My dream holiday was a $30,000 scam",/news/world-63727404
How to add 'sizzle' to meat-free products,https://www.bbc.com/news/business-64337616
The new tech offering relief from period pain,https://www.bbc.com/news/business-64397795
In pictures: Up Helly Aa,/news/uk-scotland-64464271
Heavy snow disrupts life in India's Himalayan states,/news/world-asia-india-64462193
The defiant low-lying island 70 years after floods,/news/uk-england-essex-64255567
Survivors and leaders mark Holocaust Memorial Day,/news/in-pictures-64425194
Africa's top shots: Welcome parties and malted brews,/news/world-africa-64410690
