title,url
Alex Jones told to pay $965m to Sandy Hook families,/news/world-us-canada-63237092
Nato countries to boost Ukraine's missile defence,/news/world-europe-63236367
US and Mexico make deal to ease Venezuela migration,/news/world-latin-america-63237802
Can a billionaire inspire ordinary Taiwanese to fight?,/news/world-asia-63196623
Champions League reaction,/sport/live/football/63238950
Top LA city leader quits over racist remarks leak,/news/world-us-canada-63237924
Trudeau to testify at Emergencies Act public inquiry,/news/world-us-canada-63181062
Russia annexation condemned by UN General Assembly,/news/world-63237669
Liverpool's win changes the mood but for how long?,/sport/football/63237173
'We understand each other' - Kane & Son unstoppable,/sport/football/63236898
Barca on brink of Champions League exit after draw,/sport/football/63221311
The Danish tradition we all need now,https://www.bbc.com/travel/article/20221012-the-danish-tradition-we-all-need-now
The dream jobs that weren't worth it,https://www.bbc.com/worklife/article/20221010-the-workers-leaving-their-dream-jobs
The slave ship in a London courtyard,https://www.bbc.com/culture/article/20221012-the-slave-ship-in-a-london-courtyard
"Tolkien's word for the ""anti-doomsday""",https://www.bbc.com/future/article/20221005-eucatastrophe-tolkiens-word-for-the-anti-doomsday
Lab-grown brain cells play a 1970s video game,https://www.bbc.com/news/science-environment-63195653
Kanye interview pulled over 'more hate speech',https://www.bbc.com/news/entertainment-arts-63226918
What is Vladimir Putin thinking and planning?,https://www.bbc.com/news/world-europe-63231823
Is the small business surge in the US sustainable?,https://www.bbc.com/news/business-62894499
Elon Musk - superhero or supervillain?,https://www.bbcselect.com/watch/elon-musk/?utm_source=BBC.com&utm_medium=Homepage&utm_campaign=Elon+Musk
Women around the world cut their hair for Iran,/news/world-asia-63204259
Women around the world cut their hair for...,/news/world-asia-63204259
Ukraine's day of missile strikes in a minute,/news/world-europe-63208576
'The nerd emoji is not who we are',/news/uk-england-nottinghamshire-63229464
Wheat shortage: Baker's mission to reinvent...,/news/world-africa-63235963
Mother of boy killed on railway launches...,/news/uk-63228025
Storm Julia kills dozens in Central America,/news/world-latin-america-63215767
Sir David Jason shown clip of his first TV...,/news/entertainment-arts-63172380
Oh my gourd! Giant pumpkin squashes US record,/news/world-us-canada-63223322
One-minute World News,/news/10462520
Officer charged after shooting teen outside...,/news/world-us-canada-63209829
African contemporary art enjoying a surge in interest,https://www.bbc.co.uk/news/business-63200559
Lost Desert Island Discs rescued for the nation,/news/entertainment-arts-63215698
First Ebola death recorded in Ugandan capital,/news/world-africa-63212117
Dusty star mystery solved by James Webb telescope,/news/science-environment-63234027
Commonwealth Games makes mystery esports U-turn,/news/technology-63232333
"Dementia risk higher for black people, study finds",/news/health-63229986
How safe is my pension?,/news/business-63231132
China's electric car market is booming but can it last?,https://www.bbc.com/news/business-62825830
Pacific Island Fiji aims for a high-tech future,https://www.bbc.com/news/business-62830770
Chris Killip: Retrospective for UK photographer,/news/in-pictures-63163667
Dunfermline marks city status with new exhibition,/news/uk-scotland-edinburgh-east-fife-63201547
Tragic boxing star's story told in forgotten photos,/news/uk-wales-63143785
Africa's top shots: Patriotic portraits and red afros,/news/world-africa-63155899
India celebrates Dussehra festival with pomp,/news/world-asia-india-63113937
