title,url
Dog catches crawling Pennsylvania prison fugitive,/news/world-us-canada-66800144
El Chapo's wife Emma Coronel released from prison,https://www.bbc.com/news/world-latin-america-66796456
Lauren Boebert escorted out of Beetlejuice show,https://www.bbc.com/news/world-us-canada-66798627
A 'beach towel revolt' sweeping Greece,https://www.bbc.com/travel/article/20230912-what-to-know-about-the-beach-towel-revolt-taking-back-greek-beaches
How sponges help Zanzibar women,https://www.bbc.com/future/article/20230912-the-zanzibar-sea-sponges-helping-women-fight-climate-change
Watch police pose for photo after dramatic arrest,/news/world-us-canada-66800473
Why the Libyan port floods were so catastrophic,/news/world-africa-66799518
Romanians told to shelter from Russian drones,/news/world-europe-66794880
Stokes smashes record 182 as England trounce Kiwis,/sport/cricket/66788944
What to look out for in week two of Rugby World Cup,/sport/rugby-union/66785993
"Welcome to the world's biggest, wildest trail race",/sport/66747975
What Diana's sheep jumper really means,https://www.bbc.com/culture/article/20230913-what-princess-dianas-sheep-jumper-really-means
The companies staying fully remote,https://www.bbc.com/worklife/article/20230912-the-companies-sticking-to-fully-remote-work
The chef who created a culinary army,https://www.bbc.com/travel/article/20230911-jos-andrs-the-man-who-created-an-army-of-culinary-first-responders
What creates record-breaking hurricanes,https://www.bbc.com/future/article/20230911-what-a-record-breaking-hurricane-looks-like
The most audacious painters of all,https://www.bbc.com/culture/article/20230912-how-female-fauvists-were-some-of-historys-most-audacious-painters
'I put my dad on dating show to help cope with grief',https://www.bbc.com/news/newsbeat-66796162
I will seek psychological help - Richarlison,https://www.bbc.com/sport/football/66797630
Robots are trained to help revive coral reefs,https://www.bbc.com/news/business-66656369
The eight best dishes in Hong Kong,https://www.bbc.com/travel/article/20230908-hong-kong-must-eats-iconic-cantonese-dishes-and-where-to-try-them
Libyan doctor pleads for help as body count increases,/news/world-africa-66800349
Libyan doctor pleads for help as body count...,/news/world-africa-66800349
Watch: How Putin welcomed Kim to Russia,/news/world-europe-66794601
Three reasons Kim and Putin might want to be...,/news/world-66792189
Watch: Red carpet welcome in Russia for Kim...,/news/world-66790366
Watch: River of red wine flows through...,/news/world-europe-66787998
Cars dragged to coastal edge after deadly...,/news/world-africa-66790360
Floods tear through Libyan city of Derna,/news/world-africa-66787997
'Vast destruction' caused by Morocco...,/news/world-africa-66790363
Bullock trapped in sinkhole hoisted to safety,/news/uk-england-tees-66787602
BBC reporter zip wires between London...,/news/uk-england-london-66776424
Rapid ice movement monitored under UK polar base,/news/science-environment-66685821
Annie Mac speaks out on music industry sex abuse,/news/entertainment-arts-66801181
Parents feel misled by ministers over NHS cannabis,/news/health-66784170
Photographs that shaped the urban landscape,/news/in-pictures-66784928
"'I wasn't heard at meetings, so did something about it'",https://www.bbc.co.uk/news/av/business-66323981
Olivia Rodrigo: ‘I’ve got a few heartbreaks left in me’,/news/entertainment-arts-66681334
OneCoin accomplice jailed for 20 years,/news/world-us-canada-66793135
Find the right BBC email newsletter for you,https://www.bbc.com/news/world-us-canada-66715271?&at_bbc_team=studios&at_medium=native&at_objective=acquisition&at_ptr_type=&at_ptr_name=bbc.com&at_format=Module&at_link_origin=bbchomepage&at_campaign=nleditorial&at_campaign_id=&at_adset_name=&at_adset_id=&at_creation=&at_creative_id=&at_campaign_type=owned
The surprising origin of US democracy,https://www.bbc.com/travel/article/20230906-the-ancient-civilisation-that-inspired-us-democracy
Oriel luniau: Ras Cefn y Ddraig 2023 // Photo gallery: The 2023 Dragon’s Back Race,/newyddion/66786559
"Masks, mourners and megaphones: Africa's top shots",/news/world-africa-66738714
Peregrine Falcon image wins bird photo award,/news/in-pictures-66706149
Landmark captured on camera made out of beer can,/news/uk-england-bristol-66709749
'We carried our heritage with us',/news/in-pictures-66594398
