title,url
"From Kabul and beyond, a year of Taliban rule",/news/world-asia-62535300
Rushdie's 'defiant sense of humour' remains - son,https://www.bbc.com/news/world-us-canada-62542161
Dozens dead in Egypt church fire,https://www.bbc.com/news/world-middle-east-62541074
Remote Pacific nation hit by Covid outbreak,https://www.bbc.com/news/world-asia-62544116
The end of the layoff taboo,https://www.bbc.com/worklife/article/20220812-how-layoffs-shed-their-taboo
We saved who we could - Egypt church fire survivor,/news/world-africa-62544805
Ecuador blast 'declaration of war' by gangs,/news/world-latin-america-62544570
Fireworks explosion rocks Armenia shopping market,/news/world-62540398
'Match sucked me in' - why Tuchel & Conte saw red,/sport/football/62543119
"'Fight, character & depth - how Conte has changed Spurs'",/sport/football/62541788
'New-look Chelsea are a force to be reckoned with',/sport/football/62543996
How mammals won the dinosaurs' world,https://www.bbc.com/future/article/20220812-dinosaur-extinction-why-did-mammals-survive
The greatest novel of the 20th Century?,https://www.bbc.com/culture/article/20220812-did-proust-write-the-greatest-novel-of-the-20th-century
The floating homes of Lake Titicaca,https://www.bbc.com/travel/article/20220814-the-floating-homes-of-lake-titicaca
The new problem for 'overthinkers',https://www.bbc.com/worklife/article/20220803-why-overthinkers-struggle-with-remote-work
Why was British India partitioned 75 years ago?,https://www.bbc.com/news/world-south-asia-62467438
Workers going into office 1.5 days a week - survey,https://www.bbc.com/news/business-62542537
Cats to be released from special lockdown in German town,https://www.bbc.com/news/world-europe-62541752
High and low-tech ways to tackle India's water crisis,https://www.bbc.com/news/business-61965419
A life in 10 pictures: Elizabeth Taylor,https://www.bbcselect.com/watch/elizabeth-taylor/?utm_source=BBC&utm_medium=Homepage&utm_campaign=A+Life+in+10+Pictures+Elizabeth+Taylor
The boy who fled war-torn Cyprus for London,/news/uk-england-london-62516848
The boy who fled war-torn Cyprus for London,/news/uk-england-london-62516848
How 40 million Australian mangroves were...,/news/world-australia-62489574
Homes destroyed in Japan tropical storm,/news/world-asia-62544007
Green spaces across England parched in...,/news/uk-62540395
Pulling energy out of the sky,/news/science-environment-62513387
Tonnes of fish found dead in German-Polish...,/news/world-europe-62537130
Heavy winds cause havoc at Spanish festival,/news/world-europe-62531471
We fled the Taliban for our Olympic dream,/news/world-asia-62498517
Ibiza: The birth of the 'party island',/news/stories-62506050
'Extreme' racism behind Sadowitz scrapping – venue,/news/62543162
NHS IT supplier held to ransom by hackers,/news/technology-62506039
Drought highlights dangers for electricity supply,/news/science-environment-62524551
'I'm a different person after having monkeypox',/news/world-us-canada-62438263
Bike seller Peloton and meditation app Calm cut jobs,/news/business-62523708
Presenter Helen Skelton completes Strictly line-up,/news/entertainment-arts-62532622
The science of drought explained in pictures,/news/science-environment-62519107
Why more of us are trying to fix things ourselves,https://www.bbc.com/news/business-62476690
Mining boss: 'One person doesn't have all the answers',https://www.bbc.com/news/business-62476338
In pictures: Stunning Sturgeon Moon lights up skies,/news/in-pictures-62518102
"In pictures: Heatwaves, drought and wildfires",/news/in-pictures-62497772
"Africa's top shots: Laughs, leaps and prickly pears",/news/world-africa-62503581
Picture of wild cat hunting flamingo wins award,/news/in-pictures-62492855
Mexico indigenous groups celebrate their heritage,/news/world-latin-america-62491341
