title,url
BBC sees damage from blast at Gaza refugee camp as Blinken visits West Bank,/news/live/world-middle-east-67324897
"Hamburg Airport hostage drama is over, police say",/news/world-europe-67326185
Israel-Gaza war taking focus from Ukraine - Zelensky,/news/world-europe-67321777
Premier League: Forest 1-0 Villa - Aina opens scoring for hosts,/sport/live/football/67065669
Eight unusual tourist attractions in London,https://www.bbc.com/travel/article/20231103-see-another-side-to-london-at-eight-of-its-most-unusual-tourist-attractions
Four surprises that could upend the 2024 US election,/news/world-us-canada-67304536
What a Trump second term would look like,/news/world-us-canada-67272569
Biden meets families in Maine after mass shooting,/news/world-us-canada-67313370
Brilliant India reduce SA to 67-7 after Kohli's landmark ton,/sport/live/cricket/67278614
'Arteta must face scrutiny for trying to fix something not broken',/sport/football/67324261
Scottish Premiership: Dundee & Livingston goalless in top flight,/sport/live/football/67285018
"Scotland's tiny, sustainable isle with 110 people",https://www.bbc.com/travel/article/20231025-the-isle-of-eigg-the-community-owned-island-that-powers-itself
A US mystery you can see but not touch,https://www.bbc.com/travel/article/20231025-the-paulding-light-a-us-mystery-you-can-see-but-not-touch
How Massimo Bottura is redefining BBQ,https://www.bbc.com/travel/article/20231101-massimo-botturas-new-not-barbecue-restaurant
'The day I saw the walls breathing',https://www.bbc.com/future/article/20231101-psychedelic-drugs-flashbacks-hallucinogen-persisting-perception-disorder-hppd
Why ads are hitting streaming services,https://www.bbc.com/worklife/article/20231101-why-some-streaming-companies-are-leaning-into-adverts-and-raising-prices
Did American History X see the future?,https://www.bbc.com/culture/article/20231102-how-american-history-x-foreshadowed-the-resurgence-of-white-nationalism-in-the-us
Japan's unique form of accommodation,https://www.bbc.com/travel/article/20231103-shukubo-the-japanese-temples-where-you-can-sleep-alongside-monks
How do you destroy two tonnes of cocaine?,https://www.bbc.com/news/uk-northern-ireland-67237728
Red-hot Afrobeats star Rema doesn’t intend to calm down,https://www.bbc.com/news/world-africa-67308582
Touchscreen card readers frustrating blind people,https://www.bbc.com/news/disability-67239870
Tech promises to remove the guesswork from fishing,https://www.bbc.com/news/technology-67093211
Investigate three generations of lives lost,https://www.bbcselect.com/watch/lucy-worsley-investigates/?utm_source=BBC.com+&utm_medium=Homepage+Story&utm_campaign=Video&utm_term=Lucy+Worsley
BBC on scene of damage after blast at Gaza refugee camp,/news/world-middle-east-67326745
BBC on scene of damage after blast at Gaza...,/news/world-middle-east-67326745
Awkward EU summit kiss causes controversy,/news/world-europe-67319850
Succession actor Sarah Snook: 'AI is...,/news/entertainment-arts-67319851
Gaza mother: 'I'm not able to hug my...,/news/world-middle-east-67316559
Colleagues in tears after Gaza journalist...,/news/world-middle-east-67314396
BBC visits scene of Bognor Regis flooding,/news/uk-67324354
Moment cars swept away down street in Italy,/news/world-europe-67317146
Trail of destruction as Storm Ciarán hits UK,/news/uk-67304422
At the scene where a 'tornado' struck Jersey,/news/uk-67312512
Shops flooded as Storm Ciarán strikes...,/news/world-europe-67307070
I believed in Sinead O'Connor - producer Holmes,/news/entertainment-arts-67207695
"Maersk cuts 10,000 jobs as shipping demand falls",/news/business-67307248
Space telescope records baby star's first screams,/news/science-environment-67243772
Matthew Perry buried in private ceremony - US media,/news/world-us-canada-67319475
"Storms, singing and silence: Photos of the week",/news/in-pictures-67308202
Cough syrup maker boss jailed after child deaths,/news/business-67294106
AI bot 'capable of covering up illegal trading',/news/technology-67302788
'Pumpkins saved my business but almost squashed me',https://www.bbc.com/news/av/business-67265905
Portugal's tech boom challenged by tax change,https://www.bbc.co.uk/news/business-67087676
Damage and disruption: Storm Ciarán in pictures,/news/in-pictures-67298061
"Clouds, crowns and crews: Africa's top shots",/news/world-africa-67295807
Elton John photography collection to go on display,/news/uk-england-london-67205468
Skulls and flowers: Mexico's 'skeleton' parade,/news/in-pictures-67193453
Steely gaze of endangered tigress tops mangrove photo awards,/news/in-pictures-67155632
