title,url
Royal Family gathers at Balmoral amid concerns for Queen's health,/news/live/uk-62834633
Queen under medical supervision at Balmoral,/news/uk-62836057
Political leaders send best wishes to Queen,/news/uk-politics-62833839
Second Canada stabbings suspect dies after arrest,https://www.bbc.com/news/world-us-canada-62829432
'I can finally say I like my job',https://www.bbc.com/worklife/article/20220905-why-people-are-industry-hopping
US approves $2.6bn in aid for Ukraine and allies,/news/world-europe-62832881
France clamps down on city centre 'dark stores',/news/world-europe-62838667
Europe's warm summer shatters records,/news/science-environment-62833937
Chelsea appoint Potter to succeed Tuchel as manager,/sport/football/62838065
"Rain delays start of England v SA third Test - clips, radio & text",/sport/live/cricket/58523279
Hamilton to start Italian Grand Prix at the back,/sport/formula1/62839241
Italy's original wheat-free pasta,https://www.bbc.com/travel/article/20220907-pizzoccheri-northern-italys-gluten-free-buckwheat-pasta
'A flawed film with a kind heart',https://www.bbc.com/culture/article/20220907-the-son-review-a-flawed-film-with-a-kind-heart
The mystery of Europe's bog murders,https://www.bbc.com/future/article/20220907-the-mystery-of-the-human-sacrifices-buried-in-europes-bogs
The search for 'meaning' at work,https://www.bbc.com/worklife/article/20220902-the-search-for-meaning-at-work
Meet the brilliant directors behind the shortlisted films,https://www.bbc.com/culture/article/20220825-longshots-2022-the-directors-behind-the-shortlisted-films
"First day at school for George, Charlotte and Louis",https://www.bbc.com/news/uk-62825227
Domestic abuse: 'I can rebuild my life with forensic spray',https://www.bbc.com/news/uk-62821880
Should billboard advertising be banned?,https://www.bbc.com/news/business-62806697
How India is building a pearl farming industry,https://www.bbc.com/news/business-62204515
The Northern Lights as seen from space,/news/world-62831574
The Northern Lights as seen from space,/news/world-62831574
Watch: Cambridge children arrive at new...,/news/uk-62827918
Firefighters tackle Italy chemical plant fire,/news/world-europe-62823049
Evacuations as California battles deadly...,/news/world-us-canada-62821271
Liz Truss outlines her three priorities,/news/uk-62812691
What do voters think of Liz Truss?,/news/uk-politics-62815916
One-minute World News,/news/10462520
Liz Truss's first Downing Street speech as PM...,/news/uk-politics-62808801
Sunak on his future: I don't plan on going...,/news/uk-politics-62798503
Moment Liz Truss announced as new Tory leader,/news/uk-politics-62795284
Who might win the 2022 Mercury Prize?,/news/entertainment-arts-62825157
Juul to pay $438.5m in youth vaping probe,/news/business-62813896
"Malaria vaccine is world-changing, say scientists",/news/health-62797776
Harry Styles jokes about Chris Pine 'spit' story,/news/entertainment-arts-62818523
PM will explore energy market reform to cut bills,/news/science-environment-62832029
Two government departments reprimanded by watchdog,/news/technology-62833111
Earliest sign of amputation found buried in cave,/news/science-environment-62823559
'There were no women in my field so I found my own way',https://www.bbc.com/news/business-62719779
The inside scoop on ice cream innovation,https://www.bbc.com/news/business-62745767
In pictures: Liz Truss becomes UK's 56th PM,/news/in-pictures-62810557
Boy's stunning stag shot scoops top award,/news/uk-england-london-62750748
Africa's top shots: Tears of joy and celebrating bishops,/news/world-africa-62751874
Is this ape really cuddling a pet mongoose?,/news/science-environment-62724822
In pictures: The life of Mikhail Gorbachev,/news/world-europe-62732829
