title,url
Trump gets formal summons from Jan 6 committee,/news/world-us-canada-63319431
US and Russian defence ministers hold rare talks,https://www.bbc.com/news/world-europe-63348743
Ralph Lauren apologises over 'cultural appropriation',https://www.bbc.com/news/world-latin-america-63342715
Why a 90s cult novel still appeals now,https://www.bbc.com/culture/article/20221020-the-secret-history-a-murder-mystery-that-thrills-30-years-o
The flawed Soviet glider tank,https://www.bbc.com/future/article/20221020-the-tank-that-could-fly-into-battle
Steve Bannon gets four months in jail for contempt,/news/world-us-canada-63332078
Mordaunt enters PM race as Sunak support grows,/news/live/uk-politics-63338261
Far-right Meloni accepts job as Italian PM,/news/world-europe-63327290
"Australia pass 50 points against Scotland - watch, radio & text",/sport/live/rugby-league/53505128
United States Grand Prix first practice as FIA admit Japan mistakes,/sport/live/formula1/58920167
Scottish Premiership: Will Hibs extend lead? Or can St Johnstone reply?,/sport/live/football/63209113
Why people don't learn from failure,https://www.bbc.com/worklife/article/20221019-the-smart-way-to-learn-from-failure
A hotel using hope as a tourist draw,https://www.bbc.com/travel/article/20221020-in-croatia-a-hotel-trying-to-heal-war-wounds
How to save Paradise from fire,https://www.bbc.com/future/article/20221019-could-a-buffer-help-paradise-california-stop-next-wildfire
The stories hidden in an ancient craft,https://www.bbc.com/culture/article/20221020-the-stories-hidden-in-the-ancient-indian-craft-of-kantha
India destroys 100 million Covid vaccines,https://www.bbc.com/news/world-asia-india-63324548
Pound sinks as UK economic uncertainty rises,https://www.bbc.com/news/business-63340725
Deepfaked: 'They put my face on a porn video',https://www.bbc.com/news/uk-62821117
What people get wrong about anxiety,https://www.bbc.com/future/article/20221017-how-to-use-anxiety-to-your-advantage
Europe faces tough decisions over nuclear power,https://www.bbc.com/news/business-63245112
Liz Truss's short and bumpy ride in 85 seconds,/news/uk-politics-63337111
Liz Truss's short and bumpy ride in 85...,/news/uk-politics-63337111
Resignation day... in under 60 seconds,/news/uk-63338397
Watch Liz Truss step down as PM,/news/uk-63328193
Liz Truss: What just happened,/news/uk-politics-63337334
"We need a general election now, says Keir...",/news/uk-politics-63326119
Westminster's day of chaos... in 70 seconds,/news/uk-politics-63322000
Ukrainian troops under close gunfire,/news/world-europe-63318579
Doctor's death brings home pain of Russian...,/news/world-europe-63288127
Russian general: Situation in Ukraine 'tense',/news/world-europe-63311327
A feisty PMQs... in just 50 seconds,/news/uk-politics-63313536
Hacker who stole Ed Sheeran songs jailed,/news/technology-63348753
How an abandoned baby led to strip-searches in Qatar,/news/world-62072074
Critics praise Swift album but lament lack of hits,/news/entertainment-arts-63341633
The flying car that could turn into a biplane,/news/technology-63325341
Tesla sales climb but miss expectations,/news/business-63319011
China outcry over death of girl sent to quarantine,/news/world-asia-china-63324655
Vast marine protected area 'boosts tuna stocks',/news/science-environment-63291104
Brazil's winemakers aiming to toast more global sales,https://www.bbc.com/news/business-63240259
What makes Nashville a magnet for entrepreneurs?,https://www.bbc.com/news/business-63304623
Weather Watchers: Your pictures of autumn leaves,/weather/features/63345178
"Africa's top shots: Hats, horses and hay",/news/world-africa-63329521
Street photography exhibition extended,/news/uk-england-birmingham-63222871
Africa's top shots: Munching man and pink kites,/news/world-africa-63241554
Chris Killip: Retrospective for UK photographer,/news/in-pictures-63163667
