title,url
Judge orders release of Trump search court papers,/news/world-us-canada-62677948
World narrowly avoided nuclear accident - Zelensky,/news/world-europe-62679066
Putin orders 10% boost in Russian troop numbers,/news/world-europe-62677262
Living without plastic in Japan,https://www.bbc.com/future/article/20220823-quitting-single-use-plastic-in-japan
The lost truth of American whiskey,https://www.bbc.com/travel/article/20220824-the-untold-history-of-black-bourbon
"Cancelling student debt: Essential, or like burning money?",/news/world-us-canada-62667867
'Getting custody papers on stage was vicious',/news/entertainment-arts-62670696
The Americans turning to Mexico to get abortions,/news/world-us-canada-61874921
Liverpool to face Rangers in Champions League,/sport/football/62663341
Djokovic unable to travel to New York for US Open,/sport/tennis/62679272
England on top after dismissing SA for 151,/sport/cricket/62650253
The meaning of Tolkien's iconic symbol,https://www.bbc.com/culture/article/20220824-the-ancient-roots-of-the-lord-of-the-rings
An ancient earthquake-defying design,https://www.bbc.com/travel/article/20220825-kath-kuni-the-himalayas-ancient-earthquake-defying-design
Should we be avoiding contrails?,https://www.bbc.com/future/article/20220823-what-makes-up-a-planes-contrails
The big height discrimination problem,https://www.bbc.com/worklife/article/20220825-height-discrimination-how-heightism-affects-careers
Google to run ads educating users about fake news,https://www.bbc.com/news/technology-62644550
Huge recovery for butterfly once extinct in the UK,https://www.bbc.com/news/science-environment-62674800
Escaped 18ft python spotted on roof of house,https://www.bbc.com/news/uk-england-hampshire-62678259
Lost at Sea: The disappearance of Keith Davis,https://www.bbcpodcasts.com/listen/lost-at-sea/?utm_source=BBC.com&utm_medium=Homepage&utm_campaign=Lost+at+Sea
"'You're a good bloke, but you don't know how to mop'",https://www.bbc.com/news/business-62651212
A (nervous) day in the life of a GCSE student,/news/education-62678435
A (nervous) day in the life of a GCSE student,/news/education-62678435
On call with Italy's horseback doctor,/news/world-europe-62662429
Band stuck in Calais queue perform surprise...,/news/world-europe-62667554
"CCTV shows moments before girl, 9, shot dead",/news/uk-62667553
Floods deluge parts of southern Pakistan,/news/world-asia-62662927
Kyiv residents reflect on six months of war,/news/world-europe-62656754
Front line frontmen: The rock band fighting...,/news/world-europe-62636408
Scots Guards perform Eurovision tribute for...,/news/uk-62653710
One-minute World News,/news/10462520
Eurovision star faces Russian hate campaign,/news/entertainment-arts-62671940
Monkeypox antiviral drug put to the test in trial,/news/health-62644509
No fuel imports from Russia for first time on record,/news/business-62659391
Gamers face price rise on PS5 but not Switch,/news/technology-62659688
C4 boss says Big Brother return is depressing,/news/entertainment-arts-62670698
Goonhilly to support Nasa Moon mission,/news/uk-england-cornwall-62673526
Brain stimulation boosts memory for a month,/news/health-62606510
What to do with clothes you no longer wear,https://www.bbc.co.uk/news/business-62176336
Can a sleepy Japanese town become Asia's Silicon Valley?,https://www.bbc.com/news/business-62463974
Photographer heads home to shine light on refugees,/news/uk-england-tyne-62505144
Zoo animals hop on the scales for annual weigh-in,/news/uk-england-beds-bucks-herts-62647665
The pomp and celebrations as new Zulu king crowned,/news/world-africa-62623061
First saved images from vast photo archive shared,/news/uk-england-merseyside-62591866
Africa's top shots: Crowning queens and coming of age,/news/world-africa-62588364
