title,url
Arrest warrant issued for Putin over alleged war crimes,/news/world-europe-64992727
George Floyd killer Chauvin convicted of tax fraud,https://www.bbc.com/news/world-us-canada-64996161
Family questions daughter's death at US Army base,https://www.bbc.com/news/world-us-canada-64959804
Teen kills two Canadian police officers,https://www.bbc.com/news/world-us-canada-64971967
The Wire star Lance Reddick dies aged 60,https://www.bbc.com/news/world-us-canada-64959805
Watch: Can Putin actually be arrested?,/news/world-europe-64997048
Give babies peanut butter to cut allergy - study,/news/health-64987074
US nuclear plant reports radioactive water leak,/news/world-us-canada-64989112
Premier League: Isak double helps Newcastle win at Forest - reaction,/sport/live/football/64405195
Newcastle's Isak scores late winner at Forest,/sport/football/64911104
Galopin Des Champs wins Cheltenham Gold Cup,/sport/horse-racing/64992162
The disease driven by an addictive nut,https://www.bbc.com/future/article/20230315-how-the-addictive-areca-nut-drives-monkey-fever-in-india
Six ancient Norse myths resonating now,https://www.bbc.com/culture/article/20230316-the-six-ancient-norse-myths-that-still-resonate-today
An Arctic diner under the Aurora Borealis,https://www.bbc.com/travel/article/20230316-dans-diner-a-wild-dinner-in-a-roving-tundra-buggy
Shipping's wind power revolution,https://www.bbc.com/future/article/20230310-will-shipping-return-to-its-ancient-roots
Hollywood's most misogynistic cliché,https://www.bbc.com/culture/article/20230315-how-shrinking-perpetuates-hollywoods-most-sexist-clich
Going phone-free 'sets up for failure',https://www.bbc.com/worklife/article/20230313-is-it-possible-to-digital-detox-anymore
A cuisine without a country,https://www.bbc.com/travel/article/20230317-shirini-zereshk-palau-sweet-barberry-pilaf
Why is the US president given a bowl of shamrock?,https://www.bbc.com/news/uk-northern-ireland-64971048
St Patrick's Day: Everything you need to know,https://www.bbc.co.uk/newsround/35831743
Actor Sam Neill reveals cancer diagnosis,https://www.bbc.com/news/entertainment-arts-64969344
Putin's 'deep frustration and resentment against the West',https://www.bbcselect.com/watch/putin-vs-the-west/?utm_source=bbc.com&utm_medium=Homepage&utm_campaign=Putin+Vs+The+West
The revolution underway in India's diamond industry,https://www.bbc.com/news/business-64783843
Eight killed by deluge of potatoes after roof collapse,/news/world-asia-64987190
Eight killed by deluge of potatoes after roof...,/news/world-asia-64987190
Iraq amputee: I can hug my son with my feet,/news/world-middle-east-64976639
Protests as Macron pushes through pension...,/news/world-europe-64981376
Watch: Man clings on for life in harrowing...,/news/world-64977487
US releases footage of Russian jet crashing...,/news/world-us-canada-64974825
Flames engulf Russian security building in...,/news/world-europe-64974827
One-minute World News,/news/10462520
Quentin Sommerville on Bakhmut's frontline -...,/news/world-europe-64964449
CCTV shows ex-boxer Amir Khan robbed at...,/news/uk-england-london-64971148
Credit Suisse: Lessons learned from the past?,/news/business-64976316
'A village's goodwill saved me from homelessness',/news/science-environment-64940840
Comic Relief returns with The Traitors sketch,/news/entertainment-arts-64989732
"Puppeteers, superstars and dinosaurs: Africa's top shots",/news/world-africa-64976952
YouTube reinstates Donald Trump's channel,/news/technology-64993603
Drug giant becomes latest to cap US insulin prices,/news/world-us-canada-64991714
How many other Hemsbys are waiting to happen?,/news/uk-england-norfolk-64944384
Why sleeper trains are being revived across Europe,https://www.bbc.com/news/business-64950747
Has social media killed the famous advert?,https://www.bbc.com/news/business-64801683
Brian May knighted by King at Buckingham Palace,/news/uk-64960536
The best fashion looks at the Oscars,/news/entertainment-arts-64935067
'I rarely saw people who looked like me',/news/uk-england-merseyside-64881091
Tributes paid to acclaimed documentary photographer,/news/uk-england-tyne-64918073
Robert Blake: From Hollywood to murder accused,/news/world-us-canada-64911059
