title,url
Death toll rises as Hurricane Ian strengthens,/news/world-us-canada-63084460
At least 19 dead in Kabul education centre blast - police,https://www.bbc.com/news/world-asia-57137981
Tears and despair as Russian annexation looms,https://www.bbc.com/news/world-europe-63076950
Australia ends Covid isolation rule after strict era,https://www.bbc.com/news/world-australia-63084976
What causes your eyes to change colour,https://www.bbc.com/future/article/20220929-how-our-eyes-change-colour-throughout-our-lives
Fort Myers devastation: 'Worst storm surge I've seen',/news/world-us-canada-63082038
US will 'never' recognise Russian claims in Ukraine,/news/world-europe-63084286
US Army doctor and wife charged with Russia spying,/news/world-us-canada-63079868
Premier League build-up & news conferences,/sport/live/football/63085831
Brazil's yellow shirt gets political in election battle,/sport/football/62887765
McIlroy rejects criticism of caddie Diamond,/sport/golf/63064968
The US push to make salaries public,https://www.bbc.com/worklife/article/20220929-the-us-push-for-pay-transparency
The surprising power of memes,https://www.bbc.com/future/article/20220928-the-surprising-power-of-internet-memes
New Zealand's overlooked cuisine,https://www.bbc.com/travel/article/20220929-new-zealands-overlooked-indigenous-cuisine
11 films to watch this October,https://www.bbc.com/culture/article/20220929-11-of-the-best-films-to-watch-this-october
Young non-smokers told not to take up vaping,https://www.bbc.com/news/health-63076876
Nostalgia as cinema returns to Kashmir after 23 years,https://www.bbc.com/news/world-asia-india-63043411
Unravelling the mystery of the unknown child,https://www.bbc.com/news/uk-scotland-tayside-central-62961590
Finland wants to transform how we make clothes,https://www.bbc.com/news/business-62806565
Why Trump's political comeback is not guaranteed,https://www.bbcselect.com/watch/trump-the-comeback/?utm_source=BBC.com&utm_medium=Homepage&utm_campaign=Trump+The+Comeback
On the front line with Ukrainian troops in Kherson,/news/world-europe-63064531
On the front line with Ukrainian troops in...,/news/world-europe-63064531
Nazanin cuts hair in support of Iran protests,/news/world-63068095
Cars submerged in Ian's raging floodwaters,/news/world-us-canada-63070793
Truss: Right to take decisive action to help...,/news/uk-politics-63075357
"'I'm not fit to fight', says man fleeing...",/news/world-europe-63065688
Waves lash Florida shore as hurricane...,/news/world-us-canada-63060371
One-minute World News,/news/10462520
Bid to save secret world hidden inside rented...,/news/entertainment-arts-63067699
Lightning surrounds eye of Hurricane Ian over...,/news/world-us-canada-63053697
Drone video shows scale of people leaving...,/news/world-europe-63053432
Nasa and SpaceX consider Hubble re-boost mission,/news/science-environment-63084707
David Tennant jealous of incoming Doctor Who star,/news/entertainment-arts-63073710
UN elects first female tech agency chief,/news/technology-63074895
"UK must brace for big, early wave of flu - experts",/news/health-63045190
Revealed: Huge gas flaring emissions never reported,/news/science-environment-62917498
Alzheimer's-slowing drug labelled historic,/news/health-63060019
Liz Truss' path to regain market credibility,/news/business-63085416
The banker who swapped finances for fighting,https://www.bbc.com/news/business-63033554
Is Finland's Wood City the future of building?,https://www.bbc.com/news/business-62798950
Filming climate change in action for Frozen Planet,/news/uk-scotland-north-east-orkney-shetland-62925833
Candid photos chronicle life as an obese teen,/news/uk-wales-62799126
Africa's top shots: Painted faces and flying singers,/news/world-africa-62992391
Pic of the Season summer vote is open,https://www.bbc.co.uk/programmes/articles/5jLKkbYd250n0KSrH0kfzjy/pic-of-the-season-summer-2022
In pictures: The Queen's funeral,/news/in-pictures-62918196
