title,url
Man charged with murder of Tupac Shakur in 1996,/news/live/world-us-canada-66966937
US teen dies from lightning strike while hunting,https://www.bbc.com/news/world-us-canada-66953581
Rotterdam victim had reported suspect to police,https://www.bbc.com/news/world-europe-66958337
Rampant All Blacks score 13th try against Italy,/sport/live/rugby-union/65867824
10 films to watch in October,https://www.bbc.com/culture/article/20230928-from-killers-of-the-flower-moon-to-the-exorcist-believer-10-of-the-best-films-to-watch-in-october
Watch: '27 years' for Tupac - sheriff gets emotional,/news/world-us-canada-66967704
State of emergency in New York over flash flooding,/news/world-us-canada-66965396
Videos show New York inundated by flooding,/news/world-us-canada-66966004
Europe open record-equalling Ryder Cup lead over US,/sport/golf/66962049
Fury to face Usyk in undisputed title fight in Saudi,/sport/boxing/66962430
All Blacks thrash Italy to boost knockout hopes,/sport/rugby-union/66965427
The city charging visitors to enter,https://www.bbc.com/travel/article/20230928-venices-new-5-entry-fee-explained
The return of a divisive lingerie brand,https://www.bbc.com/culture/article/20230926-can-victorias-secret-fix-its-image
Space travel's heavy toll on health,https://www.bbc.com/future/article/20230927-what-a-long-term-mission-in-space-does-to-the-human-body
US auto strike: Eye-popping CEO pay,https://www.bbc.com/worklife/article/20230925-uaw-auto-strike-why-us-automotive-ceos-make-more-than-global-competition
Family finds Viking relics during earring search,https://www.bbc.com/news/world-europe-66957309
Inside the Australian magpie’s annual reign of terror,https://www.bbc.com/news/world-australia-66920781
Chelsea: What's the big idea behind £1bn spending spree?,https://www.bbc.com/sport/av/football/66927829
The slow and delicate aircraft taking on spy missions,https://www.bbc.com/news/business-66705421
Does AI scare you? It should,https://www.bbcselect.com/watch/are-you-scared-yet-human/?utm_source=BBC.com&utm_medium=Homepage&utm_campaign=Are+you+scared+yet%2C+Human
Archive footage from the scene of Tupac's murder,/news/world-66966083
Archive footage from the scene of Tupac's...,/news/world-66966083
District attorney cites famous Tupac quote,/news/world-us-canada-66967927
Watch: Biden tells climate heckler to 'shush...,/news/world-us-canada-66956877
Watch: Smoke billows out of building after...,/news/world-europe-66954165
One-minute World News,/news/10462520
"Watch: The Sycamore Gap... then, and now",/news/uk-66960442
America's top diplomat sings the blues,/news/world-us-canada-66918555
Terrifying moments as women struggle to...,/news/world-66948916
"UK unready as wildfires surge, warn firefighters",/news/science-environment-66948836
Fortnite maker Epic Games cutting 16% of workforce,/news/technology-66953910
Sir Michael Gambon: A career in pictures,/news/in-pictures-66950664
Millions wrongly labelled with penicillin allergy,/news/health-66934909
Apple to buck layoff trend by hiring UK AI staff,/news/technology-66954267
Man charged over murder of rapper Tupac,/news/entertainment-arts-66965766
Calvin Robinson suspended as GB News presenter,/news/uk-66963562
Asia's little-known Silk Road city,https://www.bbc.com/travel/article/20230925-the-five-best-things-to-do-in-turkistan
"'If you can't see it, you can't be it'",https://www.bbc.com/news/business-66854695
The day sea-dipping elephants stunned a Welsh town,/news/uk-wales-66855122
Ploughing: A snapshot of a disappearing skill,/news/uk-england-norfolk-66869691
"Glasses, goats and goodbyes: Africa’s top shots",/news/world-africa-66877589
Historic scenes for King and Queen on their French visit,/news/in-pictures-66867649
Adeiladau anghofiedig Cymru // Wales' forgotten buildings,/newyddion/66858159
