title,url
At least 37 killed in attack at Thai nursery,/news/live/world-asia-63156417
California family kidnapped at gunpoint found dead,https://www.bbc.com/news/world-us-canada-63160468
Canada top court to hear if US is 'safe' for migrants,https://www.bbc.com/news/world-us-canada-63125239
Scrubs producer charged with 18 sexual assaults,https://www.bbc.com/news/entertainment-arts-63156197
How to hallucinate without drugs,https://www.bbc.com/future/article/20221005-how-to-hallucinate-without-drugs-and-learn-about-your-brain
Rescuers comb rubble after strikes on Ukraine city,/news/live/world-europe-63142141
Seven moments that shaped Putin,https://www.bbc.com/news/world-europe-63117878
Mexico mayor assassinated in town hall massacre,/news/world-latin-america-63153362
Benn v Eubank Jr fight postponed,/sport/boxing/63158856
The women who fought for their own World Cup,/sport/rugby-union/63118254
No ranking points at upcoming LIV Golf events,/sport/golf/63162340
What it means to identify as pansexual,https://www.bbc.com/worklife/article/20220926-why-pansexuality-is-so-often-misunderstood
A Soviet novel 'too dangerous to read',https://www.bbc.com/culture/article/20221005-life-and-fate-the-soviet-novel-too-dangerous-to-read
Is this the world's best beef?,https://www.bbc.com/travel/article/20221005-the-wagyu-olympics-the-quest-for-the-worlds-best-beef
Why are global rates of myopia soaring?,https://www.bbc.com/future/article/20220927-can-you-prevent-short-sightedness-in-kids
Irish dancing body begins results fixing inquiry,https://www.bbc.com/news/uk-northern-ireland-63145693
Ex-Google ad boss builds tracker-free search engine,https://www.bbc.com/news/technology-63130364
Greenland's future may be written under North Sea,https://www.bbc.com/news/science-environment-63147947
Do you care if your boss wears a suit or a hoodie?,https://www.bbc.com/news/business-62992989
BBC Women's Footballer of 2022 - the contenders,https://www.bbc.com/sport/football/63009563
'Doctor knows best' attitude must be challenged - bereaved mum,/news/uk-63159193
'Doctor knows best' attitude must be...,/news/uk-63159193
My family died in Indonesia football...,/news/world-asia-63153616
The generations of Iranian women fighting for...,/news/world-middle-east-63148420
Why I robbed a bank to get my own money,/news/world-middle-east-63122044
Aftermath of 'kamikaze drone' strike near...,/news/world-europe-63152805
Take a ride around San Francisco in a...,/news/technology-63077437
The protest videos Iran doesn't want the...,/news/63132235
Ukraine: Flags being raised in retaken areas,/news/world-europe-63139071
Behind the scenes ahead of Liz Truss's speech,/news/uk-politics-63132740
Truss still wants to see top tax rate cut,/news/uk-politics-63131885
'Uncompromising' Ernaux wins Nobel Literature Prize,/news/entertainment-arts-63156199
Ex-Uber security chief convicted for hiding hack,/news/technology-63157883
New oil and gas at odds with green goals - report,/news/science-environment-63149957
The farmers caught up in Taiwan's tensions with China,https://www.bbc.co.uk/news/business-63128392
Edinburgh film festival and cinemas cease trading,/news/uk-scotland-edinburgh-east-fife-63158817
Global alert over cough syrups after child deaths,/news/world-africa-63150950
Scottish fossil revealed to be pterodactyl ancestor,/news/science-environment-63146271
The DIY gadgets that could keep your energy bill down,https://www.bbc.com/news/business-62900202
Can electrical stimulation improve your gym workout?,https://www.bbc.com/news/business-62887379
India celebrates Dussehra festival with pomp,/news/world-asia-india-63113937
In pictures: Floridians take in Hurricane Ian’s impact,/news/world-us-canada-63080969
Guernsey sunrise wins Pic of the Season,https://www.bbc.co.uk/weather/features/63078910
"Africa's top shots: Prayer, pride and pacing",/news/world-africa-63072006
Filming climate change in action for Frozen Planet,/news/uk-scotland-north-east-orkney-shetland-62925833
