title,url
Russia says it thwarted major Ukrainian offensive,/news/world-europe-65806152
Harry accused of 'wasting time' by not giving evidence today,https://www.bbc.com/news/live/uk-65767191
Sonic boom as US jets pursue unresponsive plane,https://www.bbc.com/news/world-us-canada-65808194
Why personalised medicine hasn't arrived,https://www.bbc.com/future/article/20230602-are-we-entering-the-era-of-personalised-medicine
Japan's ultimate lesson in gratitude,https://www.bbc.com/travel/article/20230604-japans-ultimate-lesson-in-gratitude
Wagner detains Russian officer over 'drunk' attack,/news/world-europe-65809844
War with US would be unbearable disaster - China minister,/news/world-asia-china-65803311
Brian Cox 'hasn't watched Succession finale',/news/entertainment-arts-65803015
Real Madrid want Kane as Benzema replacement,/sport/football/65808462
Whyte offered Joshua rematch - Hearn,/sport/boxing/65810253
Kasatkina 'feeling bitter' after French Open boos,/sport/tennis/65810178
The latest trends in tech direct to your inbox,https://www.bbc.com/news/technology-65786969
"Three job categories safe from AI, for now",https://www.bbc.com/worklife/article/20230507-the-jobs-ai-wont-take-yet
Are mobile phones altering our brains?,https://www.bbc.com/future/article/20230403-how-cellphones-have-changed-our-brains
"Sex, violence and sparkling one-liners",https://www.bbc.com/culture/article/20230602-noel-coward-the-dark-side-of-the-quintessential-englishman
The US' most anticipated museum opens,https://www.bbc.com/travel/article/20230531-the-us-most-anticipated-museum-opens
The birds ensnared by plastic,https://www.bbc.com/future/article/20230531-the-photo-that-changed-the-worlds-response-to-the-plastics-crisis
Will a four-day week get workers back?,https://www.bbc.com/worklife/article/20230530-will-the-four-day-workweek-get-employees-back-in-office
How old is too old to be a dad?,https://www.bbc.com/future/article/20230602-what-are-the-risks-of-being-an-older-father
Could ultra-processed foods be harmful for us?,https://www.bbc.com/news/health-65754290
Holly says she's shaken on return to This Morning,https://www.bbc.com/news/entertainment-arts-65808532
The tech tricks that make computer games look real,https://www.bbc.com/news/business-65532128
The 'exploding' demand for giant heat pumps,https://www.bbc.com/news/business-65321487
Why is Prince Harry heading to the High Court?,/news/uk-65768596
Why is Prince Harry heading to the High...,/news/uk-65768596
Wreckage cleared from tracks after India...,/news/world-asia-india-65805709
'Chaos' outside hospital after India train...,/news/world-asia-india-65799373
Uganda's Ghetto Kids seek glory in UK talent...,/news/world-africa-65796860
Protester dragged from track at Epsom Derby,/news/uk-65796257
One-minute World News,/news/10462520
Drone shows extent of India train crash...,/news/world-asia-india-65796254
Eyewitnesses describe pain and agony of India...,/news/world-asia-india-65797910
Do Russians really hate the West?,/news/world-europe-65785664
Burna Boy makes history with sold-out stadium gig,/news/newsbeat-65810233
Blood test for 50 cancers excites scientists,/news/health-65775159
Esports helps F1 to find stars of the future,/news/newsbeat-65791039
First LGBT couple to read CBeebies bedtime story,/news/entertainment-arts-65809944
Almost £9bn of old paper banknotes not cashed in,/news/uk-wales-65776923
'Extinct' butterfly species reappears in UK,/news/uk-65804939
Strawberry Moon captured over England,/news/uk-england-leicestershire-65802574
The chip maker that became an AI superpower,https://www.bbc.com/news/business-65675027
'We are selling a product that we hope gets discontinued',https://www.bbc.com/news/business-65572881
Top Scottish landscape photographers announced,https://www.bbc.co.uk/news/articles/c6p34zr7rz7o
Long lashes and fashion flair: Africa's top shots,/news/world-africa-65772200
New Yorkers gather for Manhattanhenge,/news/world-us-canada-65761850
Photographing history: The quarrymen of Wales,/news/uk-wales-65717619
Photographer blends Africa with Welsh communities,/news/uk-wales-65709322
