title,url
Kentucky bank employee shoots dead four colleagues,/news/world-us-canada-65233350
Leaked documents a risk to US security - Pentagon,https://www.bbc.com/news/world-us-canada-65235121
How China calibrates its Taiwan response,https://www.bbc.com/news/world-asia-65232566
Super Mario Movie breaks box office records,https://www.bbc.com/news/entertainment-arts-65230431
The creative Asian city few know,https://www.bbc.com/travel/article/20230410-battambang-cambodias-creative-second-city
UK-Israeli mother dies after West Bank shooting,/news/world-middle-east-65227638
US says journalist wrongfully detained in Russia,/news/world-us-canada-65234451
Mother of 6-year-old who shot teacher is charged,/news/world-us-canada-65202976
Champions League returns - all you need to know,/sport/football/65097892
McIlroy withdraws from PGA Tour's RBC Heritage,/sport/golf/65233062
La Liga leaders Barcelona held by Girona,/sport/football/65235641
The gory horror classic put on trial,https://www.bbc.com/culture/article/20230406-the-evil-dead-the-horror-shocker-that-set-off-a-culture-war
The UK street that represents the world,https://www.bbc.com/travel/article/20230409-londons-blackstock-road-the-world-in-a-street
Why do children reverse letters?,https://www.bbc.com/future/article/20230405-why-do-some-people-mirror-write
The biggest work skills Gen Z lack,https://www.bbc.com/worklife/article/20230405-why-gen-z-workers-are-starting-on-the-back-foot
India tiger census shows steady population growth,https://www.bbc.com/news/world-asia-india-65229322
Coronation coach has electric windows and air con,https://www.bbc.com/news/uk-65194594
To sing or not to sing? Theatre etiquette in the spotlight,https://www.bbc.com/news/entertainment-arts-65224777
'We turned down a client to uphold gay rights',https://www.bbc.com/news/business-65173246
A nutty solution for cleaner stoves and barbecues,https://www.bbc.com/news/business-64821804
WATCH: Building collapses onto road in Mexico,/news/world-latin-america-65234499
WATCH: Building collapses onto road in Mexico,/news/world-latin-america-65234499
A look at the King's golden coronation day...,/news/uk-65231561
Giant sketch in field marks Picasso death...,/news/world-europe-65223575
Video shows avalanche in French Alps,/news/world-europe-65228240
Songs of grief for sisters killed in occupied...,/news/world-middle-east-65227761
China conducts Taiwan military drills,/news/world-asia-china-65220109
"Forget a K9 unit, this police station has a...",/news/world-us-canada-65209664
The damage done by 80 tornadoes in a week,/news/world-us-canada-65208609
One-minute World News,/news/10462520
Watch: One of Macron's favourite cafes in...,/news/world-europe-65207369
"People were taking drugs in Spain 3,000 years ago",/news/world-europe-65211722
BBC objects to 'government funded' Twitter label,/news/entertainment-arts-65226481
Abba in tribute to 'superb' long-serving guitarist,/news/entertainment-arts-65232127
Deportation of grandmother with Alzheimer's paused,/news/uk-65196484
Lightning and lambs: Photos of the week,/news/in-pictures-65201451
Norwegian seafloor holds clue to Antarctic melting,/news/science-environment-65192825
Airbnb host tried to quadruple rate for Eurovision,/news/business-64951147
Would you open up to a chatbot therapist?,https://www.bbc.com/news/business-65110680
Friend or foe: Can computer coders trust ChatGPT?,https://www.bbc.com/news/business-65086798
Green leaves and yawning soldiers: Africa's top shots,/news/world-africa-65200809
In pictures: King Charles's state visit to Germany,/news/in-pictures-65123931
Royal murals and rare rhinos: Africa's top shots,/news/world-africa-65106486
Film fan creates hundreds of miniature movie sets,/news/uk-england-south-yorkshire-65112610
Southern Lights unusually vivid over New Zealand,/news/world-asia-65108333
