title,url
Four unanswered questions about the Biden files,/news/world-us-canada-64267983
Russia claims victory in bloody battle for Soledar,/news/world-europe-64263119
Shakira diss track breaks YouTube viewing records,/news/entertainment-arts-64267366
Premier League: Bailey gives Villa early lead against Leeds,/sport/live/football/63881770
UFO reports by US troops skyrocket to over 500,/news/world-us-canada-64252340
How Lisa Marie Presley turned personal tragedy into hope,/news/entertainment-arts-64260769
Rescuers hunt for tornado survivors in southern US,/news/world-us-canada-64258552
Boy's bag searched for gun before he shot teacher,/news/world-us-canada-64252261
No Saudi Arabian offer for Messi - Balague,/sport/football/64268892
Mendy found not guilty of six counts of rape,/news/uk-england-manchester-63677581
A 'febrile' atmosphere - is football fan violence on rise?,/sport/football/64259799
The simple error that 16% of us make,https://www.bbc.com/future/article/20230112-why-some-people-cant-tell-left-from-right
The Versailles most people don't get to see,https://www.bbc.com/travel/article/20230112-the-hidden-history-of-versailles
The companies that burn out young grads,https://www.bbc.com/worklife/article/20230111-the-companies-that-churn-through-young-workers
A return to old-school Canadian glamour,https://www.bbc.com/travel/article/20230111-canadas-1300km-atlantic-rail-route
How far can vertical farming go?,https://www.bbc.com/future/article/20230106-what-if-all-our-food-was-grown-in-indoor-vertical-farms
Why siblings are becoming less common,https://www.bbc.com/worklife/article/20230110-only-child-or-siblings-one-and-done
Films that scare in unexplainable ways,https://www.bbc.com/culture/article/20230112-enys-men-the-films-that-frighten-us-in-unexplainable-ways
Hunting for Nazi gold in a Dutch village,https://www.bbc.com/news/world-europe-64254209
'I secretly recorded my rapist's confession',https://www.bbc.com/news/uk-scotland-64248542
Americast: Biden under investigation,https://www.bbc.co.uk/sounds/play/m001h22c
India targets China's dominance in mobile phones,https://www.bbc.com/news/business-63806296
Pixar director on embracing your 'inner weirdo',https://link.chtbl.com/BBC-DomeeShi?at=1001l38zZ
Bursts of flames after Lithuania gas pipeline explosion,/news/world-europe-64269957
Bursts of flames after Lithuania gas pipeline...,/news/world-europe-64269957
Greta: Germany is really embarrassing itself...,/news/world-europe-64270147
Elvis actor thanks Presley family at Golden...,/news/entertainment-arts-64269955
Elvis's daughter's life in the public eye,/news/world-64263477
Deadly tornadoes sweep through Alabama,/news/world-us-canada-64263869
Ros Atkins on… social care’s impact on...,/news/health-64258235
'Have you read Harry's book?' - reporter asks...,/news/uk-64257067
Traffic stopped for koala crossing highway,/news/world-australia-64246872
Angry guest crashes car into hotel in...,/news/world-asia-64248574
Learning how to live like a Viking,/news/uk-northern-ireland-64257029
'Wild' camping on Dartmoor banned in test case,/news/science-environment-64238116
Argentina sees prices almost doubling last year,/news/business-64258488
Covid cases in China touch 900 million - study,/news/world-asia-china-64258799
BBC broadcaster Jennie Gow suffers serious stroke,/news/uk-england-hampshire-64261533
Winklevoss firm charged in US over crypto sales,/news/technology-64265440
Leftover Covid swabs to be tested for other viruses,/news/health-64209168
Actor Ezra Miller admits trespass but avoids jail,/news/entertainment-arts-64269515
Could floating solar farms survive out at sea?,https://www.bbc.co.uk/news/business-63728020
Will the metaverse be your new workplace?,https://www.bbc.com/news/business-64173594
"Africa's top shots: Angry rams, priest and prayers",/news/world-africa-64248968
Golden Globes: The red carpet in pictures,/news/entertainment-arts-64226431
Repairing broken gadgets for a better future,/news/in-pictures-63737951
Mastectomy photo project aims to empower women,/news/uk-england-manchester-64055153
In Pictures: Orthodox Christians mark Christmas,/news/world-64194408
